You have to trust your kids. They have to experience life, and you just hope you've provided them a foundation for what's right and what isn't.;Jack Nicklaus;hope
The moment of inspiration can come from memory, or language, or the imagination, or experience - anything that makes an impression forcibly enough for language to form.;Carol Ann Duffy;imagination
I think any period in history can be adapted into interesting fiction, as long as you approach the actual history with respect.;Seth Grahame-Smith;respect
History does not long entrust the care of freedom to the weak or the timid.;Dwight D. Eisenhower;history
I've made an odd discovery. Every time I talk to a savant I feel quite sure that happiness is no longer a possibility. Yet when I talk with my gardener, I'm convinced of the opposite.;Bertrand Russell;happiness
We do not need more intellectual power, we need more spiritual power. We do not need more of the things that are seen, we need more of the things that are unseen.;Calvin Coolidge;power
Love and death are the two great hinges on which all human sympathies turn.;B. R. Hayden;death
I know that war is very cruel and that life is harder when you aren't able to live in the place you called home.;Madeleine Albright;home
Happiness exists on earth, and it is won through prudent exercise of reason, knowledge of the harmony of the universe, and constant practice of generosity.;Jose Marti;happiness
I feel true success comes from being able to work and the love for it.;Kiana Tom;success
Beauty fades! I just turned 29, so I probably don't have that many good years left in me.;Gwyneth Paltrow;beauty
Such happiness as life is capable of comes from the full participation of all our powers in the endeavor to wrest from each changing situations of experience its own full and unique meaning.;John Dewey;happiness
Since fame is an illusion and death is in our future all we have is the next moment before we are swallowed into oblivion.;Al Goldstein;death
The five different areas in which boys are in crisis - education jobs emotional health physical health and fatherlessness - are handled by different portions of the government.;Warren Farrell;education
I think ABBA have a pure joy to their music and that's what makes them extraordinary.;Bono;music
Truth may be stretched, but cannot be broken, and always gets above falsehood, as does oil above water.;Miguel de Cervantes;truth
If one man in the country could take all the money, what was the use of passing any bills about it?;Davy Crockett;money
Follow your dreams. Just make sure to have fun too.;Chris Brown;dreams
After great pain, a formal feeling comes. The Nerves sit ceremonious, like tombs.;Emily Dickinson;great
Faith means intense, usually confident, belief that is not based on evidence sufficient to command assent from every reasonable person.;Walter Kaufmann;faith
When I get logical, and I don't trust my instincts - that's when I get in trouble.;Angelina Jolie;trust
As a child I was given the freedom to explore my passion for acting, but I also grew up in a home where there were a lot of rules. I didn't have 'yes' parents.;Emmanuelle Chriqui;freedom
If you are strong enough as a couple, reality shows can be a good thing for the relationship.;Giuliana Rancic;relationship
You, the foreign media, have been the companion of my people in its long and painful journey to freedom.;Corazon Aquino;freedom
We will never bring peace at the hands of war. As a species we have to rise above it.;Rosie O'Donnell;peace
Activist government overreach and ongoing economic stagnation have shown us why Washington should not try to displace what is best left to civil society.;Paul Ryan;best
Sometimes the most positive thing you can be in a boring society is absolutely negative.;Johnny Rotten;positive
I was 16 years old, driving to LA, and sleeping in my car, just trying to make it happen.;Nick Cannon;car
For us to think we can enjoy, understand and practice the Christian religion with just Matthew to Revelation is foolishness.;Randall Terry;religion
The way that a handful of corporations in Los Angeles dictate how our stories are told creates a real poverty of imagination and it's a big problem.;Alex Cox;imagination
If so many men, so many minds, certainly so many hearts, so many kinds of love.;Leo Tolstoy;love
You want to play another kind of character in another genre, and it's been something I've been trying to do if I can in the career so far, and it's something I hope to continue because it's interesting to me and you get to do different things as an actor.;Keanu Reeves;hope
Some people will never learn anything, for this reason, because they understand everything too soon.;Alexander Pope;education
Grudge no expense - yield to no opposition - forget fatigue - till, by the strength of prayer and sacrifice, the spirit of love shall have overcome .;Maria Weston Chapman;strength
I mean, we're going to probably debate the Iraq war for at least as long as I'm alive.;Paul Wolfowitz;war
Who would know but ten years ago that kids would be texting each other all the time, that that would be one of their main forms of communication. And so many times, these kids know more about the technology than their parents. And so many times, we're putting kids in very adult situations and expecting them to behave like they're 40 years old.;Amy Klobuchar;communication
One could not have isolated this retrovirus without knowledge of other retroviruses, that's obvious. But I believe we have answered the criteria of isolation.;Luc Montagnier;knowledge
As a world view, Darwinism cannot of course be refuted, since Faith is, always has been, and always will be, stronger than facts.;Francis Parker Yockey;faith
I don't think anybody anywhere can talk about the future of their people or of an organization without talking about education. Whoever controls the education of our children controls our future.;Wilma Mankiller;education
The display of grief makes more demands than grief itself. How few men are sad in their own company.;Lucius Annaeus Seneca;sad
I have had lots of friends who've been affected by Aids and a very good friend of mine, Oscar Moore, died of Aids and I was with him in his last year quite a bit. And of course he was a man living in a very rich culture with a wealthy family who was able to afford health care.;Emma Thompson;health
The minimum we should hope for with any display technology is that it should do no harm.;Edward Tufte;technology
A happy life must be to a great extent a quiet life, for it is only in an atmosphere of quiet that true joy dare live.;Bertrand Russell;great
Coming together is a beginning keeping together is progress working together is success.;Henry Ford;success
Healthy citizens are the greatest asset any country can have.;Winston Churchill;politics
No government ought to be without censors and where the press is free, no one ever will. Chance is the pseudonym of God when he did not want to sign.;Anatole France;god
Romance is tempestuous. Love is calm.;Mason Cooley;love
Well I do think, when there are more women, that the tone of the conversation changes, and also the goals of the conversation change. But it doesn't mean that the whole world would be a lot better if it were totally run by women. If you think that, you've forgotten high school.;Madeleine Albright;change
Music of all arts should be expansive and inclusive.;Jesse Jackson;music
Anytime you ride against the best in the world, it becomes a learning process.;Bonnie Blair;learning
Sensual pleasures have the fleeting brilliance of a comet a happy marriage has the tranquillity of a lovely sunset.;Ann Landers;marriage
Even as a little child, I've always had that comedian kind of attitude.;Etta James;attitude
I burned out on AIDS and did no AIDS work for a couple of years. I was so angry that people were still getting this disease that nobody can give you - you have to go out and get it!;Harvey Fierstein;work
Political tyranny is nothing compared to the social tyranny and a reformer who defies society is a more courageous man than a politician who defies Government.;B. R. Ambedkar;government
The Palestinian election is something that was really a turning point. It's a mandate for peace.;Warren Christopher;peace
Learning teacheth more in one year than experience in twenty.;Roger Ascham;learning
Every happening, great and small, is a parable whereby God speaks to us, and the art of life is to get the message.;Malcolm Muggeridge;great
I love to go shopping at Target. They have so much stuff there, you can buy almost anything, it's really amazing.;Liv Tyler;amazing
Pakistan not only means freedom and independence but the Muslim Ideology which has to be preserved, which has come to us as a precious gift and treasure and which, we hope other will share with us.;Muhammad Ali Jinnah;hope
I can't imagine wanting to be famous just for the sake of being famous. I think fame should come along with success, talent.;Kat Dennings;famous
When you lead change, sometimes you get arrows in your back. I mean, that's just the way the real world is.;Carly Fiorina;change
I chose America as my home because I value freedom and democracy, civil liberties and an open society.;George Soros;home
At the School of Visual Arts in New York, you can get your degree in Net art, which is really a fantastic way of thinking of theater in new ways.;Laurie Anderson;graduation
One of the biggest challenges to medicine is the incorporation of information technology in our practices.;Samuel Wilson;technology
It is forbidden to kill therefore all murderers are punished unless they kill in large numbers and to the sound of trumpets.;Voltaire;war
The love of economy is the root of all virtue.;George Bernard Shaw;love
I don't come from money.;Christina Ricci;money
The vampire was a complete change from the usual romantic characters I was playing, but it was a success.;Bela Lugosi;romantic
We fall forward to succeed.;Mary Kay Ash;success
We are all born with a unique genetic blueprint, which lays out the basic characteristics of our personality as well as our physical health and appearance... And yet, we all know that life experiences do change us.;Joan D. Vinge;change
There will one day spring from the brain of science a machine or force so fearful in its potentialities, so absolutely terrifying, that even man, the fighter, who will dare torture and death in order to inflict torture and death, will be appalled, and so abandon war forever.;Thomas A. Edison;death
If you look closely, there is no book more visual than Three Trapped Tigers, in that it is filled with blank pages, dark pages, it has stars made of words, the famous magical cube made of numbers, and there is even a page which is a mirror.;Guillermo Cabrera Infante;famous
A singer starts by having his instrument as a gift from God... When you have been given something in a moment of grace, it is sacrilegious to be greedy.;Marian Anderson;god
If we ask a vague question, such as, 'What is poetry?' we expect a vague answer, such as, 'Poetry is the music of words,' or 'Poetry is the linguistic correction of disorder.';A. R. Ammons;poetry
Never esteem men on account of their riches or their station. Respect goodness, find it where you may.;William Cobbett;respect
Our soul is cast into a body, where it finds number, time, dimension. Thereupon it reasons, and calls this nature necessity, and can believe nothing else.;Blaise Pascal;nature
Science and literature give me answers. And they ask me questions I will never be able to answer.;Mark Haddon;science
A statesman wants courage and a statesman wants vision but believe me, after six months' experience, he wants first, second, third and all the time - patience.;Stanley Baldwin;courage
The art of economics consists in looking not merely at the immediate but at the longer effects of any act or policy it consists in tracing the consequences of that policy not merely for one group but for all groups.;Henry Hazlitt;art
I am drawn to women who are independent and creative, which is problematic because it's a struggle, a competition of careers. There's jealousy.;Marilyn Manson;jealousy
We will invest in our people, quality education, job opportunity, family, neighborhood, and yes, a thing we call America.;Dan Quayle;family
Genius is initiative on fire.;Holbrook Jackson;intelligence
Where the spirit does not work with the hand, there is no art.;Leonardo da Vinci;art
I think that there is nothing, not even crime, more opposed to poetry, to philosophy, ay, to life itself than this incessant business.;Henry David Thoreau;business
There is in true beauty, as in courage, something which narrow souls cannot dare to admire.;William Congreve;beauty
Talent, like beauty, to be pardoned, must be obscure and unostentatious.;Marguerite Gardiner;beauty
The man who never dreams, goes slowly mad.;Thomas Dolby;dreams
Poetry is something to make us wiser and better, by continually revealing those types of beauty and truth, which God has set in all men's souls.;James Russell Lowell;god
In '71 or '72 I returned to New Orleans and stayed there. I started cooking Louisiana food. Of all the things I had cooked, it was the best-and it was my heritage.;Paul Prudhomme;food
We have lost that which has made us great over the generations, and that is the sense of individual and personal responsibility that we can come up, we can pursue our dreams and our aspirations and we won't be blocked by government regulation, by the inability to get a loan as a small business to make our dreams come true.;Jon Huntsman, Jr.;dreams
I'm such a good lover because I practice a lot on my own.;Woody Allen;good
I started DJing, breakdancing and MCing in the '70s and I got my record deal in 1979 with 'Christmas Rap.';Kurtis Blow;christmas
With my wife I don't get no respect. I made a toast on her birthday to 'the best woman a man ever had.' The waiter joined me.;Rodney Dangerfield;birthday
When I am getting ready to reason with a man, I spend one-third of my time thinking about myself and what I am going to say and two-thirds about him and what he is going to say.;Abraham Lincoln;time
Ideas are, in truth, force.;Henry James;truth
For an adult, eating alone at McDonald's is admitting a kind of defeat.;Jonathan Carroll;alone
Old age is like everything else. To make a success of it, you've got to start young.;Theodore Roosevelt;success
I think they should have a Barbie with a buzz cut.;Ellen DeGeneres;funny
A good boss makes his men realize they have more ability than they think they have so that they consistently do better work than they thought they could.;Charles Erwin Wilson;men
The absurd is the essential concept and the first truth.;Albert Camus;truth
When I started writing full time I had not long stopped being a teacher and when at last I had a full day to write, I would put music on and wonder to myself - am I allowed to do this? Then I thought: 'I am control of this and no one is telling me what I can do.';Roddy Doyle;teacher
It has always amazed me how tax cuts don't work until they take effect. Mr. Obama's experience with deferred tax rate increases will be the reverse. The economy will collapse in 2011.;Arthur Laffer;experience
Put your heart, mind, and soul into even your smallest acts. This is the secret of success.;Swami Sivananda;success
While the Environmental Genome Project does not seek to assign allele frequencies, we are aware of the importance of accurate allele frequency estimates for future epidemiologic studies and the large sample sizes such estimates will require.;Samuel Wilson;environmental
And we're seeing a higher level of consciousness and many more opportunities for people to challenge their present ways of thinking and move into a grander and larger experience of who they really are.;Neale Donald Walsch;experience
I thought that all of the sacrifices and blessings of the whole history of mankind have devolved upon me. Thank you, God.;Ben Stein;history
To be loved is a strength. To love is a weakness.;Zsa Zsa Gabor;strength
Well, all comedy starts with anger. You get angry, and its never for a good reason, right? You know its not a good reason. And then you try and work it from there.;Jerry Seinfeld;anger
So then, the relationship of self to other is the complete realization that loving yourself is impossible without loving everything defined as other than yourself.;Alan Watts;relationship
I've never been a hands-on dad. I'm not ashamed to admit it, but you can't run a restaurant and be home for tea at 4:30 and bath and change nappies.;Gordon Ramsay;dad
But my most favourite pursuit, after my daily exertions at the Foundry, was Astronomy. There were frequently clear nights when the glorious objects in the Heavens were seen in most attractive beauty and brilliancy.;James Nasmyth;beauty
A toothache, or a violent passion, is not necessarily diminished by our knowledge of its causes, its character, its importance or insignificance.;T. S. Eliot;knowledge
The happiness of your life depends upon the quality of your thoughts: therefore, guard accordingly, and take care that you entertain no notions unsuitable to virtue and reasonable nature.;Marcus Aurelius;happiness
When you come from desperate poverty, and that's exactly what I come from, you know that nonsenses are not to be tolerated. I'm not sure who gains from chaos, but I know it's not the poor folks in the council flats. The politics of vindictiveness is never, ever anything like a solution.;Johnny Rotton;politics
I did not resign from politics because of Bofors. I resigned because I do not know how to play petty politics. I did not know back then and I don't know now either.;Amitabh Bachchan;politics
The future depends entirely on what each of us does every day a movement is only people moving.;Gloria Steinem;future
Whenever ideas fail, men invent words.;Martin H. Fischer;men
If men are honest, everything they do and everywhere they go is for a chance to see women.;Jack Nicholson;men
The Arab World is writing a new future the pen is in our own hands.;Abdallah II;future
I'm not blaming my mom for my life because I am responsible for me, and nobody can change me or ruin me easier than I can.;Mindy McCready;mom
If net neutrality goes away, it will fundamentally change everything about the Internet.;James Hilton;computers
I am very fond of truth, but not at all of martyrdom.;Voltaire;truth
The word 'equality' shows up too much in our founding documents for anyone to pretend it's not the American way.;Martha Plimpton;equality
The flowery style is not unsuitable to public speeches or addresses, which amount only to compliment. The lighter beauties are in their place when there is nothing more solid to say but the flowery style ought to be banished from a pleading, a sermon, or a didactic work.;Voltaire;work
There comes a time when deceit and defiance must be seen for what they are. At that point, a gathering danger must be directly confronted. At that point, we must show that beyond our resolutions is actual resolve.;Dick Cheney;time
Open markets offer the only realistic hope of pulling billions of people in developing countries out of abject poverty, while sustaining prosperity in the industrialized world.;Kofi Annan;hope
When I use my strength in the service of my vision it makes no difference whether or not I am afraid.;Audre Lorde;strength
You always want to go out there with the best book possible, so I listen to what my editors say, and even if they don't know how to fix it, I always seem to find a way. 'Trust Your Eyes' is the best book I've written, and I don't know if I can do any better.;Linwood Barclay;trust
It takes courage to know when you ought to be afraid.;James A. Michener;courage
One picture is worth 1,000 denials.;Ronald Reagan;funny
It is sad to grow old but nice to ripen.;Brigitte Bardot;sad
Love is never defeated, and I could add, the history of Ireland proves it.;Pope John Paul II;love
Welcome to Lake Wobegon, where all the women are strong, all the men are good-looking, and all the children are above average.;Garrison Keillor;women
For though we love both the truth and our friends, piety requires us to honor the truth first.;Aristotle;love
You are not angry with people when you laugh at them. Humor teaches tolerance.;W. Somerset Maugham;humor
I am very much opposed to abortion personally. But I don't think it is the government's rule.;Arlen Specter;government
I don't think I ever got the hang of the writers' room. I love collaborating with people, but I really do my best work alone, and I think I would want to - if I did something again, I think I'd want to take total ownership the way Aaron Sorkin or David Kelley does.;Diablo Cody;alone
I feel a lot healthier when I'm having sex. Physically. I feel all these jitters when I wake up in the morning. Just energy jitters. I take vitamins, I work out every day. When I'm having sex, I don't have that.;Alyssa Milano;morning
By no means do I want to be a piece of meat for the rest of my career. It's funny when you get asked to do a talk show, and then they follow it up with requesting you take your shirt off.;Kellan Lutz;funny
I fell in love with many women at school who had no idea I existed. I'm a bit of a romantic.;Eric Bana;romantic
The beginning of a friendship, the fact that two people out of the thousands around them can meet and connect and become friends, seems like a kind of magic to me. But maintaining a friendship requires work. I don't mean that as a bad thing. Good art requires work as well.;Charles de Lint;art
The primary victims of Katrina, those who were given the least help by the government, those rescued last or not at all, were overwhelmingly people of color largely hidden from the mainstream of society.;Jonathan Kozol;government
Power is action the electoral principle is discussion. No political action is possible when discussion is permanently established.;Honore de Balzac;power
That said, the question remains: how to strike the balance between free speech and mutual respect in this mixed-up world, both blessed and cursed with instant communication? We should not fight fire with fire, threats with threats.;Timothy Garton Ash;communication
There is a boundary to men's passions when they act from feelings but none when they are under the influence of imagination.;Edmund Burke;imagination
I was never very interested in boys - and there were plenty of them - vying with one another to see how many famous women they would get into the hay.;Bette Davis;women
You can have financial strength, professional strength, emotional strength but for me without spiritual strength none of the rest of it matters.;Star Jones;strength
Time is the most valuable thing on earth: time to think, time to act, time to extend our fraternal relations, time to become better men, time to become better women, time to become better and more independent citizens.;Samuel Gompers;women
I'm actually tougher on myself as I get older. It's a vicious cycle. The things that are important in life are the things that you can't buy in life: love, health and happiness. I say that, and I believe that, and I try to live that.;Criss Angel;happiness
The power of the people and the power of reason are one.;Georg Buchner;power
Both referred to the Affordable Care Act, which is the accurate title of the health care reform law, as 'Obamacare.' That is a disparaging reference to the President of the United States, it is meant as a disparaging reference to the President of the United States.;Debbie Wasserman Schultz;health
We are made wise not by the recollection of our past, but by the responsibility for our future.;George Bernard Shaw;wisdom
Our fears are an amazing gift of the imagination... a way of glimpsing what might be the future when there's still time to influence how that future will play out.;Karen Thompson Walker;imagination
Where large sums of money are concerned, it is advisable to trust nobody.;Agatha Christie;trust
Men and women of every faith and good people with none at all sincerely strive to do right and lead a purpose-driven life.;Mitt Romney;men
I like to edit my sentences as I write them. I rearrange a sentence many times before moving on to the next one. For me, that editing process feels like a form of play, like a puzzle that needs solving, and it's one of the most satisfying parts of writing.;Karen Thompson Walker;movingon
Politics is not a healthy lifestyle.;Kenneth Robert Livingstone;politics
A person with a new idea is a crank until the idea succeeds.;Mark Twain;success
I was able to do To Sleep with Anger, a very powerful film about African Americans, their spirituality, and the things that happened within a small community and a family.;Danny Glover;anger
The president of General Motors was in a foul humor.;Arthur Hailey;humor
There's no doubt that scientific training helps many authors to write better science fiction. And yet, several of the very best were English majors who could not parse a differential equation to save their lives.;David Brin;science
One must not trifle with love.;Alfred de Musset;love
There can only be democracy when money is not allowed to be spent in Politics.;Imran Khan;politics
Patience is sorrow's salve.;Charles Churchill;patience
Going to the theater is such a joyous experience. My dad would take my sister and me to plays when we were very young, like six or seven years old.;Julia Roberts;dad
Scientia is knowledge. It is only in the popular mind that it is equated with facts.;John Charles Polanyi;knowledge
Only one who devotes himself to a cause with his whole strength and soul can be a true master. For this reason mastery demands all of a person.;Albert Einstein;strength
It is relatively easy to design for the perfect cases, when everything goes right, or when all the information required is available in proper format.;Donald Norman;design
