I believe in incentivizing people. If you can incentivize people in anything, whether it's in politics in life in spirituality in business just take care of folks. Incentivize them and all of a sudden it's amazing the difference that you'll see.;Zachary Levi;politics
Offspring, the due performance on religious rites, faithful service, highest conjugal happiness and heavenly bliss for the ancestors and oneself, depend on one's wife alone.;Guru Nanak;alone
And I hope that five years and 10 years from now, I'll be a better man, a more mature man, a wiser man, a more humble man and a more spirited man to serve the good of my people and the good of humanity.;Louis Farrakhan;good
I don't really see science fiction as fiction. I can imagine colonies on Mars and everything.;Sigourney Weaver;science
And what most people don't understand is the bulk of business in this country is small business.;Alphonso Jackson;business
Creativity requires the courage to let go of certainties.;Erich Fromm;courage
God cannot give us a happiness and peace apart from Himself, because it is not there. There is no such thing.;C. S. Lewis;happiness
He who knows no hardships will know no hardihood. He who faces no calamity will need no courage. Mysterious though it is, the characteristics in human nature which we love best grow in a soil with a strong mixture of troubles.;Harry Emerson Fosdick;love
War is not the quintessential emergency in which man has to prove himself, as my generation learned at its school desks in the days of the Kaiser rather, peace is the emergency in which we all have to prove ourselves.;Gustav Heinemann;peace
I've noticed that once you leave London you do kind of become a bit more famous. People in London are a bit too cool for school. It's not so unusual to see someone from London in the street. But outside of London people are a bit more excited to see you and come out and support you.;David Walliams;cool
I'm as happy a man as any in the world, for the whole world seems to smile upon me!;Samuel Smiles;smile
Change your life today. Don't gamble on the future, act now, without delay.;Simone de Beauvoir;change
Testing oneself is best when done alone.;Jimmy Carter;alone
Simply by not owning three medium-sized castles in Tuscany I have saved enough money in the last forty years on insurance premiums alone to buy a medium-sized castle in Tuscany.;Ludwig Mies van der Rohe;money
If you are worried about job security and do not have an adequate emergency fund (ideally eight months' worth of living expenses stashed away in a federally insured bank or credit union), you need to focus more on saving money than paying down the balance on your credit cards.;Suze Orman;money
Not only must we be good, but we must also be good for something.;Henry David Thoreau;good
You know, women are as promiscuous as men and yet, of course, people are inhibited from having an affair or a relationship because the real-world consequences are a drag.;Lee Child;relationship
I have nothing against turkey. We eat turkey for Thanksgiving in my house.;Marc Forgione;thanksgiving
All successful people men and women are big dreamers. They imagine what their future could be, ideal in every respect, and then they work every day toward their distant vision, that goal or purpose.;Brian Tracy;work
I'm not into watching stuff I did last week, let alone three or four years ago.;Chris Hemsworth;alone
The poetry of heroism appeals irresistibly to those who don't go to a war, and even more to those whom the war is making enormously wealthy. It's always so.;Louis-Ferdinand Celine;poetry
Undeserved praise causes more pangs of conscience later than undeserved blame, but probably only for this reason, that our power of judgment are more completely exposed by being over praised than by being unjustly underestimated.;Friedrich Nietzsche;power
I've failed over and over and over again in my life and that is why I succeed.;Michael Jordan;success
People are always angry at America. They're absolutely certain that America either caused their problems or is deliberately not fixing their problems. But the anger is always directed at America and never at Americans.;P. J. O'Rourke;anger
If you wait until your children are high school seniors to spring it on them that there's not a whole lot of money for school, they won't have too many options.;Suze Orman;money
Trophies and medals have never meant much to me. I've had amazing experiences, which let you feel like you've accomplished something.;John Krasinski;amazing
Find something in life that you love doing. If you make a lot of money, that's a bonus, and if you don't, you still won't hate going to work.;Jeff Foxworthy;money
Thanksgiving is a time when the world gets to see just how blessed and how workable the Christian system is. The emphasis is not on giving or buying, but on being thankful and expressing that appreciation to God and to one another.;John Clayton;god
To be able to sit in Donald Trump's apartment and talk about the future of corporate real estate was amazing.;Shia LaBeouf;amazing
Julia Child wasn't afraid to have fun. She made fantastic food but knew how to have a good time and not be too stuck up about the kitchen space.;Nadia Giosia;food
Flowers always make people better, happier, and more helpful they are sunshine, food and medicine for the soul.;Luther Burbank;gardening
Better by far you should forget and smile than that you should remember and be sad.;Christina G. Rossetti;sad
What does it mean to pre-board? Do you get on before you get on?;George Carlin;travel
I have long since come to believe that people never mean half of what they say, and that it is best to disregard their talk and judge only their actions.;Dorothy Day;best
I don't spend much money on clothes I never did.;Lauren Hutton;money
I don't think people understand that being poor means you have to work from dawn until dusk just to survive through the day. I think there's some notion that poor people lie about all day not doing anything.;Emma Thompson;work
I was born in the '60s and grew up in the '70s - not exactly the best decade for food in British history. It was horrendous. It was a time when, as a nation, we excelled in art and music and acting and photography and fashion - all creative skills... all apart from cooking.;Heston Blumenthal;food
Your God is ever beside you - indeed, He is even within you.;Alphonsus Liguori;god
Action cures fear, inaction creates terror.;Douglas Horton;fear
I think it's brought the world a lot closer together, and will continue to do that. There are downsides to everything there are unintended consequences to everything. The most corrosive piece of technology that I've ever seen is called television - but then, again, television, at its best, is magnificent.;Steve Jobs;best
Education is not preparation for life education is life itself.;John Dewey;education
It is all one to me if a man comes from Sing Sing Prison or Harvard. We hire a man, not his history.;Malcolm Forbes;history
Internet entrepreneurs are using technology at every level of their company - from a one-person agency to a small firm, the newest technological advances are interwoven throughout every aspect of Internet-based businesses.;Marc Ostrofsky;technology
I am the greatest, I said that even before I knew I was.;Muhammad Ali;great
When you go in and do a cool, small character, it feels less like work and more like fun.;Balthazar Getty;cool
People should watch out for three things: avoid a major addiction, don't get so deeply into debt that it controls your life, and don't start a family before you're ready to settle down.;James Taylor;family
For a long time the people at my shows were sort of the Pantera-tattoo trucker guys, really cool dudes, but I don't know what happened to them. That's the crowd that I like, the ones that don't get so offended just to be offended.;Dave Attell;cool
I think that we had a different view of what the 21st century could be like, with much more of a sense, from our perspective, of trying to have an interdependent world: looking at solving regional conflicts, having strength in alliances, operating within some kind of a sense that we were part of the international community and not outside of it.;Madeleine Albright;strength
There's nothing like a good cheating song to make me want to run home to be with my wife.;Steven Curtis Chapman;home
The beauty of a woman must be seen from in her eyes, because that is the doorway to her heart, the place where love resides.;Audrey Hepburn;love
Unfortunately the global warming hysteria, as I see it, is driven by politics more than by science.;Freeman Dyson;politics
Republicans rarely criticize Obama for lack of empathy - in part because liberals have traditionally been seen as standing up for the weak and the vulnerable. Conservatives can be just as empathetic. But they believe that, in most cases, it's not government's role to be the primary dispenser of empathy.;Gary Bauer;government
I look at Jagger and the like and if I see a good attitude I'll admire it but I wouldn't copy their style.;Michael Hutchence;attitude
All who call on God in true faith, earnestly from the heart, will certainly be heard, and will receive what they have asked and desired.;Martin Luther;faith
Mencius said that human nature is good. I disagree with that.;Xun Zi;nature
Music is the refuge of souls ulcerated by happiness.;Emile M. Cioran;happiness
This is not Johnson's war. This is America's war. If I drop dead tomorrow, this war will still be with you.;Lyndon B. Johnson;war
A large income is the best recipe for happiness I ever heard of.;Jane Austen;best
When I run in the morning, my body spends the first 20 minutes trying to figure out what's happening to it.;Danny Pudi;morning
A good education is another name for happiness.;Ann Plato;happiness
It is clear that not in one thing alone, but in many ways equality and freedom of speech are a good thing.;Herodotus;equality
My wife, whenever I'd go off to work and I'd be kind of anxious, she'll say, 'Remember, have fun.' Oh, I forgot, thanks for the reminder. Because sometimes we do forget. We take it all too seriously and there's a lot of joy to be had wherever you are.;Jeff Bridges;work
Football is a game about feelings and intelligence.;Jose Mourinho;intelligence
Young film makers should learn how to deal with the money and learn how to deal with the power structure. Because it is like a battle.;Martin Scorsese;power
The artist is a receptacle for emotions that come from all over the place: from the sky, from the earth, from a scrap of paper, from a passing shape, from a spider's web.;Pablo Picasso;art
What does it matter how one comes by the truth so long as one pounces upon it and lives by it?;Henry Miller;truth
I deserve respect for the things I did not do.;Dan Quayle;respect
Soccer and cricket were my main sports growing up. I had trials as a soccer player with a few clubs interested, Crystal Palace being one, but it was cricket which became my chosen profession.;Ian Botham;sports
Professionalism is not sportsmanship. If you don't succeed, you won't be in your profession for long. In our society, it's not about good or bad. It's about who's on top.;Chili Davis;good
When I get into bed at night, I hope I don't get into it alone!;Calvin Klein;alone
The most authentic thing about us is our capacity to create, to overcome, to endure, to transform, to love and to be greater than our suffering.;Ben Okri;love
The sad truth is that most evil is done by people who never make up their minds to be good or evil.;Hannah Arendt;sad
Change is not a destination, just as hope is not a strategy.;Rudy Giuliani;hope
What I dream of is an art of balance, of purity and serenity devoid of troubling or depressing subject matter - a soothing, calming influence on the mind, rather like a good armchair which provides relaxation from physical fatigue.;Henri Matisse;art
I contribute my best in my sport and I also have a ton of respect for myself and my family.;Venus Williams;family
There are books of which the backs and covers are by far the best parts.;Charles Dickens;best
When I travel abroad, because I'm Columbian, I'm always one that they check twice and security and I'm the one that they open my bag and the one they pull to the side to check the visa.;Sofia Vergara;travel
The Southern slave would obey God in respect to marriage, and also to the reading and studying of His word. But this, as we have seen, is forbidden him.;Gerrit Smith;respect
Change your thoughts and you change your world.;Norman Vincent Peale;change
Science without conscience is the death of the soul.;Francois Rabelais;death
One does not need buildings, money, power, or status to practice the Art of Peace. Heaven is right where you are standing, and that is the place to train.;Morihei Ueshiba;money
Now this relaxation of the mind from work consists on playful words or deeds. Therefore it becomes a wise and virtuous man to have recourse to such things at times.;Thomas Aquinas;work
I tour alone. There's no sound check, no back up. I stay with the hosts I am in a family home and it's really nourishing. I just have to remember after the show not to run out into the living room in my pyjamas. Every day, it's a new relationship being built. It's odd and wonderful.;Jane Siberry;alone
It's funny how social activists usually protest against the only things that have a credible chance of achieving the activists' goals.;Craig Bruce;funny
Leaving home in a sense involves a kind of second birth in which we give birth to ourselves.;Robert Neelly Bellah;home
Where I come from, it was a heresy to say you wanted to be in movies, leave alone American movies.;Daniel Day-Lewis;alone
After a lifetime of world travel I've been fascinated that those in the third world don't have the same perception of reality that we do.;Jim Harrison;travel
My first experiences of academic friendship made me smile in after years when I looked back on them. But my circle of acquaintances had gradually grown so large that it was only natural new friendships should grow out of it.;Georg Brandes;friendship
I love the solitude of being on a plane and finally getting to read an entire book and being left alone.;Christina Ricci;alone
The thing that differentiates man from animals is money.;Gertrude Stein;money
Wisdom is found only in truth.;Johann Wolfgang von Goethe;wisdom
The day I finished 'Twilight,' I came home and started bulking up. For 'New Moon,' I'm 30 pounds heavier than I was in 'Twilight.';Taylor Lautner;home
The color of truth is gray.;Andre Gide;truth
Gabriel Byrne is an extraordinary human being. We have two extraordinary kids and we work at it. We were always friends. He stuck by me through very hard times, and I hope he'd say the same about me.;Ellen Barkin;hope
Because of the lack of education on AIDS, discrimination, fear, panic, and lies surrounded me.;Ryan White;fear
He that would be angry and sin not, must not be angry with anything but sin.;John Ruskin;anger
I want to thank all the women who have worn my clothes, the famous and the unknown, who have been so faithful to me and given me so much joy.;Yves Saint Laurent;famous
Orlando's a part of me. The next guy's a part of me. And the next guy's a part of me. That's all I'm trying to do, is tell cool stories that people can relate to.;Shemar Moore;cool
You find happiness where you find it.;Anna Paquin;happiness
I've always believed that you can think positive just as well as you can think negative.;James A. Baldwin;positive
I hasten to laugh at everything, for fear of being obliged to weep.;Pierre Beaumarchais;fear
I also became close to nature, and am now able to appreciate the beauty with which this world is endowed.;James Dean;nature
I hope this doesn't sound pompous but I don't think of myself as famous, whatever fame I've got has come through what I've done and associations of things I've done.;Peter Cushing;famous
It is impossible to imagine the universe run by a wise, just and omnipotent God, but it is quite easy to imagine it run by a board of gods.;H. L. Mencken;god
To live your life well, and have respect for what came before or after - there's a strong respect for that in African culture.;Anna Deavere Smith;respect
Tommie Aaron taught me how to have a good attitude, to be easy going and not get uptight.;Dale Murphy;attitude
In terms of number of movies, I've been in an extraordinary amount. If you count only the minutes I'm onscreen, it's not so long.;Wallace Shawn;movies
Only the change on the international scene, the crisis in the gulf, and the strong, firm position of the United States against aggression between two Arab countries created realities that led to the Madrid Peace Conference.;Yitzhak Rabin;peace
The wretch who lives without freedom feels like dressing in the mud from the streets Those who have you, o Liberty, do not know. you. Those who do not have you should not speak of you, but win you.;Jose Marti;freedom
I began the study of medicine, impelled by a desire for knowledge of facts and of man. The resolution to do disciplined work tied me to both laboratory and clinic for a long time to come.;Karl Jaspers;knowledge
I've made a promise to myself to be a 100% healthy person if nothing else.;Picabo Street;health
With acknowledgement of residues, we can be more easily prepared to grant the unit of science, the overlapping of disciplines, and the total coherence of all facts.;Kenneth L. Pike;science
No human being, however great, or powerful, was ever so free as a fish.;John Ruskin;great
The time is now for Congress to address health care in America.;John Conyers;health
A true friend is the greatest of all blessings, and that which we take the least care of all to acquire.;Francois de La Rochefoucauld;friendship
The respect for human rights, essential if we are to use technology wisely, is not something alien that must be grafted onto science. On the contrary, it is integral to science, as also to scholarship in general.;John Charles Polanyi;science
I went to a fight the other night, and a hockey game broke out.;Rodney Dangerfield;sports
We have to pray with our eyes on God, not on the difficulties.;Oswald Chambers;god
My problem is that I like technology, but I always have to ask myself, 'Now wait a minute, will I actually have any use for this?';Jerry Zucker;technology
My family belongs to a tennis club in Valencia, California, so I always go there. I play a lot of tennis with my dad and swim. And I like to go to the gym there.;Ashley Tisdale;dad
We can lick gravity, but sometimes the paperwork is overwhelming.;Wernher von Braun;science
Once you become successful, people know where you live, the type of house you live in, the kind of car you drive, the clothes you wear, and so it would be patronising to go and talk like a welder. Welding's a mystery to me now. You can't go back, your life changes every day.;Billy Connolly;car
I hold that religion and faith are two different things.;Pat Buckley;religion
The sort of poetry I seek resides in objects man can't touch.;E. M. Forster;poetry
At this year's Open, I'll have five boyfriends.;Anna Kournikova;dating
All that stuff about heavy metal and hard rock, I don't subscribe to any of that. It's all just music. I mean, the heavy metal from the '70s sounds nothing like the stuff from the '80s, and that sounds nothing like the stuff from the '90s. Who's to say what is and isn't a certain type of music?;Neil Young;music
I buy food and gasoline - that's it.;Kat Dennings;food
Make a Goal Box, a chart of positive daily contact with a family when you are working with them.;Richard G. Scott;positive
I think I might actually die of showing off. It'll be on my headstone - 'Cause of Death: Showing Off.';Jenny Eclair;death
As a politician who cherishes religious conviction in his personal sphere, but regards politics as a domain belonging outside religion, I believe that this view is seriously flawed.;Recep Tayyip Erdogan;religion
I have learned, that if one advances confidently in the direction of his dreams, and endeavors to live the life he has imagined, he will meet with a success unexpected in common hours.;Henry David Thoreau;learning
Organized labor, if they're doing a responsible job, is going to organize the pooling of small amounts of money to protect the interests of the people who are not rich.;Warren Beatty;money
A molecular manufacturing technology will let us build molecular surgical tools, and those tools will, for the first time, let us directly address the problems at the very root level.;Ralph Merkle;technology
It's easier to change what you do than people think it is. If you don't change, your field changes around you.;Walter Gilbert;work
The pictures of my family were designed to be on a family wall, they were supposed to be together. It was supposed to copy my mother's wall in her house.;Annie Leibovitz;family
I think it's a good thing for a president or political leaders to want to put their values or their faith into action. Desmond Tutu did that in South Africa. Martin Luther King Jr. did that here. This is a good thing.;Jim Wallis;faith
People called '28 Days' and '28 Weeks' zombie movies, and they're not! It's some sort of virus they're not dead.;George A. Romero;movies
Movies are hard work. The public doesn't see that. The critics don't see it. But they're a lot of work. A lot of work.;Robert De Niro;movies
For his heart was in his work, and the heart giveth grace unto every art.;Henry Wadsworth Longfellow;art
Most of what I listen to now is mainstream jazz from 1935 right up to and including early bebop and cool jazz.;Dave Van Ronk;cool
A creative man is motivated by the desire to achieve, not by the desire to beat others.;Ayn Rand;motivational
Country music is three chords and the truth.;Harlan Howard;music
Faith is an aptitude of the spirit. It is, in fact, a talent: you must be born with it.;Anton Chekhov;faith
I played sports year around: basketball, soccer, softball and I ran track year around, from the time I was, like, six, seven.;Gabrielle Union;sports
Few things are impracticable in themselves and it is for want of application, rather than of means, that men fail to succeed.;Francois de La Rochefoucauld;men
Goals provide the energy source that powers our lives. One of the best ways we can get the most from the energy we have is to focus it. That is what goals can do for us concentrate our energy.;Denis Waitley;best
But if nothing but soul, or in soul mind, is qualified to count, it is impossible for there to be time unless there is soul, but only that of which time is an attribute, i.e. if change can exist without soul.;Aristotle;time
Family is the most important thing in the world.;Princess Diana;family
All men and women have an equal need for love. When these needs are not fulfilled it is easy to have our feelings hurt, for which we blame our partner.;John Gray;men
When I hosted the dinner I served fast food hamburgers. It had nothing to do with black, white, purple, yellow, green race. it had nothing to do with Tiger or his family or his golf game.;Fuzzy Zoeller;food
Don't be afraid of your dreams.;Jacques Parizeau;dreams
Freedom is not procured by a full enjoyment of what is desired, but by controlling the desire.;Epictetus;freedom
A supermodel needed to be able to be on 'Sports Illustrated,' to be able to walk runways, to be able to do beauty ads, to be on covers. And the girls now can no longer be on covers and be in the ads because your actresses have taken over all the jobs. I don't know what happened, but we want our jobs back.;Kim Alexis;beauty
To profit from good advice requires more wisdom than to give it.;Wilson Mizner;wisdom
He's the kind of man a woman would have to marry to get rid of.;Mae West;marriage
The instinct of nearly all societies is to lock up anybody who is truly free. First, society begins by trying to beat you up. If this fails, they try to poison you. If this fails too, the finish by loading honors on your head.;Jean Cocteau;society
Our attitudes control our lives. Attitudes are a secret power working twenty-four hours a day, for good or bad. It is of paramount importance that we know how to harness and control this great force.;Irving Berlin;great
Men do not fail they give up trying.;Elihu Root;men
I'm not a big sports fan, but I love it when they 'slam dunk.' That's sexy.;Emma Bunton;sports
The real solution is to improve the incomes of the poor and provide their children with decent education.;Carol Bellamy;education
This is so cliche, but my beauty icon would have to be Angelina Jolie. She looks like she wears natural makeup, but she's still beautiful.;Tila Tequila;beauty
I have enough love to last me a lifetime! Thank God I'll never lose my imagination and my passion. That's really what it is. I'm still passionate about what I do.;Teena Marie;imagination
The day in 2004 when the radiologist told me I had invasive cancer, I walked down the hospital corridor looking for a phone to call my husband, and I could almost see the fear coming toward me like a big, black shadow.;Geraldine Brooks;fear
Coming out involves varying degrees of difficulty that are affected by class, race, religion, and geography.;Lance Loud;religion
There's a lot of thought in art. People get to talk about important things. There's a lot of sex, you know, in art. There's a lot of naked women and men, and there's intrigue, there's fakery. It's a real microcosm of the larger world.;Steve Martin;art
I feel like my work has been my path to freedom from having grown up in a segregated environment.;Anna Deavere Smith;freedom
Travel in all the four quarters of the earth, yet you will find nothing anywhere. Whatever there is, is only here.;Ramakrishna;travel
Remember, the burden of sorrow is doubled when it is borne alone.;Goran Persson;alone
