I see when men love women. They give them but a little of their lives. But women when they love give everything.;Oscar Wilde;women
I don't believe in God but I'm very interested in her.;Arthur C. Clarke;god
If forgers and malefactors are put to death by the secular power, there is much more reason for excommunicating and even putting to death one convicted of heresy.;Thomas Aquinas;death
I think Nina Simone has had an amazing journey. She was spicy and she had attitude and she didn't care, she wanted her money in a paper bag and don't mess with me and I've been doing some research on that so.;Nia Long;amazing
There has been a change in attitude, though.;Daniel Petrie;attitude
A lot of the struggle I had with movies is I really loved moments and tones and feelings in a scene, and I loved creating those, but I never really had great stories to string them together.;Louis C. K.;movies
Electronic aids, particularly domestic computers, will help the inner migration, the opting out of reality. Reality is no longer going to be the stuff out there, but the stuff inside your head. It's going to be commercial and nasty at the same time.;J. G. Ballard;computers
My boyfriend and I broke up. He wanted to get married and I didn't want him to.;Rita Rudner;dating
To lack intelligence is to be in the ring blindfolded.;David M. Shoup;intelligence
I try to be known more for my work than for anything else.;Charlie Sheen;work
The most fundamental fact about the ideas of the political left is that they do not work. Therefore we should not be surprised to find the left concentrated in institutions where ideas do not have to work in order to survive.;Thomas Sowell;work
Several professional athletes have wrongly taught many young Americans by example that the only way to succeed in sports is to take steroids.;Jim Sensenbrenner;sports
The trouble with learning from experience is that you never graduate.;Doug Larson;experience
I believe that you should gravitate to people who are doing productive and positive things with their lives.;Nadia Comaneci;positive
If I were going to convert to any religion I would probably choose Catholicism because it at least has female saints and the Virgin Mary.;Margaret Atwood;religion
It is necessary to the happiness of man that he be mentally faithful to himself. Infidelity does not consist in believing, or in disbelieving, it consists in professing to believe what he does not believe.;Thomas Paine;happiness
A fulfilling life is different to each person. You have to acknowledge your dreams, and not just wait for life to happen, and opportunities to come knocking at your door.;Joan Lunden;dreams
All too often miners, and indeed other trade unionists, underestimate the economic strength they have.;Arthur Scargill;strength
You demand respect and you'll get it. First of all, you give respect.;Mary J. Blige;respect
In the practical art of war, the best thing of all is to take the enemy's country whole and intact to shatter and destroy it is not so good.;Sun Tzu;art
Education should be one of our top funding priorities talking about it does not help the teachers and students who desperately need promises fulfilled.;Solomon Ortiz;education
We've got to demonstrate why European unity and integration, our vast single market, our single currency, equip us with the strength to embrace globalization.;Peter Mandelson;strength
Women can't do everything at the same time, we need to understand milestones in our lives comes in segments.;Madeleine Albright;women
Now, being a girl, I was ashamed of my body and my lack of strength. So I tried to be a man. I shot, rode, jumped, and took part in all the fights of the boys.;Agnes Smedley;strength
The God who gave us life, gave us liberty at the same time.;Thomas Jefferson;god
We control the content of our dreams.;Thom Gunn;dreams
My mom was a waitress, and my dad was a plumber who worked for the City of San Clemente fixing mains breaks, so not too glamorous.;Shaun White;dad
You know it's going to hell when the best rapper out there is white and the best golfer is black.;Charles Barkley;sports
I like mathematics because it is not human and has nothing particular to do with this planet or with the whole accidental universe - because, like Spinoza's God, it won't love us in return.;Bertrand Russell;god
Cultivation to the mind is as necessary as food to the body.;Marcus Tullius Cicero;food
I'm a romantic slob!;Willie Nelson;romantic
Well, my thoughts about California are kind of mythological. To me, as well as being a real place, it's a place where people go to find something - to find happiness or to realize their dreams. So it has that kind of quality of heroism and heartache, and Australia has that, as well.;Colin Hay;happiness
We love the precepts for the teacher's sake.;George Farquhar;teacher
If we gave up eating beef we would have roughly 20 to 30 times more land for food than we have now.;James Lovelock;food
The natural superiority of women is a biological fact, and a socially acknowledged reality.;Ashley Montagu;women
One goes through school, college, medical school and one's internship learning little or nothing about goodness but a good deal about success.;Ashley Montagu;medical
The best thing to do with the best things in life is to give them up.;Ambrose Bierce;best
Popstars really draws you in. It's fascinating. It's interesting to watch people thrown together in that kind of a situation. Even if the egos weren't involved and they weren't trying to be world famous. It's the Real World, only better.;Scott Patterson;famous
We imagine that we want to escape our selfish and commonplace existence, but we cling desperately to our chains.;Anne Sullivan Macy;imagination
Bob Altman had this relaxed but serious attitude. Everybody loved him. I wanted him to adopt me.;Steve Buscemi;attitude
There is no connection between the political ideas of our educated class and the deep places of the imagination.;Lionel Trilling;imagination
Time spent with cats is never wasted.;Sigmund Freud;pet
Discouragement is not the absence of adequacy but the absence of courage.;Neal A. Maxwell;courage
The less I behave like Whistler's mother the night before, the more I look like her the morning after.;Tallulah Bankhead;morning
If you're going to tell people the truth, be funny or they'll kill you.;Billy Wilder;truth
Pride slays thanksgiving, but a humble mind is the soil out of which thanks naturally grow. A proud man is seldom a grateful man, for he never thinks he gets as much as he deserves.;Henry Ward Beecher;thanksgiving
Pessimism leads to weakness, optimism to power.;William James;power
Our authorities leave us no doubt that the trust lodged with the oligarchy was sometimes abused, but it certainly ought not to be regarded as a mere usurpation or engine of tyranny.;Henry James Sumner Maine;trust
My dad's whole family is in Madras and I was born in America so we didn't have that big Indian community. I don't really have anything interesting to say about it. When I talk about it people are like, 'meh, let's talk about something else.';Mindy Kaling;family
I had the privilege of practicing medicine in the early '60s, before we had any government. It worked rather well, and there was nobody on the street suffering with no medical care.;Ron Paul;medical
That was excellent! I mean, it didn't do anything, but it looked really cool!;Adam Savage;cool
If one tends to be a humorous person and you have a sense of humor the rest of your life then you can certainly lighten the load, I think, by bringing that to your trials and tribulations. It's easy to have a sense of humor when everything is going well.;Alan Thicke;humor
First and last, what is demanded of genius is love of truth.;Johann Wolfgang von Goethe;truth
While I had often said that I wanted to die in bed, what I really meant was that in my old age I wanted to be stepped on by an elephant while making love.;Roger Zelazny;age
You can't trust actors.;Emma Roberts;trust
Exercise should be regarded as tribute to the heart.;Gene Tunney;fitness
The Broken Bow group is such a great family and seem like a group of tight-knit people. When I looked for a new label, I wanted to feel I could trust everybody. I wanted motivation to be at an all-time high.;Fatima Siad;trust
The past cannot be changed. The future is yet in your power.;Mary Pickford;future
I think fashion is a lot of fun. I love clothes. More than fashion or brand labels, I love design. I love the thought that people put into clothes. I love when clothes make cultural statements and I think personal style is really cool. I also freely recognize that fashion should be a hobby.;Anne Hathaway;design
Every crisis offers you extra desired power.;William Moulton Marston;power
But the best thing Washington can do for education is realize that our role is limited. Washington must keep its promises, but let those who know our childrens' names- parents, teachers and school board members- make education decisions.;Mark Kennedy;education
Definitely they write themselves. It's an amazing experience. It's like the characters have come alive and are sitting on my shoulder talking to me, telling me their tales.;R. A. Salvatore;amazing
In the night of death, hope sees a star, and listening love can hear the rustle of a wing.;Robert Green Ingersoll;hope
When men hear women want a commitment, they think it means commitment to a romantic relationship, but that's not it. It's a commitment to not floating around anymore. I want a guy who is entrenched in his own life. Entrenched is awesome.;Mindy Kaling;romantic
You can't walk alone. Many have given the illusion, but none have really walked alone. Man is not made that way. Each man is bedded in his people, their history, their culture, and their values.;Peter Abrahams;alone
The sports world is an echo chamber. All it takes is one quote from a general manager and a thousand sports columns bloom.;Michael Lewis;sports
God continues to work miracles in my life.;Willie Aames;god
Even if I have to stand alone, I will not be afraid to stand alone. I'm going to fight for you. I'm going to fight for what's right. I'm going to fight to hold people accountable.;Barbara Boxer;alone
Good judgment comes from experience and experience comes from bad judgment.;Fred Brooks;experience
You may keep your beauty and your health, unless you destroy them yourself, or discourage them to stay with you, by using them ill.;William Temple;beauty
If you dream of something worth doing and then simply go to work on it and don't think anything of personalities, or emotional conflicts, or of money, or of family distractions it is amazing how quickly you get through those 5,000 steps.;Edwin Land;work
Yeah, ideally, I'd probably wish to be more anonymous. But scrutiny and success go together. And I want to be successful.;Paula Radcliffe;success
Home is pretty utopian.;Scott Adams;home
People tell you the world looks a certain way. Parents tell you how to think. Schools tell you how to think. TV. Religion. And then at a certain point, if you're lucky, you realize you can make up your own mind. Nobody sets the rules but you. You can design your own life.;Carrie-Anne Moss;design
For real change, we need feminine energy in the management of the world. We need a critical number of women in positions of power, and we need to nurture the feminine energy in men.;Isabel Allende;power
Saw a wedding in the church. It was strange to see what delight we married people have to see these poor fools decoyed into our condition.;Samuel Pepys;wedding
Defining marriage is a power that should be left to the states. Moreover, no state should be forced to recognize a marriage that is not within its own laws, Constitution, and legal precedents.;John Sununu;legal
Inactivity is death.;Benito Mussolini;death
For those that are working part time, in small businesses, or who are unemployed and do not currently have health insurance, we want to make sure that you are covered.;Valerie Jarrett;health
All we can hope for is that the thing is going to slowly and imperceptibly shift. All I can say is that 50 years ago there were no such thing as environmental policies.;David Attenborough;hope
I was afterwards sorry for this, though, if I ever travel again, I shall trust to none but natives, as the climate of Africa is too trying to foreigners.;John H. Speke;trust
I do the very best I know how - the very best I can and I mean to keep on doing so until the end.;Abraham Lincoln;best
I was not good in school. I could never read very fast or very well. I got tested for learning disabilities, for dyslexia. Then I got put on Ritalin and Dexedrine. I took those starting in the eighth grade. As soon as they pumped that drug into me, it would focus me right in.;Channing Tatum;learning
If I could create one job in the private sector by helping to grow a business, that would be one more than Congress has created in the last six months.;Evan Bayh;business
Later, I realized that the mission had to end in a let-down because the real barrier wasn't in the sky but in our knowledge and experience of supersonic flight.;Chuck Yeager;knowledge
The dirty little secret is that the pool man, who's making $30,000 a year, is subsidizing the million-dollar mortgage for the family whose pool he cleans. No wonder people want to get rid of tax breaks for corporate jets.;Dee Dee Myers;family
I don't blame the players today for the money. I blame the owners. They started it. They wanna give it to 'em? More power to 'em.;Yogi Berra;money
A man ceases to be a beginner in any given science and becomes a master in that science when he has learned that he is going to be a beginner all his life.;Robin G. Collingwood;science
Emotion resulting from a work of art is only of value when it is not obtained by sentimental blackmail.;Jean Cocteau;work
Since I've been in the U.S. I've lost the back of my heart, 15 ft. of intestine and my marriage - and God, I miss my intestine.;Nigel Lythgoe;marriage
Spare a thought for the poor introverts among us. In a world of party animals and glad-handers, they're the ones who stand by the punch bowl. In a world of mixers and pub crawls, they prefer to stay home with a book. Everywhere around them, cell phones ring and e-mails chime and they just want a little quiet.;Jeffrey Kluger;home
Success is 99 percent failure.;Soichiro Honda;success
My father's death, my move, and my frightening and difficult delivery created a tremendous amount of stress, pain, and sadness for me. I was practically devastated beyond recovery.;Brooke Shields;death
For the first time in the history of mankind, one generation literally has the power to destroy the past, the present and the future, the power to bring time to an end.;Hubert H. Humphrey;future
The friendship we share grows amidst the craggy rock pond reeds of water spray fireflies scented with bonfires.;Bradley Chicho;friendship
My mom took me to a Dolly Parton concert when I was 3.;Kat Dennings;mom
And there are a lot more people reading poetry, but there are not so many people reading an individual poet.;Peter Davison;poetry
Our Founding Fathers crafted a constitutional Republic for the first time in the history of the world because they were shaping a form of government that would not have the failures of a democracy in it, but had the representation of democracy in it.;Steve King;government
If the misery of the poor be caused not by the laws of nature, but by our institutions, great is our sin.;Charles Darwin;great
It seemed romantic but also tragic - people would be winning but then lose it all, or crash but fight on, break bones but get back on their bikes and try to finish. Just getting to the end was seen as an achievement in itself.;David Millar;romantic
I used to hang out by the food table at parties because you don't have to talk to anybody. If you do then you can talk about the food.;Jennifer Jason Leigh;food
Yosemite Valley, to me, is always a sunrise, a glitter of green and golden wonder in a vast edifice of stone and space.;Ansel Adams;nature
Women have been taught that, for us, the earth is flat, and that if we venture out, we will fall off the edge. Some of us have ventured out nevertheless, and so far we have not fallen off. It is my faith, my feminist faith, that we will not.;Andrea Dworkin;faith
Food is a coping mechanism people are afraid of giving it up because then they'll feel confused and lost.;Phil McGraw;food
For me, poetry is a situation - a state of being, a way of facing life and facing history.;Tahar Ben Jelloun;poetry
You go to college not only for the latest knowledge but also to meet people from different backgrounds. That's the genius of the American higher-education system compared with the Europeans'. We don't simply skim the elite.;Donna Shalala;knowledge
Nearly all men can stand adversity, but if you want to test a man's character, give him power.;Abraham Lincoln;power
I love sports and I love sports movies.;James Van Der Beek;sports
Growing up on stage, I was introduced to makeup at a young age and I will never forget the first time I tried on a L'Oreal Paris iconic lipstick - it was instant glamour and I've been hooked ever since.;Lea Michele;age
All of us, who are members of the Germanic peoples, can be happy and thankful that once in thousands of years fate has given us, from among the Germanic peoples, such a genius, a leader, our Fuehrer Adolf Hitler, and you should be happy to be allowed to work with us.;Heinrich Himmler;thankful
People should recognize who you are and how you can act rather then how famous you are.;Mae Whitman;famous
Like many women my age, I am 28 years old.;Mary Schmich;age
Since my teen years I was interested in martial arts.;Tony Visconti;teen
To seduce a woman famous for strict morals, religious fervor and the happiness of her marriage: what could possibly be more prestigious?;Christopher Hampton;happiness
The bare recollection of anger kindles anger.;Publilius Syrus;anger
Silence is true wisdom's best reply.;Euripides;wisdom
I am deeply concerned that, without peace and a two-state solution, the Jewish and democratic nature of Israel is in danger. That's why I have opposed Israel's settlement policy since 1973, and that's why I have favored a two-state solution since 1967.;Alan Dershowitz;peace
I would often find myself, at the age of 21, at midnight, running down a dark street on my own with 10 men chasing me. And the fact they had cameras in their hands made that legal.;Sienna Miller;legal
Experience: that most brutal of teachers. But you learn, my God do you learn.;C. S. Lewis;god
Racism oppresses its victims, but also binds the oppressors, who sear their consciences with more and more lies until they become prisoners of those lies. They cannot face the truth of human equality because it reveals the horror of the injustices they commit.;Alveda King;equality
As for how criticism of Keats' poetry relates to criticism of my own work, I'll leave that for others to decide.;Jane Campion;poetry
I travel 330 days a year and eat every two and a half hours - I'm a big guy. I always carry a fork, little bottles of spices, and Sriracha. I eat what I feel like eating.;Robert Irvine;travel
I fantasize about going back to high school with the knowledge I have now. I would shine. I would have a good time, I would have a girlfriend. I think that's where a lot of my pain comes from. I think I never had any teenage years to go back to.;Spalding Gray;dating
Patience, the beggar's virtue, shall find no harbor here.;Philip Massinger;patience
I feel we live in the kind of culture now where you have to be very smart to navigate the right way, and I just don't have those smarts. I think with age and time it will change, but I can't obsess about it.;Sienna Miller;change
Money is neither my god nor my devil. It is a form of energy that tends to make us more of who we already are, whether it's greedy or loving.;Dan Millman;money
No person who is not a great sculptor or painter can be an architect. If he is not a sculptor or painter, he can only be a builder.;John Ruskin;great
You have to trust your body to take care of you.;A. J. Langer;trust
I understand now that the vulnerability I've always felt is the greatest strength a person can have. You can't experience life without feeling life. What I've learned is that being vulnerable to somebody you love is not a weakness, it's a strength.;Elisabeth Shue;strength
Only very intelligent people don't wish they were in politics, and I'm dumb enough to want to be in there.;Orson Welles;politics
I need some isolation, it's necessary to me, that's just who I am. I need to be left alone.;Laura Marling;alone
I fear all we have done is to awaken a sleeping giant and fill him with a terrible resolve.;Isoroku Yamamoto;fear
Mystical explanations are thought to be deep the truth is that they are not even shallow.;Friedrich Nietzsche;truth
Beautiful music is the art of the prophets that can calm the agitations of the soul it is one of the most magnificent and delightful presents God has given us.;Martin Luther;music
God judged it better to bring good out of evil than to suffer no evil to exist.;Saint Augustine;god
I loved Alien, and I loved Carrie, and I loved The Exorcist - those were big movies for me. They were just brilliantly done, and unusual, and they all took horror to some new place.;Lawrence Kasdan;movies
If I can give you some kind of knowledge of life you should listen.;Leon Spinks;knowledge
Thunder is good, thunder is impressive but it is lightning that does the work.;Mark Twain;good
There were points in my life where I felt oddly irresistible to women. I'm not in that state now and that makes me sad.;Jack Nicholson;sad
Faith is not a sense, nor sight, nor reason, but taking God at His work.;Faith Evans;faith
The course of this conflict is not known, yet its outcome is certain. Freedom and fear, justice and cruelty, have always been at war, and we know that God is not neutral between them.;George W. Bush;god
Apply yourself. Get all the education you can, but then, by God, do something. Don't just stand there, make it happen.;Lee Iacocca;education
We come in many different shapes and sizes, and we need to support each other and our differences. Our beauty is in our differences.;Carre Otis;beauty
To reject even one major tenet of the religion or to violate one major rule of behavior is enough to get one kicked out - or worse.;Robert Shea;religion
By and large we have got to find the good leaders to work with to make sure that we build the strength in these communities. Simply issuing edicts from Canberra isn't going to solve issues on the APY lands.;Jay Weatherill;strength
It goes without saying that the desire to accomplish the task with more confidence, to avoid wasting time and labour, and to spare our experimental animals as much as possible, made us strictly observe all the precautions taken by surgeons in respect to their patients.;Ivan Pavlov;respect
I think there's been a decline in the public's access to what's being done with their tax dollars, what's being done in their name. I hope that that will be repaired.;Bill Keller;hope
Research is creating new knowledge.;Neil Armstrong;knowledge
My role in society, or any artist's or poet's role, is to try and express what we all feel. Not to tell people how to feel. Not as a preacher, not as a leader, but as a reflection of us all.;John Lennon;society
The only hope of socialism resides in those who have already brought about in themselves, as far as is possible in the society of today, that union between manual and intellectual labor which characterizes the society we are aiming at.;Simone Weil;hope
I think the most important thing in life is self-love, because if you don't have self-love, and respect for everything about your own body, your own soul, your own capsule, then how can you have an authentic relationship with anyone else?;Shailene Woodley;relationship
Our parents are obviously proud, but they're still trying to get used to the fact that we're in a band. I have a feeling my mom would actually like One Direction if I wasn't in it!;Zayn Malik;mom
A permanent base on Mars would have a number of advantages beyond being a bonanza for planetary science and geology. If, as some evidence suggests, exotic micro-organisms have arisen independently of terrestrial life, studying them could revolutionise biology, medicine and biotechnology.;Paul Davies;science
Most of the change we think we see in life is due to truths being in and out of favor.;Robert Frost;life
America has the best doctors, the best nurses, the best hospitals, the best medical technology, the best medical breakthrough medicines in the world. There is absolutely no reason we should not have in this country the best health care in the world.;Bill Frist;technology
In high school, we studied a lot of poetical forms. I was really interested in the math that was involved and the strange live break ups. That gave me a great amount of respect for a rhymed stanza.;Joanna Newsom;respect
When it is obvious that the goals cannot be reached, don't adjust the goals, adjust the action steps.;Confucius;wisdom
When I realized I was having trouble reading, I was too embarrassed to ask for help. Some teachers believed in me, but I just wasn't focused on school - I was into the music and trying to please my dad.;Fantasia Barrino;dad
The building of the architecture of a novel - the craft of it - is something I never tire of.;John Irving;architecture
Now, there are so many movies, so many festivals, and so many awards going on, each judged with each other, like your work is worse than others and that's not fair. How can you tell what's best and what's worst from these awards? We're talking about art.;Javier Bardem;movies
One of the greatest titles in the world is parent, and one of the biggest blessings in the world is to have parents to call mom and dad.;Jim DeMint;mom
