A political prisoner is someone who is out fighting for his or her people's rights and freedom and is imprisoned for that alone.;Leonard Peltier;freedom
Adversity makes men, and prosperity makes monsters.;Victor Hugo;men
Even the most wretched individual of our present society could not exist and develop without the cumulative social efforts of countless generations.;Mikhail Bakunin;society
As soon as you trust yourself, you will know how to live.;Johann Wolfgang von Goethe;trust
The great pleasure of a dog is that you may make a fool of yourself with him and not only will he not scold you, but he will make a fool of himself too.;Samuel Butler;great
Man never made any material as resilient as the human spirit.;Bernard Williams;inspirational
To them though, not to us, we were just a catalyst for their imagination.;Donald Sutherland;imagination
I have to say I have an incredible musical education because of my father.;Kareem Abdul-Jabbar;education
An artist is not paid for his labor but for his vision.;James Whistler;art
Like almost everyone who uses e-mail, I receive a ton of spam every day. Much of it offers to help me get out of debt or get rich quick. It would be funny if it weren't so exciting.;Bill Gates;funny
The moment you think you understand a great work of art, it's dead for you.;Oscar Wilde;art
Money equals freedom.;Kevin O'Leary;freedom
Los Angeles gives one the feeling of the future more strongly than any city I know of. A bad future, too, like something out of Fritz Lang's feeble imagination.;Henry Miller;imagination
Where all is but dream, reasoning and arguments are of no use, truth and knowledge nothing.;John Locke;truth
If you're going to do something tonight that you'll be sorry for tomorrow morning, sleep late.;Henny Youngman;morning
You have to come in and be that character when you walk into the room. That's what one of my first acting teachers taught me. You know, don't go in there being Jennifer and then expect to flip and change, because they're not going to have that imagination.;Jennifer Lopez;change
It will be about which candidate, which of the two candidates remaining, is best suited to make a positive difference in the lives of North Carolina families, and I submit to each of you tonight that I am that candidate and Elizabeth Dole is not.;Erskine Bowles;positive
Even though we're a week and a half away from Thanksgiving, it's beginning to look a lot like Christmas.;Richard Roeper;thanksgiving
We all dream. We dream vividly, depending on our nature. Our existence is beyond our explanation, whether we believe in God or we have religion or we're atheist.;Anthony Hopkins;nature
The great questions of the day will not be settled by means of speeches and majority decisions but by iron and blood.;Otto von Bismarck;great
Rhyme patterns are nothing without meanings to the words. A lot of rappers can do those flows, but the raps aren't really about anything - which is cool sometimes, but to have the flow and the message is one of my favorite things.;J. Cole;cool
But the true feminist deals out of a lesbian consciousness whether or not she ever sleeps with women.;Audre Lorde;women
Those who wish to pet and baby wild animals 'love' them. But those who respect their natures and wish to let them live normal lives, love them more.;Edwin Way Teale;pet
He who is obsessed by death is made guilty by it.;Elias Canetti;death
I think that when you get dressed in the morning, sometimes you're really making a decision about your behavior for the day. Like if you put on flipflops, you're saying: 'Hope I don't get chased today.' 'Be nice to people in sneakers.';Demetri Martin;hope
Architecture is my work, and I've spent my whole life at a drawing board, but life is more important than architecture. What matters is to improve human beings.;Oscar Niemeyer;architecture
My mother is a special story. She went through so much to bring us up, four men at home, especially when our country was going through really difficult times.;Novak Djokovic;home
I think the people who are making Christmas-themed movies today feel that people are more cynical about Christmas. There's more of an edge.;Leonard Maltin;christmas
You cannot transpose the U.S. system on Turkey, and the Turkish system on France etc. You have to understand the people and their culture. That's leadership.;Hamad bin Isa Al Khalifa;leadership
Every great advance in natural knowledge has involved the absolute rejection of authority.;Thomas Huxley;great
There are patriots who opposed the war in Iraq and there are patriots who supported the war in Iraq. We are one people, all of us pledging allegiance to the stars and stripes, all of us defending the United States of America.;Barack Obama;war
In the United States three new methods of transportation made their appearance at almost the same time - the steamboat, the canal boat, and the rail car.;John Moody;car
When I was at drama school, I wanted to change the world, and thought I had some great wisdom to impart to people about humanity. Now that I'm older, I know enough to realise that I know nothing at all.;Michael Sheen;change
A good painting to me has always been like a friend. It keeps me company, comforts and inspires.;Hedy Lamarr;good
I can't remember a time when I didn't want to be a reporter. I don't know where I got the idea that it was a romantic calling.;Charles Kuralt;romantic
As far as I was concerned, the Depression was an ill wind that blew some good. If it hadn't occurred, my parents would have given me my college education. As it was, I had to scrabble for it.;Sargent Shriver;education
I think that Indy is special to me. The greater the distance between the last time I drove an Indy car and the next time, I wouldn't like that to be too big.;Danica Patrick;car
If you cannot work on the marriage or the women is a moron, staying married and cheating makes the most sense because divorce is disruptive to the family life and your bank account.;Al Goldstein;marriage
An honest God is the noblest work of man.;Robert Green Ingersoll;god
Faith is taking the first step even when you don't see the whole staircase.;Martin Luther King, Jr.;faith
Catholicism played such a huge part in my life, I would not have survived without my faith.;Samantha Morton;faith
Have no fear of perfection - you'll never reach it.;Salvador Dali;fear
In its most limited sense, modern, art would seem to concern itself only with the technical innovations of the period.;Edward Hopper;art
If you dream the proper dreams, and share the myths with people, they will want to grow up to be like you.;Ray Bradbury;dreams
The only thing that mattered was what you were to do in life, and it wasn't about money. It was about teaching, or learning.;Maya Lin;learning
To my mind the old masters are not art their value is in their scarcity.;Thomas A. Edison;art
Great authors are admirable in this respect: in every generation they make for disagreement. Through them we become aware of our differences.;Andre Gide;respect
I'm very pleased with being a part of the Bean Pole family. It's a relationship that makes sense to me. I'm very pleased to have my name associated with Bean Pole Jeans.;Wentworth Miller;relationship
The authentic self is the soul made visible.;Sarah Ban Breathnach;inspirational
Organic architecture seeks superior sense of use and a finer sense of comfort, expressed in organic simplicity.;Frank Lloyd Wright;architecture
It takes a lot of courage to release the familiar and seemingly secure, to embrace the new. But there is no real security in what is no longer meaningful. There is more security in the adventurous and exciting, for in movement there is life, and in change there is power.;Alan Cohen;life
A free America... means just this: individual freedom for all, rich or poor, or else this system of government we call democracy is only an expedient to enslave man to the machine and make him like it.;Frank Lloyd Wright;government
What will I be doing in twenty years' time? I'll be dead, darling! Are you crazy?;Freddie Mercury;time
There are over 200 million illiterate women in India. This low literacy negatively impacts not just their lives but also their families' and the country's economic development. A girl's lack of education also has a negative impact on the health and well-being of her children.;Sachin Tendulkar;education
To make no mistakes is not in the power of man but from their errors and mistakes the wise and good learn wisdom for the future.;Plutarch;wisdom
I was ecstatic they re-named 'French Fries' as 'Freedom Fries'. Grown men and women in positions of power in the U.S. government showing themselves as idiots.;Johnny Depp;power
I am an agnostic I do not pretend to know what many ignorant men are sure of.;Clarence Darrow;men
I'm sure we'll be Tweetin' up the Twitosphere as we travel around the world playing music.;Brandon Boyd;travel
Our nation's Social Security Trust Fund is depleting at an alarming rate, and failure to implement immediate reforms endangers the ability of Americans to plan for their retirement with the options and certainty they deserve.;Pete Sessions;trust
The simplest questions are the most profound. Where were you born? Where is your home? Where are you going? What are you doing? Think about these once in a while and watch your answers change.;Richard Bach;change
I think we spend too much on K-12 education a.k.a. teachers' salaries. It's the only industry where you never see any productivity increases.;Peter Brimelow;education
When you cut that eggplant up and you roast it in the oven and you make the tomato sauce and you put it on top, your soul is in that food, and there's something about that that can never be made by a company that has three million employees.;Mario Batali;food
When one may pay out over two million dollars to presidential and Congressional campaigns, the U.S. government is virtually up for sale.;John W. Gardner;government
For a number of years, I'd been around the kind of people who financed movies and the kind of people who are there to make the deals for movies. But I'd always had this naive idea that everybody wants to make movies as good as they can be, which is stupid.;David Fincher;movies
The one thing I like about 'Playboy' is they don't have the anorexic look. The women are voluptuous. So I didn't really want to diet. I just wanted to tone up.;Jenny McCarthy;diet
Money can't buy you happiness, but it can buy you a yacht big enough to pull up right alongside it.;David Lee Roth;money
When the British came to Ibo land, for instance, at the beginning of the 20th century, and defeated the men in pitched battles in different places, and set up their administrations, the men surrendered. And it was the women who led the first revolt.;Chinua Achebe;women
Death is the sound of distant thunder at a picnic.;W. H. Auden;death
Getting pregnant wasn't easy, and I found that devastating. I really beat myself up for waiting so long when I'd always wanted children and family had been the basis of my happiness my whole life.;Emily Procter;happiness
A great part of courage is the courage of having done the thing before.;Ralph Waldo Emerson;great
A gentle word, a kind look, a good-natured smile can work wonders and accomplish miracles.;William Hazlitt;work
I thank Marc Jacobs so much for giving me the opportunity to design a shoe for Louis Vuitton, but the thing that broke my heart most was when they said, 'You're finished. The shoe's finished.';Kanye West;design
Enjoy present pleasures in such a way as not to injure future ones.;Seneca;future
There is a common theme, though, in the stories I have told, which are usually associations of characters or families that are formed outside of a family circle.;Gus Van Sant;family
I've always embraced failure as a noble pursuit. It allows you to be anti whatever anyone wants you to be, and to break all the rules.;Malcolm Mclaren;failure
Good humor is the health of the soul, sadness is its poison.;Lord Chesterfield;humor
The best thing to hold onto in life is each other.;Audrey Hepburn;love
One of the things that people don't realize is that that natural beauty, those recreational forests, they have an economic development impact for the state as well.;Ed Rendell;beauty
A government is invigorated when each of us is willing to participate in shaping the future of this nation.;Barbara Jordan;government
Beware, so long as you live, of judging men by their outward appearance.;Jean de La Fontaine;men
It is the most sensual men who need to flee women and torment their bodies.;Friedrich Nietzsche;women
I wanted to be a teacher, but I was a lousy student, one of the slowest readers. It was a tremendous struggle. But I'm lucky I had some teachers who saw something in me.;Ann Bancroft;teacher
If I were to say, 'God, why me?' about the bad things, then I should have said, 'God, why me?' about the good things that happened in my life.;Arthur Ashe;god
The only break I ever took was to eat. That's all I did. Work, and then quickly eat something. It became my main pleasure, having access to my comfort food.;John Prescott;food
My loathings are simple: stupidity, oppression, crime, cruelty, soft music.;Vladimir Nabokov;music
If you wish to spare yourself and your venerable family, give heed to my advice with the ear of intelligence. If you do not, you will see what God has willed.;Hulagu Khan;intelligence
Deep down, the US, with its space, its technological refinement, its bluff good conscience, even in those spaces which it opens up for simulation, is the only remaining primitive society.;Jean Baudrillard;society
Economic prosperity and quality education for our children are inexorably linked.;Jon Huntsman, Jr.;education
In order to lead a country or a company, you've got to get everybody on the same page and you've got to be able to have a vision of where you're going. America can't have a vision of health care for everybody, green economy, regulations - can't have a bunch of piece-meal activities. It's got to have a vision.;Jack Welch;health
You may call God love, you may call God goodness. But the best name for God is compassion.;Meister Eckhart;best
Death gives us sleep, eternal youth, and immortality.;Jean Paul;death
Let's not leave an educational vacuum to be filled by religious extremists who go to families who have no other option and offer meals, housing and some form of education. If we are going to combat extremism then we must educate those very same children.;Hillary Clinton;education
I think we have to face the reality that in a society where there is a legitimate threat of terrorism, not being able to see one's face, not being able to have some sense of communication in that way, is for many societies a challenge.;Hillary Clinton;society
I like my name. My mom named me after a song by the 1970s group Bread. So, it's meaningful, and I like the song. It's a love song - kind of - but it's kind of depressing and dark.;Aubrey Plaza;mom
Religion was used as an ideology, as a system of control. When they forced the veil upon women, they were using it as an instrument of control in the same way that in Mao's China people were wearing Mao jackets and women were not supposed to wear any makeup.;Azar Nafisi;religion
My mother was the most beautiful woman I ever saw. All I am I owe to my mother. I attribute all my success in life to the moral, intellectual and physical education I received from her.;George Washington;mom
I am concerned about the whole man. I am concerned about what the people, using their government as an instrument and a tool, can do toward building the whole man, which will mean a better society and a better world.;Lyndon B. Johnson;society
I have run a general election campaign pregnant and ran Ed Miliband's leadership campaign commuting to London with a new baby so I already have my system set up.;Lucy Powell;leadership
I want to work on respecting individuals' dignity. Equal rights, that's where my heart is. That means equal rights and benefits, and that's what we need.;Christine Gregoire;equality
I paint what cannot be photographed, that which comes from the imagination or from dreams, or from an unconscious drive.;Man Ray;dreams
I put instant coffee in a microwave oven and almost went back in time.;Steven Wright;time
I'm an actor. And I guess I've done so many movies I've achieved some high visibility. But a star? I guess I still think of myself as kind of a worker ant.;Bill Vaughan;movies
Few men in our history have ever obtained the Presidency by planning to obtain it.;James A. Garfield;history
I hope to inspire people, influence people.;Ashley Tisdale;hope
What I like about music is the songs you can remember the lines of in a single second.;Karl Lagerfeld;music
People who are always taking care of their health are like misers, who are hoarding a treasure which they have never spirit enough to enjoy.;Laurence Sterne;health
The idealists will always be in society, and we will survive.;John Zorn;society
Remember, as long as you live, that nothing but strict truth can carry you through the world, with either your conscience or your honor unwounded.;Lord Chesterfield;truth
All successful people men and women are big dreamers. They imagine what their future could be, ideal in every respect, and then they work every day toward their distant vision, that goal or purpose.;Brian Tracy;men
I was always the new kid in school, I'm the kid from a broken family, I'm the kid who had no dad showing up at the father-son stuff, I'm the kid that was using food stamps at the grocery store.;Dave Mustaine;dad
I never saw any of my dad's stories. My mother said he had piles and piles of manuscripts.;Stephen King;dad
As a mom, I always feel I have to protect them. I talk about them because they are the most important things in my life but they are private people. I won't use them for my own press.;Jami Gertz;mom
I have a terrific marriage, but unlike a lot of relationships where they ebb and flow, no matter what happens you fall deeper and deeper in love every day. It's kind of the best thing that can happen to you. It's thrilling.;Hugh Jackman;marriage
I have no regrets. I've got my health.;Naomi Campbell;health
It is not enough to understand, or to see clearly. The future will be shaped in the arena of human activity, by those willing to commit their minds and their bodies to the task.;Robert Kennedy;future
In addition, I'll be attending women's health expos and medical conferences with the goal to promote dialogue between women and their health-care providers.;Karen Duffy;medical
I hate menus, I hate choosing food. I just want to be brought. Bring me dinner!;Hugh Laurie;food
Art raises its head where creeds relax.;Friedrich Nietzsche;art
When Christians start thinking about Jesus, things start breaking down, they lose their faith. It's perfectly possible to go to church every Sunday and not ask any questions, just because you like it as a way of life. They fear that if they ask questions they'll lose their Christ, the very linchpin of their religion.;A. N. Wilson;religion
On rare occasions one does hear of a miraculous case of a married couple falling in love after marriage, but on close examination it will be found that it is a mere adjustment to the inevitable.;Emma Goldman;marriage
Every man needs two women: a quiet home-maker, and a thrilling nymph.;Iris Murdoch;women
Hackers are breaking the systems for profit. Before, it was about intellectual curiosity and pursuit of knowledge and thrill, and now hacking is big business.;Kevin Mitnick;business
I have no problem with the people who work hard to get success. But I think people are very jealous about success. I work very hard and they don't appreciate that.;Alain Prost;work
Personally, I would be delighted if there were a life after death, especially if it permitted me to continue to learn about this world and others, if it gave me a chance to discover how history turns out.;Carl Sagan;learning
I took a gamble to exercise leadership without losing my feminine nature.;Michelle Bachelet;leadership
Our intelligence community needs better coordination of operations and exchange of information, and that's why we need an overall director of national intelligence and a national counterterrorism center.;Jim Ramstad;intelligence
We would fight not for the political future of a distant city, rather for principles whose destruction would ruin the possibility of peace and security for the peoples of the earth.;Neville Chamberlain;future
You have citizens who don't understand how government works and they're kind of soured on it. All they do is criticize. They have no idea that they can make things happen.;Sandra Day O'Connor;government
An adolescent is somebody who is in between things. A teenager is somebody who's kind of permanently there. And so living with them through the various teenage hopes and sorrows and joys was curiously enough a maturing experience for me.;Andrew Greeley;experience
Men would live exceedingly quiet if these two words, mine and thine, were taken away.;Anaxagoras;men
Most Americans aren't the sort of citizens the Founding Fathers expected they are contented serfs. Far from being active critics of government, they assume that its might makes it right.;Joseph Sobran;government
Experience is a great teacher.;John Legend;experience
I strongly support the call to greatly expand our human intelligence capability to penetrate al Qaeda and gather critical intelligence to prevent terrorist attacks on our homeland.;Jim Ramstad;intelligence
An inexhaustible good nature is one of the most precious gifts of heaven, spreading itself like oil over the troubled sea of thought, and keeping the mind smooth and equable in the roughest weather.;Washington Irving;good
I have always been pushed by the negative. The apparent failure of a play sends me back to my typewriter that very night, before the reviews are out. I am more compelled to get back to work than if I had a success.;Tennessee Williams;work
It's not like I just have to go to Washington and go to the White House everyday, and go to the same press conference at 10 in the morning and then be briefed at 4 in the afternoon, and then get a story on at 6.;Tabitha Soren;morning
The good things of prosperity are to be wished but the good things that belong to adversity are to be admired.;Lucius Annaeus Seneca;good
We need international support so that our people live a life of normality, of dignity, of liberty and freedom. I hope that our cry for freedom may be heard.;Mahmoud Abbas;freedom
There is that in the glance of a flower which may at times control the greatest of creation's braggart lords.;John Muir;power
I love being one half of a romantic couple.;Julianna Margulies;romantic
I believe entertainment can aspire to be art, and can become art, but if you set out to make art you're an idiot.;Steve Martin;art
And inasmuch as the bridge is a symbol of all such poetry as I am interested in writing it is my present fancy that a year from now I'll be more contented working in an office than ever before.;Hart Crane;poetry
A happy arrangement: many people prefer cats to other people, and many cats prefer people to other cats.;Mason Cooley;pet
Women are the real architects of society.;Cher;society
So during those first moments of the day, which are yours and yours alone, you can circumvent these boundaries and concentrate fully on spiritual matters. And this gives you the opportunity to plan the time management of the entire day.;Menachem Mendel Schneerson;time
As a child, I didn't know what I didn't have. I'm thankful for the challenges early on in my life because now I have a perspective on the world and kind of know what's important.;America Ferrera;thankful
The improver of natural knowledge absolutely refuses to acknowledge authority, as such. For him, skepticism is the highest of duties blind faith the one unpardonable sin.;Thomas Huxley;faith
Life always rides in strength to victory, not through internationalism... but only through the direct responsibility of the individual.;Frank Lloyd Wright;strength
Dreams will get you nowhere, a good kick in the pants will take you a long way.;Baltasar Gracian;dreams
My mind withdrew its thoughts from experience, extracting itself from the contradictory throng of sensuous images, that it might find out what that light was wherein it was bathed... And thus, with the flash of one hurried glance, it attained to the vision of That Which Is.;Saint Augustine;experience
People like to do politics with me, and they like to do business.;Terry McAuliffe;politics
I've told Billy if I ever caught him cheating, I wouldn't kill him because I love his children and they need a dad. But I would beat him up. I know where all of his sports injuries are.;Angelina Jolie;love
Success is the sum of small efforts - repeated day in and day out.;Robert Collier;success
For most of our history, Americans enjoyed both liberty and security from foreign threats.;Harry Browne;history
But in fact if you look at film as a metaphor, only through the negative can you have the positive print. What I'm trying to get to is the positive value of negation.;Godfrey Reggio;positive
Our dreams are made of real things, like a shoebox full of photographs.;Jack Johnson;dreams
Once we hit forty, women only have about four taste buds left: one for vodka, one for wine, one for cheese, and one for chocolate.;Gina Barreca;women
Art is parasitic on life, just as criticism is parasitic on art.;Harry S. Truman;art
Anger will never disappear so long as thoughts of resentment are cherished in the mind. Anger will disappear just as soon as thoughts of resentment are forgotten.;John Dryden;anger
We had two rules growing up in my house: If you're going to take a shower, do it with whomever you're dating so you don't waste water and if you buy one for yourself, buy six, because everybody's going to want one.;Moon Unit Zappa;dating
