I believe in the equality of man and I believe that religious duties consist in doing justice, loving mercy, and endeavoring to make our fellow-creatures happy.;Thomas Paine;equality
I have no time for those who say there is no way Scotland could go it alone. I know first-hand the contribution Scotland and Scots make to Britain's success - so for me there's no question about whether Scotland could be an independent nation.;David Cameron;success
Intellectual despair results in neither weakness nor dreams, but in violence. It is only a matter of knowing how to give vent to one's rage whether one only wants to wander like madmen around prisons, or whether one wants to overturn them.;Georges Bataille;dreams
I like high impact movies.;Kathryn Bigelow;movies
I want to deal with somebody who comes from another country to the United States and has a family that comes. I don't care if it's a black family from Jamaica or a Hispanic family from Mexico. These issues need to be dealt with, but they need to be dealt with in the entertaining way.;Harvey Weinstein;family
The foundation of a financial fresh start actually has nothing to do with money or specific financial dos and don'ts.;Suze Orman;money
Men can have a huge turnover of sponsorship and still survive a lot better than the women. But the women's ratings are better, at least at home in the United States than in the men's tennis.;Billie Jean King;home
Me and Matt love to argue, but in general our sense of humor is pretty much alike.;Trey Parker;humor
Faith is a knowledge within the heart, beyond the reach of proof.;Khalil Gibran;knowledge
Deep down, my mom had long suspected I was gay... Much of her anger and hurt came from her sense of betrayal that she was the last to be told.;Chaz Bono;mom
Old age isn't so bad when you consider the alternative.;Maurice Chevalier;age
When the wedding march sounds the resolute approach, the clock no longer ticks, it tolls the hour. The figures in the aisle are no longer individuals, they symbolize the human race.;Anne Morrow Lindbergh;wedding
I used to be a hopeless romantic - I fell in love with everyone I went out with.;Jeremy London;valentinesday
It is impossible to underrate human intelligence - beginning with one's own.;Henry Adams;intelligence
Venice is the perfect place for a phase of art to die. No other city on earth embraces entropy quite like this magical floating mall.;Jerry Saltz;art
God is to be worshipped as the one beloved, dearer than everything in this and next life.;Swami Vivekananda;god
I'm worried because of my mother, she's going to see my performance and she's quite hard. She's going to see me naked. And my Dad, woah. Yeah, they're going to see me like a woman, you know?;Eva Green;dad
I've come to realize that protecting freedom of choice in our everyday lives is essential to maintaining a healthy civil society.;George McGovern;freedom
We need more of the Office Desk and less of the Show Window in politics. Let men in office substitute the midnight oil for the limelight.;Calvin Coolidge;politics
He may be president, but he still comes home and swipes my socks.;Joseph P. Kennedy;home
Television is not real life. In real life people actually have to leave the coffee shop and go to jobs.;Bill Gates;life
Someone's career that I admire would have to be Justin Timberlake's because he started off on Disney and he made this huge film career and huge solo music career. I really respect him as an artist.;Victoria Justice;respect
My dad had been born in Mexico and his family had to leave during the Mexican revolution.;Mitt Romney;family
I do not wish women to have power over men but over themselves.;Mary Wollstonecraft Shelley;power
Things alter for the worse spontaneously, if they be not altered for the better designedly.;Francis Bacon;change
An arts education helps build academic skills and increase academic performance, while also providing alternative opportunities to reward the skills of children who learn differently.;Gavin Newsom;education
A healthy democracy requires a decent society it requires that we are honorable, generous, tolerant and respectful.;Charles W. Pickering;society
Learned men are the cisterns of knowledge, not the fountainheads.;James Northcote;knowledge
Once you agree upon the price you and your family must pay for success, it enables you to ignore the minor hurts, the opponent's pressure, and the temporary failures.;Vince Lombardi;family
Cats seem to go on the principle that it never does any harm to ask for what you want.;Joseph Wood Krutch;pet
The process of learning requires not only hearing and applying but also forgetting and then remembering again.;John Gray;learning
I'm not a tough guy. I'm just delivering the truth and only the truth and if you can't deal with it, too bad.;Kevin O'Leary;truth
We hold these truths to be self-evident: that all men are created equal that they are endowed by their Creator with certain unalienable rights that among these are life, liberty, and the pursuit of happiness.;Thomas Jefferson;life
From too much love of living, From hope and fear set free, We thank with brief thanksgiving Whatever gods may be That no life lives for ever That dead men rise up never That even the weariest river Winds somewhere safe to sea.;Algernon Charles Swinburne;hope
If there were no bad people, there would be no good lawyers.;Charles Dickens;good
Most people like to read about intrigue and spies. I hope to provide a metaphor for the average reader's daily life. Most of us live in a slightly conspiratorial relationship with our employer and perhaps with our marriage.;John le Carre;relationship
Sometimes the most positive thing you can be in a boring society is absolutely negative.;Johnny Rotten;society
My advice to the women of America is to raise more hell and fewer dahlias.;William Allen White;women
It's far easier to forgive an enemy after you've got even with him.;Olin Miller;forgiveness
I can support co-ops if they want to do it as we've known co-ops in America for 150 years - where they serve the purposes of the consuming public, whether it's health care or whether it's co-ops as we know them in the Midwest, providing electricity or to sell supplies to farmer.;Chuck Grassley;health
A lot of people quit looking for work as soon as they find a job.;Zig Ziglar;work
Perfecting oneself is as much unlearning as it is learning.;Edsger Dijkstra;learning
You can't walk alone. Many have given the illusion, but none have really walked alone. Man is not made that way. Each man is bedded in his people, their history, their culture, and their values.;Peter Abrahams;history
You have to have been a Republican to know how good it is to be a Democrat.;Jackie Kennedy;good
I know this sounds generic, but I'm so happy to be home with my husband, my family, and my dog.;Fergie;home
As the biggest library if it is in disorder is not as useful as a small but well-arranged one, so you may accumulate a vast amount of knowledge but it will be of far less value than a much smaller amount if you have not thought it over for yourself.;Arthur Schopenhauer;knowledge
I think leadership is service and there is power in that giving: to help people, to inspire and motivate them to reach their fullest potential.;Denise Morrison;leadership
I have made this letter longer than usual, only because I have not had the time to make it shorter.;Blaise Pascal;time
Anyone who says he can see through women is missing a lot.;Groucho Marx;women
Success in its highest and noblest form calls for peace of mind and enjoyment and happiness which come only to the man who has found the work that he likes best.;Napoleon Hill;work
I am determined that my children shall be brought up in their father's religion, if they can find out what it is.;Charles Lamb;religion
If we love our country, we should also love our countrymen.;Ronald Reagan;love
Deprived of meaningful work, men and women lose their reason for existence they go stark, raving mad.;Fyodor Dostoevsky;men
Everyone who remembers his own education remembers teachers, not methods and techniques. The teacher is the heart of the educational system.;Sidney Hook;teacher
The chief function of the city is to convert power into form, energy into culture, dead matter into the living symbols of art, biological reproduction into social creativity.;Lewis Mumford;power
Extracting oil from the tar sands is a nasty, polluting, energy-intensive business.;Jeff Goodell;business
Being divorced is like being hit by a Mack truck. If you live through it, you start looking very carefully to the right and to the left.;Jean Kerr;movingon
I've looked after my money. As I started working around my third birthday, my first check went straight to the bank.;Samantha Barks;birthday
I always believe it's better to have 30 imaginations working on a project, rather than one imagination telling the other 29 what to do.;Trevor Nunn;imagination
Technology has advanced more in the last thirty years than in the previous two thousand. The exponential increase in advancement will only continue. Anthropological Commentary The opposite of a trivial truth is false the opposite of a great truth is also true.;Niels Bohr;great
If you haven't turned rebel by twenty you've got no heart if you haven't turned establishment by thirty you've got no brains!;Kevin Spacey;age
I've noticed a lot of younger artists have less fear of doing different sorts of things, whether it's various types of music, or gallery artists moving between video and sculpture and drawing.;David Byrne;music
I play some fighting games, but mostly I just play sports.;Vince Carter;sports
Going out and playing football or baseball with the boys, when I was a tomboy, was a great way to learn about winning and losing, and most girls didn't have that experience.;Hillary Clinton;experience
The Constitution only gives people the right to pursue happiness. You have to catch it yourself.;Benjamin Franklin;happiness
It would be especially tragic if the people who most cherish ideals of peace, who are most anxious for political cooperation on a wider than national scale, made the mistake of underestimating the pace of economic change in our modern world.;Lester B. Pearson;peace
There is something sinister, something quite biographical about what I do - but that part is for me. It's my personal business. I think there is a lot of romance, melancholy. There's a sadness to it, but there's romance in sadness. I suppose I am a very melancholy person.;Alexander McQueen;business
In order to change the world, you have to get your head together first.;Jimi Hendrix;change
I've brought my daughters all over the world-they travel with me. I drag them out of school just to keep the relationship. When I'm home I'm a big-time daddy.;Armand Assante;travel
And now I have a big house, nice clothes and I travel in first class and I love it, so maybe it's time to enjoy being a star.;Vincent Cassel;travel
General Motors spends more on health care than steel.;Kathleen Sebelius;health
My fitness is good. I hope to improve it even further during training.;Andriy Shevchenko;fitness
After a while of getting jerked around, you realize what the business is really made up of.;Tori Amos;business
We can stand affliction better than we can prosperity, for in prosperity we forget God.;Dwight L. Moody;god
Books are the carriers of civilization. Without books, history is silent, literature dumb, science crippled, thought and speculation at a standstill.;Barbara Tuchman;science
Look folks, we know who built this country and we know who is going to rebuild it. It's you. Instead of vilifying you, we should be thanking you. We owe you.;Joe Biden;thankful
The fact that the Kardashians could be more popular than a show like 'Mad Men' is disgusting. It's a super disgusting part of our culture, but I still find it funny to make a joke about it.;Jonah Hill;funny
Happiness is an imaginary condition, formerly attributed by the living to the dead, now usually attributed by adults to children, and by children to adults.;Thomas Szasz;happiness
We have been learning since we were children how to make money, buy things, build things. The whole education system is set up to teach us how to think, not to feel.;Yakov Smirnoff;learning
What helped me was I had people around me to remind me to help my country even when it did me wrong, have respect for my people, my family, my nation and mankind.;Alexis Arguello;respect
Base Ball, to be played thoroughly, requires the possession of muscular strength, great agility, quickness of eye, readiness of hand, and many other faculties of mind and body that mark the man of nerve.;Henry Chadwick;strength
One of the most amazing locations I've ever been is the top of the volcano in Tanzania, Africa. It's an actual volcano where you really have this lava every day.;Jan de Bont;amazing
Apparently, one in five people in the world are Chinese. And there are five people in my family, so it must be one of them. It's either my mum or my dad. Or my older brother, Colin. Or my younger brother, Ho-Chan-Chu. But I think it's Colin.;Tim Vine;dad
Sobering up was responsible for breaking up my marriage. That's what it couldn't stand.;James Taylor;marriage
My boyfriend calls me 'princess', but I think of myself more along the lines of 'monkey' and 'retard'.;Alicia Silverstone;dating
We do not covet anything from any nation except their respect.;Winston Churchill;respect
The relationship between Israel and the United States is a bond of - it's just a very powerful bond. It was, it is, and will be and will continue to be.;Benjamin Netanyahu;relationship
An important consequence of freeing oneself from the fear of death is a radical opening to spirituality of a universal and non-denominational type.;Stanislav Grof;fear
I do not think we are ever going to be able to, for a long time, get the kind of quality of school personnel that we need in our schools, especially in the areas of science and math. One of the answers to that problem is to use more educational technology.;Major Owens;science
A majority, perhaps as many as 75 percent, of abortion clinics are in areas with high minority populations. Abortion apologists will say this is because they want to serve the poor. You don't serve the poor, however, by taking their money to terminate their children.;Alveda King;money
Films that are entertainments give simple answers but I think that's ultimately more cynical, as it denies the viewer room to think. If there are more answers at the end, then surely it is a richer experience.;Michael Haneke;experience
Environmental degradation, overpopulation, refugees, narcotics, terrorism, world crime movements, and organized crime are worldwide problems that don't stop at a nation's borders.;Warren Christopher;environmental
The two operations of our understanding, intuition and deduction, on which alone we have said we must rely in the acquisition of knowledge.;Rene Descartes;alone
A University should be a place of light, of liberty, and of learning.;Benjamin Disraeli;learning
Let us beware of saying that death is the opposite of life. The living being is only a species of the dead, and a very rare species.;Friedrich Nietzsche;life
For decades, Japan has been a friend and reliable trading partner with the United States, and I anticipate that relationship will prosper.;Jim Costa;relationship
Life is lived on the edge.;Will Smith;life
I believe we need to attract a new generation of the best and brightest to public service and I believe that government can be a source of inspiration, not degradation.;Andrew Cuomo;best
Young people in the business have grown up and made the wrong decisions, or bad decisions, and haven't been good role models. To be someone that people look up to is important to me.;Justin Bieber;business
I haven't deliberately set out to play the blonde bombshell in my movies. In fact, it's probably been quite the opposite. After the success of The Mask, I wasn't offered all that many blonde bombshell parts, to be honest. I think people believed from the beginning that I could actually walk and talk at the same time.;Cameron Diaz;success
Nothing. We're all friends and friendly. So when the cameras go down, depending on the mood or the nature of the material we're dealing with, there's usually a kind of a prevailing light attitude that's floating around.;Richard Dean Anderson;attitude
When you're young, you don't think very far ahead. You just think in terms of the next day, the next week, the next competition. You don't think about injuries that could threaten your long-term health.;Katarina Witt;health
In the modern world of business, it is useless to be a creative, original thinker unless you can also sell what you create.;David Ogilvy;business
I have always been an outstanding football player, I have always had uncanny abilities, great arm strength, an immense ability to play the game from a quarterback standpoint. The problem was that I wasn't given the liberty to do certain things when I was young.;Michael Vick;strength
I adore food and always have.;Jane Asher;food
The world is full of abundance and opportunity, but far too many people come to the fountain of life with a sieve instead of a tank car... a teaspoon instead of a steam shovel. They expect little and as a result they get little.;Ben Sweetland;car
Every girl should use what Mother Nature gave her before Father Time takes it away.;Laurence J. Peter;nature
I would love to hear all types of Christian artists played all over the world. I'd love to hear good, positive mainstream music played all over the place. I'd love to be able to bring music together. But I have not deserted Christ. I have not deserted my faith.;Stacie Orrico;positive
Think with your whole body.;Taisen Deshimaru;inspirational
I'm living life as best I can - but I'm not exempt from failure and making bad choices.;LeAnn Rimes;failure
I can imagine no society which does not embody some method of arbitration.;Herbert Read;society
I've always believed fitness is an entry point to help you build that happier, healthier life. When your health is strong, you're capable of taking risks. You'll feel more confident to ask for the promotion. You'll have more energy to be a better mom. You'll feel more deserving of love.;Jillian Michaels;health
Not all moral issues have the same moral weight as abortion and euthanasia. There may be legitimate diversity of opinion even among Catholics about waging war and applying the death penalty, but not... with regard to abortion and euthanasia.;Pope Benedict XVI;death
I was always depressed growing up. There wasn't a reason for it, I just was. I was sad and morose. I cried a lot, I wrote a lot, and I read a lot and that was how I dealt with it.;Amanda Hocking;sad
I was a big fan of Middle Eastern elements of music and experimental electronic and tribal sounds.;Adam Lambert;music
Give light and people will find the way.;Ella Baker;inspirational
She can't even chew gum and walk in a straight line, let alone write a book.;Liam Gallagher;alone
Keep cool my babies.;Conan O'Brien;cool
Patience makes a women beautiful in middle age.;Elliot Paul;patience
A bad man is the sort who weeps every time he speaks of a good woman.;H. L. Mencken;good
If faith is lost, there is no security and there is no life for him who does not adhere to religion.;Muhammad Iqbal;religion
If I were asked for a one-sentence sound bite on religion, I would say I was against it.;Salman Rushdie;religion
Southern political personalities, like sweet corn, travel badly. They lose flavor with every hundred yards away from the patch. By the time they reach New York, they are like Golden Bantam that has been trucked up from Texas - stale and unprofitable. The consumer forgets that the corn tastes different where it grows.;A. J. Liebling;travel
Music is very spiritual, it has the power to bring people together.;Edgar Winter;power
We are not really privy to all that crazy stuff that goes on in the show. I go to work, eat, and talk about food. The wild things happen when we aren't around. I expected Top Chef to last three or four seasons and we are now shooting season ten.;Tom Colicchio;food
The next major explosion is going to be when genetics and computers come together. I'm talking about an organic computer - about biological substances that can function like a semiconductor.;Alvin Toffler;science
I am excited to rise today to support National Mom and Pop Business Owners Day. This celebration honors the husband and wife business owner teams whose work helps drive the economy and fuel job growth.;Melissa Bean;mom
The farther a society progresses, the more clearly the individual becomes the antithesis of the group.;Herbert Read;society
There are a lot of things that make up a performance, a lot of technical things. It isn't always just about pulling it up from the darkest recesses of your mind or your heart. It's your experience and your observation.;Robert Carlyle;experience
What does music mean to me? I don't think I would really be much without it, without it coming through me. It's my means of communication, my means of growth, my means of transportation from one point in my life to another.;Erykah Badu;communication
Every good relationship, especially marriage, is based on respect. If it's not based on respect, nothing that appears to be good will last very long.;Amy Grant;good
May there always be peace, love and happiness in every house.;Islom Karimov;peace
I have nothing to hide in art. The initial force alone can bring anyone to the end he must attain.;Paul Cezanne;art
I actually started as a model builder and quickly progressed into production design, which made sense because I could draw and paint. But I kept watching that guy over there who was moving the actors around and setting up the shots.;James Cameron;design
There are no points of the compass on the chart of true patriotism.;Robert Charles Winthrop;memorialday
I think superheroes are heroes with flaws, and in their flaws, there is a sense of humor.;Peter Segal;humor
It's a fundamental, social attitude that the 1% supports symphonies and operas and doesn't support Johnny learning to program hip-hop beats. When I put it like that, it sounds like, 'Well, yeah,' but you start to think, 'Why not, though?' What makes one more valuable than another?;David Byrne;attitude
Nothing is perfect. Life is messy. Relationships are complex. Outcomes are uncertain. People are irrational.;Hugh Mackay;relationship
Every man who has shown the world the way to beauty, to true culture, has been a rebel, a 'universal' without patriotism, without home, who has found his people everywhere.;Chaim Potok;home
And I thought, when I have kids, that's the sort of well told, silly, and fun fairy tale that I would want to take them to. But it was an amazing experience. And I think Shrek is a real classic, a fairy tale classic.;Mike Myers;amazing
France, after the month of May, will share trust with the current leadership of the United States which, on many subjects, has tended to take useful positions in our view.;Francois Hollande;trust
I'm looking for a guy who makes you want to dance and write poetry all day long.;Angela Sarafyan;poetry
Religion is the sole technique for the validating of values.;Allen Tate;religion
Now, we believe that the majority of teachers in America know our system must be reformed, to put students first so that America can compete, that teachers don't teach to become rich or famous. They teach because they love children.;Chris Christie;famous
Concentrated power has always been the enemy of liberty.;Ronald Reagan;power
We all have big changes in our lives that are more or less a second chance.;Harrison Ford;change
I think poetry is best read to oneself.;Rickie Lee Jones;poetry
Even in the darkest regions, people have discovered their right of freedom.;Javier Bardem;freedom
I venture to say no war can be long carried on against the will of the people.;Edmund Burke;war
I did private study for about a month, five days a week, six hours a day. I came to understand the character in ways that I never would've previous to that. I was so innocent in respect to ways of creating characters.;Corin Nemec;respect
It is time we passed a balanced budget amendment and return this government to limited spending.;Newt Gingrich;government
My father was a swim teacher. We used to swim before school, swim after school.;Gordon Ramsay;teacher
The value of experience is not in seeing much, but in seeing wisely.;William Osler;experience
Music is essentially useless, as is life.;George Santayana;music
For God so loved the World that he gave his only Son, that whoever believes in him should not perish but have eternal life.;Jesus Christ;life
I think one of the terrible things today is that people have this deathly fear of food: fear of eggs, say, or fear of butter. Most doctors feel that you can have a little bit of everything.;Julia Child;fear
Aristotle taught that the brain exists merely to cool the blood and is not involved in the process of thinking. This is true only of certain persons.;Will Cuppy;cool
I love extreme sports, I like snowboarding and motorcross and rollerblading and hockey.;Jeremy London;sports
I say that justice is truth in action.;Benjamin Disraeli;truth
The world will never have lasting peace so long as men reserve for war the finest human qualities. Peace, no less than war, requires idealism and self-sacrifice and a righteous and dynamic faith.;John Foster Dulles;faith
Hope is a very thin diet.;Thomas Shadwell;diet
To wear your heart on your sleeve isn't a very good plan you should wear it inside, where it functions best.;Margaret Thatcher;best
Wisdom begins at the end.;Daniel Webster;wisdom
