American influence in the world is certainly considerable, but the United States does not control, directly or indirectly, the politics and economics of other societies, as empires have always done, save for a few special cases that turn out to be the exceptions that prove the rule.;Michael Mandelbaum;politics
Go confidently in the direction of your dreams. Live the life you have imagined.;Henry David Thoreau;life
The highest use of capital is not to make more money, but to make money do more for the betterment of life.;Henry Ford;life
Women are oppressed in the east, in the west, in the south, in the north. Women are oppressed inside, outside home, a woman is oppressed in religion, she is oppressed outside religion.;Taslima Nasrin;women
Man is a genius when he is dreaming.;Akira Kurosawa;dreams
There is something in the unselfish and self-sacrificing love of a brute, which goes directly to the heart of him who has had frequent occasion to test the paltry friendship and gossamer fidelity of mere Man.;Edgar Allan Poe;friendship
If you look at the various strategies available for dealing with a new technology, sticking your head in the sand is not the most plausible strategy.;Ralph Merkle;technology
When I was growing up in New Jersey, my mom would regularly take my sister and I into the city to see shows. I have many fond memories of standing in the half-price ticket line in Times Square and going to matinees.;Trey Anastasio;mom
No, let's make sure that people understand that this is a very important war that is helping to protect us here at home. And that we have no choice but to win it. As difficult as it is.;John Boehner;war
I've always believed in God. I also think that's the sort of thing that either comes as part of the equipment, the capacity to believe, or at some point in your life, when you're in a position where you actually need help from a power greater than yourself, you simply make an agreement.;Stephen King;god
Faith goes out through the window when beauty comes in at the door.;George Edward Moore;faith
Extraordinary how potent cheap music is.;Noel Coward;music
I absolutely refuse to reveal my age. What am I - a car?;Cyndi Lauper;car
I should have no objection to go over the same life from its beginning to the end: requesting only the advantage authors have, of correcting in a second edition the faults of the first.;Benjamin Franklin;life
When Whitney Houston died, I felt great sadness. My sadness, of course, was about our collective loss - when you listened to this nightingale sing, your body would drop into a chair, your head would tilt up, a small smile would creep across your face, and inside you knew that there was a higher power somewhere: gifted, beautiful, spiritual.;James Belushi;smile
Sitting down to a meal with an Indian family is different from sitting down to a meal with a British family.;Roland Joffe;food
Christmas renews our youth by stirring our wonder. The capacity for wonder has been called our most pregnant human faculty, for in it are born our art, our science, our religion.;Ralph W. Sockman;christmas
I don't really make movies because I want to see my face on a billboard or because I want to get good reviews or have a big box office. That doesn't really matter to me at all.;Joaquin Phoenix;movies
My dad was a singer in a band and neither of my parents went to college, and I ended up getting into Harvard and was the first person in my family that went to college and it happened to be Harvard.;Dean Norris;dad
Death is a challenge. It tells us not to waste time... It tells us to tell each other right now that we love each other.;Leo Buscaglia;love
Who do I like? I am a big fan of French and Saunders - not that that they are particularly stand-up I have to say, but I think they have been great for women and they are of themselves just incredibly funny whether they are male or female.;Jo Brand;funny
Very often when I go in to meet for movies or pilots, I'm put on videotape. I hate the notion that that tape is going to sit on a shelf and never get better.;David Ogden Stiers;movies
Be thou the rainbow in the storms of life. The evening beam that smiles the clouds away, and tints tomorrow with prophetic ray.;Lord Byron;life
Thank you for leaving us alone but giving us enough attention to boost our egos.;Mick Jagger;alone
Corruption is nature's way of restoring our faith in democracy.;Peter Ustinov;nature
A good teacher is a determined person.;Gilbert Highet;teacher
Falling in love and having a relationship are two different things.;Keanu Reeves;dating
He who steals a little steals with the same wish as he who steals much, but with less power.;Plato;power
Killing is the payoff of war.;Morley Safer;war
I do not consider it an insult, but rather a compliment to be called an agnostic. I do not pretend to know where many ignorant men are sure - that is all that agnosticism means.;Clarence Darrow;men
If you let your fear of consequence prevent you from following your deepest instinct, your life will be safe, expedient and thin.;Katharine Butler Hathaway;fear
Because parents have power over children. They feel they have to do what their parents say. But the love of money is the root of all evil. And this is a sweet child. And to see him turn like this, this isn't him. This is not him.;Michael Jackson;money
When we are sure that we are on the right road there is no need to plan our journey too far ahead. No need to burden ourselves with doubts and fears as to the obstacles that may bar our progress. We cannot take more than one step at a time.;Orison Swett Marden;time
I'm not trying to clock scores in this lifetime, it's just that things are better now than they were like five, ten years ago. Music has gotten a lot better. There's a lot of people who are committed to - soulfully.;Jerry Garcia;music
You don't have to love them. You just have to respect their rights.;Edward Koch;respect
I didn't really want to live, so anything that was an investment in time made me angry... but also I just felt sad. When the hopelessness is hurting you, it's the fixtures and fittings that finish you off.;Angelina Jolie;sad
You can't control the paparazzi. But if you go to Coachella you're going to get photographed. Whereas if you're at home, walking down the street you probably won't. It's something I've learnt to navigate my way around but I try to keep my private life private.;Ashley Greene;home
When you kill somebody in the movies, it matters, whereas in literature it can be allegorical.;Barbet Schroeder;movies
It often happens that when a person possesses a particular ability to an extraordinary degree, nature makes up for it by leaving him or her incompetent in every other department.;Robert Shea;nature
Leadership has a harder job to do than just choose sides. It must bring sides together.;Jesse Jackson;leadership
So long as the memory of certain beloved friends lives in my heart, I shall say that life is good.;Helen Keller;life
The government is not your salvation. The government is not your road to prosperity. Hard work, education will take you far beyond what any government program can ever promise.;Mia Love;government
We need to reclaim our American system of limited government, low taxes, reasonable regulations, and sound money, which has blessed us with unprecedented prosperity. And it has done more to help the poor than any other economic system ever designed.;Paul Ryan;money
The best men of the best epochs are simply those who make the fewest blunders and commit the fewest sins.;Thomas Huxley;best
The thing I thought about doing it was it's Comic Relief and you've got to be funny. So although I did try to sing properly it obviously has hilarious results when you can't sing.;Jo Brand;funny
I see no reason for calling my work poetry except that there is no other category in which to put it.;Marianne Moore;poetry
If you pursue good with labor, the labor passes away but the good remains if you pursue evil with pleasure, the pleasure passes away and the evil remains.;Marcus Tullius Cicero;good
I have the most amazing support network around me.;Jenny Frost;amazing
I wanted to dress cool, and get all the ladies.;John Singleton;cool
Love ceases to be a pleasure when it ceases to be a secret.;Aphra Behn;love
I think it is an immutable law in business that words are words, explanations are explanations, promises are promises - but only performance is reality.;Harold S. Geneen;business
To treat your facts with imagination is one thing, to imagine your facts is another.;John Burroughs;imagination
Don't fear failure so much that you refuse to try new things. The saddest summary of a life contains three descriptions: could have, might have, and should have.;Louis E. Boone;failure
The things you fear are undefeatable, not by their nature, but by your approach.;Jewel;fear
Delay always breeds danger and to protract a great design is often to ruin it.;Miguel de Cervantes;design
Life isn't meant to be easy. It's hard to take being on the top - or on the bottom. I guess I'm something of a fatalist. You have to have a sense of history, I think, to survive some of these things... Life is one crisis after another.;Richard M. Nixon;history
There's a lot of trust being built up. I think we have a lot of work ahead of us.;Jacob Lew;trust
I already gave my best. I have no regrets at all.;William Hung;best
Men and women must be educated, in a great degree, by the opinions and manners of the society they live in.;Mary Wollstonecraft;women
Every time I see an adult on a bicycle, I no longer despair for the future of the human race.;H. G. Wells;time
Knowledge is not a passion from without the mind, but an active exertion of the inward strength, vigor and power of the mind, displaying itself from within.;Ralph Cudworth;strength
With a recent birthday, I've been acting now for twenty years.;Thayer David;birthday
My favorite travel pastime is writing music, either with my guitar or on my computer.;Alexander Ludwig;travel
To understand the nature of the people one must be a prince, and to understand the nature of the prince, one must be of the people.;Niccolo Machiavelli;nature
I don't believe in God personally but I have great respect for those people who do and different people have different religious views in this country.;Ed Miliband;respect
It is not enough to say we must not wage war. It is necessary to love peace and sacrifice for it.;Martin Luther King, Jr.;peace
It's interesting, because I tend to trust a man with big ears.;Mo Rocca;trust
When I'm bored or tired of being blonde, I'll throw on a wig. It's a lot less of a permanent way to change your look, and I have about 10 - all different colors, shapes, bobs, long hair, short, feathered.;Sara Blakely;change
Man seeks to change the foods available in nature to suit his tastes, thereby putting an end to the very essence of life contained in them.;Sai Baba;food
One of the things I like best about 'Biggest Loser' is being around people who are trying to make the right choices. When you feel defeated about your weight and your health, like there's no hope, and you still make the choice to fight for it, to make the change happen no matter what people say or think, that's inspiring to me.;Alison Sweeney;health
Only in dreams, in poetry, in play do we sometimes arrive at what we were before we were this thing that, who knows, we are.;Julio Cortazar;dreams
The design of Rhetoric is to remove those Prejudices that lie in the way of Truth, to Reduce the Passions to the Government of Reasons to place our Subject in a Right Light, and excite our Hearers to a due consideration of it.;Mary Astell;government
As a woman who has some sort of power, you have to have a man that can take that. It's hard to find those men.;Jessica Simpson;power
I believe that the capacity that any organisation needs is for leadership to appear anywhere it is needed, when it is needed.;Margaret J. Wheatley;leadership
In all my career, in my ups and downs, I've never had a beauty campaign. This was meaningful that at almost 41 years old, I could be getting my first beauty campaign. It made me feel really great.;Teri Hatcher;beauty
Uttering a word is like striking a note on the keyboard of the imagination.;Ludwig Wittgenstein;imagination
The future is always beginning now.;Mark Strand;future
All men profess honesty as long as they can. To believe all men honest would be folly. To believe none so is something worse.;John Quincy Adams;men
Pain and foolishness lead to great bliss and complete knowledge, for Eternal Wisdom created nothing under the sun in vain.;Khalil Gibran;great
What they're not ready for is guys like you and I and Nails and all the other gnarly gnarlingtons in my life, that we are high priests, Vatican assassin warlocks. Boom. Print that, people. See where that goes.;Charlie Sheen;life
Because power corrupts, society's demands for moral authority and character increase as the importance of the position increases.;John Adams;society
To kill an error is as good a service as, and sometimes even better than, the establishing of a new truth or fact.;Charles Darwin;good
Knowledge of what is does not open the door directly to what should be.;Albert Einstein;knowledge
It is very necessary to have markers of beauty left in a world seemingly bent on making the most evil ugliness.;Thornton Wilder;beauty
Face it, I didn't become famous until I took my clothes off.;Jude Law;famous
Music is part of God's universe.;Cat Stevens;music
Rather than waiting for future trials to determine rules that will impact every citizen, Congress should step in and write a law that takes every American's rights into consideration.;Ron Wyden;future
I'm going home now. I apologize for what I said. I hope you can forget it, but I'm going home right now.;Benjamin Day;hope
I love that for Barack, there is no such thing as 'us' and 'them' - he doesn't care whether you're a Democrat, a Republican, or none of the above... he knows that we all love our country... and he's always ready to listen to good ideas... he's always looking for the very best in everyone he meets.;Michelle Obama;best
The more equality women have, the fairer, more civilized and tolerant society will be. Sexual equality is a lot more effective against terrorism than military strength.;Jose Luis Rodriguez Zapatero;equality
These are Canadian and United States intelligence and law enforcement offices who are working in teams and who are using good intelligence and good law enforcement to really stop the criminals and terrorists before they ever get to the border.;Paul Cellucci;intelligence
My mom just didn't put a very high premium on me being like really famous or really wealthy or anything.;Martha Plimpton;mom
Back a hundred years ago, especially around Woodrow Wilson, what happened in this country is we took freedom and we chopped it into pieces.;Ron Paul;freedom
Women would be disproportionately affected by the privatization of social security. It is one of the most important safety nets for American women in old age, or in times of disability, to insure financial income for their families.;Barbara Mikulski;age
I take it that what all men are really after is some form or perhaps only some formula of peace.;Joseph Conrad;peace
I think teaching should be an exalted profession, not a picked-on profession.;Charles Schumer;teacher
You have people come into your life shockingly and surprisingly. You have losses that you never thought you'd experience. You have rejection and you have learn how to deal with that and how to get up the next day and go on with it.;Taylor Swift;experience
Christianity is not about religion. It's about faith, about being held, about being forgiven. It's about finding joy and finding home.;Bear Grylls;faith
I probably spent the first 20 years of my life wanting to be as American as possible. Through my 20s, and into my 30s, I began to become aware of how so much of my art and architecture has a decidedly Eastern character.;Maya Lin;architecture
To say that I am organized is an understatement, but my car tells a different story.;Emily Procter;car
Nuclear arms and atomic power represent a technology in which coexistence with man is extremely difficult.;Naoto Kan;technology
No man was ever wise by chance.;Lucius Annaeus Seneca;wisdom
Music shouldn't be based around money or politics. Music should be a bunch of people that really do great songs together doing them together for the pursuit of having a good time.;Jerry Only;politics
Celebrity gives us delusion of self importance.;Al Goldstein;famous
I have many valentines. My mom and my sister and my directors. I got calls from all of them. And my friends. I respect what Valentine's Day stands for because it is about love.;Michelle Trachtenberg;respect
But now I feel off the grid. I feel that I am not part of the culture. And because I don't have a car I don't really go anywhere to buy things. In fact, I have been in a slow process of selling and giving away everything I own.;Vincent Kartheiser;car
Lean your body forward slightly to support the guitar against your chest, for the poetry of the music should resound in your heart.;Andres Segovia;music
One of the things I've always enjoyed is moving around and staying fit. Physicality is such a big part of being an actor, but it's also about stillness and silence.;Joel Edgerton;fitness
People who are in power make their arrangements in secret, largely as a way of maintaining and furthering that power.;Don DeLillo;power
The Communist Party said that I must finish my studies because after the revolution in Germany people would be required with technical knowledge to take part in the building of the Communist Germany.;Klaus Fuchs;knowledge
Which goes to show you, you can make all the laws you want, but you cannot change people's ways. If you must change them, you have to understand that it will take a long time.;Miriam Makeba;change
From now on we live in a world where man has walked on the Moon. It's not a miracle we just decided to go.;Tom Hanks;science
I wanted to contribute my time, myself, my knowledge, my love, because Haiti is my everything.;Laurent Lamothe;knowledge
Men do not shape destiny, Destiny produces the man for the hour.;Fidel Castro;men
I'd like to jump out of a plane. I have a fear of heights I'd like to face.;Freida Pinto;fear
Unfortunately, money in politics is an insidious thing - and a loophole in our campaign finance system was taken advantage of with money going to existing or new 527 groups with the sole purpose of influencing the election.;Olympia Snowe;finance
When someone says that I'm angry it's actually a compliment. I have not always been direct with my anger in my relationships, which is part of why I'd write about it in my songs because I had such fear around expressing anger as a woman.;Alanis Morissette;fear
I don't read a lot of the sports, because I think people sometimes either build it up, or you have this guy that hates sports that is going to write bad about it, so I figure I'm not going to read it. Because I'm not going to let him put an idea into my head.;Herschel Walker;sports
I worked in a pet store and people would ask how big I would get.;Rodney Dangerfield;pet
Eighty percent of success is showing up.;Woody Allen;success
What is past is past, there is a future left to all men, who have the virtue to repent and the energy to atone.;Edward G. Bulwer-Lytton;future
I grew up on the golden age of children's TV.;Edward Norton;age
And I like to keep whatever is mine remaining that way. It's a funny little game to play and it's a slippery slope. I always say to myself I'm never going to give anything away because there's never any point or benefit for me.;Kristen Stewart;funny
Everyone has things that they don't love about themselves but I think that as a woman its much healthier and more positive to focus on your good parts and the things you like about yourself, not pick yourself apart.;Miranda Kerr;positive
If a man lets all of my dogs sleep in the bed with us, then that is the most romantic thing. You must love my dogs in order to love me. A man who is nice to my animals and doesn't shoo them away - well, that's the height of romance.;Salma Hayek;romantic
Play is the only way the highest intelligence of humankind can unfold.;Joseph Chilton Pearce;intelligence
In business, the competition will bite you if you keep running, if you stand still, they will swallow you.;Victor Kiam;business
We have abolished the death penalty for humans, so why should it continue for animals?;Brigitte Bardot;death
The knowledge of God is the cause of things. For the knowledge of God is to all creatures what the knowledge of the artificer is to things made by his art.;Thomas Aquinas;knowledge
As long as men are free to ask what they must, free to say what they think, free to think what they will, freedom can never be lost and science can never regress.;Marcel Proust;men
I think the part of media that romanticizes criminal behavior, things that a person will say against women, profanity, being gangster, having multiple children with multiple men and women and not wanting to is prevalent. When you look at the majority of shows on television they placate that kind of behavior.;Bill Cosby;women
It is a weird feeling to have people go, 'Hey Chris' like they know me. But, number one, 99 percent of my experiences have been really cool. People couldn't be nicer and more positive.;Christopher Meloni;positive
Mom was 50 when my Dad died. She got on a bus every weekday for years, and rode 40 miles each morning to Madison. She earned a new degree and learned new skills to start her small business. It wasn't just a new livelihood. It was a new life.;Paul Ryan;mom
Society does not consist of individuals but expresses the sum of interrelations, the relations within which these individuals stand.;Karl Marx;society
It takes time to persuade men to do even what is for their own good.;Thomas Jefferson;men
If this is not done, future ages will certainly look back upon us as a people so immersed in the pursuit of wealth as to be blind to higher considerations.;Alfred Russel Wallace;future
Little islands of human happiness, peace, and prosperity are so exceptional at this point in history that I'm not even sure we can draw lessons from them.;P. J. O'Rourke;peace
Wedding is destiny, and hanging likewise.;John Heywood;wedding
No matter the nationality, no matter the religion, no matter the ethnic background, America brings out the best in people.;Arnold Schwarzenegger;best
I started studying music at the age of five and a half. My older sister was taking piano lessons. When her teacher left our apartment, I would get up on the piano bench and start picking out the notes that were part of my sister's lessons.;Marvin Hamlisch;teacher
There is a fifth dimension, beyond that which is known to man. It is a dimension as vast as space and as timeless as infinity. It is the middle ground between light and shadow, between science and superstition.;Rod Serling;science
Every now and then I read a poem that does touch something in me, but I never turn to poetry for solace or pleasure in the way that I throw myself into prose.;J. K. Rowling;poetry
On Thanksgiving I will stop to give thanks that my family is safe and healthy, especially because I realize that, following the tragedies of this year, it is all too real a possibility that they might not have been.;Bobby Jindal;family
If you only design menus that are essentially junk or fast food, the whole infrastructure supports junk.;Jamie Oliver;design
Management is nothing more than motivating other people.;Lee Iacocca;work
You shouldn't be afraid of failure - when something fails, you think, 'What did I learn from that experience? I can do better next time.' Then kill that project and move on to the next. Don't get disappointed.;Niklas Zennstrom;experience
In books lies the soul of the whole past time.;Thomas Carlyle;time
The unthankful heart... discovers no mercies but let the thankful heart sweep through the day and, as the magnet finds the iron, so it will find, in every hour, some heavenly blessings!;Henry Ward Beecher;thankful
I have a cycle that is not particularly cool, but it's a cycle: trash myself to reward myself.;Jeff Bridges;cool
I think I was a good student, because I jumped over a school. My main interest was basically history and literature. Sports were basically basketball and swimming at a pool. I was so happy.;Shimon Peres;history
I come from Montana, and in eastern Montana we have a lot of dirt between light bulbs. It is expensive trying to bring the new technologies to smaller schools to upgrade their technologies to take advantage of distance learning.;Conrad Burns;learning
I believe in the transformational power of liberty. I believe that the free Iraq is in this nation's interests. I believe a free Afghanistan is in this nation's interest.;George W. Bush;power
Benevolence alone will not make a teacher, nor will learning alone do it. The gift of teaching is a peculiar talent, and implies a need and a craving in the teacher himself.;John Jay Chapman;alone
I think mistakes are the essence of science and law. It's impossible to conceive of either scientific progress or legal progress without understanding the important role of being wrong and of mistakes.;Alan Dershowitz;legal
I wish life was not so short, he thought. languages take such a time, and so do all the things one wants to know about.;J. R. R. Tolkien;time
The only freedom I care about is the freedom to do right the freedom to do wrong I am ready to part with on the cheapest terms to anyone who will take it of me.;Thomas Huxley;freedom
My fault, my failure, is not in the passions I have, but in my lack of control of them.;Jack Kerouac;failure
Nothing in life is promised except death.;Kanye West;death
Men who love their mothers treat women wonderfully. And they have enormous respect for women.;Ellen Barkin;women
