In America, through pressure of conformity, there is freedom of choice, but nothing to choose from.;Peter Ustinov;freedom
Sometimes we need to remind ourselves that thankfulness is indeed a virtue.;William Bennett;thankful
As to those who hoard gold and silver and spend it not in God's path, give them, then, the tidings of a painful agony: on a day when these things shall be heated in hell-fire, and their foreheads, and their sides, and their backs shall be branded therewith.;Kin Hubbard;god
Patriotism is the religion of hell.;James Branch Cabell;patriotism
I really wanted to just be a musician. I didn't want to be anything else, but I was funny and all that.;Jamie Foxx;funny
It's true that it's within the realm of cultural politics that young people tend to work through political issues, which I think is good, although it's not going to solve the problems.;Angela Davis;politics
Politics is just show business for ugly people.;Jay Leno;politics
Friendship is two-sided. It isn't a friend just because someone's doing something nice for you. That's a nice person. There's friendship when you do for each other. It's like marriage - it's two-sided.;John Wooden;marriage
Dreams are real as long as they last. Can we say more of life?;Havelock Ellis;dreams
You can't separate peace from freedom because no one can be at peace unless he has his freedom.;Malcom X;peace
At school, there was an annual school disco and I'd be standing in my bedroom wondering what to wear for hours on end. Eventually I'd arrive at a decision that was just the most ridiculous costume you could have ever devised - I think it was probably knitted Christmas jumpers on top of buttoned-up white shirts.;Guy Berryman;christmas
I am desperate for change - now - not in 8 years or 12 years, but right now.;Michelle Obama;change
My dad was a big believer in treating people well, oftentimes even when he himself wasn't well.;Neil Cavuto;dad
Nobody makes movies bad on purpose.;Roland Emmerich;movies
Time moves in one direction, memory in another.;William Gibson;time
There is always the danger that we may just do the work for the sake of the work. This is where the respect and the love and the devotion come in - that we do it to God, to Christ, and that's why we try to do it as beautifully as possible.;Mother Teresa;god
If the government fails to listen to your demands, then you will decide what is best for you.;Muqtada al Sadr;government
I spent many a summer early morning with the radio very low, half sleeping and half listening.;Frankie Valli;morning
I remember when the candle shop burned down. Everyone stood around singing 'Happy Birthday.';Steven Wright;birthday
It is good even for old men to learn wisdom.;Aeschylus;wisdom
I travel around the world, experiencing every language, every religion... some places where there's just no reason to smile, because their lives are so difficult.;Lionel Richie;religion
The fact that we are I don't know how many millions of people, yet communication, complete communication, is completely impossible between two of those people, is to me one of the biggest tragic themes in the world.;Georges Simenon;communication
Solitude can be used well by very few people. They who do must have a knowledge of the world to see the foolishness of it, and enough virtue to despise all the vanity.;Abraham Cowley;knowledge
The most absurd and reckless aspirations have sometimes led to extraordinary success.;Luc de Clapiers;success
I lived by the candlelight for two years because I couldn't afford power. It was nice and romantic at the time, but if you can't afford power you're pretty broke. You endure it.;Jeremy Renner;romantic
What the mass media offers is not popular art, but entertainment which is intended to be consumed like food, forgotten, and replaced by a new dish.;W. H. Auden;food
Any old place I can hang my hat is home sweet home to me.;William Jerome;home
Great art picks up where nature ends.;Marc Chagall;art
Human dignity is better served by embracing knowledge.;John Charles Polanyi;knowledge
I thought I was funny as a kid.;Jo Brand;funny
It is impossible to experience one's death objectively and still carry a tune.;Woody Allen;death
I enjoy being busy, I really do. Remember, I'm the stub end of the railroad. I have no family, so I'm not taking busy time away from people that I should be spending it with. So I'm just relaxing and enjoying it.;Betty White;family
Poetry is really a way of sharing feelings and ideas.;Caroline Kennedy;poetry
When I'm good I'm very, very good, but when I'm bad, I'm better.;Mae West;good
The American economic, political, and social organization has given to its citizens the benefits of material prosperity, political liberty, and a wholesome natural equality and this achievement is a gain, not only to Americans, but to the world and to civilization.;Herbert Croly;equality
I've probably earned the right to screw up a few times. I don't want the fear of failure to stop me from doing what I really care about.;Emma Watson;failure
The corporate woman has been defined as the 'liberated woman' and I see that as the exact opposite. I think she now is more enslaved, maybe even more than the housewife was because she's so out of her power, and imitating male power is not female power.;Kenny Loggins;power
Sid Vicious began the age of participation in which everyone could be the artist. Sid proved that you don't have to play well to be the star. You can play badly, or not even at all. I endorsed that attitude. If you can't write songs, no problem - simply steal one and change it to your taste.;Malcolm Mclaren;attitude
When I found out I got this job, I cried, of course - I'm a girly-girl - and then I called my dad, and he cried, too. On so many levels, this is a thrill for me.;Lisa Guerrero;dad
A lot of the fun lies in trying to penetrate the mystery and this is best done by saying over the lines to yourself again and again, till they pass through the stage of sounding like nonsense, and finally return to a full sense that had at first escaped notice.;Anthony Hecht;best
It is not ignorance but knowledge which is the mother of wonder.;Joseph Wood Krutch;knowledge
Music and politics are in essence about communication. Without over-stretching the analogy I do feel a sense of rhythm is important in getting your message across.;Charles Kennedy;politics
I am ready to accept all accusations, allegations, anger - but I have to succeed.;Boris Trajkovski;anger
Since 2001, the Patriot Act has provided the means to detect and disrupt terrorist threats against the U.S. Prior to enactment of the law, major legal barriers prevented intelligence, national defense, and law enforcement agencies from working together and sharing information.;Roger Wicker;legal
The three most important things a man has are, briefly, his private parts, his money, and his religious opinions.;Samuel Butler;money
I decided that if I could paint that flower in a huge scale, you could not ignore its beauty.;Georgia O'Keeffe;nature
A woman has the age she deserves.;Coco Chanel;age
An important aspect of the current situation is the strong social reaction against suggestions that the home language of African American children be used in the first steps of learning to read and write.;William Labov;learning
Fruitful discourse in science or theology requires us to believe that within the contexts of normal discourse there are some true statements.;Kenneth L. Pike;science
There are no great limits to growth because there are no limits of human intelligence, imagination, and wonder.;Ronald Reagan;intelligence
Part of the reason for the ugliness of adults, in a child's eyes, is that the child is usually looking upwards, and few faces are at their best when seen from below.;George Orwell;best
We've arranged a civilization in which most crucial elements profoundly depend on science and technology.;Carl Sagan;technology
Whosoever desires constant success must change his conduct with the times.;Niccolo Machiavelli;success
Driving at high speed where safe and legal is part of my life. As well as a higher top speed I wanted even better stability in my FX and that meant work on the aerodynamics.;Sebastian Vettel;legal
I believed in studying just because I knew education was a privilege. It was the discipline of study, to get into the habit of doing something that you don't want to do.;Wynton Marsalis;education
Teacher unions are an interest group that acts in defense of their own interests, which means the union bosses' interests, not the members.;Peter Brimelow;teacher
Most people have no concept of how an automatic transmission works, yet they know how to drive a car. You don't have to study physics to understand the laws of motion to drive a car. You don't have to understand any of this stuff to use Macintosh.;Steve Jobs;car
Our founders got it right when they wrote in the Declaration of Independence that our rights come from nature and nature's God, not from government.;Paul Ryan;government
Going out and playing football or baseball with the boys, when I was a tomboy, was a great way to learn about winning and losing, and most girls didn't have that experience.;Hillary Clinton;great
People who don't like me talk about it as though I'm trash because I have tattoos. I find that insane because it's 2008, not the 1950s. Tattoos aren't limited to sailors. It's a form of art I find beautiful. I love it.;Megan Fox;art
Things are beautiful if you love them.;Jean Anouilh;art
I just want to make music, I don't want people to talk about me. All I've ever wanted to do was sing. I don't want to be a celebrity. I don't want to be in people's faces, you know, constantly on covers of magazine that I haven't even known I'm on.;Adele;famous
Despite the encouraging and wonderful gains and the changes for women which have occurred in my lifetime, there is still room to advance and to promote correction of the remaining deficiencies and imbalances.;Sandra Day O'Connor;women
Happiness comes when we test our skills towards some meaningful purpose.;John Stossel;happiness
The big thing that everyone forgets, you're famous and on TV and everything, but I think there's something very rewarding to be able to write a song, record it, and have it turn out as you heard it in your head, or even better.;Phil Collen;famous
Serious sport has nothing to do with fair play. It is bound up with hatred, jealousy, boastfulness, disregard of all rules and sadistic pleasure in witnessing violence. In other words, it is war minus the shooting.;George Orwell;jealousy
You come to a point in your life when you really don't care what people think about you, you just care what you think about yourself.;Evel Knievel;life
The development of the food industry for both domestic and export markets relies on a regulatory framework that both protects the consumer and assures fair trading practices in food.;Gro Harlem Brundtland;food
The tragedy of life is in what dies inside a man while he lives - the death of genuine feeling, the death of inspired response, the awareness that makes it possible to feel the pain or the glory of other men in yourself.;Norman Cousins;death
I never saw a lawyer yet who would admit he was making money.;Mary Roberts Rinehart;legal
A business that makes nothing but money is a poor business.;Henry Ford;business
The wheel that squeaks the loudest is the one that gets the grease.;Josh Billings;wisdom
I've never dreamed of a story idea. I have such boring dreams.;R. L. Stine;dreams
The 'morality of compromise' sounds contradictory. Compromise is usually a sign of weakness, or an admission of defeat. Strong men don't compromise, it is said, and principles should never be compromised.;Andrew Carnegie;men
In fact men will fight for a superstition quite as quickly as for a living truth - often more so, since a superstition is so intangible you cannot get at it to refute it, but truth is a point of view, and so is changeable.;Hypatia;truth
I believe that being an actress or being involved in a movie has to be a life experience, otherwise why go for it? I have to change me, and I have to learn things, and I have to push me and my limits. By acting, I find a freedom inside of a prison in a way.;Juliette Binoche;experience
In a way song writing can almost be detrimental, because suddenly you find an outlet that is a kind of cheating. You don't need to have direct communication. You can say, 'I can't describe it to you, but I will record it and send it to you.';James Blunt;communication
I love slow music.;Norah Jones;music
A creative element is surely present in all great systems, and it does not seem possible that all sympathy or fundamental attitudes of will can be entirely eliminated from any human philosophy.;Morris Raphael Cohen;sympathy
There must be people who remember World War II and the Holocaust who can help us get out of this rut.;Martin Scorsese;war
Let us change our traditional attitude to the construction of programs. Instead of imagining that our main task is to instruct a computer what to do, let us concentrate rather on explaining to human beings what we want a computer to do.;Donald Knuth;attitude
I was friends with all different people and all different groups. And that led me to being friends with a few people who didn't even go to my school. Now I have the most amazing collection of friends of all ethnic backgrounds and upbringing and financial backgrounds.;James Maslow;amazing
I get so nervous on stage I can't help but talk. I try. I try telling my brain: stop sending words to the mouth. But I get nervous and turn into my grandma. Behind the eyes it's pure fear. I find it difficult to believe I'm going to be able to deliver.;Adele;fear
In Heaven, I believe my dad is somewhere doing something nice. I feel I've been too lucky to travel this far without somebody guiding me.;Katherine Jenkins;dad
Education commences at the mother's knee, and every word spoken within hearsay of little children tends toward the formation of character.;Hosea Ballou;education
It is better to travel well than to arrive.;Buddha;travel
I thought I was going to be killed. The casualties were so heavy, it was just a given. I learned to take each day, each mission, as it came. That's an attitude I've carried into my professional life. I take each case, each job, as it comes.;Elliot Richardson;attitude
You've got to eat while you dream. You've got to deliver on short-range commitments, while you develop a long-range strategy and vision and implement it. The success of doing both. Walking and chewing gum if you will. Getting it done in the short-range, and delivering a long-range plan, and executing on that.;Jack Welch;success
Audacity augments courage hesitation, fear.;Publilius Syrus;fear
A quest for knowledge is not a war with faith spirituality is not usually an infelicitous amalgam of superstition and philistinism and moral relativism, taken outside midfield, leads inexorably both to heresy and to secular wickedness, which are often identical.;Conrad Black;faith
In times of change learners inherit the earth while the learned find themselves beautifully equipped to deal with a world that no longer exists.;Eric Hoffer;learning
So much of our lives are defined by habit or what the guy next to us is doing, never wondering and knowing who and what we support with our actions, from the detergent Mom always used, to my favorite dish I make... A lot of my life is unexamined habit.;Kristin Bauer van Straten;mom
I think the Cold War works as a great analogy or simile for different kinds of conflict. It's funny, when you look back at it, it's one of the last times that the boundaries were clear. Now, as we see on 'Homeland,' there are no clear boundaries and enemies.;Matthew Rhys;funny
As a coach you can influence the diet of your players. You can point out what is wrong.;Arsene Wenger;diet
I wanted to be a 150% entrepreneur and a 150% mom, and I found that I was having a very hard time doing both. I was about 75% and 75% - still better than 100%, but not what I was accustomed to at work.;Barbara Corcoran;mom
I never ask a man what his business is, for it never interests me. What I ask him about are his thoughts and dreams.;H. P. Lovecraft;dreams
I think of marriage as a garden. You have to tend to it. Respect it, take care of it, feed it. Make sure everyone is getting the right amount of, um, sunlight.;Mark Ruffalo;marriage
In high school, in sport, I had a coach who told me I was much better than I thought I was, and would make me do more in a positive sense. He was the first person who taught me not to be afraid of failure.;Mike Krzyzewski;positive
People with courage and character always seem sinister to the rest.;Hermann Hesse;courage
Men have to do some awfully mean things to keep up their respectability.;George Bernard Shaw;men
We used to go to Studio 54 - an amazing place.;Jerry Hall;amazing
A hero is someone who has given his or her life to something bigger than oneself.;Joseph Campbell;life
The practice of peace and reconciliation is one of the most vital and artistic of human actions.;Nhat Hanh;peace
I got into this little habit of architecture and building. I designed a house in Colorado and one in Hawaii. The idea is supposed to be build and sell - but then I can never bring myself to sell them.;Trey Parker;architecture
My decision to end my marriage was such a risk to lose ratings and lose my fan base. I had to take that risk for my inner peace and to be happy with myself.;Kim Kardashian;peace
The only people who live in a post-black world are four people who live in a little white house on Pennsylvania Avenue. The idea that America is post-racial or post-black because a man I admire, Barack Obama, is president of the United States, is a joke. And I hope no one will even wonder about this crazy fiction again.;Henry Louis Gates;hope
I do not go in search of poetry. I wait for poetry to visit me.;Eugenio Montale;poetry
Music - that's been my education. There's not a day that goes by that I take it for granted.;Billie Joe Armstrong;education
I shall never believe that God plays dice with the world.;Albert Einstein;god
Capital is money, capital is commodities. By virtue of it being value, it has acquired the occult ability to add value to itself. It brings forth living offspring, or, at the least, lays golden eggs.;Karl Marx;money
This is a work of fiction. All the characters in it, human and otherwise, are imaginary, excepting only certain of the fairy folk, whom it might be unwise to offend by casting doubts on their existence. Or lack thereof.;Neil Gaiman;work
I know of no single formula for success. But over the years I have observed that some attributes of leadership are universal and are often about finding ways of encouraging people to combine their efforts, their talents, their insights, their enthusiasm and their inspiration to work together.;Queen Elizabeth II;leadership
All good music resembles something. Good music stirs by its mysterious resemblance to the objects and feelings which motivated it.;Jean Cocteau;music
Dreams do come true, even for someone who couldn't speak English and never had a music lesson or much of an education.;Lawrence Welk;music
Our bodies are shaped to bear children, and our lives are a working out of the processes of creation. All our ambitions and intelligence are beside that great elemental point.;Saint Augustine;great
A Bush Administration will, I believe, enjoy a better relationship with the new Congress, although President-elect Bush will be faced with real challenges in getting along with the Congress.;Richard V. Allen;relationship
Because of that I don't care when I read in the newspaper that I am colourblind. I went through a red light in my car and I stopped when I before a green light. So I must be really colourblind, eh?;Ruud van Nistelrooy;car
Right now I'm not involved with anybody, but I hope by 75 I will be again.;Stevie Nicks;hope
My mom came from such humble beginnings and especially my dad as well. He didn't go to university.;Petra Ecclestone;mom
Captain Hale, alone, without sympathy or support, save that from above, on the near approach of death asked for a clergyman to attend him. It was refused. He then requested a Bible that too was refused by his inhuman jailer.;William Hull;sympathy
Beauty is grace and confidence. I've learned to accept and appreciate what nature gave me.;Lindsay Lohan;nature
The beginning of wisdom is to desire it.;Solomon Ibn Gabirol;wisdom
Country music is still your grandpa's music, but it's also your daughter's music. It's getting bigger and better all the time and I'm glad to be a part of it.;Shania Twain;music
Silence is the sleep that nourishes wisdom.;Francis Bacon;wisdom
The financial reward is great and I love the life I have, but all money makes possible is for you to stop worrying about money. Then you have freedom to live your life.;Paul Stanley;freedom
To succeed in business, to reach the top, an individual must know all it is possible to know about that business.;J. Paul Getty;business
When we talk about safety and security of the American people, politics falls aside pretty quickly.;Bill Frist;politics
Music is my home.;Jennifer Hudson;home
I question myself every day. That's what I still find motivating about this. I don't have the answers, I don't pretend that I do just because I won the match. Just keep fighting and maybe something good happens.;Andre Agassi;good
Writing allows me the time to travel and see the world, which is what I always wanted to do. I'd really like to have been Sir Richard Francis Burton, but it's the wrong century.;Alan Dean Foster;travel
I'm very accepting with my age. It's like notches on your belt: experience, wisdom, and a different kind of beauty. There comes a day when you've become comfortable in your skin.;Zoe Saldana;age
I like low-maintenance girls, but at the same time, classy. She needs to take care of herself. But also be a girl who isn't afraid to get sweaty and play basketball, so it's cool if she's a tomboy.;Chris Brown;cool
My kids say if there's any family dinner that doesn't result in somebody crying, it's not a good dinner. They cry because it helps relieve them of a guilt or some onerous emotional burden. It's like a family tradition.;William Shatner;family
One of the great things personally coming to Hawai'i is my friendship of Jim Nicholson.;Dan Fouts;friendship
Normal social behavior requires that we be able to recognize identities in spite of change. Unless we can do so, there can be no human society as we know it.;Kenneth L. Pike;society
When I go to a concert, I can't help but feel happy and everything else just goes away. I hope everyone feels that way at my concerts.;Victoria Justice;hope
The man who makes everything that leads to happiness depends upon himself, and not upon other men, has adopted the very best plan for living happily. This is the man of moderation, the man of manly character and of wisdom.;Plato;happiness
I pray daily... for peace.;Paul O'Neill;peace
When I see a bird that walks like a duck and swims like a duck and quacks like a duck, I call that bird a duck.;James Whitcomb Riley;nature
All the works of man have their origin in creative fantasy. What right have we then to depreciate imagination.;Carl Jung;imagination
All of them had so much to offer us as far as, you know, knowledge in the music industry, and especially Randy and Paula because, you know, they've been artists.;Ruben Studdard;knowledge
Learning a foreign language, and the culture that goes with it, is one of the most useful things we can do to broaden the empathy and imaginative sympathy and cultural outlook of children.;Michael Gove;sympathy
Aaron Pryor wants to get into the ring with me. He wants to be able to retire, and he will. For health reasons.;Sugar Ray Leonard;health
So foolish is the heart of man that he ever puts his hope in the future, learning nothing from his past errors and fancying that tomorrow must be better than today.;Mika Waltari;future
No man can call himself liberal, or radical, or even a conservative advocate of fair play, if his work depends in any way on the unpaid or underpaid labor of women at home, or in the office.;Gloria Steinem;work
I know a man who gave up smoking, drinking, sex, and rich food. He was healthy right up to the day he killed himself.;Johnny Carson;food
But if nothing but soul, or in soul mind, is qualified to count, it is impossible for there to be time unless there is soul, but only that of which time is an attribute, i.e. if change can exist without soul.;Aristotle;change
I don't believe in an afterlife, so I don't have to spend my whole life fearing hell, or fearing heaven even more. For whatever the tortures of hell, I think the boredom of heaven would be even worse.;Isaac Asimov;life
I think there are certain folks in Missouri that don't trust government. And they haven't trusted government for a long time.;Claire McCaskill;time
Godot is whatever it is in life that you are waiting for: 'I'm waiting to win the lottery. I'm waiting to fall in love'. For me, as a child, it was Christmas. At least that eventually came.;Ian Mckellen;christmas
Happiness held is the seed Happiness shared is the flower.;John Harrigan;happiness
The progress of freedom depends more upon the maintenance of peace, the spread of commerce, and the diffusion of education, than upon the labors of cabinets and foreign offices.;Richard Cobden;freedom
The '60s was one of the first times the power of music was used by a generation to bind them together.;Neil Young;power
Not everyone likes sports. Gandhi and Malcolm X come to mind.;Jay Mohr;sports
I'm more interested in being good than being famous.;Annie Leibovitz;famous
I always wanted what Mom and Dad had.;Kim Kardashian;mom
Enthusiasm is the genius of sincerity and truth accomplishes no victories without it.;Edward G. Bulwer-Lytton;truth
