Older fatherhood isn't all bad: testosterone rates drop about 1% per year as men age, making them less reactive and more patient, and a professionally established middle-aged man is likely to have more time and money to devote to his kids than a twenty-something who's just getting started.;Jeffrey Kluger;age
The human species, according to the best theory I can form of it, is composed of two distinct races, the men who borrow and the men who lend.;Charles Lamb;best
The government, which was designed for the people, has got into the hands of the bosses and their employers, the special interests. An invisible empire has been set up above the forms of democracy.;Woodrow Wilson;government
We want you to sit down and leave your egos at home and let's get an understanding as to where all this is foolishness coming from. There are others who are putting things out there or throwing a stick and hiding their hand and keeping things built up in the media.;Afrika Bambaataa;home
I've finally learnt how to say, 'No comment'. To appear in the tabloids is a real learning curve and a steep one at that. You had better learn quick or you get burnt.;Ben Affleck;learning
The distance between insanity and genius is measured only by success.;Bruce Feirstein;science
When obedience to the Divine precepts keeps pace with knowledge, in the mind of any man, that man is a Christian and when the fruits of Christianity are produced, that man is a disciple of our blessed Lord, let his profession of religion be what it may.;Joseph Lancaster;knowledge
I'd rather be a failure at something I love than a success at something I hate.;George Burns;failure
When you see what some women marry, you realize how they must hate to work for a living.;Helen Rowland;women
Let the beauty of what you love be what you do.;Rumi;love
And we can see the positive impacts right here at Solyndra. Less than a year ago, we were standing on what was an empty lot.But through the Recovery Act, this company received a loan to expand its operations. This new factory is the result of those loans.;Barack Obama;positive
Thankfulness is the beginning of gratitude. Gratitude is the completion of thankfulness. Thankfulness may consist merely of words. Gratitude is shown in acts.;Henri Frederic Amiel;thankful
I had to learn my faith and look after my family, and I had to make priorities. But now I've done it all and there's a little space for me to fill in the universe of music again.;Cat Stevens;music
A powerful attraction exists, therefore, to the promotion of a study and of duties of all others engrossing the time most completely, and which is less benefited than most others by any acquaintance with science.;Charles Babbage;science
Marriage should be a duet - when one sings, the other claps.;Joe Murray;marriage
No woman has to be a victim of physical abuse. Women have to feel like they are not alone.;Salma Hayek;alone
I'm single, footloose and fancy free, I have no responsibilities, no anchors. Work, friendship and self-improvement, that's me.;Joel Edgerton;friendship
He didn't come out of my belly, but my God, I've made his bones, because I've attended to every meal, and how he sleeps, and the fact that he swims like a fish because I took him to the ocean. I'm so proud of all those things. But he is my biggest pride.;John Lennon;god
Success can't be forced.;Loretta Young;success
War had always seemed to me to be a purely human behavior. Accounts of warlike behavior date back to the very first written records of human history it seemed to be an almost universal characteristic of human groups.;Jane Goodall;war
The true work of art is but a shadow of the divine perfection.;Michelangelo;work
I love being a woman and I was not one of these women who rose through professional life by wearing men's clothes or looking masculine. I loved wearing bright colors and being who I am.;Madeleine Albright;men
Great minds are to make others great. Their superiority is to be used, not to break the multitude to intellectual vassalage, not to establish over them a spiritual tyranny, but to rouse them from lethargy, and to aid them to judge for themselves.;William Ellery Channing;great
You may either win your peace or buy it: win it, by resistance to evil buy it, by compromise with evil.;John Ruskin;peace
Wisdom alone is true ambition's aim, wisdom the source of virtue, and of fame, obtained with labour, for mankind employed, and then, when most you share it, best enjoyed.;William Whitehead;wisdom
Contentment does not come from achievement. It comes from a relationship with the Lord.;Paul Henderson;relationship
The health of a democratic society may be measured by the quality of functions performed by private citizens.;Alexis de Tocqueville;society
A lot of the work in United States is highly critical of technology. I'm using 15,000 watts of power and 18 different pieces of electronic equipment to say that.;Laurie Anderson;technology
To understand me, you have to meet me and be around me. And then only if I'm in a good mood - don't meet me in a bad mood.;Avril Lavigne;good
It is an interesting and demonstrable fact, that all children are atheists and were religion not inculcated into their minds, they would remain so.;Ernestine Rose;religion
Health economists have estimated that an injection of $250 million per year in Indigenous clinical care, and $50 million in preventative care, is required to provide services at the same level as for any other group with the health conditions of Indigenous Australians.;Malcolm Fraser;health
Education is a better safeguard of liberty than a standing army.;Edward Everett;education
So then learn to conquer your fear. This is the only art we have to master nowadays: to look at things without fear, and to fearlessly do right.;Friedrich Durrenmatt;fear
I find it strange the way human nature wants heroes and yet wants to destroy their heroes. It's a kind of mass insecurity people want something to look up to and get a buzz off but, at the same time, want to destroy it because it makes them feel insecure.;Danielle Dax;nature
I've always felt that sexuality is a really slippery thing. In this day and age, it tends to get categorized and labeled, and I think labels are for food. Canned food.;Michael Stipe;food
I always prefer to believe the best of everybody, it saves so much trouble.;Rudyard Kipling;best
Therefore, don't let sinners take courage to think they will be favoured like the thief on the cross for we see on the other side, they may be like the hardened one, and reproach death itself.;Elias Hicks;courage
From my first dunk at 14 years old to my second NCAA Championship at the University of Tennessee, my intense training with my dad was always to credit.;Candace Parker;dad
We run into some pretty tough arguments sometimes, but the idea is that at the end of the day, my wife and I realize that we'll always be holding each other's hand. This is a lifelong relationship, and after 12 years she hasn't gotten rid of me yet.;Kyle Chandler;relationship
To help a friend in need is easy, but to give him your time is not always opportune.;Charlie Chaplin;time
Cherish your visions and your dreams as they are the children of your soul, the blueprints of your ultimate achievements.;Napoleon Hill;dreams
Nothing in the universe is contingent, but all things are conditioned to exist and operate in a particular manner by the necessity of the divine nature.;Baruch Spinoza;nature
I usually just have one cat. It is difficult, but I have my one cat that he'll travel with me if it's appropriate, if I'm not going overseas.;Gina Gershon;travel
And that's the great thing about living the Christian life and trying to live by faith, is you're trying to get better every day. You're trying to improve.;Tim Tebow;faith
There is no morality in war. Morality is the privilege of those judging from the distance. War is only death and destruction.;John Cory;war
I've been saying for a couple of years now that people need to let God out of the Sunday morning box, that He doesn't want to just be with you for an hour or two on Sunday morning and then put back in His box to sit there until you have an emergency, but He wants to invade your Monday, Tuesday, Wednesday, Thursday, Friday, Saturday, and Sunday.;Joyce Meyer;morning
Men naturally despise those who court them, but respect those who do not give way to them.;Thucydides;respect
Mike Watt and I had the same teacher. Mr. Tanaka.;Krist Novoselic;teacher
On the road to equality there is no better place for blacks to detour around American values than in forgoing its example in the treatment of its women and the organization of its family.;Eleanor Holmes Norton;equality
A painstaking course in qualitative and quantitative analysis by John Wing gave me an appreciation of the need for, and beauty of, accurate measurement.;Paul D. Boyer;beauty
The Sunday School teacher talked too much in the way our grade school teacher used to when she told us about George Washington. Pleasant, pretty stories, but not true.;Frances Farmer;teacher
Scientific knowledge is in perpetual evolution it finds itself changed from one day to the next.;Jean Piaget;knowledge
Seeing that a Pilot steers the ship in which we sail, who will never allow us to perish even in the midst of shipwrecks, there is no reason why our minds should be overwhelmed with fear and overcome with weariness.;John Calvin;fear
About morals, I know only that what is moral is what you feel good after and what is immoral is what you feel bad after.;Ernest Hemingway;good
Probably all the attention to poetry results in some value, though the attention is more often directed to lesser than to greater values.;A. R. Ammons;poetry
I try not to put anything political on the forefront of what I'm trying to do creatively. At the same time, I do think it's wonderful when I hear people say that it's inspirational that I'm an Indian woman on camera. My life is very diverse, and my friends are a diverse group of people.;Mindy Kaling;inspirational
It is essential to employ, trust, and reward those whose perspective, ability, and judgment are radically different from yours. It is also rare, for it requires uncommon humility, tolerance, and wisdom.;Dee Hock;wisdom
How often we fail to realize our good fortune in living in a country where happiness is more than a lack of tragedy.;Paul Sweeney;happiness
At the age of 15, a teacher had asked me what I wanted to do for a career, and without knowing why or even how I replied that I wanted to be a poet.;Ama Ata Aidoo;teacher
Marriage is not about age it's about finding the right person.;Sophia Bush;age
There are few ways in which a man can be more innocently employed than in getting money.;Samuel Johnson;money
Most of the approaches to peace between Israel and the Palestinians, have been directed at trying to resolve the most complex problems, like refugees and Jerusalem, which is akin to building the pyramid from the top down.;Benjamin Netanyahu;peace
I have been wounded like this since about half past eight this morning and I will tell you how it happened.;Francesco Borromini;morning
I think there are opportunities for women in comedies - how zany is up to them.;Jennifer Aniston;women
Mr. Churchill is proud of Britain's stand alone, after France had fallen and before America entered the War.;Eamon de Valera;alone
It was a mixed blessing to have famous parents. It was tough to go to auditions and be bad, since I couldn't be anonymous.;Ben Stiller;famous
When I'm living in the world of luxury and celebrity, which is where I found myself for a large part of my life, it's a walk-on part. Not a vital necessity, like it is for so many people. I enjoy it but I can see right through it!;Agnetha Faltskog;famous
The greatest way for people to experience a comedy is to go in not knowing anything about it. But because of marketing, it's impossible. Marketing meaning that in order to get people to come you can't just go, 'Hey, there's a great movie - we're not going to show you anything from it but trust us!';Paul Feig;trust
One of the good things about the way the Gulf War ended in 1991 is, you'd see the Vietnam veterans marching with the Gulf War veterans.;George H. W. Bush;war
To free us from the expectations of others, to give us back to ourselves - there lies the great, singular power of self-respect.;Joan Didion;respect
If you love somebody, you love them. My parents had a 25-year age gap between them and my mum was the breadwinner, my dad the house husband. I'm a strong believer that a good relationship can work, whatever the situation.;Katherine Jenkins;age
Men, even when alone, lighten their labors by song, however rude it may be.;Quintilian;alone
Monarchs ought to put to death the authors and instigators of war, as their sworn enemies and as dangers to their states.;Elizabeth I;war
I know exactly where I've come from, I know exactly who my mum and dad are.;Christopher Eccleston;dad
I think there is a real misconception about Indian food being super spicy. And I know that's because when you go into an Indian restaurant, it is pretty spicy. But it doesn't have to be. In fact, my husband can't handle a lot of heat. I've had to temper my cooking so that he can eat with me.;Aarti Sequeira;food
Home interprets heaven. Home is heaven for beginners.;Charles Henry Parkhurst;home
My best kiss was on stage. Kelly Rowland from Destiny's Child gave me a really nice soft kiss on my lips during a performance on my birthday. It was amazing.;Chris Brown;amazing
Spiderman can climb walls and he's got a cool outfit.;Rhona Mitra;cool
It's like gambling somehow. You go out for a night of drinking and you don't know where your going to end up the next day. It could work out good or it could be disastrous. It's like the throw of the dice.;Jim Morrison;good
I thoroughly enjoyed working on Enemy of the State. Tony Scott is an important director, and has an amazing ability to express himself, and he doesn't do it in musical terms , he does it in emotional terms. I got along really well with him.;Trevor Rabin;amazing
To the artist is sometimes granted a sudden, transient insight which serves in this matter for experience. A flash, and where previously the brain held a dead fact, the soul grasps a living truth! At moments we are all artists.;Arnold Bennett;experience
As a mom, I don't have much time for beauty.;Idina Menzel;mom
You have to trust your kids. They have to experience life, and you just hope you've provided them a foundation for what's right and what isn't.;Jack Nicklaus;experience
Movies like that aren't about the visual effects and explosions. They're human stories about family, about life, about death.;Orlando Bloom;family
Pharmaceutical companies are enjoying unprecedented profits and access with this Administration. Yet the Republicans' prescription drug plan for seniors has been a colossal failure, and over 43 million Americans wake up every morning without health insurance.;Jim Clyburn;failure
If one advances confidently in the direction of his dreams, and endeavors to live the life which he has imagined, he will meet with a success unexpected in common hours.;Henry David Thoreau;dreams
By 1969, when I celebrated 45 years in the music business, I also had 45 people in our musical family.;Lawrence Welk;family
A little more persistence, a little more effort, and what seemed hopeless failure may turn to glorious success.;Elbert Hubbard;success
I believe there is a relationship between having an interest in the arts and the behaviour of society as a whole. Some politicians find it difficult that the arts is a weapon of happiness... Politics is often about deprivation rather than the opening up of ideas and nourishing creative endeavour.;Richard Eyre;relationship
Courage is often lack of insight, whereas cowardice in many cases is based on good information.;Peter Ustinov;courage
The only failure one should fear, is not hugging to the purpose they see as best.;George Eliot;failure
My father was an inspiration to me I made a few movies with him and I loved working with him. Everything about him - his whole approach to work, as well as his love, enthusiasm and respect for it and other people in the business - was inspiring. I was very lucky to have him as a role model.;Hayley Mills;respect
I am opposed to anybody making a decision for you or me or anybody else about what health care plan we should have.;Arlen Specter;health
Heaven and hell suppose two distinct species of men, the good and the bad. But the greatest part of mankind float betwixt vice and virtue.;David Hume;men
The wise man must remember that while he is a descendant of the past, he is a parent of the future.;Herbert Spencer;future
Time is a beautiful thing. It's like when you meet an old lover on the street six years later and they don't look so ugly anymore.;Sarah McLachlan;time
My greatest concern is that the emergence of this technology without the appropriate public attention and international controls could lead to an unstable arms race.;K. Eric Drexler;technology
I'm working on my relationship with my mother and father, but my upbringing has been very destructive.;Paz de la Huerta;relationship
I think people need to be educated to the fact that marijuana is not a drug. Marijuana is an herb and a flower. God put it here. If He put it here and He wants it to grow, what gives the government the right to say that God is wrong?;Willie Nelson;god
South Park started as a little video Christmas card.;Joel Hodgson;christmas
Happiness is ideal, it is the work of the imagination.;Marquis de Sade;work
Father told me that if I ever met a lady in a dress like yours, I must look her straight in the eyes.;Prince Charles;dad
Perfect as the wing of a bird may be, it will never enable the bird to fly if unsupported by the air. Facts are the air of science. Without them a man of science can never rise.;Ivan Pavlov;science
At some future period, not very distant as measured by centuries, the civilized races of man will almost certainly exterminate, and replace the savage races throughout the world.;Charles Darwin;future
Hemingway seems to be in a funny position. People nowadays can't identify with him closely as a member of their own generation, and he isn't yet historical.;Leslie Fiedler;funny
There's pros and cons of a big church. Cons is I don't get to know everybody, I don't get to go to their ballgame, I don't get to marry everybody, but the pros are you get all this community, 800 ushers come in to serve, getting there at 7 in the morning on their day off and coming in on Saturday to make all those wafers.;Joel Osteen;morning
Let us speak, though we show all our faults and weaknesses, - for it is a sign of strength to be weak, to know it, and out with it - not in a set way and ostentatiously, though, but incidentally and without premeditation.;Herman Melville;strength
The truth does not change according to our ability to stomach it.;Flannery O'Connor;change
Are you in earnest? Seize this very minute! Boldness has genius, power, and magic in it. Only engage, and then the mind grows heated. Begin, and then the work will be completed.;Jean Anouilh;power
The art of healing comes from nature, not from the physician. Therefore the physician must start from nature, with an open mind.;Paracelsus;art
Paris is always a good idea.;Audrey Hepburn;good
But while they prate of economic laws, men and women are starving. We must lay hold of the fact that economic laws are not made by nature. They are made by human beings.;Franklin D. Roosevelt;nature
In Israel, a land lacking in natural resources, we learned to appreciate our greatest national advantage: our minds. Through creativity and innovation, we transformed barren deserts into flourishing fields and pioneered new frontiers in science and technology.;Shimon Peres;science
Democrats are going to proudly run on the fact that we turned the economy around. It was our policies under President Obama's leadership through the Recovery Act, through investing in the automobile industry.;Debbie Wasserman Schultz;leadership
When I grew up we had gym at school, two or three dance classes after school, ice skating lessons, and all sorts of sports at our finger tips. We weren't glued to computers because they didn't exist, so being active was all we knew.;Lisa Loeb;sports
I have a lot of boyfriends, I want you to write that. Every country I visit, I have a different boyfriend. And I kiss them all.;Anna Kournikova;dating
I'm fascinated by failure, and I'm fascinated by finality. Shakespeare's historical plays are more universal than his comedies because they relate to the finality of life. Without finality, life would not be beautiful.;George Hickenlooper;failure
I had a very insightful friend who warned me back when I stopped reading scripts, 'It's easier to change directions while you're still moving.' If you stop, it's harder to get started again. I still don't think I made the wrong decision, but he was right.;Debra Winger;change
Picasso is a character that has pursued me for a long time and I always rejected. He deserves a lot of respect because I am from Malaga, and I was born four blocks from where he was born.;Antonio Banderas;respect
It is a fact often observed, that men have written good verses under the inspiration of passion, who cannot write well under other circumstances.;Ralph Waldo Emerson;men
We may think there is willpower involved, but more likely... change is due to want power. Wanting the new addiction more than the old one. Wanting the new me in preference to the person I am now.;George A. Sheehan;change
The discussion in Washington has changed dramatically. I mean, it's no longer a question of should we address entitlements - it's no longer a question of do we need to reduce spending in the future.;Mark Zandi;future
Don't be afraid of failure be afraid of petty success.;Maude Adams;success
Gay marriage is the last bastion of, to me... as a legal, ceremonial, sentimental and religious side, it's one of the last steps. Retaining your job being one of the earlier steps, like, not getting kicked out of your job because you're gay.;Gus Van Sant;legal
That was my first lesson from Ben-Gurion. Then I saw him making peace, and I saw him making war. He mobilized me before the war. The man was a very rare combination between a real intellectual and a born leader. There is a contradiction between the two.;Shimon Peres;peace
My attitude to peace is rather based on the Burmese definition of peace - it really means removing all the negative factors that destroy peace in this world. So peace does not mean just putting an end to violence or to war, but to all other factors that threaten peace, such as discrimination, such as inequality, poverty.;Aung San Suu Kyi;attitude
The product of the scientific imagination is a new vision of relations - like that of artistic imagination.;Edmund Wilson;imagination
So I'm more at home with my backpack, sleeping in a hotel room or on a bus or on an airplane, than I am necessarily on a bed. It's weird being here. It feels like I'm standing next to my real life.;Henry Rollins;home
The clearest way into the Universe is through a forest wilderness.;John Muir;nature
Strange - is it not? That of the myriads who Before us passed the door of Darkness through, Not one returns to tell us of the road Which to discover we must travel too.;Horace;travel
Food - I love nuts. I eat them all the time, they're easy to carry around, and I am never hungry all day long.;Mehmet Oz;food
The mother's heart is the child's schoolroom.;Henry Ward Beecher;mom
I don't find music being less important than, like, politics.;Kurt Loder;politics
When I graduated from high school, the teacher said I was throwing my life away following music, and the same teacher invited me back to speak at the school. I don't say that to brag, I just want to be an example.;Big Sean;teacher
Wisdom is the power to put our time and our knowledge to the proper use.;Thomas J. Watson;knowledge
I think steak is the ultimate comfort food, and if you're going out for one, that isn't the time to scrimp on calories or quality.;Tom Colicchio;food
I think that women who know who they are are beautiful.;Demi Lovato;women
I got to spend all of my time every day at work reading and editing papers about cutting-edge technical research and getting paid for it. Then I'd go home at night and turn what I learned into science fiction stories.;Kevin J. Anderson;science
For-profit higher education is today a booming industry, feeding on the student loans handed out to the desperate.;Thomas Frank;education
My earliest memory is seeing Michael Jackson in Melbourne with my sister when I was about ten. I still have this souvenir stick with a glove that would light up and make a peace sign in a bunch of different colors. I'm so happy my mom didn't throw that out.;Emilie de Ravin;mom
Oh, I think there are a lot of people who would be buying and selling online today that go up there and they get the information, but then when it comes time to type in their credit card they think twice because they're not sure about how that might get out and what that might mean for them.;Bill Gates;time
I think what a life in science really teaches you is the vastness of our ignorance.;David Eagleman;science
Marriage gives you a new respect for a person.;Katharine McPhee;respect
Lonnie was ahead of his time, but at the same time he was right in there with Albert Collins's Cool Sounds.;Stevie Ray Vaughan;cool
Men and women were declared equal one morning and everybody could divorce each other by postcard.;Kate Millett;morning
It is not that the child lives in a world of imagination, but that the child within us survives and starts into life only at rare moments of recollection, which makes us believe, and it is not true, that, as children, we were imaginative?;Cesare Pavese;imagination
