It is perfectly true that that government is best which governs least. It is equally true that that government is best which provides most.;Walter Lippmann;government
Policemen so cherish their status as keepers of the peace and protectors of the public that they have occasionally been known to beat to death those citizens or groups who question that status.;David Mamet;peace
A lot of athletes use sports psychologists.;Andy Murray;sports
For my birthday this year, my girlfriends - who knew I'd just inherited my dad's turntable - gave me a carton of albums like 'Blue Kentucky Girl,' by Emmylou Harris, and 'Off the Wall,' by Michael Jackson. It's all stuff we grew up with. I mean, you can't have a music collection without Prince's 'Purple Rain' - it just can't be done!;Connie Britton;dad
My parents have a wonderful marriage, for many years. But I can't commit myself for such a long time.;Kim Wilde;marriage
One way to find food for thought is to use the fork in the road, the bifurcation that marks the place of emergence in which a new line of development begins to branch off.;William Irwin Thompson;food
I want to thank the Academy for its courage and generosity.;Elia Kazan;courage
Old age is not a matter for sorrow. It is matter for thanks if we have left our work done behind us.;Thomas Carlyle;age
I have long recognized a link between fitness and mental health and I think we need to encourage young people to take part in sports and team activities because we know it has such positive results.;Tipper Gore;fitness
Happiness? No, it's not there for me.;Robert Mapplethorpe;happiness
The natural liberty of man is to be free from any superior power on Earth, and not to be under the will or legislative authority of man, but only to have the law of nature for his rule.;Samuel Adams;power
If people are good only because they fear punishment, and hope for reward, then we are a sorry lot indeed.;Albert Einstein;hope
I have for some time urged that a nuclear abolition summit to mark the effective end of the nuclear era be convened in Hiroshima and Nagasaki on the 70th anniversary of the bombings of those cities, with the participation of national leaders and representatives of global civil society.;Daisaku Ikeda;society
Every company has two organizational structures: The formal one is written on the charts the other is the everyday relationship of the men and women in the organization.;Harold S. Geneen;relationship
I've been to all 50 states, and traveled this whole country, and 90 percent of the people are good folks. The rest of them take after the other side of the family.;Jeff Foxworthy;family
Mother is the name for God in the lips and hearts of little children.;William Makepeace Thackeray;god
For 50 years, nuclear power stations have produced three products which only a lunatic could want: bomb-explosive plutonium, lethal radioactive waste and electricity so dear it has to be heavily subsidised. They leave to future generations the task, and most of the cost, of making safe sites that have been polluted half-way to eternity.;James Buchan;future
We are involved in a life that passes understanding and our highest business is our daily life.;John Cage;business
Be true to your work, your word, and your friend.;Henry David Thoreau;work
Don't go around saying the world owes you a living. The world owes you nothing. It was here first.;Mark Twain;life
Bad taste is simply saying the truth before it should be said.;Mel Brooks;truth
The ballplayer who loses his head, who can't keep his cool, is worse than no ballplayer at all.;Lou Gehrig;cool
In every man the memory of the struggles and the heroes of the past is alive. But these memories are not incompatible with the desire for peace in the future.;Gustav Stresemann;peace
I enjoy trying to develop a car and Mercedes are one of the biggest car manufacturers in the world.;Lewis Hamilton;car
Swift speedy time, feathered with flying hours, Dissolves the beauty of the fairest brow.;Lord Chesterfield;beauty
Finance, like time, devours its own children.;Honore de Balzac;finance
The Russians feared Ike. They didn't fear me.;Lyndon B. Johnson;history
For one thing, I don't think that anybody in any war thinks of themselves as a hero.;Steven Spielberg;war
Work hard. And have patience. Because no matter who you are, you're going to get hurt in your career and you have to be patient to get through the injuries.;Randy Johnson;patience
Honestly, I didn't have the patience for biology or history in an academic sense, but I always liked the kind of big questions.;Andrew Bird;patience
Leadership appears to be the art of getting others to want to do something you are convinced should be done.;Vance Packard;leadership
I've always felt that technology can be used to our benefit and should be used to our benefit.;Deepak Chopra;technology
As a member of the House Select Committee on Intelligence, I will be participating in several hearings on the startling revelations contained in the report.;Charles Foster Bass;intelligence
Adopting the right attitude can convert a negative stress into a positive one.;Hans Selye;positive
If we wish to preserve a free society, it is essential that we recognize that the desirability of a particular object is not sufficient justification for the use of coercion.;Friedrich August von Hayek;society
I cannot swallow whole the view of Lincoln as the Great Emancipator.;Barack Obama;great
John was the smartest and most amazing comedian I've ever worked with. I think more than teaching me about acting or comedy, he taught me about life and the love of people and respect of people.;Kaley Cuoco;amazing
I never felt totally, 100%, patriotically English... I'd seen a lot of the world by an early age - sort of spent a lot of time traveling around Lebanon and I'd seen Babylon, and Damascus, and all sorts of places in the Middle East by the time I was ten. Then we'd return to Ruslip in West London... Done a fair bit of traveling really.;Andy Serkis;age
I did not just fall in love. I made a parachute jump.;Zora Neale Hurston;love
Prepare for death, if here at night you roam, and sign your will before you sup from home.;Samuel Johnson;home
All men are children, and of one family. The same tale sends them all to bed, and wakes them in the morning.;Henry David Thoreau;family
It is the superfluous things for which men sweat, - superfluous things that wear our togas theadbare, that force us to grow old in camp, that dash us upon foreign shores.;Lucius Annaeus Seneca;men
But when I lose my temper, I find it difficult to forgive myself. I feel I've failed. I can be calm in a crisis, in the face of death or things that hurt badly. I don't get hysterical, which may be masochistic of me.;Emma Thompson;death
Nothing is void of God, his work is everywhere his full of himself.;Lucius Annaeus Seneca;god
Leisure is the time for doing something useful. This leisure the diligent person will obtain the lazy one never.;Benjamin Franklin;time
Food simply isn't important to me.;Alice Paul;food
Sympathy constitutes friendship but in love there is a sort of antipathy, or opposing passion. Each strives to be the other, and both together make up one whole.;Samuel Taylor Coleridge;friendship
I'm a visual thinker, really bad at algebra. There's others that are a pattern thinker. These are the music and math minds. They think in patterns instead of pictures. Then there's another type that's not a visual thinker at all, and they're the ones that memorize all of the sports statistics, all of the weather statistics.;Temple Grandin;sports
There must be freedom for all to live, to think, to worship, no book, no avenue must be closed.;James Larkin;religion
Deficiency motivation doesn't work. It will lead to a life-long pursuit of try to fix me. Learn to appreciate what you have and where and who you are.;Wayne Dyer;work
The most I can do for my friend is simply be his friend.;Henry David Thoreau;friendship
You can't have any successes unless you can accept failure.;George Cukor;failure
Every morning I wake up and thank God.;Aaron Neville;god
I don't want a Black History Month. Black history is American history.;Morgan Freeman;history
Often we can help each other most by leaving each other alone at other times we need the hand-grasp and the word of cheer.;Elbert Hubbard;alone
Women have to be active listeners and interrupters - but when you interrupt, you have to know what you are talking about.;Madeleine Albright;women
Success is where preparation and opportunity meet.;Bobby Unser;success
Here I am trying to live, or rather, I am trying to teach the death within me how to live.;Jean Cocteau;death
Let's not overlook, though, what we do know about the campaign finance scandal, and the fact the Chinese were involved in our presidential campaign and our congressional campaigns.;Fred Thompson;finance
My films seem to be about men's struggle with failure.;Tom Hooper;failure
Peace is not the absence of conflict but the presence of creative alternatives for responding to conflict - alternatives to passive or aggressive responses, alternatives to violence.;Dorothy Thompson;peace
My role model is my dad.;Seann William Scott;dad
We are not victims of aging, sickness and death. These are part of scenery, not the seer, who is immune to any form of change. This seer is the spirit, the expression of eternal being.;Deepak Chopra;death
The goal of the EU is to form a region of freedom, security and justice. Freedom in this connection cannot be just the freedom of the strong, but it must be combined with fraternity and equality.;Tarja Halonen;equality
Compassion alone stands apart from the continuous traffic between good and evil proceeding within us.;Eric Hoffer;alone
Friendship is a pretty full-time occupation if you really are friendly with somebody. You can't have too many friends because then you're just not really friends.;Truman Capote;friendship
Life is a series of steps. Things are done gradually. Once in a while there is a giant step, but most of the time we are taking small, seemingly insignificant steps on the stairway of life.;Ralph Ransom;time
Let the word go forth from this time and place, to friend and foe alike, that the torch has been passed to a new generation of Americans - born in this century, tempered by war, disciplined by a hard and bitter peace.;John F. Kennedy;time
Music should be your escape.;Missy Elliot;music
I think that what went wrong with religion is the same thing that went wrong with politics. Is that it became too money based and too controlling. It's just a weakness that we human beings have for control - we want one thing and then we want more and then we want more.;Dave Davies;money
What I try to do is factor in how people use computers, what people's problems are, and how these technologies can get applied to those problems. Then I try to direct the various product groups to act on this information.;John Warnock;computers
Studies show that children best flourish when one mom and one dad are there to raise them.;John Boehner;parenting
My mom and I have always been very close. She is my best friend. She had to make a lot of sacrifices early on in my life to make sure I got to do what I wanted to do.;Norah Jones;mom
The five separate fingers are five independent units. Close them and the fist multiplies strength. This is organization.;James Cash Penney;strength
I'm lucky because my dad taught me to be frugal and save. And that's important because I want to know that I don't have to take an acting job for two or three years if I don't want to and that I'll still be able to make my house and car payments and buy food for my dogs.;Ashley Greene;food
Purity of personal life is the one indispensable condition for building up a sound education.;Mahatma Gandhi;life
In art the best is good enough.;Johann Wolfgang von Goethe;best
The importance of money flows from it being a link between the present and the future.;John Maynard Keynes;money
My first marriage was totally unsuitable and shouldn't have happened. It was a whirlwind, rebound thing. I was 23 or 24 - a baby.;Carol Vorderman;marriage
I do have a close circle of friends and I am very fortunate to have them as friends. I feel very close to them I think friends are everything in life after your family. You come across lots of people all the time but you only make very few friends and you have to be true to them otherwise what's the point in life?;Shahrukh Khan;family
All one's inventions are true, you can be sure of that. Poetry is as exact a science as geometry.;Gustave Flaubert;science
People say they love truth, but in reality they want to believe that which they love is true.;Robert J. Ringer;truth
The teacher who is indeed wise does not bid you to enter the house of his wisdom but rather leads you to the threshold of your mind.;Khalil Gibran;wisdom
It's a family that's loaded with grudges and passion. We come from a long line of robbers and highwaymen in Italy, you know. Killers, even.;Nicolas Cage;family
You know, be an actor because you love to act. Don't be an actor because you think you're going to get famous, because that's luck.;Whoopi Goldberg;famous
My husband and I are best of friends first and foremost. We fight like cats and dogs, but never stay mad for long. I was lucky to find him, he is in every way, my soulmate.;Carnie Wilson;best
To me, movies and music go hand in hand. When I'm writing a script, one of the first things I do is find the music I'm going to play for the opening sequence.;Quentin Tarantino;movies
Always there has been some terrible evil at home or some monstrous foreign power that was going to gobble us up if we did not blindly rally behind it.;Douglas MacArthur;power
To even be called the 'teen queen' is crazy.;Victoria Justice;teen
The truth is in nature, and I shall prove it.;Paul Cezanne;nature
Dreams can come true.;Lil' Romeo;dreams
I swear, by my life and my love of it, that I will never live for the sake of another man, nor ask another man to live for mine.;Ayn Rand;love
Poetry is all that is worth remembering in life.;William Hazlitt;poetry
We can realise a lasting peace and transform the East-West relationship to one of enduring co-operation.;George H. W. Bush;relationship
Things do not happen. Things are made to happen.;John F. Kennedy;motivational
Living alone makes it harder to find someone to blame.;Mason Cooley;alone
You have to watch all sides of your advancement, you have to make sure people's bodies and minds are healthy and their morale is cool before you can really go out and play great music.;Shirley Manson;cool
I think in most jobs, you get better as you get older. You gain experience, you gain knowledge.;Kristin Scott Thomas;knowledge
For nine years I worked to change what was hairdressing then into a geometric art form with color, perm without setting which had never been done before.;Vidal Sassoon;art
If we had been less reliant on technology and the security that we enjoy in being divorced from what we used to know, maybe things would have turned out differently.;Heather Donahue;technology
Revolution, n. In politics, an abrupt change in the form of misgovernment.;Ambrose Bierce;change
Chance has never yet satisfied the hope of a suffering people.;Marcus Garvey;hope
A gift consists not in what is done or given, but in the intention of the giver or doer.;Lucius Annaeus Seneca;birthday
Queuing tips for fans: wrap up and bring food!;Niall Horan;food
We assume that everything's becoming more efficient, and in an immediate sense that's true our lives are better in many ways. But that improvement has been gained through a massively inefficient use of natural resources.;Paul Hawken;environmental
Sometimes it's the smallest decisions that can change your life forever.;Keri Russell;change
I've been in and out of Wall Street since 1949, and I've never seen the type of animosity between government and Wall Street. And I'm not sure where it comes from, but I suspect it's got to do with a general schism in this society which is really becoming ever more destructive.;Alan Greenspan;government
No agent wants to see a book until he or she has decided whether to pursue the relationship.;Sara Paretsky;relationship
I always believed that women have rights and that there are some women that are intelligent enough to claim those rights. There are some others that are stupid enough not to.;Shakira;women
Love is not weakness. It is strong. Only the sacrament of marriage can contain it.;Boris Pasternak;marriage
I do not have much patience with a thing of beauty that must be explained to be understood. If it does need additional interpretation by someone other than the creator, then I question whether it has fulfilled its purpose.;Charlie Chaplin;beauty
Not necessity, not desire - no, the love of power is the demon of men. Let them have everything - health, food, a place to live, entertainment - they are and remain unhappy and low-spirited: for the demon waits and waits and will be satisfied.;Friedrich Nietzsche;love
Politics is the art of looking for trouble, finding it everywhere, diagnosing it incorrectly and applying the wrong remedies.;Groucho Marx;politics
Cats have a scam going - you buy the food, they eat the food, they go away that's the deal.;Eddie Izzard;food
In our civilization, and under our republican form of government, intelligence is so highly honored that it is rewarded by exemption from the cares of office.;Ambrose Bierce;government
Sometimes I envy people who can be only half crazy, with one foot in the passion and one foot in the real world. But that's not me. I dive into the total crazy experience. That's the only way to travel.;Kiran Ahluwalia;travel
I look forward to death with great anticipation, to meeting God face to face.;Billy Graham;great
You cannot blame the mismanagement of the economy or the fact that we have not invested adequately in education in order to give our people the knowledge, the skills and the technology that they need in order to be able to use the resources that Africa has to gain wealth.;Wangari Maathai;knowledge
Gold medals aren't really made of gold. They're made of sweat, determination, and a hard-to-find alloy called guts.;Dan Gable;sports
The great advance of personal computers was not the computing power per se but the fact that it brought it right to your face, that you had control over it, that were confronted with it and could steer it.;Kevin Kelly;computers
I'm not a guy who curses very much in my personal life. When I curse it sounds like a kid trying to be cool. But I think there are quite a few people, my father being one of them, who use curse words rather eloquently.;Justin Halpern;cool
Smile, it is the key that fits the lock of everybody's heart.;Anthony J. D'Angelo;smile
Beauty for some provides escape, who gain a happiness in eyeing the gorgeous buttocks of the ape or Autumn sunsets exquisitely dying.;Langston Hughes;happiness
They certainly give very strange names to diseases.;Plato;medical
Today, all patients accepted for treatment at St. Jude's are treated without regard for the family's ability to pay. Everything beyond what is covered by insurance is taken care of, and for those without insurance, all of the medical costs are absorbed by the hospital.;Marlo Thomas;medical
Letting your mind play is the best way to solve problems.;Bill Watterson;best
A small house must depend on its grouping with other houses for its beauty, and for the preservation of light air and the maximum of surrounding open space.;Clarence Stein;beauty
For the Nugent family, fast food is a running herbivore.;Ted Nugent;family
The great advantage of a hotel is that it is a refuge from home life.;George Bernard Shaw;great
Yet it is in our idleness, in our dreams, that the submerged truth sometimes comes to the top.;Virginia Woolf;dreams
If one of two lovers is loyal, and the other jealous and false, how may their friendship last, for Love is slain!;Marie de France;friendship
The modern mind is in complete disarray. Knowledge has stretched itself to the point where neither the world nor our intelligence can find any foot-hold. It is a fact that we are suffering from nihilism.;Albert Camus;intelligence
I don't read music. I don't write it. So I wander around on the guitar until something starts to present itself.;James Taylor;music
Under Barack Obama, the only 'Change' is that 'Hope' has been hard to find. Now millions of Americans are insecure about their future. But instead of inspiring us by reminding us of what makes us special, he divides us against each other. He tells Americans they're worse off because others are better off. That people got rich by making others poor.;Marco Rubio;change
I hope there have been times when I made you all proud, or made you all smile or at least piqued your interest in this wonderful institution we call government.;John Rowland;smile
I love making new friends and I respect people for a lot of different reasons.;Taylor Swift;respect
I am rediscovering the whole sexual dimension of life at the age of 86, really. And that also means discovering the feminine. So the whole of this dimension, which I had been seeking for a very long time, is now sort of opening itself up to me.;Bede Griffiths;age
If marriage really is a sacred institution, then why is the government controlling it, especially in a nation that affirms separation of church and state?;Tony Campolo;government
Good news doesn't necessarily have to be a positive thing. Bringing good news is imparting hope to one's fellow man.;Patti Smith;hope
The legions of reporters who cover politics don't want to quit the clash and thunder of electoral combat for the dry duty of analyzing the federal budget. As a consequence, we have created the perpetual presidential campaign.;Hugh Sidey;politics
We want to obviously foster a relationship that we're a partner with states that we all share the same goals of closing the achievement gap, just as the Congress does and that we're practical and sophisticated enough to understand what they're talking about.;Margaret Spellings;relationship
Each morning when I awake, I experience again a supreme pleasure - that of being Salvador Dali.;Salvador Dali;morning
A lot of times on tour it's about, 'OK, where am I today? Wow, I'm in Costa Rica. What is their famous dish?' And it's about trying the food, and really experiencing it.;Fergie;famous
God made everything out of nothing, but the nothingness shows through.;Paul Valery;god
I don't have the recipe for happiness, but I think the engine is simply having the desire.;Vanessa Paradis;happiness
I know of no more important subject to the peace of Europe and the world than the reasonable reduction of armaments, especially in Europe, and of naval armaments throughout the world.;Frank B. Kellogg;peace
The problem for those who assert biblical authority in support of traditional definitions of marriage is that one could, with equal validity, assert that the lending of money or certain kinds of haircuts are forbidden by God, or that slavery and the subjugation of women are authorized by the Lord.;Jon Meacham;money
Awards were made in Hollywood, in whatever the time it was created. They're to promote each other's movies. You give me an award, I give you an award and people will believe that we are great movies and they'll go to see them. It's still the same.;Javier Bardem;movies
It is the child's understanding that teaches the adults the way of the future. They're still doing it today with modern technology.;Michael Morpurgo;technology
Religion has caused more misery to all of mankind in every stage of human history than any other single idea.;Madalyn Murray O'Hair;history
Little islands of human happiness, peace, and prosperity are so exceptional at this point in history that I'm not even sure we can draw lessons from them.;P. J. O'Rourke;happiness
Any serious shift towards more sustainable societies has to include gender equality.;Helen Clark;equality
The more I get to do this character, the more I realize that she's not just annoying. It's that her strength is not interacting with people socially. She just doesn't have time because she has so much going on in her brain.;Mary Lynn Rajskub;strength
With the never-ending stream of new social technologies, apps and platforms rolling out every day, its easy to get lost in the minutiae of social media. Yet for there to be effective change, especially within large, top-down, hierarchical institutions, a company must have an over-arching understanding of the new role it has to play.;Simon Mainwaring;change
Architecture is the art of how to waste space.;Philip Johnson;art
It's amazing that you can listen to any song and you can always tell when there's some substance beneath it and when there isn't. Even if it's poetically written and technically brilliant, I'd rather hear something that's all over the place but has some soul to it.;Teddy Thompson;amazing
Observe all men, thyself most.;Benjamin Franklin;men
It is easier for a father to have children than for children to have a real father.;Pope John XXIII;dad
I think the number one thing Black women and all Black people should be paying attention to is our health.;Bell Hooks;health
I sing seriously to my mom on the phone. To put her to sleep, I have to sing 'Maria' from West Side Story. When I hear her snoring, I hang up.;Adam Sandler;mom
We need to understand that we as citizens and as a government in any community throughout this country have no more important obligation than to educate those who are going to replace us.;Colin Powell;government
Down on your knees, and thank heaven, fasting, for a good man's love.;Euripides;love
I'm often called an old-fashioned modernist. But the modernists had the absurd idea that architecture could heal the world. That's impossible. And today nobody expects architects to have these grand visions any more.;Thom Mayne;architecture
