To love abundantly is to live abundantly, and to love forever is to live forever.;Henry Drummond;love
Until we respect bin Laden, we are going to die in numbers that are probably unnecessary.;Michael Scheuer;respect
After I became a citizen, I felt freer to say what I thought about this country, both negative and positive. I think I had been, consciously and subconsciously, biting my tongue in the past.;Robert MacNeil;positive
We are by nature observers, and thereby learners. That is our permanent state.;Ralph Waldo Emerson;nature
Two hundred years ago, our Founding Fathers gave us a democracy. It was based upon the simple, yet noble, idea that government derives its validity from the consent of the governed.;Paul Tsongas;government
Marriage, like death, is a debt we owe to nature.;Julia Ward Howe;marriage
In the seventies, a group of American artists seized the means not of production but of reproduction. They tore apart visual culture at a time of no money, no market, and no one paying attention except other artists. Vietnam and Watergate had happened everything in America was being questioned.;Jerry Saltz;money
I love my dad and we have a very good relationship now.;Norah Jones;dad
I know that I will never find my father in any other man who comes into my life, because it is a void in my life that can only be filled by him.;Halle Berry;dad
I knew that there were black people in Africa, of course, unfortunately because of movies such as 'Tarzan.';Henry Louis Gates;movies
I woke up on May 15, 1991, the day of my Barnard graduation, and I said to myself, 'By the end of today you will decide what you want to do with the rest of your life.';Alexandra Guarnaschelli;graduation
The biggest kick I get is to communicate with those who are exiled from the game - in hospitals, homes, prisons - those who have seldom seen a game, who can't travel to a game, those who are blind.;Jack Buck;travel
Death is the final wake-up call.;Douglas Horton;death
The beauty of 'spacing' children many years apart lies in the fact that parents have time to learn the mistakes that were made with the older ones - which permits them to make exactly the opposite mistakes with the younger ones.;Sydney J. Harris;beauty
As far as humor goes, I've always been a very insecure person and I've always wanted to be liked.;Peter Steele;humor
Writing for children is bloody difficult books for children are as complex as their adult counterparts, and they should therefore be accorded the same respect.;Mark Haddon;respect
People do not win people fights. Lawyers do.;Norman Ralph Augustine;legal
So much of life is luck. One day you make a right turn and get hit by a car. Turn left and you meet the love of your life. I think I made the correct turn.;Loretta Swit;car
In war, when a commander becomes so bereft of reason and perspective that he fails to understand the dependence of arms on Divine guidance, he no longer deserves victory.;Lucius Annaeus Seneca;war
There's another way we are getting behind business - by sorting out the banks. Taxpayers bailed you out. Now it's time for you to repay the favour and start lending to Britain's small businesses.;David Cameron;business
The American Dream has run out of gas. The car has stopped. It no longer supplies the world with its images, its dreams, its fantasies. No more. It's over. It supplies the world with its nightmares now: the Kennedy assassination, Watergate, Vietnam.;J. G. Ballard;dreams
My strengths as a businessman lie in the design and sale of women's shoes, and I have never been comfortable with complicated or technical legal or business documents.;Steve Madden;design
The youth is the hope of our future.;Jose Rizal;hope
My dad was an engineer and so I had this picture of science and technology and pursuits of the mind as being more impressive than artistic pursuits, which I saw a as kind of frivolous.;Scott McCloud;technology
My childhood, I would say, was a bit sad.;Columba Bush;sad
It is paradoxical that many educators and parents still differentiate between a time for learning and a time for play without seeing the vital connection between them.;Leo Buscaglia;learning
At the moment of death I hope to be surprised.;Ivan Illich;death
Being a CEO still means sitting across the table from big institutional investors and showing your leadership and having them believe in you.;Christie Hefner;leadership
The terrorists are fighting freedom with all their cunning and cruelty because freedom is their greatest fear - and they should be afraid, because freedom is on the march.;George W. Bush;freedom
The exposed nature of life in the public square affects leaders' attitudes toward risk - and failure.;Dee Dee Myers;nature
We are all hungry and thirsty for concrete images. Abstract art will have been good for one thing: to restore its exact virginity to figurative art.;Salvador Dali;art
As people are walking all the time, in the same spot, a path appears.;John Locke;time
A pun is the lowest form of humor, unless you thought of it yourself.;Doug Larson;humor
Soon I knew the craft of experimental physics was beyond me - it was the sublime quality of patience - patience in accumulating data, patience with recalcitrant equipment - which I sadly lacked.;Abdus Salam;patience
Each blade of grass has its spot on earth whence it draws its life, its strength and so is man rooted to the land from which he draws his faith together with his life.;Joseph Conrad;faith
The search for human freedom can never be complete without freedom for women.;Betty Ford;freedom
What a country calls its vital... interests are not things that help its people live, but things that help it make war.;Simone Weil;war
My parents are very hard working people who did everything they could for their children. I have two brothers and they worked dog hard to give us an education and provide us with the most comfortable life possible. My dad provided for his family daily. So, yes, that is definitely in my DNA.;David Oyelowo;education
I usually make up my mind about a man in ten seconds, and I very rarely change it.;Margaret Thatcher;men
The South is very beautiful but its beauty makes one sad because the lives that people live here, and have lived here, are so ugly.;James Baldwin;beauty
When one has success, the answer is not to undo that success. It is to continue what has been done.;Charles Schumer;success
Certainly, protecting oppressed people, stopping ethnic conflict and promoting responsible governance are worthy goals. But none is as important for American security and prosperity as keeping the peace in the Middle East, Europe and East Asia.;Michael Mandelbaum;peace
Security is mostly a superstition. It does not exist in nature, nor do the children of men as a whole experience it. Avoiding danger is no safer in the long run than outright exposure. Life is either a daring adventure, or nothing.;Helen Keller;experience
Those who gave thee a body, furnished it with weakness but He who gave thee Soul, armed thee with resolution. Employ it, and thou art wise be wise and thou art happy.;Akhenaton;newyears
Everybody's a dreamer.;John Lithgow;dreams
After you're older, two things are possibly more important than any others: health and money.;Helen Gurley Brown;age
We need earmark reform, and when I'm President, I will go line by line to make sure that we are not spending money unwisely.;Barack Obama;money
Fiction will always be my greatest love, with poetry close behind.;J. Courtney Sullivan;poetry
What We want is to make it possible for our unfortunate people to live a life of industry for it is by steady work alone that we hope for our physical and moral rehabilitation. For this reason above all we have undertaken to rally our people around our ideal.;Theodor Herzl;alone
Some people are drawn naturally - there are natural guitarists, and there are natural piano players, and I think guitar implies travel, a sort of footloose gypsy existence. You grab your bag and you go to the next town.;Hugh Laurie;travel
It takes vision and courage to create - it takes faith and courage to prove.;Owen D. Young;courage
Mom was the one who taught me unconditional love. With Dad, I'd always felt there was something to live up to - expectations. But in the last year, we had a wonderful relationship.;Greg Louganis;relationship
For that story, I took as my subject a young woman whom I got to know over the course of a couple of visits. I never saw her having any health problems - but I knew she wanted to be married.;Jhumpa Lahiri;health
I've made club songs, and I've made radio songs, and I've made the car songs.;T-Pain;car
The aim of a college education is to teach you to know a good man when you see one.;William James;good
Patriotism is the virtue of the vicious.;Oscar Wilde;patriotism
And then we watched an amazing number of movies from the late '60s and '70s, which is my favorite time, and we studied their camera movements, their stocks, the way they lit stuff, the colors they used.;Ted Demme;amazing
Pink Floyd is like a marriage that's on a permanent trial separation.;Rick Wright;marriage
I've made some great mistakes in my life, but, you know, they were honest mistakes.;Henry Rollins;great
We are not merely passive pawns of historical forces nor are we victims of the past. We can shape and direct history.;Daisaku Ikeda;history
He killed his enemies because he was afraid they would kill him. Amin ordered entire tribes to be put to death, because he feared they would rebel.;Ryszard Kapuscinski;death
Don't solicit feedback on your product, idea or your business just for validation purposes. You want to tell the people who can help move your idea forward, but if you're just looking to your friend, co-worker, husband or wife for validation, be careful. It can stop a lot of multimillion-dollar ideas in their tracks in the beginning.;Sara Blakely;business
On the other side of that coin, and far outweighing it, is the fact that I've been able to use genre of Fantasy/Horror and express my opinion, talk a little about society, do a little bit of satire and that's been great, man. A lot of people don't have that platform.;George A. Romero;society
When I was a kid, I had two great guilty pleasures. One was horror movies and the other was martial arts movies.;M. Night Shyamalan;movies
Anybody who finds it easy to make money on the horses is probably in the dog food business.;Franklin P. Jones;food
I'm at the age now where just putting my cigar in its holder is a thrill.;George Burns;age
One thing that hasn't changed, though, is that we still have to hear the new ad 2 or 3 times before it begins to affect us, even when we're already familiar with the advertiser in question and have a positive opinion of them.;Roy H. Williams;positive
Freedom and responsibility aren't interconnected things. They are the same thing.;Harry Browne;freedom
I got a lot of things that society had promised would make me whole and fulfilled - all the things that the culture tells you from preschool on will quiet the throbbing anxiety inside you - stature, the respect of colleagues, maybe even a kind of low-grade fame.;Anne Lamott;society
Music is amazing. There's some metaphysical comfort where it allows you to be isolated and alone while telling you that you are not alone... truly, the only cure for sadness is to share it with someone else.;Wayne Coyne;alone
Baseball happens to be a game of cumulative tension but football, basketball and hockey are played with hand grenades and machine guns.;John Leonard;sports
When Religion and Royalty are swept away, the people will attack the great, and after the great, they will fall upon the rich.;Honore de Balzac;religion
The screen is a magic medium. It has such power that it can retain interest as it conveys emotions and moods that no other art form can hope to tackle.;Stanley Kubrick;hope
I love it, man I'm 23 years old and I'm lucky enough to write movies as a job! I just feel really blessed and can't believe it's happening.;Jonah Hill;movies
The will to succeed is important, but what's more important is the will to prepare.;Bobby Knight;motivational
I never quite toed the line. I was a bit disruptive. All my early school reports from the age of 5 were 'Daniel must learn not to distract others.' And now, that's what I do for a living.;Dan Stevens;age
I am optimistic that peace can be achieved in the region because I believe that every society on earth can be free and that if freedom comes to the Middle East, there can be peace.;Natan Sharansky;freedom
Perhaps the greatest social service that can be rendered by anybody to the country and to mankind is to bring up a family.;George Bernard Shaw;family
God is His own Design and End, and that there is no other Worthy of Him.;Mary Astell;design
Love has always been the most important business in my life, I should say the only one.;Stendhal;business
People who shop in health food stores never look healthy.;Amy Sedaris;food
I have seen doctors, in good faith, leave patients on steroids for years, thinking they are doing right. A friend of mine was on steroids for so long, she has severe osteoporosis.;Mary Ann Mobley;faith
Comedy is defiance. It's a snort of contempt in the face of fear and anxiety. And it's the laughter that allows hope to creep back on the inhale.;Will Durst;hope
Faith is to believe what you do not see the reward of this faith is to see what you believe.;Saint Augustine;faith
Waste your money and you're only out of money, but waste your time and you've lost a part of your life.;Michael LeBoeuf;money
It's not just the effect of technology on the environment, on religion, on the economic structure, on society, on politics, etc. It's that everything now exists in technology to the point where technology is the new and comprehensive host of nature of life.;Godfrey Reggio;religion
It is bad policy to regulate everything... where things may better regulate themselves and can be better promoted by private exertions but it is no less bad policy to let those things alone which can only be promoted by interfering social power.;Friedrich List;finance
I love the idea of marriage. I definitely want marriage and little Kellans running around.;Kellan Lutz;marriage
If you die you're completely happy and your soul somewhere lives on. I'm not afraid of dying. Total peace after death, becoming someone else is the best hope I've got.;Kurt Cobain;best
I don't need the money, dear. I work for art.;Maria Callas;work
Probably the happiest period in life most frequently is in middle age, when the eager passions of youth are cooled, and the infirmities of age not yet begun as we see that the shadows, which are at morning and evening so large, almost entirely disappear at midday.;Eleanor Roosevelt;morning
In marriage do thou be wise: prefer the person before money, virtue before beauty, the mind before the body then thou hast a wife, a friend, a companion, a second self.;William Penn;beauty
The first question at that time in poetry was simply the question of honesty, of sincerity.;George Oppen;poetry
For about ten years now, the struggle for democracy and the respect of human rights has been in the focus point - if not a commodity - of political groups aiming to rise to power.;Omar Bongo;respect
The second half of the '60s really was a kind of learning period, in terms of writing, for me.;Bruce Cockburn;learning
I really believe that's one of the many reasons that God had put me right in the middle of the Backstreet Boys. There are so many stars today that don't realize the impact they have on young people. Being a superstar is great, as long as you can be a positive role model.;Brian Littrell;positive
Well, for me the pro-life issue has been something I've been very passionate about since the '70s, and I have been very involved in the pro-life community since long before politics.;Mike Huckabee;politics
And I watch 'Saturday Night Live' religiously, I have since I was a little boy. I watch it basically like one of my favorite sports teams.;Ty Burrell;sports
Literature is the expression of a feeling of deprivation, a recourse against a sense of something missing. But the contrary is also true: language is what makes us human. It is a recourse against the meaningless noise and silence of nature and history.;Octavio Paz;history
If I test the car for a year I can be quite competitive the next season.;Valentino Rossi;car
It was a source of shame for my family that I was in rock and roll, which is so blue-collar. It just isn't done. And I felt it, too.;Liz Phair;family
I love going to Africa and stuff. I love going anywhere, really, but I've been to Africa a bunch of times and it's just a beautiful place that needs help, obviously, but helping people that are really thankful is really easy to do. And the people out there always seem so thankful.;Kris Allen;thankful
I took three years off. I differentiated myself from the industry. Found my identity - sort of... I haven't graduated yet. I'm not legitimately educated yet, but maybe one day.;Claire Danes;graduation
I think it's a mistake to treat different realms of knowledge as if they are some how fundamentally the same.;Jimmy Wales;knowledge
Hundreds of thousands of American servicemen and women are deployed across the world in the war on terror. By bringing hope to the oppressed, and delivering justice to the violent, they are making America more secure.;George W. Bush;hope
Friendship is held to be the severest test of character. It is easy, we think, to be loyal to a family and clan, whose blood is in your own veins.;Charles Alexander Eastman;friendship
Some women can be fooled all of the time, and all women can be fooled some of the time, but the same woman can't be fooled by the same man in the same way more than half of the time.;Helen Rowland;women
Men rise from one ambition to another: first, they seek to secure themselves against attack, and then they attack others.;Niccolo Machiavelli;men
That is the thankless position of the father in the family - the provider for all, and the enemy of all.;August Strindberg;dad
Before deciding to retire, stay home for a week and watch the daytime TV shows.;Bill Copeland;home
A bird doesn't sing because it has an answer, it sings because it has a song.;Lou Holtz;nature
When someone shows you who they are, believe them the first time.;Maya Angelou;time
Courage - a perfect sensibility of the measure of danger, and a mental willingness to endure it.;William Tecumseh Sherman;courage
There is no worse screen to block out the Spirit than confidence in our own intelligence.;John Calvin;intelligence
The first problem for all of us, men and women, is not to learn, but to unlearn.;Gloria Steinem;men
Texas women have an amazing sense of purpose when they lose it. They're the best girls in the world - they're loyal and fun, but when they get mad, they'll try to kill you.;John Cusack;best
I saw music as a way to entertain people and take them away from their daily lives and put smiles on their faces, as opposed to what I see it being now, which is a way for me to actually communicate, and a way for me to tap into my subconscious.;Alanis Morissette;music
Actresses can get outrageously precious about the way they look. That's not what life's about. If you starve yourself to the point where your brain cells shrivel, you will never do good work. And if you're overly conscious of your arms flapping in the wind, how can you look the other actor in the eye to respond to them?;Cate Blanchett;work
By the time the children go to bed, I am as drained as any mother who has spent her day working, car pooling, building Lego castles and shopping for the precisely correct soccer cleat.;Ayelet Waldman;car
Advertising must respect the intelligence of its audience and if it does not prompt them to think, it will be instantly dismissed.;Maurice Saatchi;respect
And so I think that if the person has the funds, the network, and the equipment to do this, and also the experience, which is the key factor, then they can be quite deadly.;John Abizaid;experience
I never make a trip to the United States without visiting a supermarket. To me they are more fascinating than any fashion salon.;Wallis Simpson;travel
Several studies, and a number of public statements by senior military and political personalities, testify that - except for disputes between the present nuclear states - all military conflicts, as well as threats to peace, can be dealt with using conventional weapons.;Joseph Rotblat;peace
I went to watch my father at Silverstone in the early 1950s, and I've still got the car he was in.;Nick Mason;car
As both a local resident and a parent with a CF-afflicted child, I'm thankful for companies like Canon, Chase and Outback who believe that giving back to the community is critical to their role as corporate citizens.;Boomer Esiason;thankful
Artists don't talk about art. Artists talk about work. If I have anything to say to young writers, it's stop thinking of writing as art. Think of it as work.;Paddy Chayefsky;art
We tend to mistake music for the physical object.;David Byrne;music
The secret of success is to be ready when your opportunity comes.;Benjamin Disraeli;success
It is impossible that anything so natural, so necessary, and so universal as death, should ever have been designed by providence as an evil to mankind.;Jonathan Swift;death
Viewed freely, the English language is the accretion and growth of every dialect, race, and range of time, and is both the free and compacted composition of all.;Walt Whitman;time
We got Martha Stewart legitimizing homemaking for her generation, and then there's this return to being interested in all things home, lifestyle, and food again. I think this generation is less about the frills and more about the flavor of things.;Nadia Giosia;food
Democracy is stronger than terrorism, and we will not cower to the terrorists' campaign of fear.;John Doolittle;fear
You can't be a great mum and work the whole time necessarily those two things aren't ideal. We have an awful lot to work on and to debate about in relation to our working lives, because it isn't working for a lot of people, particularly for a lot of women.;Emma Thompson;women
Success without honor is an unseasoned dish it will satisfy your hunger, but it won't taste good.;Joe Paterno;success
That's the key to success, isn't it? It has to be fun.;Monica Seles;success
I suggest that the introductory courses in science, at all levels from grade school through college, be radically revised. Leave the fundamentals, the so-called basics, aside for a while, and concentrate the attention of all students on the things that are not known.;Lewis Thomas;science
And what is liberty, whose very name makes the heart beat faster and shakes the world? Is it not the union of all liberties - liberty of conscience, of education, of association, of the press, of travel, or labor, or trade?;Frederic Bastiat;education
I always use my husband's cocoa butter stuff. He has amazing skin!;Idina Menzel;amazing
I'm the fourth generation to be in show business. It's pretty neat it's nice to have that family history.;Rachel Bilson;history
Any act often repeated soon forms a habit and habit allowed, steady gains in strength, At first it may be but as a spider's web, easily broken through, but if not resisted it soon binds us with chains of steel.;Tryon Edwards;strength
Man is the unnatural animal, the rebel child of nature, and more and more does he turn himself against the harsh and fitful hand that reared him.;H. G. Wells;nature
I'm not entirely sure what my end goal is, but I'd love to get involved in city politics and broadcast TV.;Holly Madison;politics
Beauty is now defined by your bones sticking out of your decolletage. For that to be the standard is really perilous for women.;Alanis Morissette;beauty
I take care of my flowers and my cats. And enjoy food. And that's living.;Ursula Andress;food
I don't think my principles change. I think the way in which you apply those principles to modern society changes.;William Hague;change
One of my earliest memories is of my father carrying me in one arm with a picket sign in the other.;Camryn Manheim;dad
Gray skies are just clouds passing over.;Frank Gifford;sports
You don't make peace with friends. You make it with very unsavory enemies.;Yitzhak Rabin;peace
Suspicion is the cancer of friendship.;Petrarch;friendship
The question remains: which brands will commit to creating a private sector pillar of social change, and which will become casualties of their own outdated thinking?;Simon Mainwaring;change
If the Holy Spirit can take over the subconscious with our consent and cooperation, then we have almighty Power working at the basis of our lives, then we can do anything we ought to do, go anywhere we ought to go, and be anything we ought to be.;E. Stanley Jones;power
Dreams are often most profound when they seem the most crazy.;Sigmund Freud;dreams
I respect knowledge of the psyche. I would be a therapist if I weren't an entertainer.;Jessica Simpson;knowledge
The world is mud-luscious and puddle-wonderful.;e. e. cummings;nature
Anxiety does not empty tomorrow of its sorrows, but only empties today of its strength.;Charles Spurgeon;strength
Poetry is not only dream and vision it is the skeleton architecture of our lives. It lays the foundations for a future of change, a bridge across our fears of what has never been before.;Audre Lorde;future
Sixth grade was a big time, in my childhood, of hoops and friendship, and coming up with funny things.;Adam Sandler;funny
Women have served all these centuries as looking glasses possessing the power of reflecting the figure of man at twice its natural size.;Virginia Woolf;women
The Declaration of Independence was always our vision of who we wanted to be, our ideal of freedom and justice, how we were going to be different, and what the American experiment was going to be about.;Marian Wright Edelman;freedom
