I try to read for pleasure whenever I can - it's a great way just to shut it off for a while so your brain doesn't get fried.;Hillary Clinton;great
So the major obstacle to the development of new supplies is not geology but what happens above ground: international affairs, politics, investment and technology.;Daniel Yergin;technology
I know, to banish anger altogether from one's breast is a difficult task. It cannot be achieved through pure personal effort. It can be done only by God's grace.;Mahatma Gandhi;god
Life everlasting in a state of happiness is the greatest desire of all men.;Joseph Franklin Rutherford;happiness
The Madden NFL franchise holds a special place in popular culture and the cover is a coveted position for players all over the league. I'm honored to be the first cover athlete chosen by Madden NFL fans and it's a great way to cap off an amazing year for the Saints and the city of New Orleans.;Drew Brees;amazing
In terms of romantic films, all-time romantic films, I really like 'Gone With the Wind.' And I realize I sound so cliched saying that, but there's something so absolutely romantic about it.;Freida Pinto;romantic
Dying is an art, like everything else. I do it exceptionally well. I do it so it feels like hell. I do it so it feels real. I guess you could say I've a call.;Sylvia Plath;art
I love a beautiful gown on stage, and luckily I've been fortunate to wear some amazing dresses.;Leona Lewis;amazing
In fact the experience at Oxford has really helped me later in life.;Imran Khan;experience
Obedience is the fruit of faith.;Christina Rossetti;faith
After a while in marriage, it doesn't work anymore. There is something missing, there is something wrong. There are few marriages that stay alive forever. We like something, and after a while, we hate what we used to love.;Monica Bellucci;marriage
I'm sure we, the American people, are the butt of jokes by those in power.;Alice Walker;power
Education is hanging around until you've caught on.;Robert Frost;education
Success is finding satisfaction in giving a little more than you take.;Christopher Reeve;success
Most children threaten at times to run away from home. This is the only thing that keeps some parents going.;Phyllis Diller;home
Illegal immigration costs taxpayers $45 billion a year in health care, education, and incarceration expenses.;Ric Keller;education
I hate newspapermen. They come into camp and pick up their camp rumors and print them as facts. I regard them as spies, which, in truth, they are.;William Tecumseh Sherman;truth
There is no greater glory than love, nor any great punishment than jealously.;Lope de Vega;jealousy
I try to give the media as many confusing images as I can to retain my freedom. What's real is for my children and the people I live with.;Sting;freedom
Whose rights will we acknowledge? Whose human dignity will we respect? For whose well-being will we, as a people, assume responsibility?;Robert Casey;respect
In addition, California spends nearly $1 billion a year in Medi-Cal services for an average of 780,000 illegal immigrants a month, over and above emergency health services.;Elton Gallegly;health
I never read the life of any important person without discovering that he knew more and could do more than I could ever hope to know or do in half a dozen lifetimes.;J. B. Priestley;hope
The question is, what are we to do in order to consolidate peace on a universal and durable foundation, and what are the essential elements of such a peace?;Arthur Henderson;peace
The past is a source of knowledge, and the future is a source of hope. Love of the past implies faith in the future.;Stephen Ambrose;faith
It takes a lot of work to put together a marriage, to put together a family and a home.;Elizabeth Edwards;family
Secrecy is the chastity of friendship.;Jeremy Taylor;friendship
So when I go home, sometimes, even when I had an amazing game, I always think about what I missed.;Thierry Henry;amazing
America believes in education: the average professor earns more money in a year than a professional athlete earns in a whole week.;Evan Esar;work
Part of making any endeavour is that each one has its own special problems. It's the nature of the process.;Martin Scorsese;nature
And the attitude of faith is the very opposite of clinging to belief, of holding on.;Alan Watts;attitude
I honestly think it is better to be a failure at something you love than to be a success at something you hate.;George Burns;love
My ultimate aim is to make euthanasia a positive experience.;Jack Kevorkian;positive
If God created us in his own image, we have more than reciprocated.;Voltaire;god
But I recognize no infallible authority, even in special questions consequently, whatever respect I may have for the honesty and the sincerity of such or such an individual, I have no absolute faith in any person.;Mikhail Bakunin;faith
See, that's why Barack's running: to end the war in Iraq responsibly - to build an economy that lifts every family, to make sure health care is available for every American - and to make sure that every child in this nation has a world-class education all the way from preschool to college.;Michelle Obama;family
Tears shed for self are tears of weakness, but tears shed for others are a sign of strength.;Billy Graham;strength
The secret is not to give up hope. It's very hard not to because if you're really doing something worthwhile I think you will be pushed to the brink of hopelessness before you come through the other side.;George Lucas;hope
Women are so unforgiving of themselves. We don't recognize our own beauty because we're too busy comparing ourselves to other people.;Kelly Osbourne;women
If my career continues along its current arc, people will probably look at me and see a writer who is obsessed with the relationship between rich and poor and with how the rich somehow or other always manage to betray the poor, even when they don't mean to.;Richard Russo;relationship
Climb the mountains and get their good tidings.;John Muir;wisdom
I respect a woman too much to marry her.;Sylvester Stallone;respect
I think that the biggest beauty essential is as simple as a good, full night's sleep.;Angela Kinsey;beauty
The desire of excessive power caused the angels to fall the desire of knowledge caused men to fall.;Francis Bacon;power
First let me report that the art in the Barnes Collection has never looked better. My trips to the old Barnes were always amazing, but except on the sunniest days, you could barely see the art. The building always felt pushed beyond its capacity.;Jerry Saltz;art
Instead of giving a politician the keys to the city, it might be better to change the locks.;Doug Larson;change
Much of the debate over global warming is predicated on fear, rather than science.;James Inhofe;environmental
He plants trees to benefit another generation.;Caecilius Statius;gardening
The quality of your work, in the long run, is the deciding factor on how much your services are valued by the world.;Orison Swett Marden;work
Men make angry music and it's called rock-and-roll women include anger in their vocabulary and suddenly they're angry and militant.;Ani DiFranco;music
It has yet to be proven that intelligence has any survival value.;Arthur C. Clarke;intelligence
The press attack people to sell more papers without thinking, but when you get famous you have to put up with this kind of stuff.;Roberto Cavalli;famous
I have always said I will be in politics to serve as best as I can and it will take me wherever it will take me.;George Papandreou;politics
I believe in luck: how else can you explain the success of those you dislike?;Jean Cocteau;success
If I have to lay an egg for my country, I'll do it.;Bob Hope;funny
I don't want any yes-men around me. I want everybody to tell me the truth even if it costs them their job.;Samuel Goldwyn;truth
In Genesis, it says that it is not good for a man to be alone but sometimes it is a great relief.;John Barrymore;great
All those vitamins aren't to keep death at bay, they're to keep deterioration at bay.;Jeanne Moreau;death
Only trust thyself, and another shall not betray thee.;William Penn;trust
The only thing I believe is this: A player does not have to like a manager and he does not have to respect a manager. All he has to do is obey the rules.;Sparky Anderson;respect
Faith crosses every border and touches every heart in every nation.;George W. Bush;faith
We were told this war would be over in a matter of weeks, and that the Iraqis would be able to finance it with oil sales. We were promised it was not a mission of nation building.;Sherrod Brown;finance
There are three ingredients in the good life: learning, earning and yearning.;Christopher Morley;good
It is amazing that people who think we cannot afford to pay for doctors, hospitals, and medication somehow think that we can afford to pay for doctors, hospitals, medication and a government bureaucracy to administer it.;Thomas Sowell;government
An Atheist believes that a hospital should be built instead of a church. An atheist believes that deed must be done instead of prayer said. An atheist strives for involvement in life and not escape into death. He wants disease conquered, poverty vanished, war eliminated.;Madalyn Murray O'Hair;life
I studied Japanese language and culture in college and graduate school, and afterward went to work in Tokyo, where I met a young man whose father was a famous businessman and whose mother was a geisha.;Arthur Golden;famous
I'd like to have a family.;Maria Sharapova;family
When one may pay out over two million dollars to presidential and Congressional campaigns, the U.S. government is virtually up for sale.;John W. Gardner;politics
And my first film was Carnal Knowledge, another amazing experience, largely because of Mike Nichols, who would tell me you can't do anything wrong because you're doing everything right.;Carol Kane;knowledge
People who know me know I have a sense of humor that can really push the envelope.;Carmen Electra;humor
Music should strike fire from the heart of man, and bring tears form the eyes of woman.;Ludwig van Beethoven;music
Good nature is worth more than knowledge, more than money, more than honor, to the persons who possess it.;Henry Ward Beecher;knowledge
In many ways, it was much, much harder to get the first book contract. The hardest thing probably overall has been learning not to trust people, publicists and so forth, implicitly.;Neil Gaiman;learning
We busted a lot of family secrets with this. But to make a long story short, my parents relationship was built heavily on security issues for my Mom, and when my Dad couldn't provide security, the relationship unraveled.;Kenny Loggins;dad
We can't help everyone, but everyone can help someone.;Ronald Reagan;inspirational
If I've got food and water, as long as I can exercise my mind and keep it nimble, then I'll be okay.;Rob Walton;food
Those who have no record of what their forebears have accomplished lose the inspiration which comes from the teaching of biography and history.;Carter G. Woodson;teacher
I'm not afraid of storms, for I'm learning to sail my ship.;Aeschylus;learning
Historic changes and challenges. Breakthroughs in human knowledge and opportunity. And yet, for vast numbers across the globe, the daily realities have not altered.;Abdallah II;knowledge
Some people are born on third base and go through life thinking they hit a triple.;Barry Switzer;sports
The American Dream is still alive out there, and hard work will get you there. You don't necessarily need to have an Ivy League education or to have millions of dollars startup money. It can be done with an idea, hard work and determination.;Bill Rancic;education
The deeper the experience of an absence of meaning - in other words, of absurdity - the more energetically meaning is sought.;Vaclav Havel;experience
When you say things like, 'We have to wipe out the Taliban,' what does that mean? The Taliban is not a fixed number of people. The Taliban is an ideology that has sprung out of a history that, you know, America created anyway.;Arundhati Roy;history
A stockbroker urged me to buy a stock that would triple its value every year. I told him, 'At my age, I don't even buy green bananas.';Claude Pepper;funny
Conscience is the root of all true courage if a man would be brave let him obey his conscience.;James Freeman Clarke;courage
The test of our progress is not whether we add more to the abundance of those who have much it is whether we provide enough for those who have little.;Franklin D. Roosevelt;history
The Rooneys are very classy. They're very deliberate with their decision-making. Once you're part of that family, Steeler nation, they treat you with respect. You don't have a lot of rambunctious players running around.;Tony Dorsett;family
The accumulation of numbers always augments in some measure moral corruptions, and the consequences to health of the various vices incident thereto, are well known.;William Falconer;health
First love is a kind of vaccination which saves a man from catching the complaint the second time.;Honore de Balzac;time
Participate joyfully in the sorrows of the world. We cannot cure the world of sorrows, but we can choose to live in joy.;Joseph Campbell;sad
Evil, when we are in its power, is not felt as evil, but as a necessity, even a duty.;Simone Weil;power
Learning how to be still, to really be still and let life happen - that stillness becomes a radiance.;Morgan Freeman;learning
So I can't show you how, exactly, health care is a basic human right. But what I can argue is that no one should have to die of a disease that is treatable.;Paul Farmer;health
The essential function of art is moral. But a passionate, implicit morality, not didactic. A morality which changes the blood, rather than the mind.;David Herbert Lawrence;art
You have to think anyway, so why not think big?;Donald Trump;leadership
Happiness is a byproduct of function, purpose, and conflict those who seek happiness for itself seek victory without war.;William S. Burroughs;happiness
As a mom, I know it is my responsibility, and no one else's, to raise my kids. But we have to ask ourselves, what does it mean when so many parents are finding their best efforts undermined by an avalanche of advertisements aimed at our kids.;Michelle Obama;mom
A whopping 89 percent of buyers start their home search online. How your house looks online is the modern equivalent of 'curb appeal.' Rent a wide-angle lens and good lighting, get rid of your clutter and post at least eight great photos to win the beauty contest.;Barbara Corcoran;good
The business of the advertiser is to see that we go about our business with some magic spell or tune or slogan throbbing quietly in the background of our minds.;Marshall McLuhan;business
Freedom is an internal achievement rather than an external adjustment.;Powell Clayton;freedom
Thoughts have power thoughts are energy. And you can make your world or break it by your own thinking.;Susan Taylor;power
It is a blessed thing that in every age some one has had the individuality enough and courage enough to stand by his own convictions.;Robert Green Ingersoll;courage
When I started dating I had this kind of Romeo and Juliet, fateful romantic idea about love which was almost that you were a victim and there was a lot of pain involved and that was how it should be.;Emma Watson;romantic
Success is peace of mind which is a direct result of self-satisfaction in knowing you did your best to become the best you are capable of becoming.;John Wooden;peace
Sometimes it takes ten seconds to see some humor in your dilemmas, sometimes ten years.;Allen Klein;humor
The game in beauty is changing so much, if your product isn't high tech or can't make a unique performance claim - plump your lips, reduce your lines, look glossy, and stay on for 24 hours - you can't go to market today. I'm not just talking about a $20 lipstick, but a $5 lipstick!;Andrea Jung;beauty
Everybody gets so much information all day long that they lose their common sense.;Gertrude Stein;technology
All of us in society are supposed to believe that cruelty to animals is wrong and that it is a good thing to prevent needless suffering. So if that is true, how can meat be acceptable under any but the most extraordinary circumstances, such as perhaps roasting the bird who died flying into a window?;Ingrid Newkirk;society
Whatever my individual desires were to be free, I was not alone. There were many others who felt the same way.;Rosa Parks;alone
Eternal principles that govern happiness apply equally to all.;Russell M. Nelson;happiness
We need men with moral courage to speak and write their real thoughts, and to stand by their convictions, even to the very death.;Robert Green Ingersoll;courage
Work is a prayer. And I start off every morning dedicating it to our Creator.;Joseph Murray;morning
America is a model of force and freedom and moderation - with all the coarseness and rudeness of its people.;Lord Byron;freedom
Religion is not merely the opium of the masses, it's the cyanide.;Tom Robbins;religion
God created the world the laws of nature were created by God. True science tries to find out what God put in the world. The trouble is where scientists speculate about theology and they don't know what they're talking about because they weren't there. They can't speculate about the origins of life because they weren't there.;Pat Robertson;nature
It is necessary for me to establish a winner image. Therefore, I have to beat somebody.;Richard M. Nixon;history
It's all about quality of life and finding a happy balance between work and friends and family.;Philip Green;life
There is the expression of selfishness and there is the expression of selflessness - but economists or theoreticians never touched that part. They said: 'Go and become a philanthropist.' I said, 'No, I can do that in the business world, create a different kind of business - a business based on selflessness.';Muhammad Yunus;business
I mean, I went to a Catholic boys' school for a year, but that was to play hockey. Religion class was quite contentious for me.;Keanu Reeves;religion
The one thing I would hope would go on my tombstone is, 'I made my parents proud.';Roger Goodell;hope
In the kingdom of consumption the citizen is king. A democratic monarchy: equality before consumption, fraternity in consumption, and freedom through consumption.;Raoul Vaneigem;equality
In nature there are neither rewards nor punishments there are consequences.;Robert Green Ingersoll;nature
What is uttered from the heart alone, Will win the hearts of others to your own.;Johann Wolfgang von Goethe;alone
I don't get a sense of American pride. I just get a sense that everyone is here, battling the same thing - that around the world everybody's after the same thing, just some minor piece of happiness each day.;Paul Thomas Anderson;happiness
I am not against all forms of high-tech medicine. Drugs and surgeries have a secure place in the treatment of serious health conditions. But modern American medicine treats almost every health condition as if it were an emergency.;Andrew Weil;health
People who own property feel a sense of ownership in their future and their society. They study, save, work, strive and vote. And people trapped in a culture of tenancy do not.;Henry Louis Gates;society
Above all, we must realize that no arsenal, or no weapon in the arsenals of the world, is so formidable as the will and moral courage of free men and women. It is a weapon our adversaries in today's world do not have.;Ronald Reagan;women
If you want to change the way your banking system is regulated, if you want to learn the mistakes of what's gone wrong, then you have to change your government.;George Osborne;change
It is an accepted commonplace in psychology that the spiritual level of people acting as a crowd is far lower than the mean of each individual's intelligence or morality.;Christian Lous Lange;intelligence
In the 1960s we were fighting to be recognized as equals in the marketplace, in marriage, in education and on the playing field. It was a very exciting, rebellious time.;Marlo Thomas;marriage
The basis of computer work is predicated on the idea that only the brain makes decisions and only the index finger does the work.;Brian Eno;work
Republicans use think tanks to come up with a lot of their messages. The think tanks are the single worst, most undisciplined example of communication I've ever seen.;Frank Luntz;communication
I'm a geeky toy collector, and to have toys of your own characters is unbelievably cool.;Craig McCracken;cool
The call of death is a call of love. Death can be sweet if we answer it in the affirmative, if we accept it as one of the great eternal forms of life and transformation.;Hermann Hesse;death
War is the statesman's game, the priest's delight, the lawyer's jest, the hired assassin's trade.;Percy Bysshe Shelley;war
Whatever I will become will be what God has chosen for me.;Elvis Presley;god
If you like small government you need to work hard at having a strong national defense that is not so militant. Personal liberty is the purpose of government, to protect liberty - not to run your personal life, not to run the economy, and not to pretend that we can tell the world how they ought to live.;Ron Paul;life
It is, I claim, nonsense to say that it does not matter which individual man acted as the nucleus for the change. It is precisely this that makes history unpredictable into the future.;Gregory Bateson;future
If you can dream it, you can do it.;Walt Disney;motivational
No one has a right to consume happiness without producing it.;Helen Keller;happiness
I was from such a large family that when I first met my wife, I told her: 'You can go work outside of the house and I'll stay home and continue making my cartoon strips. Maybe I'll make some commercials nearby, you know I'll do anything locally, but I would love to just stay at home and raise the kids like I did when I was growing up.';Robert Rodriguez;home
Those Dutchmen had hardly any imagination or fantasy, but their good taste and their scientific knowledge of composition were enormous.;Vincent Van Gogh;knowledge
We live in a society obsessed with public opinion. But leadership has never been about popularity.;Marco Rubio;leadership
Parenthood and family come first for me, and when I'm not working I'm cool with the Teletubbies.;Clive Owen;cool
Most Italians who came to this country are very patriotic. There was this exciting possibility that if you worked real hard, and you loved something, you could become successful.;Francis Ford Coppola;patriotism
Men love to wonder, and that is the seed of science.;Ralph Waldo Emerson;love
A corporation's primary goal is to make money. Government's primary role is to take a big chunk of that money and give it to others.;Larry Ellison;government
Also, when you escape a Communist regime, you treasure liberty and you understand that as government and state expand, liberty must contract.;Dennis Prager;government
She got the magazine on a Wednesday morning, and on Thursday announced our marriage was over.;David Gest;morning
Reading a script is usually as exciting as reading a boilerplate legal document, so when you read one that makes you feel as if you're seeing the movie, you know it's something different.;Tom Hanks;legal
No power of government ought to be employed in the endeavor to establish any system or article of belief on the subject of religion.;Jeremy Bentham;religion
We cannot remember too often that when we observe nature, and especially the ordering of nature, it is always ourselves alone we are observing.;Georg C. Lichtenberg;alone
My mom had gotten a Super 8 camera to make home movies with, and my brother and me got our hands on it and ran with it.;Lev Yilmaz;mom
Our learning ought to be our lives' amendment, and the fruits of our private study ought to appear in our public behavior.;Thomas Nashe;learning
Don't try to be like Jackie. There is only one Jackie. Study computers instead.;Jackie Chan;computers
I always looked really young for my age. And once I hit 23, 24 and 25, I was then allowed to play the cool 18-year-olds and stuff.;Ben Barnes;age
The danger is not that a particular class is unfit to govern: every class is unfit to govern.;Lord Acton;government
I think the issue is that Americans traveling abroad if gotten into legal problems should have access to a fair trial and an impartial tribunal.;Maria Cantwell;legal
It is not power that corrupts but fear. Fear of losing power corrupts those who wield it and fear of the scourge of power corrupts those who are subject to it.;Aung San Suu Kyi;fear
As a microbiologist, I am particularly concerned with Mr. Bush's blatant disregard for science.;Louise Slaughter;science
Gestures, in love, are incomparably more attractive, effective and valuable than words.;Francois Rabelais;love
The beauty of having short hair is that I actually can wash and style it at home!;Meagan Good;beauty
You cannot reform your society or institution without opening your mind.;Bashar al-Assad;society
You leave old habits behind by starting out with the thought, 'I release the need for this in my life'.;Wayne Dyer;life
I think having a vision can make someone an influential man. I'm not talking about acting or anything like that, I'm talking about people I admire, whether it's a writer or a musician or a sports figure or a politician, whatever.;Benicio Del Toro;sports
Even if society dictates that men and women should behave in certain ways, it is fathers and mothers who teach those ways to children not just in the words they say, but in the lives they lead.;Augustus Y. Napier;society
Man has two great spiritual needs. One is for forgiveness. The other is for goodness.;Billy Graham;forgiveness
It is not love that should be depicted as blind, but self-love.;Voltaire;love
