As the most extravagant errors were received among the established articles of their faith, so the most infamous vices obtained in their practice, and were indulged not only with impunity, but authorized by the sanction of their laws.;David Brainerd;faith
It would be too frightening for me to consider myself a role model. But I like the idea of not being afraid of letting your imagination rule you, to feel the freedom of expression, to let creativity be your overwhelming drive rather than other things.;Florence Welch;imagination
Segregation has no place in the education system.;Richard Dawkins;education
You know, I had my mother and my father convincing me that he would be going back to Hollywood and he'd be back with the actresses and dating them and that he wasn't serious about me at all. So I had him saying one thing to me and my parents telling me something else.;Priscilla Presley;dating
The World is a book, and those who do not travel read only a page.;Saint Augustine;travel
True knowledge exists in knowing that you know nothing.;Socrates;wisdom
The present is a point just passed.;David Russell;time
The purposes of the United States should not be doubted. The Security Council resolutions will be enforced - the just demands of peace and security will be met - or action will be unavoidable. And a regime that has lost its legitimacy will also lose its power.;Colin Powell;peace
Computer technology is so built into our lives that it's part of the surround of every artist.;Steven Levy;technology
Bureaucracy gives birth to itself and then expects maternity benefits.;Dale Dauten;government
It was difficult being a teacher and out of the closet in the '50s. By the time I retired, the English department was proud of having a gay poet of a certain minor fame. It was a very satisfactory change!;Thom Gunn;teacher
My father... had sharper eyes than the rest of our people.;Chief Joseph;dad
Don't let people disrespect you. My mom says don't open the door to the devil. Surround yourself with positive people.;Cuba Gooding, Jr.;mom
If the money's right, I'll do a film.;Oliver Reed;money
For a small child there is no division between playing and learning between the things he or she does just for fun and things that are educational. The child learns while living and any part of living that is enjoyable is also play.;Penelope Leach;learning
Next to a circus there ain't nothing that packs up and tears out faster than the Christmas spirit.;Kin Hubbard;christmas
Nature is the art of God.;Dante Alighieri;nature
Jealousy lives upon doubts. It becomes madness or ceases entirely as soon as we pass from doubt to certainty.;Francois de La Rochefoucauld;jealousy
Doing 'White Collar,' quite often my character goes undercover, so therein lies the compounding of the imagination. I get to play Peter Burke and then someone else when Peter Burke goes undercover.;Tim DeKay;imagination
Lawsuit abuse is a major contributor to the increased costs of healthcare, goods and services to consumers.;Charles W. Pickering;legal
Poor Georgia O'Keeffe. Death didn't soften the opinions of the art world toward her paintings.;Jerry Saltz;death
I want anyone who believes in life, liberty, pursuit of happiness to succeed. And I want any force, any person, any element of an overarching Big Government that would stop your success, I want that organization, that element or that person to fail. I want you to succeed.;Rush Limbaugh;government
My mom was scared of the old Times Square so I was never allowed to go. Now I'm scared of the new Times Square, so I still never go.;Padma Lakshmi;mom
Heights by great men reached and kept were not obtained by sudden flight but, while their companions slept, they were toiling upward in the night.;Henry Wadsworth Longfellow;men
At a formal dinner party, the person nearest death should always be seated closest to the bathroom.;George Carlin;death
The way people in democracies think of the government as something different from themselves is a real handicap. And, of course, sometimes the government confirms their opinion.;Lewis Mumford;government
What is truth? said jesting Pilate and would not stay for an answer.;Francis Bacon;truth
It is not power that corrupts but fear. Fear of losing power corrupts those who wield it and fear of the scourge of power corrupts those who are subject to it.;Aung San Suu Kyi;power
I want to see as many movies as I can and I covet a lot of weird influential movies.;Kat Dennings;movies
Well, darkness with humor... I'm not an extremely suicidal or sad person.;Peter Steele;humor
When we, through our educational culture, through the media, through the entertainment culture, give our children the impression that human beings cannot control their passions, we are telling them, in effect, that human beings cannot be trusted with freedom.;Alan Keyes;freedom
I trust Winsor and Newton and I paint directly upon it.;Edward Hopper;trust
At the end of the day I have always seen the end of my relationships as a personal failure. There is nothing ever pretty in saying goodbye.;Elisabetta Canalis;failure
These are tough times and under this Tory-led government many people in Manchester are suffering and getting left behind. If elected I will use all my energy, skills, experience and knowledge to stand up for our communities and get things done for the better.;Lucy Powell;experience
The revolution is a dictatorship of the exploited against the exploiters.;Fidel Castro;politics
When people get married because they think it's a long-time love affair, they'll be divorced very soon, because all love affairs end in disappointment. But marriage is a recognition of a spiritual identity.;Joseph Campbell;marriage
We have three cats. It's like having children, but there is no tuition involved.;Ron Reagan;pet
Even philosophers will praise war as ennobling mankind, forgetting the Greek who said: 'War is bad in that it begets more evil than it kills.';Immanuel Kant;war
You'd think that in this age, especially in the 21st century - especially with all the technology and all the discoveries that we've made - that we would figure out how to tackle abuse.;Tori Amos;technology
Piecemeal social engineering resembles physical engineering in regarding the ends as beyond the province of technology.;Karl Popper;technology
I spend so much time with my parents. My mom and I were joined at the hip for five years. There was not one moment when I wasn't with her.;Kay Panabaker;mom
I was trying to break out of the suburbs, and when I did break out, I don't think I took my whole self with me - I think I played a role of being too cool and hip.;Liz Phair;cool
Suddenly a single shot on the extreme left rang out on the clear morning air, followed quickly by several others, and the whole line pushed rapidly forward through the brush.;John Gibbon;morning
Sometimes in the morning, when it's a good surf, I go out there, and I don't feel like it's a bad world.;Kary Mullis;morning
What the world needs is a small, compact, flexible fusion technology that could make electricity where and when it is needed. The existing fusion program is leading to a huge source of centralized power, at a price that nobody except a government can afford.;Freeman Dyson;technology
Poetry should be able to reach everybody, and it should be able to appeal to all levels of understanding.;Peter Davison;poetry
I got married at 22 and remained in an abusive marriage for 10 years. I made up my mind that that was never going to happen to me again. I made a brave step to walk out in a society when you didn't walk out of an abusive marriage. It was mental and physical abuse.;Joyce Banda;marriage
Keep your dreams alive. Understand to achieve anything requires faith and belief in yourself, vision, hard work, determination, and dedication. Remember all things are possible for those who believe.;Gail Devers;work
Courage in danger is half the battle.;Plautus;courage
Common sense is the measure of the possible it is composed of experience and prevision it is calculation applied to life.;Henri Frederic Amiel;experience
For time and the world do not stand still. Change is the law of life. And those who look only to the past or the present are certain to miss the future.;John F. Kennedy;future
I've been trying to learn how to not be so conflicted about things like my own anger. I've always had a place in my music for my anger as a way of compensating for not having a mechanism to express it in my everyday life. So I've been trying to be more true to myself, and that helps me to chill out a little bit. But politically, uh-uh. No.;Ani DiFranco;music
They got married, they got divorced, and half their money goes out the window.;Suze Orman;money
To know God better is only to realize how impossible it is that we should ever know him at all. I know not which is more childish to deny him, or define him.;Samuel Butler;god
They are representations of many shared hours of collaboration between us all. That's the real nature of the relationship the orchestra and I are trying to build.;Michael Tilson Thomas;relationship
For decades, parents were told by so-called parenting 'experts' that offspring would be best raised on the belief each is special and entitled to all life has to offer.;Bob Barr;parenting
The marvel of all history is the patience with which men and women submit to burdens unnecessarily laid upon them by their governments.;George Washington;government
Every artist dips his brush in his own soul, and paints his own nature into his pictures.;Henry Ward Beecher;nature
When women are encouraged to be competitive, too many of them become disagreeable.;Benjamin Spock;women
We will always make sure player health and safety is our No. 1 priority in the NFL.;Roger Goodell;health
If science fiction is the mythology of modern technology, then its myth is tragic.;Ursula K. Le Guin;science
People can be more forgiving than you can imagine. But you have to forgive yourself. Let go of what's bitter and move on.;Bill Cosby;forgiveness
The first time I rode a bike I was four or five. I crashed into the back of a car.;David Millar;car
I don't mind saying, you know, that I don't take a salary from the church, and God has blessed me with more money than I could imagine from my books.;Joel Osteen;money
Basically, fundamentalism is a modern phenomenon. In the same way that Hitler evoked a mythological religion of German purity and the glory of the past, the Islamists use religion to evoke emotions and passions in people who have been oppressed for a long time in order to reach their purpose.;Azar Nafisi;religion
I was born on a farm. My strength has nothing to do with political apparatus. I get my strength from nature, from flowers.;Ariel Sharon;strength
In my experience, it's all wonderful with girls until about 16. Around that time, boys kind of calm down and start focusing their testosterone. Girls get a little challenging, especially for fathers.;Tim Allen;experience
Public office is supposed to be a public trust. This is a clear sign of the rampant corruption at the highest levels of the Republican leadership.;Bob Etheridge;trust
There's something so romantic about being broke in New York. You gotta do it. You have to live there once without any money, and then you have to live there when you have money. Let me tell you, of the two, the latter is far better.;Amy Poehler;romantic
It's cool to have instruments lying around because they give you different ideas.;Ezra Koenig;cool
There will always be a place for us somewhere, somehow, as long as we see to it that working people fight for everything they have, everything they hope to get, for dignity, equality, democracy, to oppose war and to bring to the world a better life.;Harry Bridges;equality
I will continue to work as hard as I can to make this organization proud. Every time I step on the field I will give everything I have and I will leave everything I have on the field every single Sunday.;Tim Tebow;work
The foolish and the dead alone never change their opinions.;James Russell Lowell;change
That's what I like about film-it can be bizarre, classic, normal, romantic. Cinema is to me the most versatile thing.;Catherine Deneuve;romantic
The lawyer's truth is not Truth, but consistency or a consistent expediency.;Henry David Thoreau;truth
As I've grown - dare I say it - older, I had hopes of indulging my dreams of being a sailor.;Jimmy Webb;dreams
Don't be afraid to give up the good to go for the great.;John D. Rockefeller;good
In the last analysis, it is our conception of death which decides our answers to all the questions that life puts to us.;Dag Hammarskjold;death
Faith is deliberate confidence in the character of God whose ways you may not understand at the time.;Oswald Chambers;faith
Republicans have nothing but bad ideas and Democrats have no ideas.;Lewis Black;politics
Something happens to us all when we experience something as a unit that doesn't occur when we're on our couches or holding our little portable DVD players.;David Ogden Stiers;experience
Those who have experienced the most, have suffered so much that they have ceased to hate. Hate is more for those with a slightly guilty conscience, and who by chewing on old hate in times of peace wish to demonstrate how great they were during the war.;Thor Heyerdahl;war
To me, the greatest pleasure of writing is not what it's about, but the inner music that words make.;Truman Capote;music
Four hours of prosthetics every morning, the jowls and the nose, and it was very hot so they're having to attend to it all day, and you're still petrified of so many things, such as, can I speak properly? Hitchcock never quite lost those East End vowels, even though he had the softened California consonants.;Toby Jones;morning
If you do not wish a man to do a thing, you had better get him to talk about it for the more men talk, the more likely they are to do nothing else.;Thomas Carlyle;men
Judi Dench and Ian McKellen taught me how to work hard and respect the theatre.;Francesca Annis;respect
Unless action is taken soon - unless we can display the same vision of that earlier period - we will lose the treasure of California's open space and environmental beauty.;Adam Schiff;beauty
I'm so single. It's funny. I'm usually a relationship girl. I love being in love and having a partner in crime. But it's good to be your own partner in crime. God, that makes me sound like I have multiple-personality disorder.;Brittany Snow;funny
We didn't have a TV in the living room and all my friends thought we were kind of weird. When they'd come over, my mom wanted to talk to them about current events.;Eliza Dushku;mom
A man who dares to waste one hour of time has not discovered the value of life.;Charles Darwin;time
Do not fear mistakes. You will know failure. Continue to reach out.;Benjamin Franklin;failure
When work is a pleasure, life is a joy! When work is a duty, life is slavery.;Maxim Gorky;work
We're a diverse society, and I think the TV is doing a great job in showing that we're all human beings, that we can all get along, that we can all be together, and I think that's a marvelous thing.;Billy Graham;great
It's been a joy to be a part of other people's journey, to be able to inspire and be a part of new singers coming up in this business.;Christina Aguilera;business
I am concerned about how to reverse the process by which a fundamentalist right and a corporate elite were able to seize power in the United States.;Todd Gitlin;power
I dare say there may be some men and women in the Armed Forces who are so decent that they would say: Give the Iraqi people money, we do not want to be paid back. That is the strength of our country.;Lindsey Graham;strength
There is no love without forgiveness, and there is no forgiveness without love.;Bryant H. McGill;love
Men may yearn for peace, cry for peace, and work for peace, but there will be no peace until they follow the path pointed out by the Living Christ. He is the true light of men's lives.;David O. McKay;peace
I have found that if you love life, life will love you back.;Arthur Rubinstein;life
Family life is too intimate to be preserved by the spirit of justice. It can be sustained by a spirit of love which goes beyond justice.;Reinhold Niebuhr;family
We don't have any CGI with any of the car stuff. I think it's a real experience when you see this car going through really fast really wild and you see me driving a lot of the times and also a big chase in downtown Atlanta. It's just incredible.;Sean William Scott;car
I do think I feel it but you don't think you are cause at a certain time you are no age but you don't think you are anything. You feel the life you have lived. I feel that. It's been a long fifty years.;Bob Geldof;age
Unfortunately, 'chick flick' has become a term to describe most movies that I don't even like. They're these movies that, yes, have women in them but they really don't reflect who women are, and there's something kind of silly or shallow or gossipy about them.;Carla Gugino;movies
A resilient people cherishing liberty and equality and the rule of law will endure.;Nick Rahall;equality
The will is a beast of burden. If God mounts it, it wishes and goes as God wills if Satan mounts it, it wishes and goes as Satan wills Nor can it choose its rider... the riders contend for its possession.;Martin Luther;god
I loved the world of imagination.;R. A. Salvatore;imagination
The British nation is unique in this respect. They are the only people who like to be told how bad things are, who like to be told the worst.;Winston Churchill;respect
Bereavement is the sharpest challenge to our trust in God if faith can overcome this, there is no mountain which it cannot remove.;Dean Inge;faith
Men judge us by the success of our efforts. God looks at the efforts themselves.;Charlotte Bronte;god
Some of us can be examples about going ahead and growing, and some of us, unfortunately, don't make it there, and end up being examples because they had to die. I hit rock bottom, but thank God my bottom wasn't death.;Stevie Ray Vaughan;god
The best revenge is to live on and prove yourself.;Eddie Vedder;best
I think the amazing thing about gospel music is that not only does it lift up the death and resurrection of our Lord, which is consistent with the Gospel, but it is uniquely communicated depending upon the generation.;T. D. Jakes;amazing
Whatever women do, they must do twice as well as men to be half as good. Luckily, this is not difficult.;Charlotte Whitton;men
Dictionaries are like watches, the worst is better than none and the best cannot be expected to go quite true.;Samuel Johnson;best
There have been nine Super Bowls in New Orleans, and not all of them have brought the best of luck to NFL Films. We got robbed twice there, got food poisoning, and my hotel room was broken into on the day the Bears played the Patriots in January 1986.;Steve Sabol;food
The art of war is simple enough. Find out where your enemy is. Get at him as soon as you can. Strike him as hard as you can, and keep moving on.;Ulysses S. Grant;art
I lost my dad way too early and it was agonisingly awful. I missed him so much and I hated knowing that I could never again pick up the phone to tell him about my day.;Monica Seles;dad
I have a 16 year-old son, so I'm now a soccer mom. I stand on the sidelines and I hear the things parents are saying, so I want them to understand what it is their kids are feeling in any sports environment.;Brandi Chastain;sports
The plain man is familiar with blindness and deafness, and knows from his everyday experience that the look of things is influenced by his senses but it never occurs to him to regard the whole world as the creation of his senses.;Ernst Mach;experience
Art is good, bad, boring, ugly, useful to us or not.;Jerry Saltz;art
Old age, believe me, is a good and pleasant thing. It is true you are gently shouldered off the stage, but then you are given such a comfortable front stall as spectator.;Confucius;good
It is only when men begin to worship that they begin to grow.;Calvin Coolidge;religion
Brevity is the best recommendation of speech, whether in a senator or an orator.;Marcus Tullius Cicero;best
For 'So Cold the River,' I'm actually working on adapting the book with Scott Silver, who was just nominated for an Oscar for 'The Fighter,' and who also wrote '8 Mile,' which I think is a terrific screenplay. The chance to work with Scott is a tremendous pleasure and I'm learning a lot.;Michael Koryta;learning
See, I don't really go after girls. Most of the girlfriends I've had have come after me. So it's really funny when girls get offended because I don't hit on them.;Kellan Lutz;funny
Having a child is surely the most beautifully irrational act that two people in love can commit.;Bill Cosby;love
I don't think of myself as hot or cool or anything, just a dork.;Ashley Olsen;cool
I grew up in an abusive home and was told on a daily basis by my father that I would never amount to anything and that I looked like a boy.;Janice Dickinson;home
There are certain people that are marked for death. I have my little list of those that treated me unfairly.;Jennifer Lopez;death
When you travel, remember that a foreign country is not designed to make you comfortable. It is designed to make its own people comfortable.;Clifton Paul Fadiman;travel
He's a man of great common sense and good taste - meaning thereby a man without originality or moral courage.;George Bernard Shaw;good
We give advice, but we cannot give the wisdom to profit by it.;Francois de La Rochefoucauld;wisdom
When you have vision it affects your attitude. Your attitude is optimistic rather than pessimistic.;Charles R. Swindoll;attitude
I've always thought my soundtracks do pretty good, because they're basically professional equivalents of a mix tape I'd make for you at home.;Quentin Tarantino;home
Taking a new step, uttering a new word, is what people fear most.;Benjamin Disraeli;fear
I am not one who was born in the custody of wisdom I am one who is fond of olden times and intense in quest of the sacred knowing of the ancients.;Gustave Courbet;wisdom
I do not agree with what you have to say, but I'll defend to the death your right to say it.;Voltaire;death
My next project is to get back to that. Actually, to learn how to write poetry. I'm not kidding.;Harry Mathews;poetry
You can't blame gravity for falling in love.;Albert Einstein;love
You really have to be a morning person if you want to be a teacher.;Alanna Ubach;teacher
As time goes by, I realize that I do trust the wind. And I often write my songs for myself.;David Friedman;trust
What power can poverty have over a home where loving hearts are beating with a consciousness of untold riches of the head and heart?;Orison Swett Marden;power
I was always anti-marriage. I didn't understand monogamy. I couldn't figure out how that could last. And then I met Bryn and I started to understand the beauty of constancy and history and change and going on the roller coaster with someone - of having a partner in life.;Maria Bello;beauty
I'm learning to accept the lack of privacy as the real downer in my profession.;Halle Berry;learning
O that unbelievers would learn of faithful Abraham, and believe whatever is revealed from God, though they cannot fully comprehend it! Abraham knew God commanded him to offer up his son, and therefore believed, notwithstanding carnal reasoning might suggest may objections.;George Whitefield;god
Well, just being stupid and politically incorrect doesn't work. You can be politically incorrect if you're smart.;Mel Brooks;work
Muslims must believe that all power, success and victory comes from God alone.;Abu Bakar Bashir;religion
If I'm in a relationship, that girl gets showered with letters from the road. I pour my heart into it.;Jason Mraz;relationship
The inspired Scriptures make the clear distinction between false and true riches and make plain the reason why happiness is gained and fully enjoyed only by those who find true riches.;Joseph Franklin Rutherford;happiness
Intelligence and courtesy not always are combined Often in a wooden house a golden room we find.;Henry Wadsworth Longfellow;intelligence
I visited those friends who'd just had a baby, and she was washing dishes and he was cleaning the house, and I burst with happiness. And in their minds, they were in this terrible domestic rut.;Josh Lucas;happiness
A professor is someone who talks in someone else's sleep.;W. H. Auden;teacher
I first came to think about media and politics in the late 1960s, having observed some distortions up close, but since then I wouldn't say that my personal experience has remained an important motive for my writing about media.;Todd Gitlin;politics
Music is my religion.;Jimi Hendrix;music
In all history there is no war which was not hatched by the governments, the governments alone, independent of the interests of the people, to whom war is always pernicious even when successful.;Leo Tolstoy;alone
We tell them that we believe it will be beautiful because that is our specialty, we only create joy and beauty. We have never done a sad work. Through the drawings, we hope a majority will be able to visualize it.;Christo;beauty
To love means loving the unlovable. To forgive means pardoning the unpardonable. Faith means believing the unbelievable. Hope means hoping when everything seems hopeless.;Gilbert K. Chesterton;faith
I believe that history has shape, order, and meaning that exceptional men, as much as economic forces, produce change and that passe abstractions like beauty, nobility, and greatness have a shifting but continuing validity.;Camille Paglia;change
C-17s should be ready to go at various military bases around the world packed with water, food, medical supplies, sleeping bags and tents, all prepared to be air dropped in alongside soldiers and doctors to begin relief efforts.;Steven Van Zandt;medical
