Somebody called me a 'bruised romantic' once, and I like that.;Susannah McCorkle;romantic
Keep a cool head and maintain a low profile. Never take the lead - but aim to do something big.;Deng Xiaoping;cool
We believe it wrong ever to take a dollar from a free citizen without a very necessary public purpose, because each such taking diminishes the freedom to spend that dollar as its owner would prefer.;Mitch Daniels;freedom
Our truest life is when we are in dreams awake.;Henry David Thoreau;imagination
A work of art that contains theories is like an object on which the price tag has been left.;Alexander Pope;work
God the Father, the supreme Architect, had already built this cosmic home we behold, the most sacred temple of His godhead, by the laws of His mysterious wisdom.;Giovanni Pico della Mirandola;wisdom
I consider skateboarding an art form, a lifestyle and a sport. 'Action sport' would be the least offensive categorization.;Tony Hawk;art
I refuse to accept the view that mankind is so tragically bound to the starless midnight of racism and war that the bright daybreak of peace and brotherhood can never become a reality... I believe that unarmed truth and unconditional love will have the final word.;Martin Luther King, Jr.;war
When you put something out there into the world, there's all these words you don't want to hear, that you hope people don't say. I don't like anything that starts with 're' - like retro, reinvent, recreate - I hate that. It's always like living in the past - copying, emulating.;Jack White;hope
A dog barks when his master is attacked. I would be a coward if I saw that God's truth is attacked and yet would remain silent.;Pearl S. Buck;truth
Read the best books first, or you may not have a chance to read them at all.;Henry David Thoreau;best
It is not in the nature of politics that the best men should be elected. The best men do not want to govern their fellowmen.;George MacDonald;best
The art of medicine consists in amusing the patient while nature cures the disease.;Voltaire;nature
God sleeps in the minerals, awakens in plants, walks in animals, and thinks in man.;Arthur Young;god
The situation in the United States is becoming more dire for average ordinary Americans and the last thing we need to do is to spend money on death, destruction and war.;Cynthia McKinney;death
I just sort of take it from a character perspective, and I don't know if he was necessarily spiritual, but I do think he had hope. He was a character that was comfortable having hope in his life, and hope is faith.;Ryan Gosling;faith
Generally, I'm a pretty positive, but like any other working person, if the jobs aren't coming in, I do get depressed.;Britt Ekland;positive
The ultimate end of education is happiness or a good human life, a life enriched by the possession of every kind of good, by the enjoyment of every type of satisfaction.;Mortimer Adler;happiness
I read the Odyssey because it was the story of a man who returned home after being absent for more than twenty years and was recognized only by his dog.;Guillermo Cabrera Infante;home
The chief difference between words and deeds is that words are always intended for men for their approbation, but deeds can be done only for God.;Leo Tolstoy;god
A man can fail many times, but he isn't a failure until he begins to blame somebody else.;John Burroughs;failure
Religion, like water, may be free, but when they pipe it to you, you've got to help pay for piping. And the Piper!;Abigail Van Buren;religion
Pictures must not be too picturesque.;Ralph Waldo Emerson;art
I had found English audiences highly satisfactory. They are the best listeners in the world. Perhaps the music-lovers of some of our larger cities equal the English, but I do not believe they can be surpassed in that respect.;John Philip Sousa;respect
Life is but thought.;Sara Teasdale;life
I went to engineering school, which I thought was what I wanted to do, for about two weeks. We had an orientation class and we met this guy where he worked and stuff and it was cool, but I was like, 'There is no way this is going to be my life.';Evan Glodell;cool
I very much enjoyed my career in science. I didn't leave science because I was disillusioned, but felt I'd done my bit for it after about twenty-five years.;John Polkinghorne;science
It is easier to learn to interpret dreams if you have a reason to use them for something constructive. You apply your dream insights to making constructive changes in your life.;Henry Reed;dreams
The next thing I wrote was in a writing class at night school. It was about a poor woman who worked at a dime store and who was all alone for Christmas in Laurel, Mississippi.;Beth Henley;alone
So we mustn't lower our guard in any sense because of what has happened in terms of the death of Osama Bin Laden and we are certainly not doing that. The terror threat level here in the U.K. remains at severe and we're very conscious of the need to continue that.;Theresa May;death
No power in society, no hardship in your condition can depress you, keep you down, in knowledge, power, virtue, influence, but by your own consent.;William Ellery Channing;power
Sorrows gather around great souls as storms do around mountains but, like them, they break the storm and purify the air of the plain beneath them.;Jean Paul;nature
I hate failure and that divorce was a Number One failure in my eyes. It was the worst period of my life. Neither Desi nor I have been the same since, physically or mentally.;Lucille Ball;failure
As an actor, to have achieved financial stability is amazing. But I always have this weird fear that I'm not going to get any more work it's about not having enough money.;Paul Giamatti;amazing
I love power. But it is as an artist that I love it. I love it as a musician loves his violin, to draw out its sounds and chords and harmonies.;Napoleon Bonaparte;politics
I'm not, nor is anybody I know in government part of a nasty right wing clique.;William Hague;government
I am encouraged that there's going to be much better dialogue between the federal government and the state of Arizona. I mean, I hope that's not wishful thinking.;Jan Brewer;hope
To me, a building - if it's beautiful - is the love of one man, he's made it out of his love for space, materials, things like that.;Martha Graham;architecture
I grew up in a family that was multifaceted, sexually oriented, and pretty much open to everything. And because I was working, my friends were all adults. I had a tough time going to different schools because people knew me from films and I was the fat child who got beaten up every day.;Drew Barrymore;family
Public confidence in the integrity of the Government is indispensable to faith in democracy and when we lose faith in the system, we have lost faith in everything we fight and spend for.;Adlai E. Stevenson;government
That is now my mission: to provide a European vision of growth, employment, prosperity - in one word, our future.;Francois Hollande;future
The world is given to me only once, not one existing and one perceived. Subject and object are only one. The barrier between them cannot be said to have broken down as a result of recent experience in the physical sciences, for this barrier does not exist.;Erwin Schrodinger;experience
There is overwhelming evidence that the higher the level of self-esteem, the more likely one will be to treat others with respect, kindness, and generosity.;Nathaniel Branden;respect
The show doesn't drive home a lesson, but it can open up people's minds enough for them to see how stupid every kind of prejudice can be.;Redd Foxx;home
I was hit by a car once on my bike, but I still rode home.;Amy Winehouse;home
It's easy to be lazy when there's food lying around backstage or there's a fast-food joint a couple blocks away. But if you walk a little further, ask around a bit, of course there are exciting things to discover.;Alex Kapranos;food
I am favor of cutting taxes under any circumstances and for any excuse, for any reason, whenever it's possible.;Milton Friedman;finance
We praise a man who feels angry on the right grounds and against the right persons and also in the right manner at the right moment and for the right length of time.;Aristotle;time
Time, which alone makes the reputation of men, ends by making their defects respectable.;Voltaire;time
I thought the more famous I became, the more friendships I would have, but the opposite was true.;Alanis Morissette;famous
Passion is universal humanity. Without it religion, history, romance and art would be useless.;Honore de Balzac;history
Anxiety is love's greatest killer. It makes others feel as you might when a drowning man holds on to you. You want to save him, but you know he will strangle you with his panic.;Anais Nin;love
I'm a role model now. I didn't know I was gonna have 13-year-old fans, so I've tried to change a few things here and there. But I also know that the girls don't want me to be Miley Cyrus, either.;Nicki Minaj;change
Poetry is ordinary language raised to the Nth power. Poetry is boned with ideas, nerved and blooded with emotions, all held together by the delicate, tough skin of words.;Paul Engle;poetry
Hurtling the Pentagon into an unprecedented budgetary meltdown is horrifically irresponsible. Obama doesn't care. This is war - not against the Taliban, but war against the GOP. He has Republicans on the ropes, and that's a victory he savors and desires - unlike Afghanistan, where he seems only to want to turn tail.;John Podhoretz;war
Set your goals high, and don't stop till you get there.;Bo Jackson;motivational
A verbal art like poetry is reflective it stops to think. Music is immediate, it goes on to become.;W. H. Auden;music
I only like food without color, like potatoes, bread, and pasta.;Emma Roberts;food
I had been here five years already, training very hard, learning about the systems, the shuttle, the station systems. But, everything really became real when I started to work with them.;Philippe Perrin;learning
My background was computer science and business school, so eventually I worked my way up where I was running product groups - development, testing, marketing, user education.;Melinda Gates;education
I'm girlie in the sense that I like makeup, but I also love sports and man food.;Carrie Underwood;food
Writing a book of poetry is like dropping a rose petal down the Grand Canyon and waiting for the echo.;Don Marquis;poetry
Every life has a measure of sorrow, and sometimes this is what awakens us.;Steven Tyler;sad
All change is bad. But sometimes it has to be done.;P. J. O'Rourke;change
I'd like a male to listen to my music and find it kind of fascinating, what a girl goes through when they get heartbroken or get sad or get hurt by something.;Ellie Goulding;sad
I'm on the board of directors for Peace Now, which works tirelessly between the Palestinians and the Israelis to create peace in the Middle East and we've never been closer.;Mandy Patinkin;peace
Look at Gleason in The Honeymooners. He was humorous but the way he lived wasn't really humorous. He was a bus driver. Who wants to be a bus driver? He didn't have any money and he was not famous. But despite that, the show is humorous.;George Thorogood;famous
I don't believe in social equality, and they know it.;George Smathers;equality
Science already contained all that was necessary, if you just brought it out.;Arthur Young;science
She got the magazine on a Wednesday morning, and on Thursday announced our marriage was over.;David Gest;marriage
I believe that children are our future. Teach them well and let them lead the way. Show them all the beauty they possess inside.;Whitney Houston;beauty
The waking mind is the least serviceable in the arts.;Henry Miller;art
Bad humor is an evasion of reality good humor is an acceptance of it.;Malcolm Muggeridge;humor
Habitual texters may not only cheat their existing relationships, they can also limit their ability to form future ones since they don't get to practice the art of interpreting nonverbal visual cues.;Jeffrey Kluger;future
I am climbing a difficult road but the glory gives me strength.;Sextus Propertius;strength
My Botswana books are positive, and I've never really sought to deny that. They are positive. They present a very positive picture of the country. And I think that that is perfectly defensible given that there is so much written about Africa which is entirely negative.;Alexander McCall Smith;positive
I think art education, especially in this country, which government pretty much ignores, is so important for young people.;Mikhail Baryshnikov;education
I've had enough boyfriends and enough issues. I'd seen enough train wrecks.;Taylor Dayne;dating
The sea - this truth must be confessed - has no generosity. No display of manly qualities - courage, hardihood, endurance, faithfulness - has ever been known to touch its irresponsible consciousness of power.;Joseph Conrad;power
It is our experience that political leaders do not always mean the opposite of what they say.;Abba Eban;politics
The fact is that I find more most men are more open, more generous, and much more stimulating than the majority of females I know.;Marilyn Monroe;men
We think of enterprise architecture as the process we use for fully describing and mapping business functionality and business requirements and relating them to information systems requirements.;Tony Scott;architecture
It's better to be unhappy alone than unhappy with someone - so far.;Marilyn Monroe;alone
The population forecast for the United States in 1970 is 170 million. The population forecast for Russia alone in 1970 is 251 million. The implications are clear.;Emanuel Celler;alone
When you live on the road, going home is a place to escape and just be with your family to unwind.;Jonathan Davis;family
Most importantly, nothing has happened to change my conviction that freedom and the love of liberty remain the essential defining attributes of our national character as a people.;Ibrahim Babangida;freedom
You will be a failure, until you impress the subconscious with the conviction you are a success. This is done by making an affirmation which 'clicks.';Florence Scovel Shinn;success
I've often thought if I didn't make my marriage work, I would have failed at my one true shot at happiness.;Bethenny Frankel;marriage
Meyer and I have a bit in common because we're both left-handed. I think it's great that he seeks out that advice because he's not too cool or too uncomfortable to ask for it.;Barry Zito;cool
Power has only one duty - to secure the social welfare of the People.;Benjamin Disraeli;power
Friendship is a strong and habitual inclination in two persons to promote the good and happiness of one another.;Eustace Budgell;friendship
I could finally quit my job as a bartender and stop dreaming that I might be Superman and know that I was. Then I started thinking about how cool it was.;Brandon Routh;cool
If we don't know life, how can we know death?;Confucius;death
We should measure welfare's success by how many people leave welfare, not by how many are added.;Ronald Reagan;success
I don't want to play golf. When I hit a ball, I want someone else to go chase it.;Rogers Hornsby;sports
It is all nonsense, to be sure and so much the greater nonsense inasmuch as the true interpretation of many dreams - not by any means of all dreams - moves, it may be said, in the opposite direction to the method of psycho-analysis.;Arthur Machen;dreams
Every president has to live with the result of what Lyndon Johnson did with Vietnam, when he lost the trust of the American people in the presidency.;Robert Caro;trust
Spin Me Round was number one all over the world, everywhere. It changed the face of pop music, no question. We took technology further than Trevor Horn.;Pete Waterman;technology
A year ago I had a back injury and followed a good nutrition program to help speed up my recovery. I focused on exercise and staying healthy in order to get back out on the ice.;Sasha Cohen;fitness
Divorce is one of the most financially traumatic things you can go through. Money spent on getting mad or getting even is money wasted.;Richard Wagner;money
The business of America is business.;Calvin Coolidge;business
There are only really a few stories to tell in the end, and betrayal and the failure of love is one of those good stories to tell.;Sean Lennon;good
I can't change the direction of the wind, but I can adjust my sails to always reach my destination.;Jimmy Dean;change
I like being famous when it's convenient for me and completely anonymous when it's not.;Catherine Deneuve;famous
A dream is a scripture, and many scriptures are nothing but dreams.;Umberto Eco;dreams
Editing is now the easiest thing on earth to do, and all the things that evolved out of word processing - 'Oh, let's put that sentence there, let's get rid of this' - have become commonplace in films and music too.;Brian Eno;music
My music will go on forever. Maybe it's a fool say that, but when me know facts me can say facts. My music will go on forever.;Bob Marley;music
We know what works. Freedom Works. We know what's right. Freedom is right.;George H. W. Bush;freedom
I had some wonderful dreaming meetings. I can't tell you specifically what they've been in the recent months. In the past they've been verbal kinds of messages that he needed to give me. Now they're more dreams of his presence.;Judy Collins;dreams
I have absolutely no empathy for camels. I didn't care for being abused in the Middle East by those horrible, horrible, horrible creatures. They don't like people. It's not at all like the relationship between horses and humans.;Rachel Weisz;relationship
Men are so necessarily mad, that not to be mad would amount to another form of madness.;Blaise Pascal;men
These heroes of finance are like beads on a string when one slips off, all the rest follow.;Henrik Ibsen;finance
I will not attempt to deny the reasonableness and necessity of a party war but in carrying on that war all principles and rules of justice should not be departed from.;Robert Walpole;war
Anyone who knows history, particularly the history of Europe, will, I think, recognize that the domination of education or of government by any one particular religious faith is never a happy arrangement for the people.;Eleanor Roosevelt;government
The strength of criticism lies in the weakness of the thing criticized.;Henry Wadsworth Longfellow;strength
I see 30 to 40 gallery shows a week, and no matter what kind of mood I'm in, no matter how bad the art is, I almost always feel better afterward. I can learn as much from bad art as from good.;Jerry Saltz;art
I've played a lot of mothers in my movies.;Vera Farmiga;movies
It is with children that we have the best chance of studying the development of logical knowledge, mathematical knowledge, physical knowledge, and so forth.;Jean Piaget;best
Your determination, selflessness and courage have brought the freedom struggle towards its fulfilment.;Gerry Adams;courage
Music was your real passion, this thing you held dear even above family. It was this relationship that never betrayed you. Once it became your job - this thing that was highly visible, this thing that became about commerce - that's when you were holding onto music like it was a palm tree in a hurricane.;Eddie Vedder;relationship
He hits the ball a long way and he knows how to win.;Gary McCord;sports
A market is never saturated with a good product, but it is very quickly saturated with a bad one.;Henry Ford;good
The romantic love we feel toward the opposite sex is probably one extra help from God to bring you together, but that's it. All the rest of it, the true love, is the test.;Joan Chen;god
The movies have got more corporate, they're making fewer movies in general, and those they are making are all $200-$300m tent-pole releases that eat up all the oxygen.;John Cusack;movies
I had a fear that I'd be typecast, but I don't really have that fear anymore.;David Duchovny;fear
If you're using first-class land for biofuels, then you're competing with the growing of food. And so you're actually spiking food prices by moving energy production into agriculture.;Bill Gates;food
I enjoyed working as a model a lot as it let me travel and I got to do some really interesting projects.;Patricia Velasquez;travel
I'll see you in my dreams.;Gus Kahn;dreams
This required the development of a view which allowed one to integrate research with belief, thing with person, fact with aesthetics, knowledge with application of knowledge.;Kenneth L. Pike;knowledge
When man learns to understand and control his own behavior as well as he is learning to understand and control the behavior of crop plants and domestic animals, he may be justified in believing that he has become civilized.;Ayn Rand;learning
Let us more and more insist on raising funds of love, of kindness, of understanding, of peace. Money will come if we seek first the Kingdom of God - the rest will be given.;Mother Teresa;love
Fear is exciting for me.;Ayrton Senna;fear
I tell people I won't vote to go to war unless I'm ready to go or send my kids.;Rand Paul;war
I've always believed in people's capacity for goodness. I still believe that people are good. What I'm not so trusting about anymore is their relationship to their own goodness.;Anne Hathaway;relationship
No man was ever great by imitation.;Samuel Johnson;great
Of course, to have money is just great because you can do what you think is important to you. I always was a rich person because money's not related to happiness.;Paulo Coelho;happiness
When you're shooting a film, you really don't get to be a dad, and you don't really get to be a husband. You don't really exist at all. But I do drag my family with me on location whenever I can.;Eric Bana;dad
Writing a teen character is something I wanted to try again for a long time!;Emily Giffin;teen
Disease is the retribution of outraged Nature.;Hosea Ballou;nature
I'm a romantic, and we romantics are more sensitive to the way people feel. We love more, and we hurt more. When we're hurt, we hurt for a long time.;Freddy Fender;romantic
In addition, I'll be attending women's health expos and medical conferences with the goal to promote dialogue between women and their health-care providers.;Karen Duffy;health
I'm trying to cut down a little on eating, on sodium, keep my blood pressure down, which is tough. Because I love food! I do, but it's unfair how everything that's bad for you tastes so good, and all the good stuff, veggies and green things, doesn't match up.;Ice Cube;food
The thing about romance and romantic movies is that they can be somewhat melodramatic. For a lot of actors, there's a certain cringe factor that's involved with that.;David Lyons;romantic
Marriage is all about knowing the ins and outs and the intimate details, and your wife is supposed to be the person you know best. But my brother and I think alike, know everything about one another, and when we get together, we block everything else out. Nothing exists in our world except for us.;Jon Heder;marriage
Democrats believe that the federal government is not our enemy, it's our partner.;George McGovern;government
I cast unusual people in my movies.;Albert Brooks;movies
You can get digital technology that almost is film quality, and go make little films and do everything you can to find a little understanding of your own voice and it will grow - Don't take no for an answer - Take every opportunity you can to do something.;Jon Voight;technology
I saw how many people were poor and how many kids my age went to school hungry in the morning, which I don't think most of my contemporaries in racially segregated schools in the South thought very much about at the time.;Charles Kuralt;age
We must have great respect for these people who also suffer and who want to find their own way of correct living. On the other hand, to create a legal form of a kind of homosexual marriage, in reality, does not help these people.;Joseph Ratzinger;respect
I certainly wasn't happy. Happiness has to do with reason, and only reason earns it. What I was given was the thing you can't earn, and can't keep, and often don't even recognize at the time I mean joy.;Ursula K. Le Guin;happiness
Liberalism is trust of the people tempered by prudence. Conservatism is distrust of the people tempered by fear.;William E. Gladstone;politics
Education is extremely important to the Hispanic community, as well as faith, and certainly working hard.;Luis Fortuno;education
The conception that, instead of this, contemporary society is at or near a turning point is very prominent in the views of a school of social scientists who, though they are still comparatively few, are getting more and more of a hearing.;Talcott Parsons;society
In tennis, it is not the opponent you fear, it is the failure itself, knowing how near you were but just out of reach.;Andy Murray;fear
Middle age is when you're sitting at home on a Saturday night and the telephone rings and you hope it isn't for you.;Ogden Nash;age
It is a great mystery that though the human heart longs for Truth, in which alone it finds liberation and delight, the first reaction of human beings to Truth is one of hostility and fear!;Anthony de Mello;great
Society has taught us to suppress certain things and not do certain things.;Kesha;society
What I really tried to do with Helen was make her show this sad side of her. She was married off at 16, was so young and living in this castle that can't leave because of how she looks, and married to a man she hates and three times her age.;Diane Kruger;sad
First and foremost I am a commercial writer, and I hope to entertain people. But having said that, I'm in love with the relationship between humans and dogs, and the more I learned about what our military working dogs are doing, I wanted to at least share with people what an important role these animals have in all our lives.;Robert Crais;relationship
