I think there have always been funny women, from Carol Burnett to Joan Rivers. When the audience sees a woman, they innately know she's worked twice as hard to get there, she's had to prove that she can be the leader, first, and then be funny on top of it. She has to emit a confidence that she's in control.;Wendy Liebman;funny
I've long been really intrigued with what is the... proper role of faith and religion in public life.;Gene Robinson;faith
We used to go to the pictures every Saturday night but we had to leave a little bit early and get home and watch Match of the Day - and my wife still complains she missed the last five minutes of every film we saw.;Brian Clough;home
The basic problem with my love relationships with women is that my standards are so high - and they apply equally to both of us. I seek full-blast mutual intensity, fully fledged mutual acceptance, full-blown mutual flourishing, and fully felt peace and joy with each other. This requires a level of physical attraction, personal adoration, and moral admiration that is hard to find.;Cornel West;women
Design is the method of putting form and content together. Design, just as art, has multiple definitions there is no single definition. Design can be art. Design can be aesthetics. Design is so simple, that's why it is so complicated.;Paul Rand;art
Together we can and must fight for justice for our children and protect them from draconian tax cuts and budget choices that threaten their survival, education and preparation for the future. If they are not ready for tomorrow, neither is America.;Marian Wright Edelman;education
The biggest problem in my life is trying to be the kind of man that I want to be, the father that I want to be, and how to process the failure of my marriage.;Ethan Hawke;marriage
Justice cannot be for one side alone, but must be for both.;Eleanor Roosevelt;alone
I'm still really close with everyone at home and their parents - and their brothers and sisters. I was so, so, so lucky to grow up as part of a community and I don't take that for granted. I try very hard to stay part of it.;Jennifer Garner;home
How sad it is that we give up on people who are just like us.;Fred Rogers;sad
Let us more and more insist on raising funds of love, of kindness, of understanding, of peace. Money will come if we seek first the Kingdom of God - the rest will be given.;Mother Teresa;money
I don't care what people say about my relationship I don't care what they say about my boobs. People are buying my songs I have a sold-out tour. I'm getting incredible feedback from my music.;Katy Perry;relationship
I went back to work because someone had to pay for the groceries.;Bette Davis;work
The idea of avant-garde art is a very suspicious thing to me, the idea that poetry is new and it keeps being new the way Chevrolets every year are new.;Robert Morgan;art
They're great girls. They're very funny, they're very smart, they're fun to be with. They're very lively, as I think people can tell. And you know, they're very confident girls.;Laura Bush;funny
Science is not only a disciple of reason but, also, one of romance and passion.;Stephen Hawking;science
Communication is everyone's panacea for everything.;Tom Peters;communication
The law cannot equalize mankind in spite of nature.;Luc de Clapiers;nature
An American Idol is someone that has all the qualities that America thinks is positive, attractive and alluring.;Mario Vazquez;positive
In politics, as in religion, it is equally absurd to aim at making proselytes by fire and sword. Heresies in either can rarely be cured by persecution.;Alexander Hamilton;religion
Truth is, I'll never know all there is to know about you just as you will never know all there is to know about me. Humans are by nature too complicated to be understood fully. So, we can choose either to approach our fellow human beings with suspicion or to approach them with an open mind, a dash of optimism and a great deal of candour.;Tom Hanks;nature
Don't do anything by half. If you love someone, love them with all your soul. When you go to work, work your ass off. When you hate someone, hate them until it hurts.;Henry Rollins;love
If a guy is intimidated by a woman in leadership, he has real problems with his own concepts of masculinity. That's a harsh statement, but I believe it to be true.;Tony Campolo;leadership
Measures must always in a progressive society be held superior to men, who are after all imperfect instruments, working for their fulfilment.;Mahatma Gandhi;men
We have the greatest hospitals, doctors, and medical technology in the world - we need to make them accessible to every American.;Barbara Boxer;technology
Yes we have a specific procedure which we follow in all cases where the Agency is in contact, for the purposes of acquiring intelligence or whatever the case may be, with an individual.;Richard M. Helms;intelligence
I'm really fun. I'm ridiculously fun. I hope I'm infectiously fun.;Kesha;hope
If we go on the way we have, the fault is our greed and if we are not willing to change, we will disappear from the face of the globe, to be replaced by the insect.;Jacques Yves Cousteau;change
The '60s was one of the first times the power of music was used by a generation to bind them together.;Neil Young;music
We assume that we've come so far as compassionate citizens of the world if we do choose to read the news, yet the attitude towards life can be one where we put blinders on and forget that there are civil wars going on. It's easy to forget that there are so many people starving to death every single day.;Anne Hathaway;attitude
Dre was one of my heros in the music industry. If he's not down for his homeboys, I don't wanna be a part of him or around him.;Tupac Shakur;music
Think of success as a game of chance in which you have control over the odds. As you begin to master concepts in personal achievement, you are increasing your odds of achieving success.;Bo Bennett;success
Passion can quickly slip to jealousy, or even hatred.;Arthur Golden;jealousy
The more laws, the less justice.;Marcus Tullius Cicero;legal
War is peace. Freedom is slavery. Ignorance is strength.;George Orwell;peace
Further, for once, I like the idea that people who think I'm a constant voice for the furthering of the imagination have to see that interest in a more materialistic fashion.;Peter Sotos;imagination
Peace is purchased from strength. It's not purchased from weakness or unilateral retreats.;Benjamin Netanyahu;peace
The great danger for family life, in the midst of any society whose idols are pleasure, comfort and independence, lies in the fact that people close their hearts and become selfish.;Pope John Paul II;society
My work always tried to unite the true with the beautiful but when I had to choose one or the other, I usually chose the beautiful.;Tom Stoppard;work
Freedom would be not to choose between black and white but to abjure such prescribed choices.;Theodor Adorno;freedom
I give myself strength by staying away from any music.;Alannah Myles;strength
I don't believe in God but I'm very interested in her.;Arthur C. Clarke;religion
To reduce deficit spending and our enormous debt, you reign in spending. You cut the budget. You don't take more from the private sector and grow government with it. And that's exactly what Obama has in mind with this expiration of Bush tax cuts proposal of his.;Sarah Palin;government
Fame changes a lot of things, but it can't change a lightbulb.;Gilda Radner;change
People don't want to talk about death, just like they don't want to talk about computer security. Maybe I should have named my workstation Fear. People are so motivated by fear.;Dan Farmer;fear
The hardest thing is that you can't trust people now. You just can't.;Kevin Pietersen;trust
Success cannot come from standstill men. Methods change and men must change with them.;James Cash Penney;success
You learn to speak by speaking, to study by studying, to run by running, to work by working in just the same way, you learn to love by loving.;Anatole France;work
Put your faith in God and confidence in yourself.;Alberta Hunter;faith
Studies have shown that since women have had access to the pill and family planning measures, they have made huge gains in both wages and in careers that were dominated by men.;Jennifer Granholm;women
In every parting there is an image of death.;George Eliot;death
I have seen how the foundations of the world are laid, and I have not the least doubt that it will stand a good while.;Henry David Thoreau;good
We live in a time where government is not a leadership thing, it's more a business that's out there and running riot, so I guess the people have to go out there and say stuff.;Yahoo Serious;leadership
Success comes from knowing that you did your best to become the best that you are capable of becoming.;John Wooden;best
Collecting intelligence information is like trying to drink water out of a fire hydrant. You know, in hindsight It's great. The problem is there's a million dots at the time.;Louis Freeh;intelligence
In the television age, the key distinction is between the candidate who can speak poetry and the one who can only speak prose.;Richard M. Nixon;poetry
Jealousy is, I think, the worst of all faults because it makes a victim of both parties.;Gene Tierney;jealousy
If you want to achieve your dreams, you must follow them, and the best way to follow them is not to think about wanting to be very rich, but to think about doing something that you really want to do.;Jackie Collins;dreams
I'm not one of those writers I learned about who get up in the morning, put a piece of paper in their typewriter machine and start writing. That I've never understood.;Wole Soyinka;morning
The extreme limit of wisdom, that's what the public calls madness.;Jean Cocteau;wisdom
What is a poet? An unhappy person who conceals profound anguish in his heart but whose lips are so formed that as sighs and cries pass over them they sound like beautiful music.;Soren Kierkegaard;music
Do not put such unlimited power into the hands of husbands. Remember all men would be tyrants if they could.;Abigail Adams;power
Also, to be honest, my dad wanted me to be an athlete. And I think all sons want to prove something to their dad. So now, aged 35, I want to see what I can achieve physically.;Joe Manganiello;dad
Forget the past.;Nelson Mandela;movingon
I'm not denyin' the women are foolish. God Almighty made 'em to match the men.;George Eliot;men
In the morning, I reach for the sports page.;Lisa Guerrero;morning
My dad was kind of a pool shark and had a Frank Sinatra, Dean Martin thing going on. I've always been fascinated by the fifties because of him. There was a hip, cool, anything-goes atmosphere back then, but looking good was still a priority.;Dylan McDermott;cool
Before anything else, we need a new age of Enlightenment. Our present political systems must relinquish their claims on truth, justice and freedom and have to replace them with the search for truth, justice, freedom and reason.;Friedrich Durrenmatt;freedom
Poetry is finer and more philosophical than history for poetry expresses the universal, and history only the particular.;Aristotle;history
Religion is the organization of spirituality into something that became the hand maiden of conquerors. Nearly all religions were brought to people and imposed on people by conquerors, and used as the framework to control their minds.;John Henrik Clarke;religion
I used to joke that if acting didn't work out, poetry was my commonsense fallback.;Merritt Wever;poetry
I wouldn't trust Nixon from here to that phone.;Barry Goldwater;trust
If we long to believe that the stars rise and set for us, that we are the reason there is a Universe, does science do us a disservice in deflating our conceits?;Carl Sagan;science
When I was young I didn't care about education, just money and box office.;Jackie Chan;education
Over the last half century the television interview has given us some of TV's most heart-stopping and memorable moments. On the surface it is a simple format - two people sitting across from one another having a conversation. But underneath it is often a power struggle - a battle for the psychological advantage.;David Frost;power
Bahrainis are better off than many other Arabs. We have a welfare state, everybody gets a salary whether they have a job or not. Electricity and food are subsidized school and healthcare are free. And we don't differentiate between Bahrainis and foreigners. We are very proud of that.;Hamad bin Isa Al Khalifa;food
The pay is good and I can walk to work.;John F. Kennedy;work
I love Lady Antebellum and Miranda Lambert - they write from the heart. But it's hard to find a country music lover in L.A. None of my friends really listen to it, and they hate getting in the car with me because I just blast Taylor Swift.;Lucy Hale;car
I think what makes our marriage work amid all the glare is that my husband is my best friend. He inspires everything in my life and enables me to do the best that I can. I want to hang out with him more than anyone.;Faith Hill;marriage
War is a game that is played with a smile. If you can't smile, grin. If you can't grin, keep out of the way till you can.;Winston Churchill;war
I also try to eat as much raw food and clean food as possible.;Kirsty Gallacher;food
If faith produce no works, I see That faith is not a living tree. Thus faith and works together grow, No separate life they never can know. They're soul and body, hand and heart, What God hath joined, let no man part.;Hannah More;faith
Sport is a wonderful metaphor for life. Of all the sports that I played - skiing, baseball, fishing - there is no greater example than golf, because you're playing against yourself and nature.;Robert Redford;sports
Children should have enough freedom to be themselves - once they've learned the rules.;Anna Quindlen;freedom
Banks have a new image. Now you have 'a friend,' your friendly banker. If the banks are so friendly, how come they chain down the pens?;Alan King;money
No woman has to be a victim of physical abuse. Women have to feel like they are not alone.;Salma Hayek;women
I want to be a loving mom.;Tori Spelling;mom
Americans believe with all their heart, the vast majority of them, and the vast majority of Floridians, that the United States of America is simply the single greatest nation in all of human history.;Marco Rubio;history
I trust the people who are working with me. I delegate.;Mario Draghi;trust
Women do not often fall in love with philosophers.;Samuel Richardson;women
Everyone comes up to me saying, 'Cooee, Julie! Hello!' as if I know them. Of course I don't bloody know them. Am I flummoxed by it? Sometimes. I think, 'Ooh, love, go easy.' For a time, I did feel this pressure that I had to be funny, but it passes.;Julie Walters;funny
Men of lofty genius when they are doing the least work are most active.;Leonardo da Vinci;work
My contribution I hope is to get people to eat full-flavored food. If I could come away with that alone, that would be a fantastic accomplishment. I'm also very proud of being a very American chef.;Bobby Flay;alone
With patient and firm determination, I am going to press on for jobs. I'm going to press on for equality. I'm going to press on for the sake of our children. I'm going to press on for the sake of all those families who are struggling right now. I don't have time to feel sorry for myself. I don't have time to complain. I am going to press on.;Barack Obama;time
Your library is your paradise.;Desiderius Erasmus;education
What is one to say about June, the time of perfect young summer, the fulfillment of the promise of the earlier months, and with as yet no sign to remind one that its fresh young beauty will ever fade.;Gertrude Jekyll;beauty
When I write stuff and I help cast it, I turn away good people all the time. I may turn them down because this one's too tall and that one doesn't have a high enough voice or this one looks to old to match up with that one - there's a billion reasons not to hire somebody.;Harvey Fierstein;time
OK, so my parents were married in 1955 and my mom knew my dad was gay and my dad knew he was gay and so I was, like, 'Why in the heck did you get married?' Like, what was going on? What was that time? It's like this crazy paradox that my whole life is based on, or my family's based on. So I spent a lot of time trying to understand '55.;Mike Mills;mom
Together we can make a world where cancer no longer means living with fear, without hope, or worse.;Patrick Swayze;hope
Dodging and burning are steps to take care of mistakes God made in establishing tonal relationships.;Ansel Adams;god
All Americans and freedom-loving people around the world owe President Reagan our deepest gratitude for his strong, principled leadership that ended the Cold War and brought freedom to millions of people.;Jim Ramstad;leadership
The idea of regretting not doing this seemed insane to me. Sitting in the corner at a bar at age 60, saying: 'I could've been Bond. Buy me a drink.' That's the saddest place I could be. At least now at 60 I can say: 'I was Bond. Now buy me a drink.';Daniel Craig;age
I just can't seem to write songs about peace and love. Yeah right, how do you get that?;Siobhan Fahey;peace
Yale places great stress on undergraduate and graduate teaching. I like teaching, and I do a lot of it.;James Tobin;graduation
It is a fact often observed, that men have written good verses under the inspiration of passion, who cannot write well under other circumstances.;Ralph Waldo Emerson;good
My life has been one great big joke, a dance that's walked a song that's spoke, I laugh so hard I almost choke when I think about myself.;Maya Angelou;life
It was quite a European war until 1917, when the Americans joined up. They don't have the same sense of the loss of innocence and the cataclysmic loss of life. A whole generation was wiped out.;Tom Hiddleston;war
Nothing you wear is more important than your smile.;Connie Stevens;smile
I was a ballplayer, but only for a limited time. I grew up playing in Wisconsin. It's a very sports-centric part of the country that I grew up in and I played a lot of sports, but baseball first and foremost. I played through high school. I was a middle-infielder.;Chad Harbach;sports
The Teutons have been singing the swan song ever since they entered the ranks of history. They have always confounded truth with death.;Henry Miller;death
Short of baseball and my family, it was gaming. And gaming is a $20-million to $200-million multi-year effort. It's an insane, stupid and utterly irresponsible act. But I did it.;Curt Schilling;family
For it pleased God, after he had made all things by the word of his power, to create man after his own image.;George Whitefield;god
So far, at least, I haven't found a way to tell my kind of stories without making them both sad and funny.;Todd Solondz;sad
High achievers spot rich opportunities swiftly, make big decisions quickly and move into action immediately. Follow these principles and you can make your dreams come true.;Robert H. Schuller;dreams
I believe that two people are connected at the heart, and it doesn't matter what you do, or who you are or where you live there are no boundaries or barriers if two people are destined to be together.;Julia Roberts;relationship
A sense of humor... is needed armor. Joy in one's heart and some laughter on one's lips is a sign that the person down deep has a pretty good grasp of life.;Hugh Sidey;humor
In fact, the best thing we could do on taxes for all Americans is to simplify the individual tax code. This will be a tough job, but members of both parties have expressed an interest in doing this, and I am prepared to join them.;Barack Obama;best
Watergate provides a model case study of the interaction and powers of each of the branches of government. It also is a morality play with a sad and dramatic ending.;Bob Woodward;government
Entrepreneurs are risk takers, willing to roll the dice with their money or reputation on the line in support of an idea or enterprise. They willingly assume responsibility for the success or failure of a venture and are answerable for all its facets.;Victor Kiam;failure
It takes a lot of courage to release the familiar and seemingly secure, to embrace the new. But there is no real security in what is no longer meaningful. There is more security in the adventurous and exciting, for in movement there is life, and in change there is power.;Alan Cohen;power
An intelligent person is never afraid or ashamed to find errors in his understanding of things.;Bryant H. McGill;intelligence
It is those who concentrates on but one thing at a time who advance in this world. The great man or woman is the one who never steps outside his or her specialty or foolishly dissipates his or her individuality.;Og Mandino;time
I feel connected to the Second World War because my father lost his father in that war. So, through my dad and the effect it had on him of losing his father young, I always felt connected to the war. It goes back years, but it still feels to me as if we're completely living in it.;Tom Hooper;dad
One of the greatest discoveries a man makes, one of his great surprises, is to find he can do what he was afraid he couldn't do.;Henry Ford;great
I try to give people a different way of looking at their surroundings. That's art to me.;Maya Lin;architecture
Money doesn't make you happy. I now have $50 million but I was just as happy when I had $48 million.;Arnold Schwarzenegger;money
I would say the most help I got was from my dad. My dad is a civil engineer in Switzerland he's 90 years old now, so he's no longer active as a civil engineer, but still a very active person.;Claude Nicollier;dad
I think women as well as men are concerned about jobs and the economy and spending and, and other issues. They're concerned that when their kids graduate from college they have an economy and they have a future in this country and they, they have the same opportunity that we've had and our grandparents have had.;Ken Buck;graduation
More than anything, I think as our country matures, we recognize that women deserve to be treated with respect and dignity.;Barbara Boxer;respect
For myself I hold no preferences among flowers, so long as they are wild, free, spontaneous. Bricks to all greenhouses! Black thumb and cutworm to the potted plant!;Edward Abbey;nature
One reason we resist making deliberate choices is that choice equals change and most of us, feeling the world is unpredictable enough, try to minimise the trauma of change in our personal lives.;Hugh Mackay;change
Keep your temper. A decision made in anger is never sound.;Ford Frick;anger
I like to think of my behavior in the sixties as a 'learning experience.' Then again, I like to think of anything stupid I've done as a 'learning experience.' It makes me feel less stupid.;P. J. O'Rourke;learning
And here's the fact: the fact is it doesn't solve the problem. First of all, if you taxed these people at 100 percent, basically next year you said, 'Look, every penny you make next year the government's going to take it from you,' it still doesn't solve the debt.;Marco Rubio;government
People have to remain positive and believe in those dreams. It's really important.;Kirsty Coventry;dreams
I think that people are tired. They're tired of the same old kind of politics. People want a new tone to politics.;Michelle Obama;politics
Study men, not historians.;Harry S. Truman;men
The assumption is that the right kind of society is an organic being not merely analogous to an organic being, but actually a living structure with appetites and digestions, instincts and passions, intelligence and reason.;Herbert Read;society
As children we recognized that we belonged to an unusual, even exceptional, family, but the effect was different on each of us.;David Rockefeller;family
Not engaging in ignorance is wisdom.;Bodhidharma;wisdom
Humor is an affirmation of dignity, a declaration of man's superiority to all that befalls him.;Romain Gary;humor
If the United Nations once admits that international disputes can be settled by using force, then we will have destroyed the foundation of the organization and our best hope of establishing a world order.;Dwight D. Eisenhower;hope
I never think of myself as wise. I think of myself as possessing a critical intelligence which I intend to allow to operate.;Harold Pinter;intelligence
From too much love of living, From hope and fear set free, We thank with brief thanksgiving Whatever gods may be That no life lives for ever That dead men rise up never That even the weariest river Winds somewhere safe to sea.;Algernon Charles Swinburne;thankful
Nothing they design ever gets in the way of a work of art.;Robert Hughes;design
If God had wanted me otherwise, He would have created me otherwise.;Johann Wolfgang von Goethe;god
We work hard on the show. We really believe in the show. It's an enormous privilege to work on a show that has the power to touch people's lives in such a positive way. The fan mail and the e-mail certainly reflect that.;Roma Downey;positive
I'm a teenager, but I'm independent - I have my own apartment, I have my own life. And I think I have learned more than any of those teenagers have in school. I learned to be responsible, leaving my family and coming here alone.;Adriana Lima;family
What we have to do, what at any rate it is our duty to do, is to revive the old art of Lying.;Oscar Wilde;art
The men who followed Him were unique in their generation. They turned the world upside down because their hearts had been turned right side up. The world has never been the same.;Billy Graham;men
Sometimes poetry is inspired by the conversation entered into by reading other poems.;John Barton;poetry
