I don't think the public is dying to see me necessarily be funny all the time.;Ben Stiller;funny
George Clooney is a super-human, he's just such an amazing human being, he taught me how to be a better person and a better actor!;Shailene Woodley;amazing
Establishing lasting peace is the work of education all politics can do is keep us out of war.;Maria Montessori;education
I guess you could say I've been in my share of violent movies.;Daniel Craig;movies
Who could refrain that had a heart to love and in that heart courage to make love known?;William Shakespeare;love
The judicial system is the most expensive machine ever invented for finding out what happened and what to do about it.;Irving R. Kaufman;history
Hope is a state of mind, not of the world. Hope, in this deep and powerful sense, is not the same as joy that things are going well, or willingness to invest in enterprises that are obviously heading for success, but rather an ability to work for something because it is good.;Vaclav Havel;hope
I worked for MI6 in the Sixties, during the great witch-hunts, when the shared paranoia of the Cold War gripped the services.;John le Carre;war
Is not liberty the destruction of all despotism - including, of course, legal despotism?;Frederic Bastiat;legal
It's to be a person who's able to shoot little arrows into sacred cows and knock politicians off their pedestals, to look out for hypocrisy, advocate for all sorts of things from social justice to peace.;Jonathan Shapiro;peace
When we're dealing with the people in our family - no matter how annoying or gross they may be, no matter how self-inflicted their suffering may appear, no matter how afflicted they are with ignorance, prejudice or nose hairs - we give from the deepest parts of ourselves.;Anne Lamott;family
A teacher must believe in the value and interest of his subject as a doctor believes in health.;Gilbert Highet;health
I love graphic design. I love working with design, and I love storytelling, so I've been working on a children's book for a while, and I'd like to see that through.;Colleen Haskell;design
With improv, it's a combination of listening and not trying to be funny.;Kristen Wiig;funny
You know, young actors say all the time, 'Should I use my own life experience?' And my response is, 'What choice do you have?';David Mamet;experience
The vast possibilities of our great future will become realities only if we make ourselves responsible for that future.;Gifford Pinchot;future
All teenagers have this desire to somehow run away.;Joan Chen;teen
Dreams will get you nowhere, a good kick in the pants will take you a long way.;Baltasar Gracian;good
House Republican leadership have refused to allow a clean minimum wage vote. Close to 15 million Americans will be affected if we did this. Do Republicans really expect a family to live on less than $11,000 a year?;Bill Pascrell;leadership
My advice to women in general: Even if you're doing a nine-to-five job, treat yourself like a boss. Not arrogant, but be sure of what you want - and don't allow people to run anything for you without your knowledge.;Nicki Minaj;knowledge
I support gay marriage. I believe they have a right to be as miserable as the rest of us.;Kinky Friedman;marriage
While everyone else is thinking about economics and politics, executive salaries and the future of the euro, do the opposite, even if it's hard. Invest in the spirit.;Jonathan Sacks;future
But the power of science lies in open publication, which, with the rise of the Internet, is no longer constrained by the price of paper.;Michael Shermer;science
Eating at home is fine, as I can easily work around the foods that don't agree with me and still eat heartily with the rest of my family. I don't force them to follow my diet.;Andrea McLean;diet
I lived at home and I cycled every morning to the railway station to travel by train to Johannesburg followed by a walk to the University, carrying sandwiches for my lunch and returning in the evening the same way.;Sydney Brenner;morning
Our strength in finance has led us to set up an international financial centre with medium and long-term objectives, especially to develop Islamic financial and insurance services.;Hassanal Bolkiah;finance
I love my family and I miss them very much but I'm a new person now. I know a lot of people will not agree with what I've done, but it was right for me.;LaToya Jackson;family
If a dad does his job, we don't need prisons, we don't need jails. That's what I saw growing up.;Mike Singletary;dad
If youth knew if age could.;Sigmund Freud;age
Frustration, although quite painful at times, is a very positive and essential part of success.;Bo Bennett;positive
Smartness runs in my family. When I went to school I was so smart my teacher was in my class for five years.;Gracie Allen;intelligence
I do not support peace in the Middle East. And I do not support Arafat. He is a stupid, incompetent fool!;Muammar al-Gaddafi;peace
Without this spirit, Modernist architecture cannot fully exist. Since there is often a mismatch between the logic and the spirit of Modernism, I use architecture to reconcile the two.;Tadao Ando;architecture
My different personalities leave me in peace now.;Anna Freud;peace
To sit with a dog on a hillside on a glorious afternoon is to be back in Eden, where doing nothing was not boring - it was peace.;Milan Kundera;peace
The production of children, the nurture of those born, and the daily life of men, of these matters woman is visibly the cause.;Guru Nanak;men
But I'm a hot-blooded Italian by nature. Whatever the situation you present, I'm going to make something out of it.;Maynard James Keenan;nature
We don't tend to write about disease in fiction - not just teen novels but all American novels - because it doesn't fit in with our idea of the heroic romantic epic. There is room only for sacrifice, heroism, war, politics and family struggle.;John Green;politics
Patriotism is voluntary. It is a feeling of loyalty and allegiance that is the result of knowledge and belief. A patriot shows their their patriotism through their actions, by their choice.;Jesse Ventura;knowledge
Who could refrain that had a heart to love and in that heart courage to make love known?;William Shakespeare;courage
Music is the social act of communication among people, a gesture of friendship, the strongest there is.;Malcolm Arnold;friendship
I went to a military school between the ages of six and 12 and later into the air force. You learn discipline and strength of character.;Larry Hagman;strength
I know people think we drive around in these nice cars and we do whatever we want and our parents will pay our credit cards, but that's not the case. Sure, my parents were generous I got a nice car at 16, but at 18 I was cut off. I've worked really hard. I opened the store myself.;Kim Kardashian;car
I think you have to feel comfortable with your car. You have to go into turn one, every lap, with confidence. You have to be sure of yourself and your equipment.;Danica Patrick;car
It takes courage to grow up and become who you really are.;e. e. cummings;teen
The only really happy folk are married women and single men.;H. L. Mencken;men
Opinions alter, manners change, creeds rise and fall, but the moral laws are written on the table of eternity.;Lord Acton;change
I've seen it too many times in Hollywood. Talking about a relationship in public can jinx it. And if you have your picture taken together, you might as well start packing your bags.;Gina Gershon;relationship
Religion is the last refuge of human savagery.;Alfred North Whitehead;religion
In an age of incompetence, I've been able to last in this crazy business. I actually know how to play my ax and write a song. That's my job.;Billy Joel;age
I don't like to boast, but I have probably skipped more poetry than any other person of my age and weight in this country.;Will Cuppy;poetry
I believe if there is any place left where the humanity is still visible, it can not be anywhere else than in an Islamic society. Time would come when the world would be obliged to accept this reality.;Jermaine Jackson;time
What we now call school training, the pursuit of fixed studies at stated hours under the constant guidance of a teacher, I could scarcely be said to have enjoyed.;Simon Newcomb;teacher
There are few more powerful tools for promoting stability than the institution of marriage.;Iain Duncan Smith;marriage
Literature adds to reality, it does not simply describe it. It enriches the necessary competencies that daily life requires and provides and in this respect, it irrigates the deserts that our lives have already become.;C. S. Lewis;life
Science consistently produces a new crop of miraculous truths and dazzling devices every year.;Kary Mullis;science
I was watching TV at age 9 or 10, and my mom said that I came from the front room and I told her that I want to act. And she said if you want to do this at 18, then you can. It was a very simple story, yet, I do not even remember the conversation that I had with my mother. Until she reminded me of the story many years later.;Derek Luke;mom
We have a powerful potential in out youth, and we must have the courage to change old ideas and practices so that we may direct their power toward good ends.;Mary McLeod Bethune;good
With respect to the environment in our state and our state's future - in addition to water which is very important here - I think it is crucial for him to make a sincere commitment to energy efficiency, fuel efficiency, by helping us to produce those cars of the future.;Jennifer Granholm;respect
Because sorry to say, women run the house. They run the family. They hold things up. I mean, it's like you don't ever see your mom get sick because she handles everything. And it's kind of amazing I think to show people just how strong women are.;Sophia Bush;family
Use state-of-the-heart technology online and offline to turn listeners into viral advocates and customers into raving fans.;Peter Guber;technology
Sometimes the truth hurts. And sometimes it feels real good.;Henry Rollins;truth
I find that the best way to do things is to constantly move forward and to never doubt anything and keep moving forward, if you make a mistake say you made a mistake.;John Frusciante;best
Strictly speaking, my interest is not in legal rights for animals but in a change of heart towards animals.;J. M. Coetzee;legal
When you read about a car crash in which two or three youngsters are killed, do you pause to dwell on the amount of love and treasure and patience parents poured into bodies no longer suitable for open caskets?;Jim Bishop;car
So live that you wouldn't be ashamed to sell the family parrot to the town gossip.;Will Rogers;family
It sounds like a cliche but I also learnt that you're not going to fall for the right person until you really love yourself and feel good about how you are.;Emma Watson;love
When I was on Broadway, I got really sick with walking pneumonia. I decided not to take my health for granted anymore and make it a priority. The great thing is, the pounds just started to fall off.;Jordin Sparks;health
The slave is doomed to worship time and fate and death, because they are greater than anything he finds in himself, and because all his thoughts are of things which they devour.;Bertrand Russell;death
Time is the father of truth, its mother is our mind.;Giordano Bruno;time
Personality is only ripe when a man has made the truth his own.;Soren Kierkegaard;truth
I pledge to you today that as president, in my first budget, I will introduce the largest increase in special education ever.;Al Gore;education
For someone who writes fiction, in order to activate the imagination and the unconscious, it's essential to be free.;Manuel Puig;imagination
Ask everyone whether they're an actor or a doctor or a teacher or whatever is entitled to his or her opinion. But unfortunately, because actors are in the public eye, whether we want it or not, sometimes our opinions carry more weight or influence than they deserve.;Debra Messing;teacher
None can love freedom heartily, but good men the rest love not freedom, but licence.;John Milton;freedom
My interest in film is sort of catholic - apart from science fiction and horror movies, I'll watch almost everything.;James Dyson;movies
The main difference between men and women is that men are lunatics and women are idiots.;Rebecca West;women
There has been a shift to what may be defined as a culture of negativity which goes well beyond coverage of politics.;Alastair Campbell;politics
It takes more than just a good looking body. You've got to have the heart and soul to go with it.;Epictetus;good
History repeats itself, but the special call of an art which has passed away is never reproduced. It is as utterly gone out of the world as the song of a destroyed wild bird.;Joseph Conrad;art
It's the degree of success and the length of time that is amazing.;Ruth Handler;amazing
Memories, imagination, old sentiments, and associations are more readily reached through the sense of smell than through any other channel.;Oliver Wendell Holmes;imagination
I walk the streets, take the train, it's real simple. Some actors create their own mythology: 'Oh, I'm so famous I can't go places, because I created this mythology that I'm so famous I can't go places.';Samuel L. Jackson;famous
Death is a billion-dollar business. They can't even pass a law where it takes seven days to get a gun. Why don't you have to go through the same kind of screening you do to get a driver's license? It's totally insane.;John Cusack;death
Honesty and integrity are absolutely essential for success in life - all areas of life. The really good news is that anyone can develop both honesty and integrity.;Zig Ziglar;life
I pity the young woman who will attempt to insinuate herself between my mama's boy and me. I sympathize with the monumental nature of her task. It will take a crowbar, two bulldozers and half a dozen Molotov cocktails to pry my Oedipus and me loose from one another.;Ayelet Waldman;nature
Classical music is the kind we keep thinking will turn into a tune.;Kin Hubbard;music
No matter how vast, how total, the failure of man here on earth, the work of man will be resumed elsewhere. War leaders talk of resuming operations on this front and that, but man's front embraces the whole universe.;Henry Miller;work
The pine stays green in winter... wisdom in hardship.;Norman Douglas;wisdom
Funny, how moms can tell you what to do no matter how old or big you are.;Gabrielle Reece;funny
Nationalism is a silly cock crowing on his own dunghill.;Richard Aldington;patriotism
We will never fully explain the world by appealing to something outside it that must simply be accepted on faith, be it an unexplained God or an unexplained set of mathematical laws.;Paul Davies;faith
I pop gum. My parents get so annoyed with me. I know my dad wishes he never taught me how to do that.;Hilary Duff;dad
I just yesterday returned from a trip where I photographed a woman with two children whom I photographed first when she was the age of the older of the two children.;Jock Sturges;age
I mean, the whole idea of movies was it was special to go to see - you went to a movie theater to see something that was magical and amazing, in a very special location.;Bob Balaban;amazing
I am like a kid. I tell my family and friends I'm like a kid.;Shahrukh Khan;family
People talk of me as being the inventor of the legal thriller.;Scott Turow;legal
I have a huge respect for writers and realise that this is not an area that I find easy. I doubt that I would have the patience in front of a blank sheet of paper to become a writer.;Jenny Agutter;patience
Global Warming: It is a hoax. It is bad science. It is high-jacking public policy. It is the greatest scam in history.;John Coleman;science
People recognize me, call me Ron, and ask me questions. It's really cool and weird as well.;Rupert Grint;cool
It was very hard for all of us. It's still very hard. The anniversary of his death just passed, and every single one of his friends, still, after all these years... it's unbelievable.;Eydie Gorme;anniversary
A priest is he who lives solely in the realm of the invisible, for whom all that is visible has only the truth of an allegory.;Karl Wilhelm Friedrich Schlegel;truth
Negative politics have always been around.;Karl Rove;politics
All you need is the plan, the road map, and the courage to press on to your destination.;Earl Nightingale;courage
I feel fortunate. I've really gotten to work with amazing talented people, and to learn from them, which is why I'm doing this. If I can work with the best director I'm going to do it.;Armie Hammer;amazing
I think there's a difference between God and religion.;Sinead O'Connor;religion
Employee of the month is a good example of how somebody can be both a winner and a loser at the same time.;Demetri Martin;time
Happiness does not come from doing easy work but from the afterglow of satisfaction that comes after the achievement of a difficult task that demanded our best.;Theodore Isaac Rubin;best
We are all ill: but even a universal sickness implies an idea of health.;Lionel Trilling;health
I am able to really enjoy the positive attention I receive.;Doutzen Kroes;positive
Now that I have found someone, I'm feeling more alone... than I ever have before.;Ben Folds;alone
We are living in 1937, and our universities, I suggest, are not half-way out of the fifteenth century. We have made hardly any changes in our conception of university organization, education, graduation, for a century - for several centuries.;H. G. Wells;education
Music was my refuge. I could crawl into the space between the notes and curl my back to loneliness.;Maya Angelou;music
Develop success from failures. Discouragement and failure are two of the surest stepping stones to success.;Dale Carnegie;success
I use every single thing that Alfred Hitchcock taught me in my acting career... I am very grateful for the education he gave me in making motion pictures.;Tippi Hedren;education
No slavery can be abolished without a double emancipation, and the master will benefit by freedom more than the freed-man.;Thomas Huxley;freedom
Well, my mom is single and we've both been single at the same time over the last ten years, so I really related to the bond between my character and Diane's.;Amanda Peet;mom
Talking about music is like dancing about architecture.;Steve Martin;music
I like America. I think it's pretty cool.;Mary Lynn Rajskub;cool
Every goal, every action, every thought, every feeling one experiences, whether it be consciously or unconsciously known, is an attempt to increase one's level of peace of mind.;Sydney Madwed;peace
Have patience with all things, But, first of all with yourself.;Saint Francis de Sales;patience
The primary factor is proportions.;Arne Jacobsen;design
Years ago women of my size were considered royalty.;Camryn Manheim;women
Times and conditions change so rapidly that we must keep our aim constantly focused on the future.;Walt Disney;change
However, we might oppose it, abortion is a sad feature of modern life.;Robert Casey;sad
On average, drug prisoners spend more time in federal prison than rapists, who often get out on early release because of the overcrowding in prison caused by the Drug War.;Michael Badnarik;war
Up against the corporate government, voters find themselves asked to choose between look-alike candidates from two parties vying to see who takes the marching orders from their campaign paymasters and their future employers. The money of vested interest nullifies genuine voter choice and trust.;Ralph Nader;future
The ladder of success is never crowded at the top.;Napoleon Hill;success
I think God made a woman to be strong and not to be trampled under the feet of men. I've always felt this way because my mother was a very strong woman, without a husband.;Little Richard;god
Well, I'm in my 60s now. I finally look it, I think. People until I was 60 would always say they thought I looked younger, which I think, without flattering myself, I did, but I think I certainly have, as George Orwell says people do after a certain age, the face they deserve.;Christopher Hitchens;age
History is the sum total of things that could have been avoided.;Konrad Adenauer;history
Still, language is resilient, and poetry when it is pressured simply goes underground.;Diane Wakoski;poetry
I feel very strong as an individual, but as a famous footballer I know I am prone to certain things. All the media have a continuous interest for me. It varies from once a year to every day interest.;Ruud van Nistelrooy;famous
I have a theory and I really believe it. I think your worst weakness can become your greatest single strength.;Barbara Corcoran;strength
I took some time out for life.;James L. Brooks;time
Nobody can give you wiser advice than yourself.;Marcus Tullius Cicero;wisdom
I have discovered the art of deceiving diplomats. I tell them the truth and they never believe me.;Camillo di Cavour;truth
Once I knew only darkness and stillness... my life was without past or future... but a little word from the fingers of another fell into my hand that clutched at emptiness, and my heart leaped to the rapture of living.;Helen Keller;life
TV is bigger than any story it reports. It's the greatest teaching tool since the printing press.;Fred W. Friendly;teacher
The artist must be in his work as God is in creation, invisible and all-powerful one must sense him everywhere but never see him.;Gustave Flaubert;god
A plague on eminence! I hardly dare cross the street anymore without a convoy, and I am stared at wherever I go like an idiot member of a royal family or an animal in a zoo and zoo animals have been known to die from stares.;Igor Stravinsky;family
I'm not really religious but very spiritual. I give money to this company that manufactures hearing aids on a regular basis. More people should really hear me sing. I have a gift from God.;Christina Aguilera;money
I want to buy my mom a house I want my family to never have to worry about anything. And I just want to have an amazing career in music, because I love to do it.;Ashthon Jones;amazing
My dad encouraged us to fail. Growing up, he would ask us what we failed at that week. If we didn't have something, he would be disappointed. It changed my mindset at an early age that failure is not the outcome, failure is not trying. Don't be afraid to fail.;Sara Blakely;failure
I have never denied my background or my culture. I have taught my child to embrace her Mexican heritage, to love my first language, Spanish, to learn about Mexican history, music, folk art, food, and even the Mexican candy I grew up with.;Salma Hayek;music
Just as your car runs more smoothly and requires less energy to go faster and farther when the wheels are in perfect alignment, you perform better when your thoughts, feelings, emotions, goals, and values are in balance.;Brian Tracy;car
Crime shapes how we think about the world it shapes social decisions that we make it shapes our base of knowledge. But we don't talk about it intelligently.;Bill James;knowledge
When I eventually met Mr. Right I had no idea that his first name was Always.;Rita Rudner;funny
Love grows more tremendously full, swift, poignant, as the years multiply.;Zane Grey;anniversary
Men are limited by the knowledge of their minds, the worth of their characters and the principles upon which they are building their lives.;Edwin Louis Cole;knowledge
I've gotten crankier in my old age.;Shirley MacLaine;age
History teaches that war begins when governments believe the price of aggression is cheap.;Ronald Reagan;war
Every once in a while, you live long enough to get the respect that people didn't want to give while you were trying to become a senior citizen.;Gil Scott-Heron;respect
I have this sense that I didn't really start growing up until my twenties.;Winona Ryder;teen
I advise everybody not to save: spend your money. Most people save all their lives and leave it to somebody else. Money is to be enjoyed.;Hedy Lamarr;money
My strength has the strength of ten because my heart is pure.;Alfred Lord Tennyson;strength
I just want to make people smile.;Julie Garwood;smile
Nothing defines humans better than their willingness to do irrational things in the pursuit of phenomenally unlikely payoffs. This is the principle behind lotteries, dating, and religion.;Scott Adams;religion
Back then, I didn't have a big organization around me. I was just a kid with a guitar, traveling around. My responsibility basically was to the art, and I had extra time on my hands. There is no extra time now. There isn't enough time.;Joni Mitchell;art
People are roasting each other at parties, at work events, around the fire. It's so fun. People are busting each other's chops, and it's a sign of affection, truly. It's a true test of love and friendship: can you make a man laugh at himself? So what makes a good burn? Go after targets you love and respect. And hit 'em hard.;Jeff Ross;friendship
The figure a poem makes. It begins in delight and ends in wisdom... in a clarification of life - not necessarily a great clarification, such as sects and cults are founded on, but in a momentary stay against confusion.;Robert Frost;life
We have a limit, a very discouraging, humiliating limit: death.;Umberto Eco;death
America's doctors, nurses and medical researchers are the best in the world, but our health care system is broken.;Mike Ferguson;health
When we have lost everything, including hope, life becomes a disgrace, and death a duty.;W. C. Fields;death
My goals over the decade include to develop new drugs to treat intractable diseases by using iPS cell technology and to conduct clinical trials using it on a few patients with Parkinson's diseases, diabetes or blood diseases.;Shinya Yamanaka;technology
I'd rather attempt to do something great and fail than to attempt to do nothing and succeed.;Robert H. Schuller;motivational
