Violent behavior exists in one's psychological makeup much deeper than the level that receives information from television or movies.;Richard King;movies
It is the great sadness of our species that we have not found a way to eliminate the conflict and to eliminate violence as a device to resolve our conflicts throughout the entire history of the human race.;Neale Donald Walsch;history
I want to do all kinds of things. I want to do some comedy. I'd love to do a romantic comedy, and I'd love to do some period pieces with classical text. I'd love somebody to cast me as Macbeth, but for a film. I just want to be all over the place.;Kevin Alejandro;romantic
Hugh Grant is the main man. He's the number one romantic comedy man in the world.;Sam Elliott;romantic
My attitude is, do as much as I can while I'm free. And if I'm arrested I'll still do as much as I can.;Aung San Suu Kyi;attitude
Style used to be an interaction between the human soul and tools that were limiting. In the digital era, it will have to come from the soul alone.;Jaron Lanier;alone
My dad is a marketing mastermind.;Serena Williams;dad
So many financial dreams are thwarted by the failure to act upon good intentions.;Suze Orman;failure
For those who live neither with religious consolations about death nor with a sense of death (or of anything else) as natural, death is the obscene mystery, the ultimate affront, the thing that cannot be controlled. It can only be denied.;Susan Sontag;death
We should not have the U.S. government buying stock in American industries - the financial industry or any other industry.;Rand Paul;government
Today right here in America we have 50 million people without health insurance.;Corrine Brown;health
Deliver me from writers who say the way they live doesn't matter. I'm not sure a bad person can write a good book, If art doesn't make us better, then what on earth is it for.;Alice Walker;art
Being on your own would be sad, sick and weird. I don't trust myself. I need that balance.;Daniel Craig;sad
Love in its essence is spiritual fire.;Lucius Annaeus Seneca;love
If terror groups are to be defeated, it is national governments that will have to do so. In nations like India, governments will have to call on the patriotism of citizens to fight the terrorists. In a nation like Pakistan, the government will have to be persuaded to deal with those in their midst who are complicit.;Bill Kristol;patriotism
If I'm in something funny, I like to try and find some kind of serious line in it that people can relate to.;Ron Livingston;funny
Dogs and philosophers do the greatest good and get the fewest rewards.;Diogenes;good
When I was kid, I remember playing 'Vogue' by Madonna over and over and over again. And ah, you know, something about the beat was really cool, and Madonna, visually, was on TV all the time and I thought she was just so beautiful.;Adam Lambert;cool
The Teen Challenge Training Center on Pennsylvania farmland houses over 200 men in rehab. Other farms and centers have been birthed out of this ministry all over the world.;David Wilkerson;teen
Probably the happiest period in life most frequently is in middle age, when the eager passions of youth are cooled, and the infirmities of age not yet begun as we see that the shadows, which are at morning and evening so large, almost entirely disappear at midday.;Eleanor Roosevelt;life
I used to look like a deer in headlights on the red carpet. You step out of the car and it's bedlam. Everyone's got crazy eyes.;Emily Blunt;car
Write it on your heart that every day is the best day in the year.;Ralph Waldo Emerson;best
I think computer viruses should count as life. I think it says something about human nature that the only form of life we have created so far is purely destructive. We've created life in our own image.;Stephen Hawking;computers
I used to know Jennifer Love Hewitt. We lived in the same apartment building when I was about... jeez, I guess it was when I was doing 'Christmas Vacation', so I was about 13 or 14.;Johnny Galecki;christmas
Movies are like magic tricks.;Jeff Bridges;movies
Our ideal is to make her ever stronger and better and finer, because in that way alone, as we believe, can she be of the greatest service to the world's peace and to the welfare of mankind.;Henry Cabot Lodge;alone
People can undergo a sudden change of thinking and loyalties under threat of death or intense social pressure and isolation from friends and family.;Keith Henson;family
Civilization depends on our expanding ability to produce food efficiently, which has markedly accelerated thanks to science and technology.;Nina Fedoroff;technology
If you love dance and you have the gift of teaching, teaching is super amazing and important because my teachers planted that seed in me. As a teacher you understand the difference or the definition of a Baryshnikov or a Gregory Hines, so teaching is really important and very necessary.;Laurieann Gibson;amazing
History and experience tell us that moral progress comes not in comfortable and complacent times, but out of trial and confusion.;Gerald R. Ford;history
There can be no knowledge without emotion. We may be aware of a truth, yet until we have felt its force, it is not ours. To the cognition of the brain must be added the experience of the soul.;Arnold Bennett;knowledge
Leadership is the key to 99 percent of all successful efforts.;Erskine Bowles;leadership
When science, art, literature, and philosophy are simply the manifestation of personality they are on a level where glorious and dazzling achievements are possible, which can make a man's name live for thousands of years.;Denis Diderot;science
In all realms of life it takes courage to stretch your limits, express your power, and fulfill your potential... it's no different in the financial realm.;Suze Orman;power
Man is made or unmade by himself. By the right choice he ascends. As a being of power, intelligence, and love, and the lord of his own thoughts, he holds the key to every situation.;James Allen;intelligence
Poetry must have something in it that is barbaric, vast and wild.;Denis Diderot;poetry
Write it on your heart that every day is the best day in the year.;Ralph Waldo Emerson;newyears
We want people to realize you are at a design school, not a land grant college. The way we look says a great deal about who we are.;James Hall;design
I remember looking through magazines or watching movies even just a couple of years ago and being like, 'I really want to be part of that,' but not realizing what that was.;Leighton Meester;movies
My dad had a church of 90 people when I was born. It was just, over the years it continued to grow.;Joel Osteen;dad
Photography is more than a medium for factual communication of ideas. It is a creative art.;Ansel Adams;communication
To me, as long as we've known each other, I've always thought Mick's most brilliant thing was that he could work in an area two foot square and give a very exciting performance.;Keith Richards;work
I'm trying to stay as calm as possible and focus one day at a time, but when reality sets in, I feel everything: anxiety, excitement, nerves, pressure and joy.;Shawn Johnson;time
Success is the result of perfection, hard work, learning from failure, loyalty, and persistence.;Colin Powell;success
In times of conflict, war, poverty or religious fundamentalism, women and children are the first and most numerous victims. Women need all their courage today.;Isabel Allende;war
You know, I've learned a lot from every person I've collaborated with, from Madlib to Jean Grae and Hi-Tek, to Mos to DJ Quik, to even somebody like Jermaine Dupri. I've taken something important away from every experience.;Talib Kweli;experience
It is only the enlightened ruler and the wise general who will use the highest intelligence of the army for the purposes of spying, and thereby they achieve great results.;Sun Tzu;great
Substitute 'damn' every time you're inclined to write 'very' your editor will delete it and the writing will be just as it should be.;Mark Twain;time
Gorillas are in danger of being wiped out by the Ebola virus. I feel like we have limited time to get to know them and understand them and they're going to disappear - that's terrifically sad. Wouldn't it be great if we could stop that?;Sara Gruen;sad
Seeing much, suffering much, and studying much, are the three pillars of learning.;Benjamin Disraeli;learning
Lovers have a right to betray you... friends don't.;Judy Holliday;friendship
A woman asking 'Am I good? Am I satisfied?' is extremely selfish. The less women fuss about themselves, the less they talk to other women, the more they try to please their husbands, the happier the marriage is going to be.;Barbara Cartland;women
The only difference is that religion is much better organised and has been around much longer, but it's the same story with different characters and different costumes.;James Randi;religion
I am a Republican, a black, dyed in the wool Republican, and I never intend to belong to any other party than the party of freedom and progress.;Frederick Douglass;freedom
I hear good things about Xbox Live from some of my younger teammates. I think it would be fun to be able to challenge fans all over the world. It would be cool to be able to play some of my friends back home in the States. I'm looking forward to trying it.;Claudio Reyna;cool
A man may learn wisdom even from a foe.;Aristophanes;wisdom
I can't get a relationship to last longer than it takes to make copies of their tapes.;Margaret Smith;relationship
Space isn't remote at all. It's only an hour's drive away if your car could go straight upwards.;Fred Hoyle;car
The strongest and most effective force in guaranteeing the long-term maintenance of power is not violence in all the forms deployed by the dominant to control the dominated, but consent in all the forms in which the dominated acquiesce in their own domination.;Robert Frost;power
But when I would see the surrogate, my first instinct, my first reaction would be jealousy, because she was doing what I wanted to do.;Cheryl Tiegs;jealousy
But I believe in fair trade, and I will tell you, I have many, many friends heading up corporations, and people that do just business in China, they say it's virtually impossible. It's very, very hard to come into China. And yet, we welcome them with open arms.;Donald Trump;business
Clearly older women and especially older women who have led an active life or elder women who successfully maneuver through their own family life have so much to teach us about sharing, patience, and wisdom.;Alice Walker;wisdom
I do not believe in excuses. I believe in hard work as the prime solvent of life's problems.;James Cash Penney;life
I'd like to live as a poor man with lots of money.;Pablo Picasso;money
None of my characters are rich or famous, and the situations they find themselves in could happen to anyone.;Nicholas Sparks;famous
My parents always made education and school the number one priority. They believed that an education is the best gift you can give to your child.;Debra Messing;education
God is a thought who makes crooked all that is straight.;Friedrich Nietzsche;religion
The foundations of a strong economy don't rest alone on the decisions of Chancellors or the spending programmes of government.;George Osborne;alone
Once upon a time my political opponents honored me as possessing the fabulous intellectual and economic power by which I created a worldwide depression all by myself.;Herbert Hoover;power
I'm like the kid in kindergarten I really do send valentines to everyone.;Susie Bright;valentinesday
If I don't feel confident about my body, I'm not going to sit at home and feel sorry for myself and not do something about it. It's all about taking action and not being lazy. So you do the work, whether it's fitness or whatever. It's about getting up, motivating yourself and just doing it.;Kim Kardashian;fitness
It's a very romantic sentiment, but to think that you would die if you didn't write, well, I would definitely choose to not write and live.;Sarah McLachlan;romantic
So I really did stop and change what I saw I was about, and really try to put that principle into play as the center of everything - my friendships, my marriage, my career, my family, my way of being in the world. And that changed everything for me.;Kathy Mattea;marriage
Art is creative for the sake of realization, not for amusement... for transfiguration, not for the sake of play.;Max Beckmann;art
Solitary trees, if they grow at all, grow strong.;Winston Churchill;nature
We convince by our presence.;Walt Whitman;inspirational
A guy is a lump like a doughnut. So, first you gotta get rid of all the stuff his mom did to him. And then you gotta get rid of all that macho crap that they pick up from beer commercials. And then there's my personal favorite, the male ego.;Roseanne Barr;mom
There is a kind of beauty in imperfection.;Conrad Hall;beauty
It's not my goal to be a famous actor.;Gavin DeGraw;famous
I think what the Nobel committee is doing is going beyond war and looking at what humanity can do to prevent war. Sustainable management of our natural resources will promote peace.;Wangari Maathai;peace
Everywhere is within walking distance if you have the time.;Steven Wright;humor
Peace is a natural effect of trade.;Charles de Montesquieu;peace
My kid could get a bad X-ray and I could get a call from the doctor saying I have something growing in my bum and that would change my perspective on everything instantaneously, on what is and what is not important.;Tom Hanks;change
No sadder proof can be given by a man of his own littleness than disbelief in great men.;Thomas Carlyle;great
There used to be this feeling under Eisenhower and Kennedy and Roosevelt and Truman that government was a solution. Trust in the presidency fell precipitously under Johnson - real lows. And it's never come back. It's a trend that, if you're liberal, is really discouraging.;Robert Caro;trust
Soon silence will have passed into legend. Man has turned his back on silence. Day after day he invents machines and devices that increase noise and distract humanity from the essence of life, contemplation, meditation.;Jean Arp;technology
I love things that age well - things that don't date, that stand the test of time and that become living examples of the absolute best.;Giorgio Armani;age
Some people think football is a matter of life and death. I assure you, it's much more serious than that.;Bill Shankly;death
As a girl, you're supposed to love Sleeping Beauty. I mean, who wants to love Sleeping Beauty when you can be Aladdin?;Ellen Page;beauty
Money is like manure. You have to spread it around or it smells.;J. Paul Getty;finance
So to hope to be able to have peace, to be able to have justice and environmental balance, are consequences of our behavior, not just our intentions.;Godfrey Reggio;environmental
Prepare a noble death song for the day when you go over the great divide.;Tecumseh;death
Nothing else so destroys the power to stand alone as the habit of leaning upon others. If you lean, you will never be strong or original. Stand alone or bury your ambition to be somebody in the world.;Orison Swett Marden;alone
A merchant who approaches business with the idea of serving the public well has nothing to fear from the competition.;James Cash Penney;fear
The Internet is just bringing all kinds of information into the home. There's just a lot of distraction, a lot of competition for the parent's voice to resonate in the children's ears.;Phil McGraw;parenting
Movies are my religion and God is my patron. I'm lucky enough to be in the position where I don't make movies to pay for my pool. When I make a movie, I want it to be everything to me like I would die for it.;Quentin Tarantino;religion
You can never stop discovering music.;Rashida Jones;music
The strangest part about being famous is you don't get to give first impressions anymore. Everyone already has an impression of you before you meet them.;Kristen Stewart;famous
An optimist is a guy that has never had much experience.;Don Marquis;experience
I don't think people are fools, and I think they deserve a good attitude and smart entertainment.;Tatyana Tolstaya;attitude
The attitude is we live and let live. This is actually an amazing change in values in a rather short time and it's an example of freedom from religion.;Tom Wolfe;amazing
We read deeply for varied reasons, most of them familiar: that we cannot know enough people profoundly enough that we need to know ourselves better that we require knowledge, not just of self and others, but of the way things are.;Harold Bloom;knowledge
A friend may well be reckoned the masterpiece of nature.;Ralph Waldo Emerson;nature
The biggest risk I've ever taken is going on American Idol and trying to be myself. I wasn't going to try too hard to conform, and I knew that it could possibly not work out.;Adam Lambert;work
I want to do very useful buildings and I would like to find a method of producing these buildings through our technology because I think that this is the only way that we will gain wonderful environment easily in the future.;Minoru Yamasaki;future
Wit is a weapon. Jokes are a masculine way of inflicting superiority. But humor is the pursuit of a gentle grin, usually in solitude.;Frank Muir;humor
I think the British people are very, very attached to the idea that the health service is free at the point of use. But there is no reason why every doctor, nurse and teacher in this country has to be employed by the state.;George Osborne;health
It can make you sad to look at pictures from your youth. So there's a trick to it. The trick is not to look at the later pictures.;Jerry Stiller;sad
The greatest enemy to human souls is the self-righteous spirit which makes men look to themselves for salvation.;Charles Spurgeon;men
I believe the American people have a genuine and justifiable fear of government intrusion in what they instinctively know is going to be an ever more intrusive world.;Joe Biden;government
Love and business and family and religion and art and patriotism are nothing but shadows of words when a man's starving!;O. Henry;art
Forgiveness is a gift you give yourself.;Suzanne Somers;forgiveness
We've taken the view that if the rest of the world would democratize and create market economies, that would spread the benefits of prosperity around the world, and that it would enhance our own prosperity, and our own stability and security, as well.;Jeffrey Sachs;finance
High-quality food is better for your health.;Michael Pollan;health
Equality is the public recognition, effectively expressed in institutions and manners, of the principle that an equal degree of attention is due to the needs of all human beings.;Simone Weil;equality
Ocean is more ancient than the mountains, and freighted with the memories and the dreams of Time.;H. P. Lovecraft;dreams
If you cannot work with love but only with distaste, it is better that you should leave your work.;Khalil Gibran;business
There are three hundred and sixty-four days when you might get un-birthday presents, and only one for birthday presents, you know.;Lewis Carroll;birthday
If anyone is crazy enough to want to kill a president of the United States, he can do it. All he must be prepared to do is give his life for the president's.;John F. Kennedy;life
The people who criticise you will not be the ones taking care of your legs when you are in your wheelchair. People who never drove a car in these conditions, they just don't know.;Alain Prost;car
Basically, there are two paths you can walk: faith or fear. It's impossible to simultaneously trust God and not trust God.;Charles Stanley;fear
Let's just do what is right for the American people. And those of us who are involved in politics and government know that our responsibility is to the American people, that we have a responsibility to find our common ground, to seek it and to find it.;Nancy Pelosi;politics
Knowledge without justice ought to be called cunning rather than wisdom.;Plato;knowledge
After about 20 years of marriage, I'm finally starting to scratch the surface of what women want. And I think the answer lies somewhere between conversation and chocolate.;Mel Gibson;women
Well, the truth is always what should be told. And the truth and the knowledge of the truth is what everybody should represent, regardless of the consequences of doing it.;Johnny Isakson;knowledge
The government's War on Poverty has transformed poverty from a short-term misfortune into a career choice.;Harry Browne;government
Outside the kingdom of the Lord there is no nation which is greater than any other. God and history will remember your judgment.;Haile Selassie;god
A man without ambition is dead. A man with ambition but no love is dead. A man with ambition and love for his blessings here on earth is ever so alive.;Pearl Bailey;love
The first thing I do when I start my day is, I get down on my hands and knees and give thanks to God. Whenever I go outside of my house, the first thing I do is stop at the church.;Mark Wahlberg;thankful
The bookful blockhead, ignorantly read With loads of learned lumber in his head.;Alexander Pope;intelligence
Well, financially it's a little bit better. But it's better than than when I was a teacher. But I kind of - it's allowed me to buy a house. And I've been able to help my mother with some stuff and my brother. So, that's nice.;Clay Aiken;teacher
The secret of success is learning how to use pain and pleasure instead of having pain and pleasure use you. If you do that, you're in control of your life. If you don't, life controls you.;Tony Robbins;life
Time heals griefs and quarrels, for we change and are no longer the same persons. Neither the offender nor the offended are any more themselves.;Blaise Pascal;change
People don't want to listen to a celebrity tweeting about their charities and shows. That's why comedy writers do well - we put out little funny ideas.;Mindy Kaling;funny
My 'fear' is my substance, and probably the best part of me.;Franz Kafka;best
My fans mean everything to me - especially the sisters! When you're on 'The View' or you're doing movies and stuff, you're a little bit insulated. It means so much to me when a woman comes up to me and says, 'Sherri, you said what I feel.' That just means so much to me to know that I have that support.;Sherri Shepherd;movies
I think everybody has something that takes them away or makes them happier. To some people it's baseball or sports or knitting or the movies.;Sutton Foster;sports
Relationship movies are often made for a female audience.;Roman Coppola;relationship
You can manage 50 people through the strength of your personality and lack of sleep. You can touch them all in a week and make sure they're all pointed in the right direction.;Mark Pincus;strength
When thinking about companions gone, we feel ourselves doubly alone.;Walter Scott;alone
But the first the general public learned about the discovery was the news of the destruction of Hiroshima by the atom bomb. A splendid achievement of science and technology had turned malign. Science became identified with death and destruction.;Joseph Rotblat;technology
Life can be dramatic and funny all in the same day.;Jennifer Aniston;funny
Today, over half of China's undergraduate degrees are in math, science technology and engineering, yet only 16 percent of America's undergraduates pursue these schools.;Cathy McMorris;technology
What society doesn't realize is that in the past, ordinary people respected learning. They respected books, and they don't now, or not very much. That whole respect for serious literature and learning has disappeared.;Doris Lessing;society
To me, art supplies are always okay to buy.;Louis C. K.;art
The war on drugs is wrong, both tactically and morally. It assumes that people are too stupid, too reckless, and too irresponsible to decide whether and under what conditions to consume drugs. The war on drugs is morally bankrupt.;Larry Elder;war
We are so obsessed with doing that we have no time and no imagination left for being. As a result, men are valued not for what they are but for what they do or what they have - for their usefulness.;Thomas Merton;time
Well, look at what people are doing for returned veterans now. The wounded warriors. They're working hard to make the wounded veterans feel that they are loved and welcomed home, unlike Vietnam. It was not a very kind, gentle world then. I think we are kinder and gentler.;Barbara Bush;home
To my knowledge, I was the first guy really to do what I do. And then later on different comedians started trying doing it.;Don Rickles;knowledge
Anything you're good at contributes to happiness.;Bertrand Russell;good
What makes old age hard to bear is not the failing of one's faculties, mental and physical, but the burden of one's memories.;W. Somerset Maugham;age
A lot of people would be embarrassed to admit that they were on 'Barney', but I embrace the fact. I just had such a wonderful time doing that show. I learned what a camera and prop is, and all that. I learned my manners too, so I guess that's a good thing!;Selena Gomez;time
Man is subject to innumerable pains and sorrows by the very condition of humanity, and yet, as if nature had not sown evils enough in life, we are continually adding grief to grief and aggravating the common calamity by our cruel treatment of one another.;Joseph Addison;life
Ironing boards are a classic example of something I find horrible about modern society: the excitementation, for want of a better word, of mundane things.;Daniel Radcliffe;society
I don't know much about sports.;Rene Russo;sports
I remember feeling that technology was like trying to draw with your foot. In a ski boot. It was the most indirect way to work imaginable, but the potential had us all excited. I started in stop motion.;Chris Wedge;technology
