My husband and I are either going to buy a dog or have a child. We can't decide whether to ruin our carpet or ruin our lives.;Rita Rudner;marriage
Character is power it makes friends, draws patronage and support and opens the way to wealth, honor and happiness.;John Howe;happiness
Our industry has invested so much money in technology that perhaps it's time to invest in talent, in people.;Christiane Amanpour;technology
What drives me now is the fact that I feel like I still have so many tricks that I want to learn and so many things that I can still do. And so many cool things outside of sports that I have been doing.;Shaun White;cool
If people in the media cannot decide whether they are in the business of reporting news or manufacturing propaganda, it is all the more important that the public understand that difference, and choose their news sources accordingly.;Thomas Sowell;business
Sometimes it's the smallest decisions that can change your life forever.;Keri Russell;life
If the critics are right that I've made all my decisions based on polls, then I must not be very good at reading them.;Barack Obama;good
The only history is a mere question of one's struggle inside oneself. But that is the joy of it. One need neither discover Americas nor conquer nations, and yet one has as great a work as Columbus or Alexander, to do.;David Herbert Lawrence;history
Every major player is working on this technology of artificial intelligence. As of now, it's benign... but I would say that the day is not far off when artificial intelligence as applied to cyber warfare becomes a threat to everybody.;Ted Bell;technology
This Bible is for the government of the people, by the people and for the people.;John Wycliffe;government
I actually may do a musical next year... not one that I've written one that I may star in. Plus my concert and other people's work and all of a sudden you've got a very full life.;Harvey Fierstein;work
Food is not just what we put in our mouths to fill up it is culture and identity. Reason plays some role in our decisions about food, but it's rarely driving the car.;Jonathan Safran Foer;car
What we achieve inwardly will change outer reality.;Plutarch;inspirational
That strong mother doesn't tell her cub, Son, stay weak so the wolves can get you. She says, Toughen up, this is reality we are living in.;Lauryn Hill;mom
We work to become, not to acquire.;Elbert Hubbard;work
He surprised me by his familiarity with details of movements and battles which I did not suppose had come to his knowledge. As he kept me talking for over half an hour, I flattered myself that what I had to say interested him.;Henry Villard;knowledge
I hope my own children never have to fight a war.;George H. W. Bush;war
A friendship like love is warm a love like friendship is steady.;Thomas More;friendship
Labels don't mean anything to me. I'm trying to play as passionately as I'm able to. If they want to call that cool, that's fine. Just spell the name right, is the formula.;Lee Konitz;cool
Perfect numbers like perfect men are very rare.;Rene Descartes;men
The first time I sang in the church choir two hundred people changed their religion.;Fred Allen;religion
Failure is not fatal, but failure to change might be.;John Wooden;failure
There's the theory that nudity doesn't really make something sexy the characters and their relationship make it sexy.;Tim Robbins;relationship
It's sort of a feeling of power onstage. It's really the ability to make people smile, or just to turn them one way or another for that duration of time, and for it to have some effect later on. I don't really think it's power... it's the goodness.;Robert Plant;power
Why should society feel responsible only for the education of children, and not for the education of all adults of every age?;Erich Fromm;age
I hope that what it comes down to at the end of the day is that people believe that I believe what I'm singing. It comes down to being believable. You don't have to be likeable generally, though, I think I am.;John Mayer;hope
It disturbs me no more to find men base, unjust, or selfish than to see apes mischievous, wolves savage, or the vulture ravenous.;Jean-Paul Sartre;men
I'm starting to judge success by the time I have for myself, the time I spend with family and friends. My priorities aren't amending they're shifting.;Brendan Fraser;success
Barack Obama knows that to create an economy built to last, we need to focus on middle-class families. Families who stay up on Sunday nights pacing the floor, like my dad did, while their children, tucked in bed, dream big dreams. Families who aren't sure what Monday morning will bring, but who believe our nation's best days are still ahead.;Charles Schumer;dad
The Israeli people must be free to live in peace and security.;Chuck Hagel;peace
Dr. Johnson has said that the chief glory of a country arises from its authors. But then that is only as they are oracles of wisdom unless they teach virtue, they are more worthy of a halter than of the laurel.;Jane Porter;wisdom
Einstein, stop telling God what to do!;Niels Bohr;god
If we fear the unknown then surely we fear ourselves.;Bryant H. McGill;fear
I think every girl needs to love herself, regardless of anything. Like if you're having a bad day, if you don't like your hair, if you don't have the best family situation, whatever, you have to love yourself and you can't do anything until you love yourself first.;Julianne Hough;best
I try to give to the poor people for love what the rich could get for money. No, I wouldn't touch a leper for a thousand pounds yet I willingly cure him for the love of God.;Mother Teresa;money
There are absolutely no problems between me, my dad and my sister. Obviously I grew up with just my mum, but my relationship with my dad is just fine.;Norah Jones;dad
I have been able to travel all over the country and see many places that I probably never would have visited. I have also participated in many charity events for worthy causes.;Rob Mariano;travel
Whoever sets any bounds for the reconstructive power of the religious life over the social relations and institutions of men, to that extent denies the faith of the Master.;Walter Rauschenbusch;faith
The strength of America is not in Washington.;J. C. Watts;strength
You get up about 2-3 o'clock in the morning and get through about 7 or 8 and 12 hours later you start all over. That's the worst kind of work a person can do. You have to do these two shifts to get one day.;Buck Owens;morning
I know that I've got big ears and a big forehead and that my hair sticks up. But I'm happy with myself. I'm not necessarily trying to win a beauty pageant here.;Clay Aiken;beauty
From the beginning, there have been some religious leaders who greeted the funding of faith-based social services by government with ambivalence.;Tony Campolo;government
We have really good data that show when you take patients and you really inform them about their choices, patients make more frugal choices. They pick more efficient choices than the health care system does.;Donald Berwick;health
You know they say the most dangerous person of the world is a member of the United States Congress just home from a three-day fact-finding trip.;Johnny Isakson;politics
Love is a symbol of eternity. It wipes out all sense of time, destroying all memory of a beginning and all fear of an end.;Madame de Stael;fear
He that fails in his endeavors after wealth or power will not long retain either honesty or courage.;Samuel Johnson;courage
Pop music is aspirin and the blues are vitamins.;Peter Tork;music
The work of science is to substitute facts for appearances, and demonstrations for impressions.;John Ruskin;science
When men speak ill of thee, live so as nobody may believe them.;Plato;men
Love thou the rose, yet leave it on its stem.;Edward G. Bulwer-Lytton;nature
Freedom is the only law which genius knows.;James Russell Lowell;freedom
Natural science will in time incorporate into itself the science of man, just as the science of man will incorporate into itself natural science: there will be one science.;Karl Marx;science
People look for their leadership to lead.;Mick Cornett;leadership
To keep the record straight, it wasn't always John and Yoko. We've all accused one another of various business things we tend to be pretty paranoid by now, as you can imagine. There's a lot of money involved.;Paul McCartney;money
The music stuff is just a hobby.;Tom Felton;music
To be in a situation where you have no rights whatsoever is something I wish everybody could experience. People's attitudes would change. It would be a better place.;Tommy Chong;change
He who rejects change is the architect of decay. The only human institution which rejects progress is the cemetery.;Harold Wilson;change
My dad was rubbish at all other aspects of his financial life, but he's pretty good at paying the rent.;Robert Carlyle;dad
Shakespeare fascinated me. He hardly ever left the country. His imagination was worldwide though reading.;Michael Tippett;imagination
Social topics may hit too close to home for people, but then again, if you pull a heartstring, then that's what country music is. It's not just songs about getting drunk and leaving your girl.;Kenny Chesney;music
Well Microsoft really does develop some really interesting technology.;Miguel de Icaza;technology
Books and all forms of writing are terror to those who wish to suppress the truth.;Wole Soyinka;truth
I tried to bake a cake for my mother's birthday - it took me four hours. It was terrible, and I cried for three days.;Rachael Ray;birthday
My dad was a sports writer when I was younger and then he became just a general columnist. But I grew up with him literally getting into brawls with football coaches.;Amy Klobuchar;sports
NASA was going to pick a public school teacher to go into space, observe and make a journal about the space flight, and I am a teacher who always dreamed of going up into space.;Christa McAuliffe;teacher
I own stock, and I also insure my car with Geico.;Ernie Banks;car
There's nothing wrong with acknowledging the panoply of life's rich experience.;David Duchovny;experience
Life is either a great adventure or nothing.;Helen Keller;life
I was raised in Boston by three older brothers and a very strong and empowering single mom.;Eliza Dushku;mom
By trying we can easily endure adversity. Another man's, I mean.;Mark Twain;funny
It takes someone with a vision of the possibilities to attain new levels of experience. Someone with the courage to live his dreams.;Les Brown;dreams
We have entered an age in which education is not just a luxury permitting some men an advantage over others. It has become a necessity without which a person is defenseless in this complex, industrialized society. We have truly entered the century of the educated man.;Lyndon B. Johnson;education
And I do believe that the way to change a society, to uplift people - not just their spirit, but to uplift their society and economic base - is through education.;Rainn Wilson;change
The Christian religion, though scattered and abroad will in the end gather itself together at the foot of the cross.;Johann Wolfgang von Goethe;religion
Of all the tyrannies that affect mankind, tyranny in religion is the worst.;Thomas Paine;religion
Poetry is a political act because it involves telling the truth.;June Jordan;poetry
I want the big drama. I always said I don't want a wedding I want a parade.;Star Jones;wedding
The truth, the absolute truth, is that the chief beauty for the theatre consists in fine bodily proportions.;Sarah Bernhardt;beauty
The experience and behavior that gets labeled schizophrenic is a special strategy that a person invents in order to live in an unlivable situation.;R. D. Laing;experience
A good teacher can inspire hope, ignite the imagination, and instill a love of learning.;Brad Henry;hope
The atmosphere seems to change once the sun goes down and the race fans get to watch a good show.;Dale Earnhardt;change
Government is like a baby. An alimentary canal with a big appetite at one end and no sense of responsibility at the other.;Ronald Reagan;government
Someday, after mastering the winds, the waves, the tides and gravity, we shall harness for God the energies of love, and then, for a second time in the history of the world, man will have discovered fire.;Pierre Teilhard de Chardin;god
Gun control means control. It means control for the government and the government starts controlling the people.;Luke Scott;government
My dad used to love Steely Dan, the Stones, Jethro Tull and all that. There was always Steely Dan going in my dad's car, but I remember The Royal Scam in particular because it has 'Kid Charlemagne' on it.;St. Vincent;dad
We make a living by what we get, but we make a life by what we give.;Winston Churchill;government
Governments have never learned anything from history, or acted on principles deducted from it.;Georg Wilhelm Friedrich Hegel;history
Which European leader today would not relish the wonder-working powers of a Moses? Budget deficit? Unpopular cuts? How about just a little miracle, an overnight increase in gold reserves, a new oil field, or the next world-changing communications technology? Surely that's not too much to ask.;Jonathan Sacks;technology
I was raised in Chicago and I guess that was one of the special breeding grounds for gangsters of all colors. That was the Detroit of the gangster world. The car industry was thugs.;Quincy Jones;car
No struggle can ever succeed without women participating side by side with men.;Muhammad Ali Jinnah;equality
A man ought to live so that everybody knows he is a Christian... and most of all, his family ought to know.;Dwight L. Moody;family
I was certain I was going to do something in sports.;Tyler Christopher;sports
What we imagine is order is merely the prevailing form of chaos.;Kerry Thornley;imagination
We were learning together. We'd go to various clinics and try to learn as much as possible.;Tom Conway;learning
When I was in elementary school, I used to write letters to myself. I'd write letters and go 'Dear Kristen-at-16-years-old, happy birthday. I hope you're doing something.';Kristin Kreuk;birthday
Patriotism is an indispensable weapon in the defense of civilization against barbarism.;Bill Kristol;patriotism
Never put a sock in a toaster.;Eddie Izzard;funny
Parents are usually more careful to bestow knowledge on their children rather than virtue, the art of speaking well rather than doing well but their manners should be of the greatest concern.;R. Buckminster Fuller;knowledge
I believe that the short story is as different a form from the novel as poetry is, and the best stories seem to me to be perhaps closer in spirit to poetry than to novels.;Tobias Wolff;poetry
My view is that good community management is like having good municipal government: You should be able to have dissenting opinions and so on, freedom of speech, but your grandmother should also be able to walk down the street at night without having to worry about getting mugged.;Jimmy Wales;freedom
If I ever completely lost my nervousness I would be frightened half to death.;Paul Lynde;death
There are so many things to think about when you make an album. Like, who am I trying to impress? Am I going to get respect, critical acclaim? Or am I going to sell lots of records?;Ellie Goulding;respect
Everything has its wonders, even darkness and silence, and I learn, whatever state I may be in, therein to be content.;Helen Keller;happiness
There are pretenders to piety as well as to courage.;Moliere;courage
Really you just gotta keep chugging along and keep a positive attitude and get through all the problems. You gotta face them, otherwise you don't get through.;Lesley Gore;attitude
The most wonderful study of mankind is man. Relieving human suffering and diffusing universal knowledge is humanitarian.;Daniel D. Palmer;knowledge
Women do not have as great a need for poetry because their own essence is poetry.;Karl Wilhelm Friedrich Schlegel;women
Hold fast to youth and beauty.;Elizabeth Arden;beauty
I deeply adored my mum. She was an extraordinary person, even for the prejudice I'm likely to have. She was beautiful, amusing, a tremendous elaborator of things into comic proportions and extravagant in her imagination.;Andrew Motion;imagination
The Bible is not man's word about God, but God's word about man.;John Barth;god
The way I feel about music is that there is no right and wrong. Only true and false.;Fiona Apple;music
But by providing the background picture - the universal situational awareness that we desire - by showing the anomalies, the Space-Based Radar will change the nature of how we do our analysis and our intelligence.;Stephen Cambone;intelligence
I agree completely with my son James when he says 'Internet is like electricity. The latter lights up everything, while the former lights up knowledge'.;Kerry Packer;knowledge
I'm thrilled to continue my partnership with U by Kotex for Generation Know while helping to empower girls. I've always been a motivational resource for my younger sisters and hope I can positively impact and inspire other young girls too.;Khloe Kardashian;hope
I can't understand people calling themselves religious and being hateful. If a preacher is preaching hate, to fear God that's not religion, that's not helping humanity, that's organizing an army to defeat somebody.;Mojo Nixon;fear
Living in dreams of yesterday, we find ourselves still dreaming of impossible future conquests.;Charles Lindbergh;future
The mountains are calling and I must go.;John Muir;nature
Leadership cannot just go along to get along. Leadership must meet the moral challenge of the day.;Jesse Jackson;leadership
I've drunk Amazon's free Diet Coke. Nothing makes more sense to me than a company trying to make bookselling into a profitable business. I'm not anti-Amazon, and I'm not pro-publishers either. I'm pro-books.;Lev Grossman;business
As human beings, we need to know that we are not alone, that we are not crazy or completely out of our minds, that there are other people out there who feel as we do, live as we do, love as we do, who are like us.;Billy Joel;alone
There's something incredibly sexy about sand and sweat and dunes photographed like women's backs.;Kristin Scott Thomas;women
I do other sorts of things. I act in other people's movies. I direct operas. I write books.;Werner Herzog;movies
Don't get too comfortable with who you are at any given time - you may miss the opportunity to become who you want to be.;Jon Bon Jovi;time
Most of the press is in league with government, or with the status quo.;Harold Pinter;government
I haven't trusted polls since I read that 62% of women had affairs during their lunch hour. I've never met a woman in my life who would give up lunch for sex.;Erma Bombeck;women
Charlatanism of some degree is indispensable to effective leadership.;Eric Hoffer;leadership
Love is something far more than desire for sexual intercourse it is the principal means of escape from the loneliness which afflicts most men and women throughout the greater part of their lives.;Bertrand Russell;women
I really wish we could stay longer in the countries we visit, but I've been lucky to have visited most of them before, because I've done a tremendous amount of travel.;Phil Keoghan;travel
I have no hostility to nature, but a child's love to it. I expand and live in the warm day like corn and melons.;Ralph Waldo Emerson;nature
The dread of lonliness is greater than the fear of bondage, so we get married.;Cyril Connolly;fear
I want the Arabic Granada, that which is art, which is all that seems to me beauty and emotion.;Isaac Albeniz;beauty
The rich are always going to say that, you know, just give us more money and we'll go out and spend more and then it will all trickle down to the rest of you. But that has not worked the last 10 years, and I hope the American public is catching on.;Warren Buffett;hope
People don't have time to wait for somebody to paint their portraits anymore. The money is in photography.;Robert Mapplethorpe;money
I was almost 8 years old when I was watching a kid on a TV commercial, and I told my mom that I wanted to do the same thing. She said that I would need to get an agent and that she would research it.;Victoria Justice;mom
Knowledge is the eye of desire and can become the pilot of the soul.;Will Durant;knowledge
I think any branding for me is band-related. It's really weird to get used to the exposure, because I am a naturally introverted person, and I'm not exactly social. Occasionally I can get comfortable enough to talk, but I spend a lot of my days not talking, especially when I'm at home and not on tour.;Nate Ruess;home
This weird thing happens when you're in a movie that has some level of success. People start offering you all kinds of things, and they just expect you to do them because they'll be good for your career. It's not about the project's integrity or anything like that.;Kristen Stewart;success
Sometimes it's so weird just to do an interview. This morning I was back in my parents' house, with my brother, and we went for a jog together, then had breakfast as a family. And a couple of hours later I'm wearing high heels and a dress and makeup, and talking about my job.;Carey Mulligan;morning
Artschwager's art always involves looking closely at surfaces, questions what an object is, wants to make you forget the name of the thing you're looking at so that it might mushroom in your mind into something that triggers unexpected infinities.;Jerry Saltz;art
Politics is the science of urgencies.;Theodore Parker;science
Own only what you can always carry with you: know languages, know countries, know people. Let your memory be your travel bag.;Aleksandr Solzhenitsyn;travel
The Academy Awards was an amazing night. I know I kind of lost my mind a little bit. I apologize for that. That night went so fast I can't remember what I said or what happened.;Cuba Gooding, Jr.;amazing
As much as I would love to be a person that goes to parties and has a couple of drinks and has a nice time, that doesn't work for me. I'd just rather sit at home and read, or go out to dinner with someone, or talk to someone I love, or talk to somebody that makes me laugh.;Daniel Radcliffe;work
I feel good because I believe I have made progress in rebuilding the people's trust in their government.;Arnold Schwarzenegger;trust
My music is bejewelled, it's colourful, it's romantic, it shines.;Carly Rae Jepsen;romantic
There is so much that must be done in a civilized barbarism like war.;Amelia Earhart;war
Canada's the best country in the world.;Justin Bieber;best
I never sort of thought of myself as a comedy writer, by nature.;Lena Dunham;nature
Art evokes the mystery without which the world would not exist.;Rene Magritte;art
You can survive with anger, but you can't live with it forever.;Ariel Dorfman;anger
I don't go to Mass every day. But I go to church every day. Just sitting there, thinking - it's a great way to start the morning, you know? You feel so good coming out, and your approach to everything is suddenly really clear.;Mark Wahlberg;morning
To those who have chosen the profession of medicine, a knowledge of chemistry, and of some branches of natural history, and, indeed, of several other departments of science, affords useful assistance.;Charles Babbage;knowledge
The world is governed by opinion.;William Ellery Channing;politics
They pick all of us out, and then they decide, they computerize, decide if they like it or don't like it, and then they go home, and then they come back again because they're not sure what they saw.;Alice Cooper;home
The world is full of people looking for spectacular happiness while they snub contentment.;Doug Larson;happiness
You cannot mistake Bush's clarity of purpose. He believes in a story about freedom and opportunity that makes his followers feel like they aren't just ticking their days down but are part of something larger than themselves.;Eric Liu;freedom
Black Friday is not another bad hair day in Wall Street. It's the term used by American retailers to describe the day after the Thanksgiving Holiday, seen as the semi-official start of Christmas shopping season.;Evan Davis;thanksgiving
Product management really is the fusion between technology, what engineers do - and the business side.;Marissa Mayer;technology
Always vote for principle, though you may vote alone, and you may cherish the sweetest reflection that your vote is never lost.;John Quincy Adams;politics
Knowledge is the most democratic source of power.;Alvin Toffler;knowledge
Well, it's very dangerous to project, but it's clear that the existing technology has some more years to go.;Jack Kilby;technology
History has demonstrated that the most notable winners usually encountered heartbreaking obstacles before they triumphed. They won because they refused to become discouraged by their defeats.;B. C. Forbes;history
My girlfriend Siri is a food blogger, and we both love to entertain and eat. This is what happens when you're in your thirties: what was once a passion and real appetite for nightlife in New York City manifests itself into other things, like entertaining at home.;Carson Daly;food
It's continuously humbling to work hard, you know? As long as you've got a good work ethic and a sense of humor, I don't think anybody can become too much of an egoist under those circumstances.;Rachael Ray;work
My subject is War, and the pity of War. The Poetry is in the pity.;Wilfred Owen;war
Fudging the data in any way whatsoever is quite literally a sin against the holy ghost of science. I'm not religious, but I put it that way because I feel so strongly. It's the one thing you do not ever do. You've got to have standards.;James Lovelock;science
