Now is the moment when we can stand up and say, 'I'm an American. I make my destiny. And we deserve better! My children deserve better! My family deserves better. My country deserves better!' So here we stand. Americans have a choice.;Mitt Romney;family
I have learned from my experiences in this industry that there is absolutely no way to control people's opinions on your performance in your movie. You go out there, promote your film and hope people like the work you did.;Leonardo DiCaprio;hope
In both children and adults, there can be a hard-to-deny link between a robust sense of hope and either work productivity or academic achievement.;Jeffrey Kluger;hope
There is nothing I love as much as a good fight.;Franklin D. Roosevelt;good
At the very outset I want to say how the people of America appreciate the steadfast support of the people of Morocco, the leadership of Morocco in our war against terrorism.;Donald Evans;leadership
Communication - the human connection - is the key to personal and career success.;Paul J. Meyer;communication
Pray thee, spare, thyself at times: for it becomes a wise man sometimes to relax the high pressure of his attention to work.;Thomas Aquinas;work
You want to do your job well so that people in the future say, 'OK, he's not bad, let's hire him.';Javier Bardem;future
When you are young your imagination is so clear.;Nina Blackwood;imagination
The Eskimos had fifty-two names for snow because it was important to them: there ought to be as many for love.;Margaret Atwood;love
Education has for its object the formation of character.;Herbert Spencer;education
What sculptors do is represent the essence of gesture. What is important in mime is attitude.;Marcel Marceau;attitude
After spending time with the rescued turkeys at Farm Sanctuary's shelter and seeing how similar they are to my furry companion animals at home, I knew I needed to do everything in my power to protect these friendly and curious birds from the daily pain and suffering they endure on factory farms.;Ginnifer Goodwin;home
So far as it depends on the course of this government, our relations of good will and friendship will be sedulously cultivated with all nations.;John Tyler;friendship
I have nothing but respect for the Lakers. So many of their legends shaped who I am as a person and player.;Bill Walton;respect
The things I want to know are in books my best friend is the man who'll get me a book I ain't read.;Abraham Lincoln;best
A man who is good enough to shed his blood for the country is good enough to be given a square deal afterwards.;Theodore Roosevelt;good
Love is the joy of the good, the wonder of the wise, the amazement of the Gods.;Plato;love
There's never really been a real hood Christmas movie.;Ice Cube;christmas
My mom is two people to me. She's my mom number one, and then she's this lady most comedians know as being a legendary owner of a nightclub that's responsible for starting a lot of heavy careers.;Pauly Shore;mom
Schools are not intended to moralize a wicked world, but to impart knowledge and develop intelligence, with only two social aims in mind: prepare to take on one's share in the world's work, and perhaps in addition, lend a hand in improving society, after schooling is done.;Jacques Barzun;knowledge
Women don't want to hear what you think. Women want to hear what they think - in a deeper voice.;Bill Cosby;women
Everything's coming up roses - for me.;Ethel Merman;valentinesday
For people to understand me when I travel, I speak with my hands.;Marcel Carne;travel
I have always thought that change you can see and feel is best.;Henry Rollins;best
I know where I'm going and I know the truth, and I don't have to be what you want me to be. I'm free to be what I want.;Muhammad Ali;motivational
Happiness comes of the capacity to feel deeply, to enjoy simply, to think freely, to risk life, to be needed.;Storm Jameson;happiness
Does age matter? Time doesn't matter.;Sandra Bullock;age
It's time to get real, folks. Hope and change ain't working. Hope and change is not a solution. Hope and change is not a job.;Herman Cain;change
I have mostly been terrified of listening to scary stories around a campfire. We camp a lot as a family, and at night my dad would try and tell us scary stories. This made eating s'mores difficult. The story would start with something like... 'and the old man who lived in these woods...' I would then run back into the camper terrified.;Willow Shields;dad
You leave home to seek your fortune and, when you get it, you go home and share it with your family.;Anita Baker;home
Content and technology are strange bed fellows. We are joined together. Sometimes we misunderstand each other. But isn't that after all the definition of marriage?;Howard Stringer;technology
Miracles, in the sense of phenomena we cannot explain, surround us on every hand: life itself is the miracle of miracles.;George Bernard Shaw;life
In religious and in secular affairs, the more fervent beliefs attract followers. If you are a moderate in any respect - if you're a moderate on abortion, if you're a moderate on gun control, or if you're a moderate in your religious faith - it doesn't evolve into a crusade where you're either right or wrong, good or bad, with us or against us.;Jimmy Carter;faith
Learning is pleasurable but doing is the height of enjoyment.;Novalis;learning
There's nothing like coming home here, having the day off or morning off and going surfing. In Orlando I don't know what I would do.;Corbin Bernsen;morning
We are faced with the paradoxical fact that education has become one of the chief obstacles to intelligence and freedom of thought.;Bertrand Russell;education
Women with money and women in power are two uncomfortable ideas in our society.;Candace Bushnell;society
I am very averse to bringing myself forward in print, but as my account will only appear as an appendage to a former production, and as it will be confined to such topics as have connection with my authorship alone, I can hardly accuse myself of a personal intrusion.;Mary Wollstonecraft Shelley;alone
Make no little plans they have no magic to stir men's blood.;Daniel Burnham;men
Throw in the humor, throw in that personality, try things you wouldn't normally try.;Melinda Clarke;humor
The first thing I've learned is to trust nobody.;Josh Bowman;trust
Each person has inside a basic decency and goodness. If he listens to it and acts on it, he is giving a great deal of what it is the world needs most. It is not complicated but it takes courage. It takes courage for a person to listen to his own goodness and act on it.;Pablo Casals;courage
I hope one day I will host my own charity event to give back to society.;Yani Tseng;hope
I've got a very deep and abiding passion about education being far more than buildings and textbooks it's what children bring into school with them.;Johann Lamont;education
My mother, Lillie Specter, was an angel and totally uninterested in politics.;Arlen Specter;politics
Don't fear anything for your letters, they are burnt one by one and I hope you do the same with mine.;Camille Claudel;fear
I don't get rattled about the big things. I get rattled when I have to pick up my laundry, get gas in the car, pick up a script.;Sherry Stringfield;car
When I was a child I used to read books by Gerald Durrell, who founded Jersey Zoo. He had a job collecting animals for zoos and for a long time that is what I wanted to do. Later when I was a teenager I had a fantastic English teacher called Mrs. Stafford. Her enthusiasm made me decide to be a writer.;Melvin Burgess;teacher
He who does not fear death cares naught for threats.;Pierre Corneille;fear
You cannot live to please everyone else. You have to edify, educate and fulfill your own dreams and destiny, and hope that whatever your art is that you're putting out there, if it's received, great, I respect you for receiving it. If it's not received, great, I respect you for not.;Octavia Spencer;dreams
We live in a world where amnesia is the most wished-for state. When did history become a bad word?;John Guare;history
You see much more of your children once they leave home.;Lucille Ball;funny
Shouldn't Democrats insist that Sen. Durbin step down as their whip, the number two man in their leadership?;Bill Kristol;leadership
There's a nastiness out there that wants to harm me with words. These are my enemies - the ideologues, the populists, the columnists who don't like the fact that I take them on toe-to-toe. What I try to do is tell the truth. It's not the coin of the realm in politics.;Ed Koch;politics
I think the part of media that romanticizes criminal behavior, things that a person will say against women, profanity, being gangster, having multiple children with multiple men and women and not wanting to is prevalent. When you look at the majority of shows on television they placate that kind of behavior.;Bill Cosby;men
Education is a kind of continuing dialogue, and a dialogue assumes different points of view.;Robert M. Hutchins;education
I liked getting the best villain award. I thought that was funny.;Stephen Dorff;funny
But I absolutely believe that architecture is a social activity that has to do with some sort of communication or places of interaction, and that to change the environment is to change behaviour.;Thom Mayne;communication
What is amazing for a woman of my age is that I change as the world is changing-and changing very, very fast. I don't think my mother had that opportunity to change.;Jeanne Moreau;age
If the leader is filled with high ambition and if he pursues his aims with audacity and strength of will, he will reach them in spite of all obstacles.;Karl Von Clausewitz;strength
If a little knowledge is dangerous, where is the man who has so much as to be out of danger?;Thomas Huxley;knowledge
We neither laugh alone, nor weep alone, why then should we pray alone?;Anna Letitia Barbauld;alone
The secret of long life is double careers. One to about age sixty, then another for the next thirty years.;David Ogilvy;age
Toleration is good for all, or it is good for none.;Edmund Burke;good
Covetousness is both the beginning and the end of the devil's alphabet - the first vice in corrupt nature that moves, and the last which dies.;Michel de Montaigne;nature
Human memory is a marvelous but fallacious instrument. The memories which lie within us are not carved in stone not only do they tend to become erased as the years go by, but often they change, or even increase by incorporating extraneous features.;Primo Levi;change
Most of my arguments with musicians through the years have had more to do with their attitude about music, or their attitude about their own lives, or their personal responsibility. Music has never really been the big centerpiece of the fight.;Billy Corgan;attitude
The Bible tells us that Jesus Christ came to do three things. He came to have my past forgiven, you get a purpose for living and a home in Heaven.;Rick Warren;easter
There is no progress whatever. Everything is just the same as it was thousands, and tens of thousands, of years ago. The outward form changes. The essence does not change.;Robert Louis Stevenson;change
Marriage, like money, is still with us and, like money, progressively devalued.;Robert Graves;marriage
I think the most exciting thing is that you expect people our age to know the music, but actually a lot of kids know the music, and if anything is left, we have left really good music, and that's the important part, not the mop-tops or whatever.;Ringo Starr;age
Friends are very important to me, and I have always had many of them. There are probably many reasons why this is so, but two seem to me more valid than any of the others I am a naturally friendly person, and I hate to be alone.;Georg Solti;alone
A wise nation should cultivate a political spirit that allows opponents to cooperate without fearing an automatic execution from their core supporters. Who knew that the real rogues in American politics would be the ones who dare to get along?;Jon Meacham;politics
The best way to know God is to love many things.;Vincent Van Gogh;god
My attitude toward graduate students was different, I must say. I used graduate students as colleagues: I gave them the best problems to work on, and I encouraged them.;Frank Press;attitude
I tour alone. There's no sound check, no back up. I stay with the hosts I am in a family home and it's really nourishing. I just have to remember after the show not to run out into the living room in my pyjamas. Every day, it's a new relationship being built. It's odd and wonderful.;Jane Siberry;relationship
I would love to do a biopic of a famous singer, like Diana Ross or Donna Summer, or an old jazz story that we haven't seen before. I would love to do that! I would love to play Diana Ross 'cause she's an icon. I'm salivating to do that.;Taraji P. Henson;famous
I try to give to the poor people for love what the rich could get for money. No, I wouldn't touch a leper for a thousand pounds yet I willingly cure him for the love of God.;Mother Teresa;god
I'm a horrible romantic!;Jamie Campbell Bower;romantic
Fundamentalists are panicked by the apparent disintegration of the family, the disappearance of certainty and the decay of morality. Fear leads them to ask, if we cannot trust the Bible, what can we trust?;Garrett Hardin;trust
I think the difficult thing is the transition between TV competition series and going into the actual music industry. There still seems to be a slight disconnect there.;Adam Lambert;music
I first became a vegetarian when I was nine, in response to an argument made by a radical babysitter. My great change - which lasted a couple of weeks - was based on the very simple instinct that it's wrong to kill animals for food.;Jonathan Safran Foer;food
You'll be much more successful if you follow your dreams and follow your passions.;Jay Weatherill;dreams
I try to stay positive by focusing on how much I'll appreciate my health if I get better.;Daniel Johns;health
By three methods we may learn wisdom: First, by reflection, which is noblest Second, by imitation, which is easiest and third by experience, which is the bitterest.;Confucius;wisdom
I believe in stopping work and eating lunch.;L'Wren Scott;work
Friendship needs no words - it is solitude delivered from the anguish of loneliness.;Dag Hammarskjold;friendship
People don't have fortunes left them in that style nowadays men have to work and women to marry for money. It's a dreadfully unjust world.;Louisa May Alcott;money
You're not working with models, you're working with real women who have, like, anatomy. Models do not have anatomy.;Isaac Mizrahi;women
There are three constants in life... change, choice and principles.;Stephen Covey;change
I think movies have much more magic than the theater. Theater can be a magical experience, but movies thrust their subjectivity on you in a more profound way.;Zoe Kazan;movies
I don't fear death because I don't fear anything I don't understand. When I start to think about it, I order a massage and it goes away.;Hedy Lamarr;death
I delight in my family obligations, but they leave little time for breaks let alone quick trips across the country.;Carre Otis;alone
When it comes to gossip, I have to readily admit men are as guilty as women.;Marilyn Monroe;men
The best thing I've done with my money is buy a house for my family. You wake up to a house you love and you feel like somebody.;Ice Cube;family
Countries across the world are taking action now to help them track paedophiles and terrorists who abuse new technology to plot their horrific crimes.;Theresa May;technology
You know among people who kind of travel a lot and have exposure to the United States and some other countries, they do have accounts, but you know, Russia is not exactly the place with multiple language skills so local networks kind of have an edge.;Yuri Milner;travel
Mama was my greatest teacher, a teacher of compassion, love and fearlessness. If love is sweet as a flower, then my mother is that sweet flower of love.;Stevie Wonder;teacher
So after the Lewinsky scandal, everything changed, and we moved from using the Bible to address the moral issues of our time, which were social, to moral issues of our time that were very personal. I have continued that relationship up until the present.;Tony Campolo;relationship
You can't fall back on the private sector and say, 'You take care of the nation's banking system.' That's a fundamental function of the government, the Federal Reserve, the Treasury and the FDIC, etc. All of those agencies have a major role to play there.;Dick Cheney;government
I have long enjoyed the friendship and companionship of Republicans because I am by instinct a teacher, and I would like to teach them something.;Woodrow Wilson;politics
Most people are satisfied with the junk food being sold as music.;Billy Joel;music
Beauty attracts us men but if, like an armed magnet it is pointed, beside, with gold and silver, it attracts with tenfold power.;Jean Paul;beauty
Love does not consist in gazing at each other, but in looking outward together in the same direction.;Antoine de Saint-Exupery;love
Restore human legs as a means of travel. Pedestrians rely on food for fuel and need no special parking facilities.;Lewis Mumford;travel
So here's the question: Without a change in leadership, why would the next four years be any different from the last four years?;Paul Ryan;change
I guess at the end of the day, all women like to be appreciated and treated with respect and kindness.;Sofia Vergara;women
He was very commanding, and you had to know what you were doing to work for Mr. Rogers. I learned how to ride very quickly with him as my riding teacher.;Glenn Ford;teacher
Nothing is so galling to a people not broken in from the birth as a paternal, or in other words a meddling government, a government which tells them what to read and say and eat and drink and wear.;Thomas W. Higginson;humor
I think there was a revolution in poetry, associated chiefly with Eliot and Pound but maybe it is of the nature of revolutions or of the nature of history that their innovations should later come to look trivial or indistinguishable from technical tricks.;Howard Nemerov;poetry
In time of war the laws are silent.;Marcus Tullius Cicero;war
When you reach a certain status in Hollywood, you have to play a lot of games to stay in the limelight. It becomes more about being famous than being an actor.;Jason Lee;famous
To counter the avoidance of intellectual challenge and responsibility, we must reduce the domination of certainty in education.;William Glasser;education
Who ever is out of patience is out of possession of their soul.;Francis Bacon;patience
When Jesus comes back, these crazy, greedy, capitalistic men are gonna kill him again.;Mike Tyson;men
Beauty is truth's smile when she beholds her own face in a perfect mirror.;Rabindranath Tagore;beauty
Failure doesn't mean you are a failure it just means you haven't succeeded yet.;Robert H. Schuller;failure
My dad was a workaholic. I saw him work seven days a week.;Kay Bailey Hutchison;dad
Children seem naturally drawn to poetry - it's some combination of the rhyme, rhythm, and the words themselves.;Jack Prelutsky;poetry
Power is so characteristically calm, that calmness in itself has the aspect of strength.;Edward G. Bulwer-Lytton;power
Before God we are all equally wise - and equally foolish.;Albert Einstein;equality
There is something good in all seeming failures. You are not to see that now. Time will reveal it. Be patient.;Sivananda;good
Hope begins in the dark, the stubborn hope that if you just show up and try to do the right thing, the dawn will come. You wait and watch and work: you don't give up.;Anne Lamott;hope
A fascist is one whose lust for money or power is combined with such an intensity of intolerance toward those of other races, parties, classes, religions, cultures, regions or nations as to make him ruthless in his use of deceit or violence to attain his ends.;Henry A. Wallace;money
Death is one moment, and life is so many of them.;Tennessee Williams;death
Here you have a new technology, and if that technology is going to work, you must allow people to provide central indexes of the data. It's just like a newspaper that publishes classified ads.;David Boies;technology
I don't want to wake up and be bored. That's probably my greatest fear is to have nothing to do. What better job is there than to play quarterback for an NFL team, and certainly one that I've been on for a long time and had success with? I don't plan on giving it up any time soon.;Tom Brady;success
In early high school years, I was pretty chubby, and I spent a lot of time on my computer, before it was cool to have a computer - because there was a time that was true. So that's where I developed my personality.;Rashida Jones;cool
I can't see what's wrong about assuming intelligence in your audience and what's bad news about being rewarded for assuming that.;Steven Moffat;intelligence
Men, when they fight in movies, it's a very different style. Harrison Ford was so cool when he had the whip, and Bruce Lee was such an artist that you couldn't take your eyes off of him.;Lucy Liu;cool
You can find out anything you want about a car now, and especially every bit of information about the price, without relying on the dealers.;Susan Orlean;car
My original inspiration was my mom: a few years after the death of my dad, she started dating one my teachers!;Meg Cabot;dating
Start every day off with a smile and get it over with.;W. C. Fields;humor
One of the darkest, deepest shames so many of us mothers feel nowadays is our fear that we are Bad Mothers, that we are failing our children and falling far short of our own ideals.;Ayelet Waldman;fear
I can't believe it. I'm speechless. It is amazing to see where I've come from the last two years.;Libby Trickett;amazing
Based on 30 years of experience with the Iranians, they will give you 100 words. Trust only one of the 100.;Hamad bin Khalifa Al Thani;trust
No science is immune to the infection of politics and the corruption of power.;Jacob Bronowski;power
Courage is just fear, plus prayers, plus understanding.;Edward Albert;courage
The minute health care becomes a huge, unwieldy, expensive government bureaucracy it's a permanent feature of life and there's nothing anyone can do about it.;Mark Steyn;health
The happiness of society is the end of government.;John Adams;government
Women are never disarmed by compliments. Men always are. That is the difference between the sexes.;Oscar Wilde;men
Time takes away the grief of men.;Desiderius Erasmus;men
One of the great attractions of patriotism - it fulfills our worst wishes. In the person of our nation we are able, vicariously, to bully and cheat. Bully and cheat, what's more, with a feeling that we are profoundly virtuous.;Aldous Huxley;great
A woman whose smile is open and whose expression is glad has a kind of beauty no matter what she wears.;Anne Roiphe;beauty
Most people say that it is the intellect which makes a great scientist. They are wrong: it is character.;Albert Einstein;great
It is not because angels are holier than men or devils that makes them angels, but because they do not expect holiness from one another, but from God only.;William Blake;men
In the inhalation and exhalation there is an energy and a lively divine spirit, since He, through his spirit supports the breath of life, giving courage to the people who are in the earth and spirit to those who walk on it.;Michael Servetus;courage
What Englishman will give his mind to politics as long as he can afford to keep a motor car?;George Bernard Shaw;politics
I knew I wanted to do something at the nexus of what I call global development and technology.;Chris Hughes;technology
Make food a very incidental part of your life by filling your life so full of meaningful things that you'll hardly have time to think about food.;Peace Pilgrim;food
We love to be with our family and friends and I can tell you that lots of eating will be involved.;Julia Barr;family
The last time money left the art world, intrepid types maxed out their credit cards and opened galleries, and a few of them have become the best in the world.;Jerry Saltz;art
There is only one kind of freedom and that's individual liberty. Our lives come from our creator and our liberty comes from our creator. It has nothing to do with government granting it.;Ron Paul;government
In this situation I was constantly exposed to danger and death.;Daniel Boone;death
Lifestyle change and changes in diet work faster, better and more cheaply than any medication and are as effective or more effective than gastric bypass without any side effects or long-term complications.;Mark Hyman;diet
It's definitely a dream come true to be recognized and to be able to sign autographs. But, it's also a lot of hard work and can be draining. If you don't know already, you will quickly learn who your real friends are.;Christina Aguilera;work
I feel, in the end, as if everything I've done has been a failure.;Jonathan Kozol;failure
I like doing things where I can get dirty, work with my hands, and use power tools. Last weekend, I did some grouting.;Nathan Fillion;power
The leader is one who mobilizes others toward a goal shared by leaders and followers... Leaders, followers and goals make up the three equally necessary supports for leadership.;Gary Wills;leadership
Denial exists because human infants, though equipped with trust-o-meters, are built to trust, blindly and absolutely, any older person who wanders past.;Martha Beck;trust
My trust in a higher power that wants me to survive and have love in my life, is what keeps me moving forward.;Kenny Loggins;trust
The first reaction to truth is hatred.;Tertullian;truth
It's an important thing to have a relationship with the director, and have it be a positive one.;Trevor Rabin;positive
