It is written on the arched sky it looks out from every star. It is the poetry of Nature it is that which uplifts the spirit within us.;John Ruskin;poetry
I couldn't wait until I grew up. I used to look at my mom's stockings and put them on with her high heels and mess with my hair.;Florence Griffith Joyner;mom
Knowledge is and will be produced in order to be sold, it is and will be consumed in order to be valorised in a new production: in both cases, the goal is exchange.;Jean-Francois Lyotard;knowledge
It's a sad day when a cartoon is doing more and cares more and pays more attention to the environment than our president.;Kathy Najimy;sad
The American flag is an enduring symbol of liberty, democracy, and justice. It is fitting that the House act to protect it as we approach our nation's birthday, and as our men and women in uniform rally behind it in Iraq's battlefields.;Joe Barton;birthday
And I like to convey my feelings, my emotions, my experience, the information I have to public use, public opinion.;Vicente Fox;experience
An election is coming. Universal peace is declared, and the foxes have a sincere interest in prolonging the lives of the poultry.;George Eliot;peace
Fear is a disease that eats away at logic and makes man inhuman.;Marian Anderson;fear
It's kinda cool seeing people having real fights with people they really know.;Ron Livingston;cool
Einstein was searching for String Theory. It not only reconciles General Relativity to Quantum Mechanics, but it reconciles Science and the Bible as well.;Roy H. Williams;science
Furthermore, we believe that health care reform, again I said at the beginning of my remarks, that we sent the three pillars that the President's economic stabilization and job creation initiatives were education and innovation - innovation begins in the classroom - clean energy and climate, addressing the climate issues in an innovative way to keep us number one and competitive in the world with the new technology, and the third, first among equals I may say, is health care, health insurance reform.;Nancy Pelosi;health
If Copenhagen were a person, that person would be generous, beautiful, elderly, but with a flair. A human being that has certain propensities for quarrelling, filled with imagination and with appetite for the new and with respect for the old - somebody who takes good care of things and of people.;Connie Nielsen;respect
Inner peace can be reached only when we practice forgiveness. Forgiveness is letting go of the past, and is therefore the means for correcting our misperceptions.;Gerald Jampolsky;peace
I see Turkey's future as being in Europe, as one of many prosperous, tolerant, democratic countries.;Orhan Pamuk;future
The great secret of success is to go through life as a man who never gets used up.;Albert Schweitzer;success
I'd much rather be a woman than a man. Women can cry, they can wear cute clothes, and they're the first to be rescued off sinking ships.;Gilda Radner;women
Of course art world ethics are important. But museums are no purer than any other institution or business. Academics aren't necessarily more high-minded than gallerists.;Jerry Saltz;art
It's amazing how people will give when you don't ask. Many of them send money because they believe in the message.;Joel Osteen;money
For electronica music, David Linton has been doing this series called Unity Gain, which is pretty cool.;Jim Coleman;cool
I'd kind of like to have a classic old muscle car. I think that would be fun.;Brooke Burke;car
Marriage destroyed my relationship with two wonderful men.;Marilyn Monroe;men
The great work must inevitably be obscure, except to the very few, to those who like the author himself are initiated into the mysteries. Communication then is secondary: it is perpetuation which is important. For this only one good reader is necessary.;Henry Miller;communication
When Maurice touched a keyboard, it was like something from a movie, magical. He would always give you something from a movie, and you'd go, what did you just play... immediately inspirational writings, amazing. That's what we're going to miss.;Robin Gibb;inspirational
I don't have a lot of patience for boring arthouse movies.;Zoe Kazan;patience
Mendacity is a system that we live in. Liquor is one way out an death's the other.;Tennessee Williams;death
There's a remarkable amount of sexism on TV. When male characters are flawed, they're interesting, deep and complex. But when female characters are flawed, they're just a mess. It's good to put more flawed but interesting female characters out there because it promotes equality.;Ellen Pompeo;equality
So there's no guarantee if you like the music you will empathize with the culture and the people who made it. It doesn't necessarily happen. I think it can, but it doesn't necessarily happen. Which is kind of a shame.;David Byrne;music
The danger of the past was that men became slaves. The danger of the future is that man may become robots.;Erich Fromm;future
I understand why society, especially American society, is gravitating toward fairy tales, given our economy. We've been exploring the world of witches and wizards for years. We've been exploring the world of vampires for years. Clearly the public - I mean, I feel like all of this was ushered in by 'Harry Potter' - in my own fannish beliefs.;Ginnifer Goodwin;society
God sleeps in the minerals, awakens in plants, walks in animals, and thinks in man.;Arthur Young;inspirational
No period of history has ever been great or ever can be that does not act on some sort of high, idealistic motives, and idealism in our time has been shoved aside, and we are paying the penalty for it.;Alfred North Whitehead;history
The world must be made safe for democracy. Its peace must be planted upon the tested foundations of political liberty.;Woodrow Wilson;peace
The worst thing that can happen in a democracy - as well as in an individual's life - is to become cynical about the future and lose hope.;Hillary Clinton;hope
I love to be alone. I never found the companion that was so companionable as solitude.;Henry David Thoreau;love
We say we want to create beauty, identity, quality, singularity. And yet, maybe in truth these cities that we have are desired. Maybe their very characterlessness provides the best context for living.;Rem Koolhaas;beauty
Work as though you would live forever, and live as though you would die today. Go another mile!;Og Mandino;work
Land really is the best art.;Andy Warhol;art
There is no forgiveness in nature.;Ugo Betti;nature
In mathematics the art of proposing a question must be held of higher value than solving it.;Georg Cantor;art
Politics I conceive to be nothing more than the science of the ordered progress of society along the lines of greatest usefulness and convenience to itself.;Woodrow Wilson;science
War is a racket. It is the only one international in scope. It is the only one in which the profits are reckoned in dollars and the losses in lives.;Smedley Butler;war
I wake up every morning singing 'The Star-Spangled Banner.';Terry McAuliffe;morning
Developments in medical technology have long been confined to procedural or pharmaceutical advances, while neglecting a most basic and essential component of medicine: patient information management.;John Doolittle;medical
Our scientific age demands that we provide definitions, measurements, and statistics in order to be taken seriously. Yet most of the important things in life cannot be precisely defined or measured. Can we define or measure love, beauty, friendship, or decency, for example?;Dennis Prager;friendship
When I was 8 years old, I knew nothing about martial arts. The coach told me I was talented with learning martial arts, and put me in a school.;Jet Li;learning
When words leave off, music begins.;Heinrich Heine;music
The whole thing about making films in an organic film on location is that it's not all about characters, relationships and themes, it's also about place and the poetry of place. It's about the spirit of what you find, the accidents of what you stumble across.;Mike Leigh;poetry
There are 435 members of Congress. There's one 'Morning Joe' show. Hopefully, we can keep hammering the argument that you can disagree with other people and have debates but remain civil.;Joe Scarborough;morning
Freedom itself was attacked this morning by a faceless coward, and freedom will be defended.;George W. Bush;freedom
I postpone death by living, by suffering, by error, by risking, by giving, by losing.;Anais Nin;death
Yes, I always remember my dad's, mom's and my grandma's perfumes.;Marc Jacobs;dad
There is no nonsense so gross that society will not, at some time, make a doctrine of it and defend it with every weapon of communal stupidity.;Robertson Davies;society
There is nothing inherently fair about equalizing incomes. If the government penalizes you for working harder than somebody else, that is unfair. If you save your money but retire with the same pension as a free-spending neighbor, that is also unfair.;Arthur C. Brooks;government
I'm not one of those actors where filmmakers that I admire ask me to be in their movies. I meet them at parties and they're nice to me, but they never ask me to work with them.;Seth Rogen;movies
That's the biggest part of doing comics: You have to create stuff that makes you want to get out of bed every morning and get to work.;Daniel Clowes;morning
I marvel at the resilience of the Jewish people. Their best characteristic is their desire to remember. No other people has such an obsession with memory.;Elie Wiesel;best
When I read Thirteen Days I was moved by it. It was just a great time for the world, in terms of looking back in history and seeing how we got ourselves into trouble and how we got ourselves out of trouble.;Kevin Costner;history
The First Amendment freedom of religion is as important today as when the Bill of Rights was first written.;Arlen Specter;freedom
When I started 'CNN,' I made the decision to stay out of endorsing candidates, and let the doers make up their own minds about politics, that it wasn't going to come from me.;Ted Turner;politics
Women wish to be loved without a why or a wherefore not because they are pretty, or good, or well-bred, or graceful, or intelligent, but because they are themselves.;Henri Frederic Amiel;good
Always, through my whole life, I've had a thirst for knowledge.;Emmitt Smith;knowledge
The more intense the nature of a man, the more readily will he find meditation, and the more successfully will he practice it.;James Allen;nature
Wisdom has its root in goodness, not goodness its root in wisdom.;Ralph Waldo Emerson;wisdom
Happiness? A good cigar, a good meal, a good cigar and a good woman - or a bad woman it depends on how much happiness you can handle.;George Burns;good
Thus it is that in war the victorious strategist only seeks battle after the victory has been won, whereas he who is destined to defeat first fights and afterwards looks for victory.;Sun Tzu;war
I've used the prestige and influence of having been a president of the United States as effectively as possible. And secondly, I've still been able to carry out my commitments to peace and human rights and environmental quality and freedom and democracy and so forth.;Jimmy Carter;environmental
Power is paradoxical.;Friedrich Durrenmatt;power
Simulated disorder postulates perfect discipline simulated fear postulates courage simulated weakness postulates strength.;Lao Tzu;courage
I'm a very passionate believer in the unity of knowledge. There is one world of reality - one world of our experience that we're seeking to describe.;John Polkinghorne;knowledge
Nothing is void of God, his work is everywhere his full of himself.;Lucius Annaeus Seneca;work
Nature says women are human beings, men have made religions to deny it. Nature says women are human beings, men cry out no!;Taslima Nasrin;nature
I am a sportsman and not a politician. I am a sportsman and will always remain one. I am not going to enter politics giving up cricket, which is my life. I will continue to play cricket.;Sachin Tendulkar;politics
I think you have to know how you feel when you're sad and it's healthy to mourn if a relationship ends.;Leighton Meester;sad
In politics women type the letters, lick the stamps, distribute the pamphlets and get out the vote. Men get elected.;Clare Boothe Luce;women
It's cool when your husband starts to sing some old Merle Haggard song and I can pop in with a harmony and it doesn't sound too bad.;Trisha Yearwood;cool
To enjoy good health, to bring true happiness to one's family, to bring peace to all, one must first discipline and control one's own mind. If a man can control his mind he can find the way to Enlightenment, and all wisdom and virtue will naturally come to him.;Buddha;happiness
Every man's life ends the same way. It is only the details of how he lived and how he died that distinguish one man from another.;Ernest Hemingway;life
Every moment and every event of every man's life on earth plants something in his soul.;Thomas Merton;inspirational
I voted for Barack because he was black. 'Cuz that's why other folks vote for other people - because they look like them... That's American politics, pure and simple.;Samuel L. Jackson;politics
I think that I shall never see a poem lovely as a tree.;Joyce Kilmer;nature
Let us be about setting high standards for life, love, creativity, and wisdom. If our expectations in these areas are low, we are not likely to experience wellness. Setting high standards makes every day and every decade worth looking forward to.;Greg Anderson;wisdom
Travel gives me the opportunity to walk through the sectors of cities where one can clearly see the passage of time.;Jerzy Kosinski;travel
We are already producing enough food to feed the world. We already have technology in place that allows us to produce more than we can find a market for.;Jeremy Rifkin;food
Cock your hat - angles are attitudes.;Frank Sinatra;attitude
Maybe there's a chance to get back to grown-up films. Anything that uses humor and dramatic values to deal with human emotions and gets down to what people are to people.;Robert Altman;humor
We are nearer loving those who hate us than those who love us more than we wish.;Francois de La Rochefoucauld;love
I managed Hewlett Packard through the worst technology downturn in 25 years, the dotcom bust.;Carly Fiorina;technology
You can lead a man to Congress, but you can't make him think.;Milton Berle;funny
Question with boldness even the existence of a God because, if there be one, he must more approve of the homage of reason, than that of blind-folded fear.;Thomas Jefferson;fear
Rock and roll music - the music of freedom frightens people and unleashes all manner of conservative defense mechanisms.;Salman Rushdie;freedom
No student of Chinese history can say that the Chinese are incapable of religious experience, even when judged by the standards of medieval Europe or pious India.;Hu Shih;experience
We cannot create observers by saying 'observe,' but by giving them the power and the means for this observation and these means are procured through education of the senses.;Maria Montessori;education
People dance at any age.;Mikhail Baryshnikov;age
An emancipated society, on the other hand, would not be a unitary state, but the realization of universality in the reconciliation of differences.;Theodor Adorno;society
Truthfully, being pregnant is changing me as a person. Each day is part of this amazing journey that has completely shifted the focus of my life and made me reevaluate my personal and professional goals.;Holly Madison;amazing
Mom and Pop were proud of my popularity, but from their point of view, show business was no way to make a living.;Ethel Merman;mom
Life is the most exciting opportunity we have. But we have one shot. You graduate from college once, and that's it. You're going out of that nest. And you have to find that courage that's deep, deep, deep in there. Every step of the way.;Andrew Shue;graduation
He who has faith has... an inward reservoir of courage, hope, confidence, calmness, and assuring trust that all will come out well - even though to the world it may appear to come out most badly.;B. C. Forbes;courage
Success is almost totally dependent upon drive and persistence. The extra energy required to make another effort or try another approach is the secret of winning.;Denis Waitley;success
Beethoven can write music, thank God, but he can do nothing else on earth.;Ludwig van Beethoven;music
The best music is essentially there to provide you something to face the world with.;Bruce Springsteen;music
I've got volumes on how not to behave. I've got more information now than a guy should have at my age.;Charlie Sheen;age
We can be knowledgable with other men's knowledge but we cannot be wise with other men's wisdom.;Michel de Montaigne;wisdom
Always remember that the most important thing in a good marriage is not happiness, but stability.;Gabriel Garcia Marquez;marriage
Unfortunately, a lot of the concepts in the Bible are based on ancient mythology that doesn't fit the findings of science.;Clyde Tombaugh;science
At best the family teaches the finest things human beings can learn from one another generosity and love. But it is also, all too often, where we learn nasty things like hate, rage and shame.;Barbara Ehrenreich;family
I just want real reactions. I want people to laugh from the gut, be sad from the gut - or get angry from the gut.;Andy Kaufman;sad
I owe much to mother. She had an expert's understanding, but also approached art emotionally.;David Rockefeller;mom
Design is a funny word. Some people think design means how it looks. But of course, if you dig deeper, it's really how it works.;Steve Jobs;funny
There is no gardening without humility. Nature is constantly sending even its oldest scholars to the bottom of the class for some egregious blunder.;Alfred Austin;nature
I don't really necessarily think I'm a funny guy, but I like the opportunity to take on something that I don't feel I'm the best at doing.;Seann William Scott;funny
My creed is that: Happiness is the only good. The place to be happy is here. The time to be happy is now. The way to be happy is to make others so.;Robert Green Ingersoll;time
Imagination disposes of everything it creates beauty, justice, and happiness, which are everything in this world.;Blaise Pascal;imagination
I got all my work done to graduate in two months and then they were like, I'm sorry, you have to take driver's ed. I just kind of went, Oh, forget it.;Fiona Apple;graduation
All modern revolutions have ended in a reinforcement of the power of the State.;Albert Camus;power
One of the many things nobody ever tells you about middle age is that it's such a nice change from being young.;William Feather;age
Sports without music is just a game. Music makes it entertaining.;Ice Cube;sports
Not really in all honesty because until you take control of your own health and go to your own doctor and have your own doctor tell you what's going to work for you.;Star Jones;health
My politics are of a practical kind - the integrity of the country, the supremacy of the Federal government, an honorable peace, or none at all.;Winfield Scott Hancock;peace
I've developed into quite a swan. I'm one of those people that will probably look better and better as I get older until I drop dead of beauty.;Rufus Wainwright;beauty
In societies where mature workers are respected and where their wisdom is respected, everybody benefits. Workers are more engaged and productive. Their health is better. They live longer.;Deepak Chopra;health
Our most important task is to transform our consciousness so that violence is no longer an option for us in our personal lives, that understanding that a world of peace is possible only if we relate to each other as peaceful beings, one individual at a time.;Deepak Chopra;peace
But for me, I thought you made a record, you got on a bus, went out and played your shows and made a lot of money. That was the way it was supposed to go down. But there's a lot more to it than that. There are a lot of early mornings, late nights, a lot of traveling, a lot of being away from home, being away from your family.;Jason Aldean;home
Human freedom involves our capacity to pause, to choose the one response toward which we wish to throw our weight.;Rollo May;freedom
Criticism in the universities, I'll have to admit, has entered a phase where I am totally out of sympathy with 95% of what goes on. It's Stalinism without Stalin.;Harold Bloom;sympathy
Here you do have forests, where pigs could be raised by letting them root about in the forests for a good part of the year. Therefore, you have a different attitude toward them compared with what continues to exist in the Middle East.;Marvin Harris;attitude
Wisdom and understanding can only become the possession of individual men by travelling the old road of observation, attention, perseverance, and industry.;Samuel Smiles;wisdom
In order to go on living one must try to escape the death involved in perfectionism.;Hannah Arendt;death
It takes someone with a vision of the possibilities to attain new levels of experience. Someone with the courage to live his dreams.;Les Brown;courage
The link between peace and stability on the one hand, and social and economic growth on the other, is dialectic. Peace, poverty, and backwardness cannot mix in one region.;King Hussein I;peace
I don't write poetry and then strum some chords and then fit the words on top of the chords.;Andrew Bird;poetry
I do not bring forgiveness with me, nor forgetfulness. The only ones who can forgive are dead the living have no right to forget.;Chaim Herzog;forgiveness
It is not death or pain that is to be dreaded, but the fear of pain or death.;Epictetus;fear
Man tells his aspiration in his God but in his demon he shows his depth of experience.;Margaret Fuller;experience
Let those who, still in their youth, have preserved their faith and fullness of hope, keep looking up.;George A. Smith;faith
The key to everything is patience. You get the chicken by hatching the egg, not by smashing it.;Arnold H. Glasow;patience
I believe that anybody who gets married should go to a counselor for months before the wedding. I think that's going to save guys a lot of money and the ladies a lot of heartbreak.;James Brolin;wedding
Offspring, the due performance on religious rites, faithful service, highest conjugal happiness and heavenly bliss for the ancestors and oneself, depend on one's wife alone.;Guru Nanak;happiness
I'm a comedian, for God's sake. Viewers shouldn't trust me. And you know what? They're hip enough to know they shouldn't trust me. I'm just doing stand-up comedy.;Dennis Miller;trust
I intend to fight and I want to win. But my priorities are basically to be a good Brother and a strong one, and to try to be a good father one day.;Mike Tyson;good
I think things like food, the food of the south is sort of the common tie that binds us all, Black and White, the sense memories. It's a very particular part of the country.;Sela Ward;food
I think clothes should make you feel safe. I like clothes you want to go to sleep in. I sometimes stand in front of a mirror and change a million times because I know I really want to wear my nightgown.;Gilda Radner;change
Widespread state control over art and culture has left no room for freedom of expression in the country. For more than 60 years, anyone with a dissenting opinion has been suppressed. Chinese art is merely a product: it avoids any meaningful engagement. There is no larger context. Its only purpose is to charm viewers with its ambiguity.;Ai Weiwei;freedom
People don't have these tidy little redemption arcs in reality the way they do in movies.;Diablo Cody;movies
But I love being scared. I think you're brave only when you do things that scare you. I've always used fear as a motivator. I'm not sure why.;Ginnifer Goodwin;fear
If I weren't performing, I'd be a beauty editor or a therapist. I love creativity, but I also love to help others. My mother was a hairstylist, and they listen to everyone's problems - like a beauty therapist!;Beyonce Knowles;beauty
The beauty of having a producer is that you have someone who says, You're finished.;Sheryl Crow;beauty
My compulsion to always be working has become less strong and my current business is purely down to this enormous alimony. If I wasn't doing this I'd be making documentaries about wildlife and other subjects that interest me.;John Cleese;business
Music was always the distraction, so it was the obvious choice to pursue. My dad always said to find a job I love to do, that way it wouldn't feel like a job. So I did that.;Jason Mraz;music
When I haven't been working I've tried to travel a lot.;Emma Watson;travel
We are drowning in information, while starving for wisdom. The world henceforth will be run by synthesizers, people able to put together the right information at the right time, think critically about it, and make important choices wisely.;E. O. Wilson;wisdom
The valor and courage of our young women and men in the armed services are a shining example to all of the world, and we owe them and their families our deepest respect.;Bill Frist;respect
This has been a learning experience for me. I also thought that privacy was something we were granted in the Constitution. I have learned from this when in fact the word privacy does not appear in the Constitution.;Bill Maher;learning
Poetry is, first and last, language - the rest is filler.;Mark Strand;poetry
I like to think my dad was easygoing and kind, and I think some of those things have been passed down. I am like him in a sense of being positive and hopeful. He was compassionate, and I've got a lot of that in me as well.;Joel Osteen;dad
