The more that social democracy develops, grows, and becomes stronger, the more the enlightened masses of workers will take their own destinies, the leadership of their movement, and the determination of its direction into their own hands.;Rosa Luxemburg;leadership
Older people shouldn't eat health food, they need all the preservatives they can get.;Robert Orben;health
Obviously, I come from one background, and the people that design fitness equipment have been doing it for years and years, and they know what works and doesn't work.;Lance Armstrong;work
It's an interesting combination: Having a great fear of being alone, and having a desperate need for solitude and the solitary experience. That's always been a tug of war for me.;Jodie Foster;fear
I go and see anything that's visually new, any technology that's about picture-making. The technology won't make the pictures different, but someone using it will.;David Hockney;technology
If you have fun, fine. It's not all life and death.;Bill Parcells;death
The mother art is architecture. Without an architecture of our own we have no soul of our own civilization.;Frank Lloyd Wright;art
I didn't have any confidence in my beauty when I was young. I felt like a character actress, and I still do.;Meryl Streep;beauty
Oh, the ignorance of us upon whom Providence did not sufficiently smile to permit us to be born in New England.;Horace Porter;smile
Who in their infinite wisdom decreed that Little League uniforms be white? Certainly not a mother.;Erma Bombeck;mom
What does it mean to not be alone? I've approached that question through music, technology, writing and other means.;Jaron Lanier;alone
But without a caring society, without each citizen voluntarily accepting the weight of responsibility, government is destined to grow even larger, taking more of your money, burrowing deeper into your lives.;Jeb Bush;government
Sometimes I feel like there are people just waiting for me to fall. The funny thing is, I can't give them anything. I have just never been a partier, even in school.;Jordin Sparks;funny
The relationship between Cathy and Mom in the strip is the one relationship drawn from real life that I have proudly never even tried to disguise.;Cathy Guisewite;mom
Banks should contribute to the real economy, make a positive contribution to economic growth.;Jeroen Dijsselbloem;positive
People often ask, why aren't you reading about what it is you're working on right now? And the truth is, you only get three pages a night before your eyelids close.;David Petraeus;truth
Freedom granted only when it is known beforehand that its effects will be beneficial is not freedom.;Friedrich August von Hayek;freedom
During my travels in Iraq, Israel, Gaza, Brazil, Indonesia, Japan, Europe and all over the United States, I have seen and heard the voices of people who want change. They want the stabilization of the economy, education and healthcare for all, renewable energy and an environmental vision with an eye on generations to come.;Michael Franti;environmental
Happiness is a butterfly, which when pursued, is always just beyond your grasp, but which, if you will sit down quietly, may alight upon you.;Nathaniel Hawthorne;happiness
Men do not accept their prophets and slay them, but they love their martyrs and worship those whom they have tortured to death.;Fyodor Dostoevsky;death
I wasn't one of the cool kids by any stretch. I just bumbled along really.;Matthew Rhys;cool
The strength and power of despotism consists wholly in the fear of resistance.;Thomas Paine;strength
The idea of avant-garde art is a very suspicious thing to me, the idea that poetry is new and it keeps being new the way Chevrolets every year are new.;Robert Morgan;poetry
You can be happy where you are.;Joel Osteen;happiness
I do love television. But the business is accelerating and people are not getting the chance to fail.;Dick Wolf;business
People's dreams are made out of what they do all day. The same way a dog that runs after rabbits will dream of rabbits. It's what you do that makes your soul, not the other way around.;Barbara Kingsolver;dreams
Mom and Dad were married 64 years. And if you wondered what their secret was, you could have asked the local florist - because every day Dad gave Mom a rose, which he put on her bedside table. That's how she found out what happened on the day my father died - she went looking for him because that morning, there was no rose.;Mitt Romney;mom
The devil has put a penalty on all things we enjoy in life. Either we suffer in health or we suffer in soul or we get fat.;Albert Einstein;life
He's as cool as a prized marrow!;Sid Waddell;cool
I think every religious person should have a deep sense of respect for other people's religious documents and religious symbols just as we were deeply opposed to the Taliban destroying the two historic buddhas which they blew up. So I think we ought to all oppose burning the Koran.;Newt Gingrich;respect
I'm not really interested in thinking about marriage or kids at all.;Stacy Keibler;marriage
An artist cannot speak about his art any more than a plant can discuss horticulture.;Jean Cocteau;art
I never thought of losing, but now that it' s happened, the only thing is to do it right. That's my obligation to all the people who believe in me. We all have to take defeats in life.;Muhammad Ali;life
Love is blind. My politics has been, too. I think you can fall in love with ideas, and you can fall in love with people. It's a very subjective experience. And I'm loyal to that experience.;Robert Wyatt;politics
I hope I'm not a tourist attraction - I'm sure that they come here really because St. Andrews is just amazing, a beautiful place.;Prince William;amazing
I started studying what the nature of a monument is and what a monument should be. And for the World War III memorial I designed a futile, almost terrifying passage that ends nowhere.;Maya Lin;war
We need the kind of leadership exemplified by President Kennedy to just do it! But we must do it as good stewards, aggressively exerting control over the moon. We can best do this by going there.;Wilson Greatbatch;leadership
Gratitude helps you to grow and expand gratitude brings joy and laughter into your life and into the lives of all those around you.;Eileen Caddy;life
Courage is a special kind of knowledge: the knowledge of how to fear what ought to be feared and how not to fear what ought not to be feared.;David Ben-Gurion;courage
As we advance in life it becomes more and more difficult, but in fighting the difficulties the inmost strength of the heart is developed.;Vincent Van Gogh;life
God gives some more than others because some accept more than others.;Ernest Holmes;god
Our men and women in uniform deserve the best intelligence possible to help them protect America.;Chris Cannon;intelligence
A good artist is willing to die many times over. What's funny is, I've died so many times.;Billy Corgan;funny
The art of communication is the language of leadership.;James Humes;communication
The hours I spend with you I look upon as sort of a perfumed garden, a dim twilight, and a fountain singing to it. You and you alone make me feel that I am alive. Other men it is said have seen angels, but I have seen thee and thou art enough.;George Edward Moore;alone
There is always strength in numbers. The more individuals or organizations that you can rally to your cause, the better.;Mark Shields;strength
I have a new philosophy. I'm only going to dread one day at a time.;Charles M. Schulz;funny
I learned some valuable lessons about the legislative process, the importance of bipartisan cooperation and the wisdom of taking small steps to get a big job done.;Hillary Clinton;wisdom
As I understand it, sport is hard work for which you do not get paid.;Irvin S. Cobb;work
A whole stack of memories never equal one little hope.;Charles M. Schulz;hope
We are involved in youth testing internationally. We want to try to prove without a shadow of a doubt the relationship between physical fitness and health, not just physical fitness and ability to perform.;Kenneth H. Cooper;relationship
History is an account, mostly false, of events, mostly unimportant, which are brought about by rulers, mostly knaves, and soldiers, mostly fools.;Ambrose Bierce;history
I had a very, very difficult relationship with my mother, who was supremely self-centred. She was hilariously self-centred. She did not really take interest in anything that didn't immediately affect her.;John Cleese;relationship
Operationally, God is beginning to resemble not a ruler but the last fading smile of a cosmic Cheshire cat.;Julian Huxley;smile
Since 1970, relationships can be more volatile, jobs more ephemeral, geographical mobility more intensified, stability of marriage weaker.;Mary Douglas;marriage
Energy has become a national security issue and as technology continues to improve, there will be more debates like the one on Keystone.;Ed Royce;technology
All women do have a different sense of sexuality, or sense of fun, or sense of like what's sexy or cool or tough.;Angelina Jolie;women
The coal industry is an even larger part of the Australian economy than it is of the American, and it has an enormous amount of political power.;Jeff Goodell;power
War makes thieves and peace hangs them.;George Herbert;peace
I grew up in Marcy Projects in Brooklyn, and my mom and pop had an extensive record collection, so Michael Jackson and Stevie Wonder and all of those sounds and souls of Motown filled the house.;Jay-Z;mom
We're as clever as we think we are, but we'll be a lot cleverer when we learn to use not just one brain but to pool huge numbers of brains. We're at a level technologically where we can share information and think collectively about our problems. We do it in science all the time - there's no reason why we can't do it in other endeavors.;Lewis Thomas;science
To live is so startling it leaves little time for anything else.;Emily Dickinson;life
Stand up to your obstacles and do something about them. You will find that they haven't half the strength you think they have.;Norman Vincent Peale;strength
When you practice gratefulness, there is a sense of respect toward others.;Dalai Lama;thankful
Wars of nations are fought to change maps. But wars of poverty are fought to map change.;Muhammad Ali;change
But my point is that you design something in the end that precludes any unhealthy trading practices that are not going to serve your environmental or your economic objectives but now is not the time to do it.;John Anderson;design
Friends are the siblings God never gave us.;Mencius;god
I've always felt toward the slightest scene, even if all I had to do in a scene was just to come in and say, 'Hi,' that the people ought to get their money's worth and that this is an obligation of mine, to give them the best you can get from me.;Marilyn Monroe;best
The first panacea for a mismanaged nation is inflation of the currency the second is war. Both bring a temporary prosperity both bring a permanent ruin. But both are the refuge of political and economic opportunists.;Ernest Hemingway;war
My teacher, my great cello teacher Leonard Rose, was such a great cellist, and nurturing man, very patient. But I grew up not only admiring him, but obviously Casals, Rostrotovich, Jacqueline du Pre, and many others, including many of my peers and contemporaries.;Yo-Yo Ma;teacher
A single twig breaks, but the bundle of twigs is strong.;Tecumseh;strength
The doorstep to the temple of wisdom is a knowledge of our own ignorance.;Benjamin Franklin;wisdom
You need some insecurity if you're an actor. It keeps the pot boiling. I haven't yet started to think about retiring. I was shocked when I heard about Paul Newman retiring at age 82. Most actors just fade away like old soldiers.;Al Pacino;age
Freedom is hammered out on the anvil of discussion, dissent, and debate.;Hubert H. Humphrey;freedom
Virginia is the absolute leader in homeland security and defense and information technology.;Mark Warner;technology
The study and knowledge of the universe would somehow be lame and defective were no practical results to follow.;Marcus Tullius Cicero;knowledge
In a few decades, the relationship between the environment, resources and conflict may seem almost as obvious as the connection we see today between human rights, democracy and peace.;Wangari Maathai;peace
It is characteristic of all deep human problems that they are not to be approached without some humor and some bewilderment.;Freeman Dyson;humor
I believe society has a right to defend itself, just as the individual has the right to attack that with which he disagrees.;Naguib Mahfouz;society
Let not him who is houseless pull down the house of another, but let him work diligently and build one for himself, thus by example assuring that his own shall be safe from violence when built.;Abraham Lincoln;work
Through all aspects of society be it art, design, the financial markets, government, technology or communications we are witnessing unprecedented global transformation - the result of which is impossible to predict.;Malcolm Mclaren;design
I don't really care about money. I find money boring and accounting boring, so I'm probably not going to ever make a lot of money.;Juliana Hatfield;money
We learn by practice. Whether it means to learn to dance by practicing dancing or to learn to live by practicing living, the principles are the same. One becomes in some area an athlete of God.;Martha Graham;god
Naturally, people are curious about how my real mom feels about me having a TV mom.;Rico Rodriguez;mom
I draw flowers every day and send them to my friends so they get fresh blooms every morning.;David Hockney;morning
We just put General Motors in the hands of people who can't even run our own government.;Glenn Beck;government
No matter what you're going through, there's a light at the end of the tunnel and it may seem hard to get to it but you can do it and just keep working towards it and you'll find the positive side of things.;Demi Lovato;positive
I made a choice to stay home and raise five boys. Believe me, it was hard work.;Ann Romney;home
Eventually I did that, but it took a lot of twists and turns, and there were a year or two there where I was living with no money at all - no home, no car, no nothing. I was living in somebody's garage in Los Angeles at that point - for a year.;Renny Harlin;car
Do the best you can, and don't take life too serious.;Will Rogers;life
Prosperity or egalitarianism - you have to choose. I favor freedom - you never achieve real equality anyway: you simply sacrifice prosperity for an illusion.;Mario Vargas Llosa;freedom
The power of the American system of republicanism lies in its capacity to allow religious belief to be a competing, not a controlling, factor in American life.;Jon Meacham;power
I just enjoy working with really wonderful actors and amazing creative people and I hope to keep doing that, no matter where.;Stana Katic;amazing
I am a feminist, and what that means to me is much the same as the meaning of the fact that I am Black: it means that I must undertake to love myself and to respect myself as though my very life depends upon self-love and self-respect.;June Jordan;respect
The confidence in another man's virtue is no light evidence of a man's own, and God willingly favors such a confidence.;Michel de Montaigne;god
One of the indictments of civilizations is that happiness and intelligence are so rarely found in the same person.;William Feather;happiness
God grant me the serenity to accept the things I cannot change, the courage to change the things I can, and the wisdom to know the difference.;Reinhold Niebuhr;wisdom
There are similarities between business and sport, in the pressures involved and in the fitness aspect too.;Peter Shilton;fitness
The wisest use of American strength is to advance freedom.;George W. Bush;strength
Marriage is an alliance entered into by a man who can't sleep with the window shut, and a woman who can't sleep with the window open.;George Bernard Shaw;marriage
Life is not an easy matter... You cannot live through it without falling into frustration and cynicism unless you have before you a great idea which raises you above personal misery, above weakness, above all kinds of perfidy and baseness.;Leon Trotsky;life
The way to make money is to buy when blood is running in the streets.;John D. Rockefeller;finance
The principle that human nature, in its psychological aspects, is nothing more than a product of history and given social relations removes all barriers to coercion and manipulation by the powerful.;Noam Chomsky;history
People are beginning to see that the first requisite to success in life is to be a good animal.;Herbert Spencer;success
I have a feeling, one of those gut feelings, that I'll make pretty good movies the rest of my life.;Paul Thomas Anderson;movies
Fair peace becomes men ferocious anger belongs to beasts.;Ovid;anger
What's another word for Thesaurus?;Steven Wright;funny
Hardboiled crime fiction came of age in 'Black Mask' magazine during the Twenties and Thirties. Writers like Dashiell Hammett and Raymond Chandler learnt their craft and developed a distinct literary style and attitude toward the modern world.;Charles Frazier;attitude
For days after death hair and fingernails continue to grow, but phone calls taper off.;Johnny Carson;death
I had seen movies before that that had made me laugh, but I had never seen anything even remotely close to as funny as Richard Pryor was, just standing there talking.;Joe Rogan;movies
The Left regards the Constitution as defective and outmoded - in part because it impedes the government's ability to control institutions, like churches and families, which stand between the state and individuals.;Gary Bauer;government
Well, there's a remedy for all things but death, which will be sure to lay us flat one time or other.;Miguel de Cervantes;death
I love being a single mom. But it's definitely different when you're dating.;Brooke Burns;dating
Caring for children is a dance between setting appropriate limits as caretakers and avoiding unnecessary power struggles that result in unhappiness.;Charlotte Davis Kasl;power
I'm so secluded. Very alone.;Yves Saint Laurent;alone
The Dalai Lama. He is a very wise man of great inner peace who believes that happiness is the purpose of our lives. Through his teachings and leadership, he continues to make this world a better place in which to live.;Sidney Sheldon;peace
I've reached a point in my life where it's the little things that matter... I was always a rebel and probably could have got much farther had I changed my attitude. But when you think about it, I got pretty far without changing attitudes. I'm happier with that.;Veronica Lake;life
I want to keep learning, keep exploring, keep doing more.;Jessye Norman;learning
One thing I hope I'll never be is drunk with my own power. And anybody who says I am will never work in this town again.;Jim Carrey;power
The U.S. has since the end of World War II had an answer - we stand for free peoples and free markets, we are willing to support and defend them - we will sustain a balance of power that favors freedom.;Condoleezza Rice;war
I had people in my life who didn't give up on me: my mother, my aunt, my science teacher. I had one-on-one speech therapy. I had a nanny who spent all day playing turn-taking games with me.;Temple Grandin;science
In a multi-racial society, trust, understanding and tolerance are the cornerstones of peace and order.;Kamisese Mara;society
The soul is everlasting, and its learning experience is lifetime after lifetime.;Shirley MacLaine;experience
It is sometimes very hard to tell the difference between history and the smell of skunk.;Rebecca West;history
The fundamental purpose of government is to protect its citizens.;Arlen Specter;government
Courage is not simply one of the virtues, but the form of every virtue at the testing point.;C. S. Lewis;courage
While a case can be made for intelligent design, I can't figure out why some Christians are so thrilled about that possibility. First of all, it doesn't prove there's a God. If anything, intelligent design lends support to some form of pantheism that defines God as immanent within nature.;Tony Campolo;nature
He that lives upon hope will die fasting.;Benjamin Franklin;hope
I see it as more of a teenage activity than, you know, she's only 11, but you know, I think it's great that she knows so many girls who want to play music. And I see it more as a teen activity than I do as going into music.;Kim Gordon;teen
Pervading nationalism imposes its dominion on man today in many different forms and with an aggressiveness that spares no one. The challenge that is already with us is the temptation to accept as true freedom what in reality is only a new form of slavery.;Pope John Paul II;freedom
The state is the great fictitious entity by which everyone seeks to live at the expense of everyone else.;Frederic Bastiat;great
We all struggle with our failure to communicate and our failure to reach beyond fear to love people.;Mira Sorvino;failure
That's the trouble with being me. At this point, nobody gives a damn what my problem is. I could literally have a tumor on the side of my head and they'd be like, 'Yeah, big deal. I'd eat a tumor every morning for the kinda money you're pulling down.';Jim Carrey;money
Love is never defeated, and I could add, the history of Ireland proves it.;Pope John Paul II;saintpatricksday
This enraged the other Nazi so much that the next morning he came to our house and he shot my father.;Bruno Schulz;morning
He too serves a certain purpose who only stands and cheers.;Henry Adams;politics
Perhaps people, and kids especially, are spoiled today, because all the kids today have cars, it seems. When I was young you were lucky to have a bike.;James Cagney;car
I clearly believe a lot more than some of my coalition colleagues - Tories - in redistribution and using the tax system for that purpose. I also believe in the government having an active role in the economy, which is having an industrial strategy. I'm not a believer in laissez-faire.;Vince Cable;government
When I sit at my table to write, I never know what it's going to be until I'm under way. I trust in inspiration, which sometimes comes and sometimes doesn't. But I don't sit back waiting for it. I work every day.;Alberto Moravia;trust
But sports carried me away from being in a gang, or being associated with drugs. Sports was my way out.;LeBron James;sports
Human beings are accustomed to think of intellect as the power of having and controlling ideas and of ability to learn as synonymous with ability to have ideas. But learning by having ideas is really one of the rare and isolated events in nature.;Edward Thorndike;nature
My publicist told me not to talk about politics but, yes, I think we have a president who stole the election.;Liev Schreiber;politics
Tragedy is restful: and the reason is that hope, that foul, deceitful thing, has no part in it.;Jean Anouilh;hope
Seventy percent of success in life is showing up.;Woody Allen;life
Nevertheless, as is a frequent occurrence in science, a general hypothesis was constructed from a few specific instances of a phenomenon.;Sidney Altman;science
I just want to keep writing music.;Lady Gaga;music
The strong manly ones in life are those who understand the meaning of the word patience.;Tokugawa Ieyasu;patience
When I planned my wedding the first time, my ex-husband and I, we were both struggling comics. I had a TV show that had gotten cancelled. Basically, I rented a wedding gown the reception hall smelled like feet.;Sherri Shepherd;wedding
Every animal leaves traces of what it was man alone leaves traces of what he created.;Jacob Bronowski;alone
Every fundamentalist movement I've studied in Judaism, Christianity and Islam is convinced at some gut, visceral level that secular liberal society wants to wipe out religion.;Karen Armstrong;society
Diligence is the mother of good fortune.;Benjamin Disraeli;good
Not longer loved or fostered by religion, beauty is lifted from its face as a mask, and its absence exposes features on that face which threaten to become incomprehensible to man.;Hans Urs von Balthasar;religion
One is never fortunate or as unfortunate as one imagines.;Francois de La Rochefoucauld;imagination
My life is my message.;Mahatma Gandhi;life
Anarchism is the great liberator of man from the phantoms that have held him captive it is the arbiter and pacifier of the two forces for individual and social harmony.;Emma Goldman;great
Disease is an experience of a so-called mortal mind. It is fear made manifest on the body.;Mary Baker Eddy;experience
When I was young, I observed that nine out of ten things I did were failures. So I did ten times more work.;George Bernard Shaw;work
Normality is death.;Theodor Adorno;death
Not every truth is the better for showing its face undisguised and often silence is the wisest thing for a man to heed.;Pindar;truth
It is not so for art in appreciation because art is concerned with human behavior. And science is concerned with the behavior of metal or energy. It depends on what the fashion is. Now today it's energy. It's the same soul behind it. The same soul, you see.;Josef Albers;science
I still believe in a place called Hope.;William J. Clinton;hope
Sports and politics don't mix.;Eric Heiden;sports
Making peace, I have found, is much harder than making war.;Gerry Adams;war
If you spend your life competing with business men, what do you have? A bank account and ulcers!;Marilyn Monroe;life
I'm certainly not the first person to be in a relationship with a younger man, but somehow I was plucked out as a bit of a poster girl.;Demi Moore;relationship
