I think a lot of young kids at school are very conscious of trying to keep credibility in case they kind of stand out in a crowd and get bullied by trying to stay cool and stuff. And my whole thing, all the way through school, was I was just a goof... I didn't care.;Dominic Monaghan;cool
Clearly, programming courses should teach methods of design and construction, and the selected examples should be such that a gradual development can be nicely demonstrated.;Niklaus Wirth;design
We often pretend to fear what we really despise, and more often despise what we really fear.;Charles Caleb Colton;fear
As an investor, what we're not looking for is 'oh this is a cool app,' it's 'is this something that can become a big business?' You need to find those that can become real businesses.;Niklas Zennstrom;cool
When a man steals your wife, there is no better revenge than to let him keep her.;Sacha Guitry;marriage
One goes through school, college, medical school and one's internship learning little or nothing about goodness but a good deal about success.;Ashley Montagu;success
There is no harm in patience, and no profit in lamentation. Death is easier to bear (than) that which precedes it, and more severe than that which comes after it. Remember the death of the Apostle of God, and your sorrow will be lessened.;Abu Bakr;patience
Of course the Republicans have long wanted to privatize Social Security and destroy it. But Social Security has been the most important and valuable social program in the history of the United States.;Bernie Sanders;history
I was in the bath at the time, and my dad came running in and said, 'Guess who they want to play Harry Potter!?' and I started to cry. It was probably the best moment of my life.;Daniel Radcliffe;dad
I always remember having a healthy respect for my grandmother.;Prince William;respect
Patience is the support of weakness impatience the ruin of strength.;Charles Caleb Colton;patience
Beauty is also submitted to the taste of time, so a beautiful woman from the Belle Epoch is not exactly the perfect beauty of today, so beauty is something that changes with time.;Karl Lagerfeld;time
When I stand before God at the end of my life, I would hope that I would not have a single bit of talent left, and could say, 'I used everything you gave me'.;Erma Bombeck;god
A good hockey player plays where the puck is. A great hockey player plays where the puck is going to be.;Wayne Gretzky;good
It's really cool to know that you've put something together that isn't for a particular audience. It's so often that a TV show can really only speak to one sect of the population, and this really is something that appeals to a worldwide fan base. People who are into the pursuit of knowledge. Their reaction has meant the world to us.;David Krumholtz;cool
Parrots make great pets. They have more personality than goldfish.;Chevy Chase;funny
Take hope from the heart of man and you make him a beast of prey.;Ouida;hope
Today's youth are told to get rich or die trying and they really shouldn't take that attitude forward with them.;Kareem Abdul-Jabbar;attitude
Everything in food is science. The only subjective part is when you eat it.;Alton Brown;food
Every Christmas now for years, I have found myself wondering about the point of the celebration. As the holiday has become more ecumenical and secular, it has lost much of the magic that I remember so fondly from childhood.;Whitley Strieber;christmas
Men are governed by lines of intellect - women: by curves of emotion.;James Joyce;women
Where is there beauty when you see deprivation and starvation?;Rosalind Russell;beauty
He is happiest, be he king or peasant, who finds peace in his home.;Johann Wolfgang von Goethe;home
I've thought hard about my psychological connections and I think I've managed to separate out the psychological from the legal, moral, and political.;Alan Dershowitz;legal
Within the hearts men, loyalty and consideration are esteemed greater than success.;Bryant H. McGill;success
One tradition I have with my friends is that when one of us gets married, we have a ton of fragrance oils and pretty bottles at the bachelorette party. Everyone puts a drop or two in a bottle for the bride and makes a wish, and the bride wears our creation on her wedding day.;Jennifer Aniston;wedding
If you listen to your fears, you will die never knowing what a great person you might have been.;Robert H. Schuller;business
I believe that we parents must encourage our children to become educated, so they can get into a good college that we cannot afford.;Dave Barry;good
Women are treated as unjustly in poetry as in life. The feminine ones are not idealistic, and the idealistic not feminine.;Karl Wilhelm Friedrich Schlegel;women
For passion, be it observed, brings insight with it it can give a sort of intelligence to simpletons, fools, and idiots, especially during youth.;Honore de Balzac;intelligence
God may forgive your sins, but your nervous system won't.;Alfred Korzybski;god
General Musharraf needs my participation to give credibility to the electoral process, as well as to respect the fundamental right of all those who wish to vote for me.;Benazir Bhutto;respect
I ask myself: Would I have been any worse off if I had stayed home or lived on a farm instead of shock treatments and medication?;Gene Tierney;home
We expect all our businesses to have a positive impact on our top and bottom lines. Profitability is very important to us or we wouldn't be in this business.;Jeff Bezos;business
Every American deserves to live in freedom, to have his or her privacy respected and a chance to go as far as their ability and effort will take them - regardless of race, gender, ethnicity or economic circumstances.;Christopher Dodd;freedom
We should be dreaming. We grew up as kids having dreams, but now we're too sophisticated as adults, as a nation. We stopped dreaming. We should always have dreams.;Herb Brooks;dreams
Art, as far as it is able, follows nature, as a pupil imitates his master thus your art must be, as it were, God's grandchild.;Dante Alighieri;art
Scientific views end in awe and mystery, lost at the edge in uncertainty, but they appear to be so deep and so impressive that the theory that it is all arranged as a stage for God to watch man's struggle for good and evil seems inadequate.;Richard P. Feynman;good
The long-established and noble rule of Law, one of the greatest products of the character and tradition of British history, has suffered a deadly blow. Blackmail has become respectable.;Robert Menzies;history
There are historic situations in which refusal to defend the inheritance of a civilization, however imperfect, against tyranny and aggression may result in consequences even worse than war.;Reinhold Niebuhr;war
Success is like death. The more successful you become, the higher the houses in the hills get and the higer the fences get.;Kevin Spacey;death
The more I think about it, the more I realize there is nothing more artistic than to love others.;Vincent Van Gogh;love
I've never been interested in action movies. Definitely not interested in sci-fi.;Carrie-Anne Moss;movies
My family is from the South, and I can remember all those ladies I grew up with, like my great-aunts, who had handkerchiefs. There's something sweet about them.;Laura Linney;family
Time goes, you say? Ah, no! alas, time stays, we go.;Henry Austin Dobson;time
We are different, in essence, from other men. If you want to win something, run 100 meters. If you want to experience something, run a marathon.;Emil Zatopek;experience
The goal of education is the advancement of knowledge and the dissemination of truth.;John F. Kennedy;truth
Marriage is not a noun it's a verb. It isn't something you get. It's something you do. It's the way you love your partner every day.;Barbara de Angelis;marriage
Technology is so much fun but we can drown in our technology. The fog of information can drive out knowledge.;Daniel J. Boorstin;knowledge
About the only problem with success is that it does not teach you how to deal with failure.;Tommy Lasorda;failure
It is sad that the Republican leadership is not as interested as they say they are in protecting the institution of marriage as they are in waging a campaign to divide and distract the American people from the real issues that need to be addressed.;Kendrick Meek;marriage
I am not a perfect servant. I am a public servant doing my best against the odds. As I develop and serve, be patient. God is not finished with me yet.;Jesse Jackson;best
I find that it's hard to fully examine one's life and not have faith be part of the discussion.;J. J. Abrams;faith
I long for the raised voice, the howl of rage or love.;Leslie Fiedler;love
Success breeds success.;Mia Hamm;success
The public has an appetite for anything about imagination - anything that is as far away from reality as is creatively possible.;Steven Spielberg;imagination
Me and my dad are friends. We're cool. I'll never be disappointed again, because I don't expect anything anymore from him. I just let him exist, and that's how we get along.;Drake;cool
Yes, I guess you could say I am a loner, but I feel more lonely in a crowed room with boring people than I feel on my own.;Henry Rollins;alone
Economists treat economics as if it is a pure science divorced from the facts of life. The result of this false accountancy is a willful confusion under cover of which industry wreaks its havoc scot-free and ignores the environmental cost.;Vivienne Westwood;environmental
Science is not addressed to poets.;George Henry Lewes;science
Hope is such a bait, it covers any hook.;Oliver Goldsmith;hope
My attitude is that if you push me towards something that you think is a weakness, then I will turn that perceived weakness into a strength.;Michael Jordan;strength
The art of pleasing is the art of deception.;Luc de Clapiers;art
At home we're the hosts, and I never liked the idea of being embarrased in front of our friends.;Knute Rockne;home
Science is the great antidote to the poison of enthusiasm and superstition.;Adam Smith;science
The greater the state, the more wrong and cruel its patriotism, and the greater is the sum of suffering upon which its power is founded.;Leo Tolstoy;power
A great man is made up of qualities that meet or make great occasions.;James Russell Lowell;great
I believe I could have had a career in the music industry without 'X Factor,' but it was an amazing platform that propelled me to where I am now.;Leona Lewis;amazing
If we invest in researching and developing energy technology, we'll do some real good in the long run, rather than just making ourselves feel good today. But climate change is not the only challenge of the 21st century, and for many other global problems we have low-cost, durable solutions.;Bjorn Lomborg;technology
Few will have the greatness to bend history itself but each of us can work to change a small portion of events, and in the total of all those acts will be written the history of this generation.;Robert Kennedy;history
The ideal has many names, and beauty is but one of them.;Ninon de L'Enclos;beauty
To make democracy work, we must be a notion of participants, not simply observers. One who does not vote has no right to complain.;Louis L'Amour;work
The main thing is that it's nice to see these young people - 9 to 14 years old - take the opportunity to get more involved in their health and fitness. We need more kids to be more active.;Rafer Johnson;fitness
There was a time when a fool and his money were soon parted, but now it happens to everybody.;Adlai E. Stevenson;money
Is it not by love alone that we succeed in penetrating to the very essence of being?;Igor Stravinsky;love
Be patient and understanding. Life is too short to be vengeful or malicious.;Phillips Brooks;patience
I have no qualms about saying I am more confident in the medical treatment in America. The breast cancer survival rate is 20 per cent higher than in the UK.;Koo Stark;medical
Our film examines the heroism, courage and prowess of the Soviet submarine force in ways never seen before.;Kathryn Bigelow;courage
All my concerts had no sounds in them they were completely silent. People had to make up their own music in their minds!;Yoko Ono;music
If I did any movies I'd have to take a break from singing, because I'd want it to be really good.;Justin Timberlake;movies
The reward of one duty is the power to fulfill another.;George Eliot;power
The families of many athletes - incensed at the sports leagues and hoping to make games safer overall - are increasingly making the brains of players who die prematurely and suspiciously available for study. Some athletes are even making the bequest themselves.;Jeffrey Kluger;sports
To be in a situation where you have no rights whatsoever is something I wish everybody could experience. People's attitudes would change. It would be a better place.;Tommy Chong;experience
There is no more lovely, friendly and charming relationship, communion or company than a good marriage.;Martin Luther;relationship
Good things happen when you meet strangers.;Yo-Yo Ma;good
I am a writer who happens to love women. I am not a lesbian who happens to write.;Jeanette Winterson;women
Love is the beauty of the soul.;Saint Augustine;love
I don't think we're yet evolved to the point where we're clever enough to handle a complex a situation as climate change. The inertia of humans is so huge that you can't really do anything meaningful.;James Lovelock;change
The overall strength of Chinese culture and its international influence is not commensurate with China's international status. The international culture of the West is strong while we are weak.;Hu Jintao;strength
Among the American contemporaries I read with most enjoyment are several North Carolinians. I think the best poetry being written these days is being written by Southerners.;Robert Morgan;poetry
There is no pain equal to that which two lovers can inflict on one another. This should be made clear to all who contemplate such a union. The avoidance of this pain is the beginning of wisdom, for it is strong enough to contaminate the rest of our lives.;Cyril Connolly;wisdom
Every saint has a past and every sinner has a future.;Oscar Wilde;future
Hope is not the conviction that something will turn out well but the certainty that something makes sense, regardless of how it turns out.;Vaclav Havel;hope
To nourish children and raise them against odds is in any time, any place, is more valuable than to fix bolts in cars or design nuclear weapons.;Marilyn French;design
Great men are like eagles, and build their nest on some lofty solitude.;Arthur Schopenhauer;men
While your life is the true expression of your faith, whom can you fear?;Julia Ward Howe;faith
The struggle of man against power is the struggle of memory against forgetting.;Milan Kundera;power
Marilyn Monroe wasn't even her real name, Charles Manson isn't his real name, and now, I'm taking that to be my real name. But what's real? You can't find the truth, you just pick the lie you like the best.;Marilyn Manson;best
I think that people want peace so much that one of these days government had better get out of their way and let them have it.;Dwight D. Eisenhower;government
My mom and dad are both in stand-up comedy, so that's where I started, that's where I got everything. My roots are holding the mic.;Pauly Shore;mom
My horizon on humanity is enlarged by reading the writers of poems, seeing a painting, listening to some music, some opera, which has nothing at all to do with a volatile human condition or struggle or whatever. It enriches me as a human being.;Wole Soyinka;music
U.N. Women was created due to the acknowledgement that gender equality and women's empowerment was still, despite progress, far from what it should be. Transforming political will and decisions, such as the Member States creating U.N. Women, into concrete steps towards gender equality and women's empowerment, I think is one of the main challenges.;Michelle Bachelet;equality
As a Member of Congress, I've continued my family's tradition of focusing on education.;Mark Kennedy;education
Treasure the love you receive above all. It will survive long after your good health has vanished.;Og Mandino;love
A good teacher can inspire hope, ignite the imagination, and instill a love of learning.;Brad Henry;teacher
Global markets must be balanced by global values such as respect for human rights and international law, democracy, security and sustainable economic and environmental development.;Anna Lindh;environmental
I went to the store and bought lady fingers, when I got home I noticed one of the fingers was missing so I went back to the store and the manager was nice enough to give me the finger.;Jay London;home
Only our individual faith in freedom can keep us free.;Dwight D. Eisenhower;freedom
My music, my songs are 100 percent inspired by girl power.;Paulina Rubio;music
If you're looking for can-do, earthy-crunchy attitude then you've got to go to Wisconsin.;Dar Williams;attitude
You will attract the younger generation and they might well prove tougher than the older generation. What we are trying to do is to look at the future and see what we can do to bring some stability back to people's lives.;Ian Botham;future
Hegel was right when he said that we learn from history that man can never learn anything from history.;George Bernard Shaw;history
War is not the only arena where peace is done to death.;Aung San Suu Kyi;peace
You have to believe that it's through politics that societies can lead social and economic and political change.;David Miliband;politics
There's a connection between the advances that are made in technology and the sense of primitive fear people develop in response to it.;Don DeLillo;fear
My mother is a big believer in being responsible for your own happiness. She always talked about finding joy in small moments and insisted that we stop and take in the beauty of an ordinary day. When I stop the car to make my kids really see a sunset, I hear my mother's voice and smile.;Jennifer Garner;smile
How many movies do you see when you can say this director really knew what film he wanted to make? I can count them on the fingers of one hand.;Gary Oldman;movies
Sometimes they are a matter of luck the photographer could not expect or hope for them. Sometimes they are a matter of patience, waiting for an effect to be repeated that he has seen and lost or for one that he anticipates.;Bill Brandt;patience
War is the greatest plague that can afflict humanity, it destroys religion, it destroys states, it destroys families. Any scourge is preferable to it.;Martin Luther;religion
It's an amazing luxury to say I'm 31 years old and I'm gonna take a year off. That's pretty amazing.;Sarah McLachlan;amazing
Money is a handmaiden, if thou knowest how to use it a mistress, if thou knowest not.;Horace;money
Education is an admirable thing, but it is well to remember from time to time that nothing that is worth knowing can be taught.;Oscar Wilde;time
I cured with the power that came through me.;Black Elk;power
The Internet didn't get invented on its own. Government research created the Internet so that all the companies could make money off the Internet. The point is, is that when we succeed, we succeed because of our individual initiative, but also because we do things together.;Barack Obama;government
One of the things I learned the hard way was that it doesn't pay to get discouraged. Keeping busy and making optimism a way of life can restore your faith in yourself.;Lucille Ball;life
In high school, a teacher once suggested that I be a math major in college. I thought, 'Me? You've got to be joking!' I mean, in junior high, I used to come home and cry because I was so afraid of my math homework. Seriously, I was terrified of math.;Danica McKellar;teacher
I think that if you keep your eyes and your ears open and you are receptive to learning, there are skills you can get from any job at all.;Cat Deeley;learning
Does wisdom perhaps appear on the earth as a raven which is inspired by the smell of carrion?;Friedrich Nietzsche;wisdom
I am rich beyond the dreams of avarice.;Edward Moore;dreams
Life is like an ice-cream cone, you have to lick it one day at a time.;Charles M. Schulz;time
When you are learning about a martial art, it is about respect.;Jackie Chan;learning
I scored a 910 on my SAT. I didn't care about education. I don't know what I cared about.;Skeet Ulrich;education
'Sparkle' fell into my lap. I had heard a little bit about it, that it was being redone in early 2011. I was just kind of like, 'Oh, that would be really cool,' and not really thinking too much about it, and then it came through my agency. I read it, I fell in love with the script and I went in to audition.;Jordin Sparks;cool
The rare person is still interested in new advances when they are adults. There is possibly a correlation with intelligence. In any case, you have to be fairly bright to keep learning and changing attitudes as you get older.;Keith Henson;intelligence
My mom had this romantic notion of her children playing classical music. The idea is you learn it when you're still learning language. It's using the same part of the brain.;Andrew Bird;mom
I felt that the elegance of pop music was that it was reflective: we were holding up a mirror to our audience and reflecting them philosophically and spiritually, rather than just reflecting society or something called 'rock and roll.';Pete Townshend;music
My mom always encouraged me, it was never weird. She'd look at 'Heavy Metal' and go 'Woo-hoo!';Zack Snyder;mom
There are two things that come very easily to me: rooting for New York sports teams and making mistakes.;Harvey Weinstein;sports
The Recovery plan will put money in the pockets of the American worker, create and save millions of new jobs and invest in crucial areas such as health care, education, energy independence and a new infrastructure.;Valerie Jarrett;education
Drawing is the honesty of the art. There is no possibility of cheating. It is either good or bad.;Salvador Dali;good
I don't dare postulate about science, but I know that it takes both emotion and intellect in order for art to happen.;Lukas Foss;science
Growing up in politics I know that women decide all elections because we do all the work.;Caroline Kennedy;politics
I have to be on such a strict diet constantly.;Lady Gaga;diet
Democracy is when the indigent, and not the men of property, are the rulers.;Aristotle;politics
Perhaps it sounds ridiculous, but the best thing that young filmmakers should do is to get hold of a camera and some film and make a movie of any kind at all.;Stanley Kubrick;best
Societies have always been shaped more by the nature of the media by which men communicate than by the content of the communication.;Marshall McLuhan;nature
So, I see technology as a Trojan Horse: It looks like a wonderful thing, but they are going to regret introducing it into the schools because it simply can't be controlled.;Daniel Greenberg;technology
Events at home, at work, in the street - these are the bases for a story.;Naguib Mahfouz;home
There is no happiness in love, except at the end of an English novel.;Anthony Trollope;happiness
Hear me, my chiefs! I am tired. My heart is sick and sad. From where the sun now stands, I will fight no more forever.;Chief Joseph;sad
To rise from error to truth is rare and beautiful.;Victor Hugo;truth
Logic will never change emotion or perception.;Edward de Bono;change
If you have to put someone on a pedestal, put teachers. They are society's heroes.;Guy Kawasaki;society
Visible Faith is an expression of my Christian faith which must be visible to be real! I gave the name to the collection of musicians who worked with me on the record.;Ken Hensley;faith
We learned the value of research in World War II.;Amar Bose;history
Death is the wish of some, the relief of many, and the end of all.;Lucius Annaeus Seneca;death
It is the patriotic duty of every man to lie for his country.;Alfred Adler;patriotism
Marriage is a wonderful institution, but who would want to live in an institution?;H. L. Mencken;funny
I can't write without a reader. It's precisely like a kiss - you can't do it alone.;John Cheever;alone
By climbing a steeper road, the value and appreciation Delaware State students took and continue to take from their education and their experiences is just as great, if not greater, than students attending ivy league schools.;Michael N. Castle;education
The ideas gained by men before they are twenty-five are practically the only ideas they shall have in their lives.;William James;men
I left science, then I went into art, but I approach things very analytically. I choose to pursue both art and architecture as completely separate fields rather than merging them.;Maya Lin;science
Pop music has progressed.;Steven Patrick Morrissey;music
Without failure there is no sweetness in success. There's no understanding of it.;Glenn Beck;failure
What's money? A man is a success if he gets up in the morning and goes to bed at night and in between does what he wants to do.;Bob Dylan;morning
I absolutely love working with my dad because there is such an ease about it, and I also love his company.;Samuel West;dad
The details are not the details. They make the design.;Charles Eames;design
A stale article, if you dip it in a good, warm, sunny smile, will go off better than a fresh one that you've scowled upon.;Nathaniel Hawthorne;smile
I gave my beauty and my youth to men. I am going to give my wisdom and experience to animals.;Brigitte Bardot;experience
And at the time, it is funny how you can look at something and say, for example with my shoulder injury, when it first happened I said this is the worst thing that could happen to me. Why me, why now? Now I look back and say it was probably the best thing that happened to me.;Drew Brees;funny
