Can you design a Rorschach test that's going to make everyone feel something every time - and that looks like a Rorschach test? It's easy to show a picture of a kitten or a car accident. The question is, how abstract can you get and still get the audience to feel something when they don't know what's happening to them?;Jason Reitman;car
Someday I want to be rich. Some people get so rich they lose all respect for humanity. That's how rich I want to be.;Rita Rudner;respect
Never fear: Thank Home, and Poetry, and the Force behind both.;Wilfred Owen;poetry
Indeed I regard the enduring support which I have received over the years from all sections of the community in Ballymena as being more than sufficient recognition for any success which I may have achieved as an actor.;Liam Neeson;success
Vision is the true creative rhythm.;Robert Delaunay;art
Let's give some substance to patriotism. It may take a generation.;Richard Dreyfuss;patriotism
There is no gambling like politics.;Benjamin Disraeli;politics
Alexander Gonzalez Inarritu is a great director. He's the one I first worked with. He's amazing.;Gael Garcia Bernal;amazing
The best years of your life are the ones in which you decide your problems are your own. You do not blame them on your mother, the ecology, or the president. You realize that you control your own destiny.;Albert Ellis;future
If you spend your life competing with business men, what do you have? A bank account and ulcers!;Marilyn Monroe;business
Ajax isn't a technology. It's really several technologies, each flourishing in its own right, coming together in powerful new ways.;Jesse James Garrett;technology
New Zealand needs to balance its environmental responsibilities with its economic opportunities, because the risk is that if you don't do that - and you want to lead the world - then you might end up getting unintended consequences.;John Key;environmental
If we wish to know the force of human genius, we should read Shakespeare. If we wish to see the insignificance of human learning, we may study his commentators.;William Hazlitt;learning
My life has been nothing but a failure.;Claude Monet;failure
I can't tell you 100 percent what makes a relationship work. But I can see something good coming and I can see something bad coming.;Sandra Bernhard;relationship
I take a simple view of life. It is keep your eyes open and get on with it.;Laurence Sterne;life
If a dog will not come to you after having looked you in the face, you should go home and examine your conscience.;Woodrow Wilson;home
There are very few monsters who warrant the fear we have of them.;Andre Gide;fear
Nothing is work unless you'd rather be doing something else.;George Halas;work
Many a revolution started with the actions of a few. Only 56 men signed the Declaration of Independence. A few hanging together can lead a nation to change.;Wynton Marsalis;change
You know, food is such - it's a hug for people.;Rachael Ray;food
I think it's fun to play with worlds that you can add a lot of your own imagination to. With 'True Blood,' you're not limited by anything, there are just leaps and bounds of the imagination you can take with these characters.;Deborah Ann Woll;imagination
The different Ministries have to work more on the promotion of the country, to build Kosovo's public image. Concrete projects must be assembled, in order to activate our businessmen to have more contacts. We have to create a positive image about ourselves.;Ibrahim Rugova;positive
Informed by our sad experience of history, we require nothing short of a foundation for lasting democracy.;Ibrahim Babangida;sad
It's rather splendid to think of all those great men and women who appear to have presented symptoms that allow us to describe them as bipolar. Whether it's Hemingway, Van Gogh... Robert Schumann has been mentioned... Virginia Woolf, Sylvia Plath... some of them with rather grim ends.;Stephen Fry;men
I guess I don't like the people in politics very much, to be blunt.;Nate Silver;politics
Cronenberg's a lot of fun, and that a lot of people don't know watching his movies. He doesn't take himself seriously. He's still reinventing himself.;Vincent Cassel;movies
I've written for every medium except poetry, at which I suck.;J. Michael Straczynski;poetry
I was a great dreamer of day dreams.;Abraham Cahan;dreams
The demise of Google Reader, if logical, is a reminder of how far we've come from the cuddly old 'I'm Feeling Lucky' Google days, in which there was a foreseeably-astonishing delight in the way Google's evolving design tricks anticipated what users would like.;James Fallows;design
Corporate executives need to re-frame their responsibilities to include the interests of all the stakeholders in society at large not just shareholders, but also employees, the citizens of our communities, and those who care about the environment.;Simon Mainwaring;society
The present was an egg laid by the past that had the future inside its shell.;Zora Neale Hurston;future
Those who own much have much to fear.;Rabindranath Tagore;fear
I can look back at stuff I wrote in my early days and squirm at some of the mistakes I made. But we're all learning every day we never stop. I just hope people keep on liking what I do. That gives me such a kick.;Paul Kane;learning
There's no right or wrong, success or failure.;Miley Cyrus;success
It's superfun being a mom, but it's hard too.;Gwen Stefani;mom
I have no other view than to promote the public good, and am unambitious of honors not founded in the approbation of my Country.;George Washington;good
I love seeing people having fun. Everyone over in L.A. is too cool for it. That's the problem.;Lukas Haas;cool
In addition to their power over government based on government financing and personal influence, bankers could steer governments in ways they wished them to go by other pressures.;Carroll Quigley;government
If we define an American fascist as one who in case of conflict puts money and power ahead of human beings, then there are undoubtedly several million fascists in the United States.;Henry A. Wallace;money
Whoever is my relative, I will not be nice to them.;George Lopez;funny
Because you know when you first become famous, you start walking a little different because people are staring at you.;Bono;famous
So I go to my first book signing, and these two girls came up and gave me a piece of paper: '10 reasons you should date our dad. He climbed Mount Kilimanjaro. He's a lawyer.' He didn't know what was going on. He didn't even know me. They called him, and he came down and asked me out that day. Now I'm dating their dad!;Hoda Kotb;dating
Pete Dye introduced me to golf course design back in the 1960's. He came to my hometown Columbus, Ohio to work on The Golf Club.;Jack Nicklaus;design
In my experience, it's not just that serious books get a hearing on comedy shows. But serious books get a serious hearing, as well as a funny one, on comedy shows.;Michael Mandelbaum;funny
Technology will definitely solve all our problems, but in the process it will create brand new ones. But that's O.K. because the most you can expect from life is to get to solve better and better problems.;Scott Adams;technology
I sat with him for three hours and we did not exchange a single word. At the end he handed me, as he had done before, an envelope with money in it. It would have been much nicer if he had enclosed a greeting or a loving word. I would have been so pleased if he had.;Eva Braun;money
In Art, man reveals himself and not his objects.;Rabindranath Tagore;art
America's veterans and troops serving abroad today fought hard to preserve our red, white and blue, from the Revolutionary War to today's Global War Against Terrorism, and Congress' action today is appropriate for one of our most sacred symbols.;Bill Shuster;war
Going meat-free can make a huge difference. Studies show that vegetarians are, on average, 10 to 20 pounds lighter than meat-eaters and that a vegetarian diet reduces our risk of heart disease by 40 percent and adds seven or more years to our lifespan.;Ingrid Newkirk;diet
One of the things I've always personally tried to stress with this band was to have some kind of visual aspect and to be consistent with it - like, not to change.;Peter Steele;change
Give us grace and strength to forbear and to persevere. Give us courage and gaiety and the quiet mind, spare to us our friends, soften to us our enemies.;Robert Louis Stevenson;strength
Oh, I will always be honest with my music. The records are black boxes for me. Like if you want to know who I am, my views, my perspective, things I love, things I hate, my convictions, my anthems. I've never let people's opinions affect the way I write.;Katy Perry;music
We're in a leadership position in sports. People look up to the National Football League.;Roger Goodell;sports
President Johnson did not want the Vietnam War to broaden. He wanted the North Vietnamese to leave their brothers in the South alone.;William Westmoreland;alone
As the President has indicated, my life has been a life of travel - for 60 years constantly moving over the wide world on journeys which first and last have taken me to 83 countries, and, what is more significant, to most of them again and again.;John Raleigh Mott;travel
I believe we should reframe our response to climate change as an imperative for growth rather than merely being a way of being green or meeting environmental commitments.;William Hague;environmental
There was a time when someone would get on a plane and request to move their seat just because the person sitting next to them was of a different ethnicity or religion or nationality. But I don't think my generation wants that. That's how it used to be.;ASAP Rocky;religion
Old minds are like old horses you must exercise them if you wish to keep them in working order.;John Adams;age
There are a lot of grotesqueries in politics, not the least of which is the fund-raising side.;Jack Kemp;politics
You know most of the food that Americans hold so dear - things like hamburgers and hot dogs - were road food, but even before they were road food, they were peasant food.;Alton Brown;food
President Obama's fight for rural America is personal. He was raised by a single mom and grandparents from Kansas. He hails from a farming state, Illinois.;Tom Vilsack;mom
We need a balanced, long term energy policy to reduce our dependence on foreign oil and preserve the beauty of the land we love.;Heather Wilson;beauty
The best way to lose weight is to close your mouth - something very difficult for a politician. Or watch your food - just watch it, don't eat it.;Ed Koch;food
To assert in any case that a man must be absolutely cut off from society because he is absolutely evil amounts to saying that society is absolutely good, and no-one in his right mind will believe this today.;Albert Camus;good
To love someone means to see him as God intended him.;Fyodor Dostoevsky;love
I never Tweet about my daughter. Never. I just want to be respectful of her privacy. My job as a mom is to know when to open my mouth and when not to.;Padma Lakshmi;mom
If one advances confidently in the direction of his dreams, and endeavors to live the life which he has imagined, he will meet with a success unexpected in common hours.;Henry David Thoreau;success
Old friends pass away, new friends appear. It is just like the days. An old day passes, a new day arrives. The important thing is to make it meaningful: a meaningful friend - or a meaningful day.;Dalai Lama;morning
Being out and about talking to residents and representing their views is, in my view, as important to politics as the grandstanding that takes place in Westminster.;Lucy Powell;politics
Writing and travel broaden your ass if not your mind and I like to write standing up.;Ernest Hemingway;travel
I get pretty much all the exercise I need walking down airport concourses carrying bags.;Guy Clark;travel
Democracy is necessary to peace and to undermining the forces of terrorism.;Benazir Bhutto;peace
Anger may be kindled in the noblest breasts: but in these slow droppings of an unforgiving temper never takes the shape of consistency of enduring hatred.;M. Kathleen Casey;anger
We've been working now with computers and education for 30 years, computers in developing countries for 20 years, and trying to make low-cost machines for 10 years. This is not a sudden turn down the road.;Nicholas Negroponte;computers
I think what motivates people is not great hate, but great love for other people.;Huey Newton;great
Our fathers had their dreams we have ours the generation that follows will have its own. Without dreams and phantoms man cannot exist.;Olive Schreiner;fathersday
I separated from the Southern Baptists when they adopted the discriminatory attitude towards women, because I believe what Paul taught in Galatians that there is no distinction in God's eyes between men and women, slaves and masters, Jews and non-Jews - everybody is created equally in the eyes of God.;Jimmy Carter;women
My dad's one of my biggest heroes. I also think Paul Newman's an inspiration. I know a lot of people say that, but I love that he's a great role model and a humanitarian. I admire people who don't necessarily want to change the world, but try to make it a better environment.;Alex Pettyfer;dad
Being from Africa is the best thing that could have ever, ever happened to me. I cannot see it any other way. All of my fundamental principles that were instilled in me in my home, from my childhood, are still with me.;Hakeem Olajuwon;home
There are some women whose pregnancy would make some sly bachelor smile.;Honore de Balzac;women
If architecture is, as is sometimes said, music set in concrete, then football and basketball may be said to be creativity embodied in team sports.;Michael Mandelbaum;sports
I do love country music.;Kesha;music
I challenge you to show me where the saloon has ever helped business, education, church, morals or anything we hold dear.;Billy Sunday;business
We, some cast members and I, even went on a weekend trip together and spent the weekend at an inn, because we enjoy each other's company so much, and it was so cool.;Victor Garber;cool
Writing has nothing to do with communication between person and person, only with communication between different parts of a person's mind.;Rebecca West;communication
I've always been an avid reader. If I don't have a book in the car, I'll stop and pick one up just to have something to read. I don't even remember learning to read.;Janis Ian;learning
A grave blockhead should always go about with a lively one - they show one another off to the best advantage.;William Hazlitt;best
Happiness is a by-product. You cannot pursue it by itself.;Sam Levenson;happiness
I cringe at backstory. Because it never quite explains or gets into some psychological thing that is never quite right and never quite the truth and who knows why someone is some way.;Steve Martin;truth
Clearly, if it is sensible to hold a referendum on independence, it is crucial that we have one on marriage. It is the only way the country can move forward on this issue. Let all those who have a view on this subject place their trust in the Scottish people and let Scotland decide.;Keith O'Brien;marriage
There is a group of individuals who are radical jihadists. We need to call them by name. They believe it is OK to kill people in the name of their religion. It is not all of Islam. It is not all Muslims. But there is a subgroup who believe it is OK. In fact, it is their plan and design to kill people.;Tim Pawlenty;design
History is full of examples of people who clamp down after they began to enjoy too much freedom. Freedom can lead to instability, anarchy, and confusion. So there can be a moral counter-revolution.;Gary Ross;freedom
No power on earth has a right to take our property from us without our consent.;John Jay;power
Citizens, the priority now is to recover trust between the Egyptian - amongst the Egyptians and to have trust and confidence in our economy and international reputation and the fact that the change that we have embarked on will carry on and there's no going back to the old days.;Hosni Mubarak;trust
I find, in being black, a thing of beauty: a joy a strength a secret cup of gladness.;Ossie Davis;strength
Anyone who thinks that the vice-president can take a position independent of the president of his administration simply has no knowledge of politics or government. You are his choice in a political marriage, and he expects your absolute loyalty.;Hubert H. Humphrey;government
In the 20 long, hungry years between my late teens and late 30s I bought in to virtually every new diet and/or exercise regime that hoved into view, particularly at this most vulnerable time for those of us prone to poor body image - a new year.;Arabella Weir;diet
It is an infantile superstition of the human spirit that virginity would be thought a virtue and not the barrier that separates ignorance from knowledge.;Voltaire;knowledge
A man who says that no patriot should attack the war until it is over... is saying no good son should warn his mother of a cliff until she has fallen.;Gilbert K. Chesterton;war
You know, Quincy Jones was a great mentor, but he was a man in a man's world. Fortunately he's a very sensitive man and a beautiful human being, and even though he was 14 or 15 years older than me, he's a capable human being and has great communication skills.;Lesley Gore;communication
I think what's really amazing is that given the scale of the web and getting the compute power we have today, we're starting to see things that appear intelligent but actually aren't semantically intelligent.;Marissa Mayer;amazing
If you have ideas, you have the main asset you need, and there isn't any limit to what you can do with your business and your life. Ideas are any man's greatest asset.;Harvey S. Firestone;business
You can find academic and industrial groups doing some relevant work, but there isn't a focus on building complex molecular systems. In that respect, Japan is first, Europe is second, and we're third.;K. Eric Drexler;respect
The 1990s, after the reign of terror of academic vandalism, will be a decade of restoration: restoration of meaning, value, beauty, pleasure, and emotion to art and restoration of art to its audience.;Camille Paglia;beauty
There is little premium in poetry in a world that thinks of Pound and Whitman as a weight and a sampler, not an Ezra, a Walt, a thing of beauty, a joy forever.;Anna Quindlen;poetry
The attempt to devote oneself to literature alone is a most deceptive thing, and often, paradoxically, it is literature that suffers for it.;Vaclav Havel;alone
I've succeeded beyond my wildest dreams - financially and the amount of fun I have in my life.;Phil Hartman;dreams
There is no kind of dishonesty into which otherwise good people more easily and frequently fall than that of defrauding the government.;Benjamin Franklin;government
All the learning in the world cannot replace instinct.;Robert Ley;learning
Willpower is the key to success. Successful people strive no matter what they feel by applying their will to overcome apathy, doubt or fear.;Dan Millman;fear
Social topics may hit too close to home for people, but then again, if you pull a heartstring, then that's what country music is. It's not just songs about getting drunk and leaving your girl.;Kenny Chesney;home
Fear is static that prevents me from hearing myself.;Samuel Butler;fear
Here we will solve with laws and dollars, problems that too many people around the world still must solve with violence and civil war.;Marco Rubio;war
There are only two kinds of men: the righteous who think they are sinners and the sinners who think they are righteous.;Blaise Pascal;men
In Afghanistan, there is a plan to build democracy hundreds of thousands of troops are protecting it. There is a plan to rebuild and reconstruct there. But many thousands of Americans die from violence and poverty every year and we don't have a plan for reconstruction at home.;Jesse Jackson;home
Women want mediocre men, and men are working to be as mediocre as possible.;Margaret Mead;men
I do not want art for a few any more than education for a few, or freedom for a few.;William Morris;freedom
Justice requires that everyone should have enough to eat. But it also requires that everyone should contribute to the production of food.;Elias Canetti;food
The power of the lawyer is in the uncertainty of the law.;Jeremy Bentham;power
Curiosity is the wick in the candle of learning.;William Arthur Ward;learning
We are really living the American dream, to be a successful brand in the States and in Europe and to steep ourselves in our heritage. But we do it with a sense of humor. We don't take ourselves too seriously in fashion.;Tommy Hilfiger;humor
The Divine of the Lord in heaven is love, for the reason that love is receptive of all things of heaven, such as peace, intelligence, wisdom and happiness.;Emanuel Swedenborg;happiness
I feel like a hostage to fortune. Not that I am complaining. I wanted to play the role. But in truth I didn't think the show would be such a success. OK, I thought it would fail. Not because it was bad. I was confident it was good, but plenty of good things just sort of wither on the vine.;Hugh Laurie;success
It cannot be said often enough that science fiction as a genre is incredibly educational - and I'm speaking the written science fiction, not 'Star Trek.' Science fiction writers tend to fill their books if they're clever with little bits of interesting stuff and real stuff.;Terry Pratchett;science
Today, I'm very happy about myself, because I realized my dreams. I learned how to understand what people want.;Roberto Cavalli;dreams
Freedom of speech includes the freedom to offend people.;Brad Thor;freedom
There are realities we all share, regardless of our nationality, language, or individual tastes. As we need food, so do we need emotional nourishment: love, kindness, appreciation, and support from others.;J. Donald Walters;food
If one more 'journalist' makes a cavalier statement about me and my band, I will personally or with my fans' help, greet them at their home and discover just how much they believe in their freedom of speech.;Marilyn Manson;freedom
From the depth of need and despair, people can work together, can organize themselves to solve their own problems and fill their own needs with dignity and strength.;Cesar Chavez;work
Peace, commerce and honest friendship with all nations entangling alliances with none.;Thomas Jefferson;friendship
We learned about honesty and integrity - that the truth matters... that you don't take shortcuts or play by your own set of rules... and success doesn't count unless you earn it fair and square.;Michelle Obama;truth
There is no time for cut-and-dried monotony. There is time for work. And time for love. That leaves no other time!;Coco Chanel;time
Only bad golfers are lucky. They're the ones bouncing balls off trees, curbs, turtles and cars. Good golfers have bad luck. When you hit the ball straight, a funny bounce is bound to be unlucky.;Lee Trevino;funny
Poetry has done enough when it charms, but prose must also convince.;H. L. Mencken;poetry
Success makes men rigid and they tend to exalt stability over all the other virtues tired of the effort of willing they become fanatics about conservatism.;Walter Lippmann;success
I think you grow wherever God plants you. I hope I'm growing as a person of faith, as a Christian. That should be our number one objective this journey of life. That all starts with a personal intimate relationship with Christ and then being in prayer every single day about all of those things - being tenacious about it.;J. C. Watts;hope
Freedom makes a huge requirement of every human being. With freedom comes responsibility. For the person who is unwilling to grow up, the person who does not want to carry is own weight, this is a frightening prospect.;Eleanor Roosevelt;freedom
In time it will become clear to everyone that support for the policies of pre-emptive war and interventionist nation-building will have much greater significance than the removal of Saddam Hussein itself.;Ron Paul;time
I have my work and my faith... If that's boring to some people, I can't tell you how much I don't care.;Madonna Ciccone;faith
Innovation has nothing to do with how many R amp& D dollars you have. When Apple came up with the Mac, IBM was spending at least 100 times more on R &amp D. It's not about money. It's about the people you have, how you're led, and how much you get it.;Steve Jobs;money
I believe there are three keys to success. For me it is keeping my priorities in order: It's my faith and my family, and then the business.;Kathy Ireland;faith
Peace with the Palestinians will open ports of peace all around the Mediterranean. The duty of leaders is to pursue freedom ceaselessly, even in the face of hostility, in the face of doubt and disappointment. Just imagine what could be.;Shimon Peres;freedom
Architecture is a art when one consciously or unconsciously creates aesthetic emotion in the atmosphere and when this environment produces well being.;Luis Barragan;architecture
Rationalism and Newtonian science has lured us into dark woods, but a new metaphysics can rescue us.;Huston Smith;science
Right actions in the future are the best apologies for bad actions in the past.;Tryon Edwards;best
Good things happen to those who hustle.;Anais Nin;good
Above all things let us never forget that mankind constitutes one great brotherhood all born to encounter suffering and sorrow, and therefore bound to sympathize with each other.;Albert Pike;great
I suppose women are attracted to the bad-boy image sometimes because it's fun to have an adventure. It's like eating junk food... it's fun at the time, but ultimately not the best choice.;Dita Von Teese;food
