We don't have a monopoly. We have market share. There's a difference.;Steve Ballmer;business
Science will explain how but not why. It talks about what is, not what ought to be. Science is descriptive, not prescriptive it can tell us about causes but it cannot tell us about purposes. Indeed, science disavows purposes.;Jonathan Sacks;science
Effectively, change is almost impossible without industry-wide collaboration, cooperation and consensus.;Simon Mainwaring;change
Love is the only force capable of transforming an enemy into friend.;Martin Luther King, Jr.;love
If we have to give up either religion or education, we should give up education.;William Jennings Bryan;education
My passion for gardening may strike some as selfish, or merely an act of resignation in the face of overwhelming problems that beset the world. It is neither. I have found that each garden is just what Voltaire proposed in Candide: a microcosm of a just and beautiful society.;Andrew Weil;society
Years may wrinkle the skin, but to give up enthusiasm wrinkles the soul. Worry, fear, self-distrust bows the heart and turns the spirit back to dust.;Samuel Ullman;fear
As life runs on, the road grows strange with faces new - and near the end. The milestones into headstones change, Neath every one a friend.;James Russell Lowell;change
The Beethoven Experience provided the opportunity to solidify the relationship between the Orchestra and me, the Orchestra and me and the public, between all of us and the city of New York, because Beethoven after all is a really amazing point of reference.;Lorin Maazel;amazing
I had a job at a movie theater for like a year and a half and then a job at a health food store for, like, two years. Those were the only two jobs I ever had.;Reggie Watts;food
It's funny, though, speaking of fathers and sons, because me and John Goodman played father and son, like, five or six years ago in the film 'Death Sentence,' and I got back with him again in 'Inside Llewyn Davis.';Garrett Hedlund;funny
And then before going back for my sophomore year, I decided to change my major to arts and sciences, and my dad cut a deal with me: He said if I'd quit school he'd pay my rent for the next three years, as if I were in school.;Sarah Silverman;dad
O Death, rock me asleep, bring me to quiet rest, let pass my weary guiltless ghost out of my careful breast.;Anne Boleyn;death
The plainer the dress, the greater luster does beauty appear.;Edward F. Halifax;beauty
Surfers have the most attitude.;Shaun White;attitude
Education enables people and societies to be what they can be.;Bill Richardson;education
It takes two to make a marriage a success and only one to make it a failure.;Herbert Samuel;failure
The thing that I've always been slightly frustrated with, was that the idea of a CD is kind of confined to a material possession that you can put on a shelf. And the idea of music, for me, is always about both the communication and the sharing of content. And so the interactive part is missing.;Yo-Yo Ma;communication
Life can be challenging and sad... but music is the easy part.;St. Vincent;sad
People think computers will keep them from making mistakes. They're wrong. With computers you make mistakes faster.;Adam Osborne;computers
A self-respecting nation is ready for anything, including war, except for a renunciation of its option to make war.;Simone Weil;war
The dreamer can know no truth, not even about his dream, except by awaking out of it.;George Santayana;dreams
All the breaks you need in life wait within your imagination, Imagination is the workshop of your mind, capable of turning mind energy into accomplishment and wealth.;Napoleon Hill;life
The hardest thing about being in this business is just being able to be yourself. People act like there's this one set of rules to follow to be a pop star and I think, 'Well, you say I'm a pop star, so maybe that's not true.';Kelly Clarkson;business
Making the City Of Joy gave me the best political education of my life. It became a wrestling match between an Englishman who had gradually ceased to be a Marxist, and a culture that was becoming more Marxist by the day.;Roland Joffe;education
When you're CEO, you have to have two conditions: first, shareholders need to trust you and want you to head your company. The second is that you need to feel the motivation to do the job. So, as long as both are reunited, you continue to do the job.;Carlos Ghosn;trust
People trust I know what I'm doing. I have lots of credibility. I've had years of learning. I know and understand my business.;Lori Greiner;learning
I had no occasion for an apron on that morning.;Lizzie Andrew Borden;morning
Friendship is like money, easier made than kept.;Samuel Butler;friendship
No art form points like poetry to this originality of language as to its essential and abiding concern.;Thomas Harrison;poetry
My mom wasn't a movie star.;Jeff Bridges;mom
To pursue science is not to disparage the things of the spirit. In fact, to pursue science rightly is to furnish the framework on which the spirit may rise.;Vannevar Bush;science
The bond that links your true family is not one of blood, but of respect and joy in each other's life.;Richard Bach;respect
As I grew up, I was continually to suffer hardships in different realms of life - in my family, in my relationship to Japanese society and in my way of living at large in the latter half of the twentieth century.;Kenzaburo Oe;relationship
Death is a very important part of life.;GG Allin;death
In formal logic, a contradiction is the signal of defeat, but in the evolution of real knowledge it marks the first step in progress toward a victory.;Alfred North Whitehead;knowledge
Death is the sanction of everything the story-teller can tell. He has borrowed his authority from death.;Walter Benjamin;death
There can be no proof that Blake's lyric is composed of the best words in the best order only a conviction, accepted by our knowledge and judgment, that it is so.;John Drinkwater;knowledge
I lived in a town of 400 until I was like nine or ten. My dad coached all the sports - he was a gym teacher and health teacher for grades K-12.;January Jones;sports
Some people are that - more than a parent, more than a role model, more than anything less than a religion.;Margaret Cho;religion
I'm not asking any of you to make drastic changes to every single one of your recipes or to totally change the way you do business. But what I am asking is that you consider reformulating your menu in pragmatic and incremental ways to create healthier versions of the foods that we all love.;Michelle Obama;change
Earlier feminists were almost universally pro-choice and have dominated political debate until now. Having access to abortion was viewed as the only way women could have full equality with men, who, until recently, couldn't get pregnant.;Kathleen Parker;equality
We do not yet possess ourselves, and we know at the same time that we are much more.;Ralph Waldo Emerson;time
Men tend to feel threatened women tend to feel guilty.;Edwin Louis Cole;men
No real social change has ever been brought about without a revolution... revolution is but thought carried into action.;Emma Goldman;politics
There are lots of people out there who think they know the truth about God and religion, but does anybody really know for sure? That's why the founding fathers built freedom of religious belief into the structure of this nation, so that everybody could make up their minds for themselves.;Jesse Ventura;religion
A work of art is above all an adventure of the mind.;Eugene Ionesco;art
Musicians and journalists are the canaries in the coalmine, but, eventually, as computers get more and more powerful, it will kill off all middle-class professions.;Jaron Lanier;computers
We are looking to brands for poetry and for spirituality, because we're not getting those things from our communities or from each other.;Naomi Klein;poetry
Doctors, dressed up in one professional costume or another, have been in busy practice since the earliest records of every culture on earth. It is hard to think of a more dependable or enduring occupation, harder still to imagine any future events leading to its extinction.;Lewis Thomas;future
If you don't like something, change it. If you can't change it, change your attitude.;Maya Angelou;attitude
Well, we can't say any more than we can say there is no god, there is no afterlife. We can only say there is no persuasive evidence for or argument for it.;Christopher Hitchens;god
I am the baby in the family, and I always will be. I am actually very happy to have that position. But I still get teased. I don't mind that.;Janet Jackson;family
The four cornerstones of character on which the structure of this nation was built are: Initiative, Imagination, Individuality and Independence.;Eddie Rickenbacker;imagination
There is none made so great, but he may both need the help and service, and stand in fear of the power and unkindness, even of the meanest of mortals.;Lucius Annaeus Seneca;power
My mom and dad played this music all the time when I was growing up, so to me songs by Jerry Lee and Fats Domino are the classics, they're the best songs ever.;Chris Isaak;dad
Individuality is the aim of political liberty. By leaving the citizen as much freedom of action and of being as comports with order and the rights of others, the institutions render him truly a freeman. He is left to pursue his means of happiness in his own manner.;James F. Cooper;happiness
A work of art has no importance whatever to society. It is only important to the individual.;Vladimir Nabokov;work
To understand someone, find out how he spends his money.;Mason Cooley;money
The more sand that has escaped from the hourglass of our life, the clearer we should see through it.;Jean Paul;wisdom
When my mom ran for the Senate, my dad was there for her every step of the way. I can still hear her saying in her beautiful voice, 'Why should women have any less say than men, about the great decisions facing our nation?';Mitt Romney;dad
I'm so unprofessional on set it's not even funny.;Katharine McPhee;funny
Those who cannot work with their hearts achieve but a hollow, half-hearted success that breeds bitterness all around.;Abdul Kalam;work
In nature we never see anything isolated, but everything in connection with something else which is before it, beside it, under it and over it.;Johann Wolfgang von Goethe;nature
I don't think I have accomplished what I still have to accomplish. There is one thing that I would like to do, and that's to bring security and peace to the Jewish people.;Ariel Sharon;peace
Our society is not a community, but merely a collection of isolated family units.;Valerie Solanas;society
Many Nobel Prizes are awaiting good research to understand and explain the many mysteries of our bodies, such as the basic mechanism of memory or imagination.;John Cameron;imagination
I had a really good childhood up until I was nine, then a classic case of divorce really affected me.;Kurt Cobain;good
People who think they know everything are a great annoyance to those of us who do.;Isaac Asimov;great
I don't purposely speed, but I might go over by five or six miles an hour from time to time. It doesn't give me a buzz driving on normal roads, because I can't go fast enough. It's never going to be anything like an F1 car.;Jenson Button;car
The downfall of the industry seems to actually be good for art. I think the industry will find their way once the focus shifts from its greed-based origins, downsizes, and begins to support creative visions that speak to our times and shifting ideals.;Saul Williams;art
The worst thing that an actor can do is go into any project with a lack of respect for the material. You can have an opinion about it, but you have to respect yourself in doing it.;Alfred Molina;respect
Racism is taught in the home. We agree on that? Well, it's very hard to teach racism to a teenager who's listening to rap music and who idolizes, say, Snoop Dogg. It's hard to say, 'That guy is less than you.' The kid is like, 'I like that guy, he's cool. How is he less than me?;Jay-Z;home
A frenzied passion for art is a canker that devours everything else.;Charles Baudelaire;art
We had periodic crises in this country when the technical intelligence didn't support the policy. We had the bomber gap, the missile gap.;Aldrich Ames;intelligence
I have one friend that I've had since I was born, and she's from Coatzacoalcos. She's not really impressed or interested in the actor's life. My family isn't really either.;Salma Hayek;family
Positive, adj.: Mistaken at the top of one's voice.;Ambrose Bierce;positive
You know, the period of World War I and the Roaring Twenties were really just about the same as today. You worked, and you made a living if you could, and you tired to make the best of things. For an actor or a dancer, it was no different then than today. It was a struggle.;James Cagney;war
Collective fear stimulates herd instinct, and tends to produce ferocity toward those who are not regarded as members of the herd.;Bertrand Russell;fear
I never worry about being driven to drink I just worry about being driven home.;W. C. Fields;newyears
It is time to change our policy of appeasement toward the Palestinians, to strengthen our ties with the nation of Israel.;Rick Perry;change
The travel writer seeks the world we have lost - the lost valleys of the imagination.;Alexander Cockburn;imagination
My dad and my uncles owned a bar outside of Cincinnati. I worked there growing up, mopping floors, waiting tables.;John Boehner;dad
We should regret our mistakes and learn from them, but never carry them forward into the future with us.;Lucy Maud Montgomery;learning
My mom drives me crazy sometimes, but I have a good relationship with her.;Seth Rogen;mom
It has been well said that a hungry man is more interested in four sandwiches than four freedoms.;Henry Cabot Lodge, Jr.;politics
If you have love in your life, it can make up for a great many things that are missing. If you don't have love in your life, no matter what else there is, it's not enough.;Ann Landers;love
President Clinton is going to embrace President Obama, as he should. They are working together. They're different kinds of people. Obama is cool, Clinton is a schmoozer. Both are great speakers. It's a great merging of the party.;Bill Richardson;cool
The wisdom of man never yet contrived a system of taxation that would operate with perfect equality.;Andrew Jackson;equality
Married men live longer than single men. But married men are a lot more willing to die.;Johnny Carson;men
I have accepted fear as a part of life - specifically the fear of change... I have gone ahead despite the pounding in the heart that says: turn back.;Erica Jong;fear
I'm not sad at all about turning 40.;Halle Berry;sad
If you're out there stressing on your pro day, then you're not going to perform well, so I plan on having a little fun. Play a little music while we're out there throwing the football, have everybody tapping their toes and bobbing their head and just go out there and make the most of the experience.;Robert Griffin III;experience
I know I'm not supposed to have any opinions about politics, because I'm famous.;Cher;politics
All men were made by the Great Spirit Chief. They are all brothers.;Chief Joseph;great
The sight of nature fascinates, the family tie has a sweet enchantment and patriotism gives the religious spirit a fiery devotion to the powers that it reveres.;Bruno Bauer;patriotism
Our happiness depends on wisdom all the way.;Sophocles;wisdom
I was told to challenge every spiritual teacher, every world leader to utter the one sentence that no religion, no political party, and no nation on the face of the earth will dare utter: 'Ours is not a better way, ours is merely another way.;Neale Donald Walsch;teacher
Power is not sufficient evidence of truth.;Samuel Johnson;power
I'm lucky because my dad taught me to be frugal and save. And that's important because I want to know that I don't have to take an acting job for two or three years if I don't want to and that I'll still be able to make my house and car payments and buy food for my dogs.;Ashley Greene;dad
If you think education is expensive, try ignorance.;Derek Bok;education
The thinner the ice, the more anxious is everyone to see whether it will bear.;Josh Billings;fear
I couldn't survive just doing independent movies. And I'd rather do modelling than movies or TV I didn't like.;Chloe Sevigny;movies
We cannot stop natural disasters but we can arm ourselves with knowledge: so many lives wouldn't have to be lost if there was enough disaster preparedness.;Petra Nemcova;knowledge
Everybody has a job to do. There are people in Iraq on both sides of this war who do what they do for religious reasons, and they feel with God on their side. Some people are good at annihilating people. Maybe that's their gift.;Denzel Washington;war
I don't get a chance to be home much.;Jennifer Hudson;home
Mom and Dad were married 64 years. And if you wondered what their secret was, you could have asked the local florist - because every day Dad gave Mom a rose, which he put on her bedside table. That's how she found out what happened on the day my father died - she went looking for him because that morning, there was no rose.;Mitt Romney;morning
Why don't they pass a constitutional amendment prohibiting anybody from learning anything? If it works as well as prohibition did, in five years Americans would be the smartest race of people on Earth.;Will Rogers;learning
So now, cut to ten years later, and I'm making this amazing contract with Pantene. It's incredible.;Maria Menounos;amazing
Why do only boys get to chase? Nuh-uh! If anything, I think this whole sitting back and waiting thing can be self-sabotaging. We have to send up flares. We have to let guys know we're open for business.;Ginnifer Goodwin;business
I admit to wasting my life messing around with fast cars and motorcycles.;Brock Yates;car
The saddest aspect of life right now is that science gathers knowledge faster than society gathers wisdom.;Isaac Asimov;science
The automobile engine will come, and then I will consider my life's work complete.;Rudolf Diesel;car
Life is the power that's greater than I can ever comprehend. The way life runs through everything, even the tiniest elements of nature - that makes me humble.;Michael J. Fox;nature
At the risk of sounding hopelessly romantic, love is the key element. I really love to play with different musicians who come from different cultural backgrounds.;John McLaughlin;romantic
I loved raising my kids. I loved the process, the dirt of it, the tears of it, the frustration of it, Christmas, Easter, birthdays, growth charts, pediatrician appointments. I loved all of it.;Jane Elliot;mom
Most organizations should be pro-active, but philanthropists concerned with poverty should deliberately be reactive, learning from the efforts of ordinary folks who tired of looking the other way as their communities fell apart.;Marvin Olasky;learning
Women always try to see the one good part of The Weird Guy because the dating landscape is so bleak. Women will say, 'He's very odd, but he likes to cook. He's creepy, but he makes good pancakes!';Zoe Lister-Jones;dating
Politics swings like a pendulum.;Ed Gillespie;politics
It takes less time to do a thing right, than it does to explain why you did it wrong.;Henry Wadsworth Longfellow;time
The family only represents one aspect, however important an aspect, of a human being's functions and activities. A life is beautiful and ideal or the reverse, only when we have taken into our consideration the social as well as the family relationship.;Havelock Ellis;family
Food is for eating, and good food is to be enjoyed... I think food is, actually, very beautiful in itself.;Delia Smith;food
War is not an independent phenomenon, but the continuation of politics by different means.;Karl Von Clausewitz;politics
There are things that I invented - the creaky geriatric robot that is always grumpy, for example, or the little wheelie guy, he's not in the Hasbro lore. But kids love that stuff - this little guy as a pet on a chain. They gravitate towards it.;Michael Bay;pet
Smoking kills. If you're killed, you've lost a very important part of your life.;Brooke Shields;life
My position is not that John Kerry is either Jesus Christ or the prophet Mohammad. My position is that John Kerry is the possibility of restarting politics.;Todd Gitlin;politics
Going to a concert is so overwhelming and the energy is amazing.;Victoria Justice;amazing
There is no love without forgiveness, and there is no forgiveness without love.;Bryant H. McGill;forgiveness
By the time a person has achieved years adequate for choosing a direction, the die is cast and the moment has long since passed which determined the future.;Zelda Fitzgerald;future
The one charm about marriage is that it makes a life of deception absolutely necessary for both parties.;Oscar Wilde;life
I believe that the testing of the student's achievements in order to see if he meets some criterion held by the teacher, is directly contrary to the implications of therapy for significant learning.;Carl Rogers;learning
If Ralph Nader runs, President Bush is going to be re-elected, and if Ralph Nader doesn't run, President Bush is going to be re-elected. We're going to run on the president's strong and principled leadership and his positive agenda for a second term.;Ed Gillespie;leadership
I keep my friends as misers do their treasure, because, of all the things granted us by wisdom, none is greater or better than friendship.;Pietro Aretino;wisdom
The only important thing I have to say is that my father never fought against his country.;Zinedine Zidane;peace
Great wisdom is generous petty wisdom is contentious.;Zhuangzi;wisdom
When anger rushes unrestrained to action, like a hot steed, it stumbles on its way. The man of thought strikes deepest and strikes safely.;Richard Savage;anger
The ladder of success in Hollywood is usually a press agent, actor, director, producer, leading man and you are a star if you sleep with each of them in that order. Crude, but true.;Hedy Lamarr;success
Climate change is a global issue - from the point of view of the Earth's climate, a molecule of CO2 emitted in Bejing is the same as a molecule emitted in Sydney.;Jeff Goodell;change
Where men of judgment creep and feel their way, The positive pronounce without dismay.;William Cowper;positive
I call architecture frozen music.;Johann Wolfgang von Goethe;architecture
I've brought my daughters all over the world-they travel with me. I drag them out of school just to keep the relationship. When I'm home I'm a big-time daddy.;Armand Assante;relationship
The only difference between death and taxes is that death doesn't get worse every time Congress meets.;Will Rogers;death
He is the best sailor who can steer within fewest points of the wind, and exact a motive power out of the greatest obstacles.;Walter Scott;power
Militant feminists are pro-choice because it's their ultimate avenue of power over men. And believe me, to them it is a question of power. It is their attempt to impose their will on the rest of society, particularly on men.;Rush Limbaugh;power
Cheryl Cole and Katy Perry are two of the hottest girls in the world - and so normal and funny with it. If I was a few years older they are the kind of girls I'd like to date. I want a younger version of Cheryl and Katy - a mixture of the two would be hot.;Justin Bieber;funny
God lets everything happen for a reason. It's all a learning process, and you have to go from one level to another.;Mike Tyson;learning
In the tumult of men and events, solitude was my temptation now it is my friend. What other satisfaction can be sought once you have confronted History?;Charles de Gaulle;history
I have often wondered how it is that every man loves himself more than all the rest of men, but yet sets less value on his own opinions of himself than on the opinions of others.;Marcus Aurelius;men
Art gives me the freedom I don't have when I make music.;Marilyn Manson;art
I was in choir in school. I kind of just did it. I already knew I wanted to sing. My music program in my school wasn't really great - people didn't really want to be part of the choir, they didn't want to do the plays and stuff like that. It definitely wasn't the cool thing to do.;Lea Michele;music
It was easy to persecute me without people feeling ashamed. It was easy to vilify me and project me as a woman who was not following the tradition of a 'good African woman' and as a highly educated elitist who was trying to show innocent African women ways of doing things that were not acceptable to African men.;Wangari Maathai;women
Your aim will be knowledge and wisdom, not the reflected glamour of fame.;Abbott L. Lowell;knowledge
Love is a friendship set to music.;Joseph Campbell;love
Most children threaten at times to run away from home. This is the only thing that keeps some parents going.;Phyllis Diller;parenting
I am and always will be a sinner. But that's the beautiful thing about Jesus. I'll always try to be a better person in the eyes of God. But I'm not all of a sudden stepping up on a pedestal and saying I'm holier than thou, 'cause I'm not!;Billy Ray Cyrus;god
We have war when at least one of the parties to a conflict wants something more than it wants peace.;Jeane Kirkpatrick;war
I would describe myself as emotional and highly strung. If something upsets me, it really upsets me. If something makes me angry, I get really angry. But it's all very upfront. I can't hide it. I'm also loyal and I hope I'm fun.;Nicole Kidman;hope
If civilization is to survive, we must cultivate the science of human relationships - the ability of all peoples, of all kinds, to live together, in the same world at peace.;Franklin D. Roosevelt;peace
