Such a faith would be fatal to my reason, to my liberty, and even to the success of my undertakings it would immediately transform me into a stupid slave, an instrument of the will and interests of others.;Mikhail Bakunin;success
I think it's sad to me that I had to make a decision to not play the game that I feel like I'm best at and that I love. But if it was just about the game itself, I'd be there in a heartbeat. But that's not how the real world works.;Tiffeny Milbrett;sad
I love being around my friends and my family and spending time with my husband. I like being normal and recharging my batteries, and I feel like I have the coolest job in the world where I get to get on stage and perform and get to do a lot of really amazing things.;Carrie Underwood;family
Every tomorrow has two handles. We can take hold of it with the handle of anxiety or the handle of faith.;Henry Ward Beecher;faith
My success and my misfortunes, the bright and the dark days I have gone through, everything has proved to me that in this world, either physical or moral, good comes out of evil just as well as evil comes out of good.;Giacomo Casanova;success
I remember when I first started in the business, I lost a lot of friends. Some were jealous, some were annoyed at the fact that I was an actress.;Amber Tamblyn;business
When we play 'Angel of Death', it's actually a 2 and half minutes sing 'til our party starts. That song is pretty much been played traditionally in the end.;Kerry King;death
I said to the almond tree, 'Friend, speak to me of God,' and the almond tree blossomed.;Nikos Kazantzakis;god
If you don't understand that you work for your mislabeled 'subordinates,' then you know nothing of leadership. You know only tyranny.;Dee Hock;leadership
It's cool to meet your idols. It's a good opportunity to travel. Those kinds of things are good.;Meg White;travel
Never build your emotional life on the weaknesses of others.;George Santayana;life
I was apprehensive. I feared every time I talked about poetry, it would be filtered through the lens of race, sex, and age.;Rita Dove;poetry
Strong women only marry weak men.;Bette Davis;women
The bungalow had more to do with how Americans live today than any other building that has gone remotely by the name of architecture in our history.;Russell Lynes;architecture
Poetry and music are very good friends. Like mommies and daddies and strawberries and cream - they go together.;Nikki Giovanni;poetry
Making peace, I have found, is much harder than making war.;Gerry Adams;peace
I haven't had that one great love, which is good. I don't want that to be in the past - I want it to be in the future.;Taylor Swift;great
We regard intelligence as man's main characteristic and we know that there is no superiority which intelligence cannot confer on us, no inferiority for which it cannot compensate.;Henri Bergson;intelligence
By asking the question 'Am I happy?,' and via the answer setting out what I mean by happiness, there is a political route that can be taken, by asking another question - 'Can politics deliver happiness, and should it try?';Alastair Campbell;happiness
The banking collapse was caused, more than anything, by bad government policy and the total failure of bad regulation, rather than by greed.;Nigel Farage;failure
All sports must be treated on the basis of equality.;Pierre de Coubertin;equality
If you take the contempt some Americans have for yuppies and multiply it by 10 you might come close to understanding their attitude towards the City, as they call it - London, the people of the south.;Martin C. Smith;attitude
One must know oneself. If this does not serve to discover truth, it at least serves as a rule of life and there is nothing better.;Blaise Pascal;truth
The first requirement of politics is not intellect or stamina but patience. Politics is a very long run game and the tortoise will usually beat the hare.;John Major;patience
It is very reasonable to worry about the harm done by organized religion, and to prefer looser and more private arrangements.;Mary Douglas;religion
There's a generation of people I think without a strong connection to family, to religion, to civic duty. They have a real disassociation from the problems of the world.;Tim Heidecker;religion
I went onto reality TV as a business decision.;Bethenny Frankel;business
Of all the planets apart from Earth in our solar system, Mars is the most hospitable. Yeah. Right. Better keep my visit short. And yet, despite the discomfort, the danger, I love it here. I love coming back for these imaginary vacations. The sights are amazing.;Greg Bear;amazing
I scientifically engineer my music to be as accessible as possible.;John Mayer;music
I didn't finish my dress until about three days before my wedding - I had the flu and was stitching it from my bed. And the tulle came back from India all brown. We had to wash it for hours, but that didn't dissuade me from wearing it.;Georgina Chapman;wedding
I'm a great believer that any tool that enhances communication has profound effects in terms of how people can learn from each other, and how they can achieve the kind of freedoms that they're interested in.;Bill Gates;communication
Defining marriage is a power that should be left to the states. Moreover, no state should be forced to recognize a marriage that is not within its own laws, Constitution, and legal precedents.;John Sununu;marriage
When I was a teenager, I read a lot of Poe.;Dario Argento;teen
Rule of art: Cant kills creativity!;Camille Paglia;art
Romantic love is mental illness. But it's a pleasurable one. It's a drug. It distorts reality, and that's the point of it. It would be impossible to fall in love with someone that you really saw.;Fran Lebowitz;romantic
The Law of God reaches into every area of life, and it brings about incredible blessing and incredible freedom.;Randall Terry;freedom
The '60s were an amazing time.;Peter Max;amazing
Knowledge about the economy, ideas about capitalism and government, the future of the world and geopolitics were things I was never really interested in.;Shia LaBeouf;future
Secretly, I'm a real big nerd. I'd rather stay home and play Scrabble than go to a Hollywood party, any day of the week. And I love reading about history and watching the Discovery Channel.;Sprague Grayden;history
I'm not sure anyone - and I could be wrong in this - grows up thinking, I want to be a single mom.;Bridget Moynahan;mom
Every building is a prototype. No two are alike.;Helmut Jahn;architecture
Truth titillates the imagination far less than fiction.;Marquis de Sade;imagination
I would be more frightened as a writer if people thought my movies were like science fiction.;Neil LaBute;science
It was only when I finished the course and left my graduation diploma on the bus that I realised I'd become an actor.;James D'arcy;graduation
Drama can feel like therapy whereas comedy feels like there's been a pressure and a weight lifted off of you. You come to work and you laugh all day, you go home and you feel light and there's a certain feeling when you're sitting with the audience and they leave after 90 minutes and it's just pure escapism and they're happy.;Gabrielle Union;home
I definitely wasn't cool in high school. I really wasn't. I did belong to many of the clubs and was in leadership on yearbook and did the musical theater route, so I had friends in all areas. But I certainly did not know what to wear, did not know how to do my hair, all those things.;Dianna Agron;cool
I think being a parent is the most challenging thing you do. That's why we're here. It's at the heart of what it is to be a human being. It's the ultimate experience because it questions everything about who you are. But it's difficult.;Michael Sheen;experience
I've just finished reading a book about the brilliant Margaret Rutherford. She wasn't a beauty, but inside she was absolutely blazing and passionate about her work. She's one of those life-affirming characters.;Sophie Thompson;beauty
Ideas can be life-changing. Sometimes all you need to open the door is just one more good idea.;Jim Rohn;good
The desire for safety stands against every great and noble enterprise.;Tacitus;great
I think that the good and the great are only separated by the willingness to sacrifice.;Kareem Abdul-Jabbar;great
The brain is like a muscle. When it is in use we feel very good. Understanding is joyous.;Carl Sagan;intelligence
Well, I am now convinced there is no kind of fear or anxiety anyone has to live with.;Ricky Williams;fear
If the First Amendment means anything, it means that a state has no business telling a man, sitting alone in his house, what books he may read or what films he may watch.;Thurgood Marshall;alone
Music is an extraordinary vehicle for expressing emotion - very powerful emotions. That's what draws millions of people towards it. And, um, I found myself always going for these darker places and - people identify with that.;Annie Lennox;music
It may not be the most popular but there is a place for it. I think about the kind of music I love, acoustic, melodic, and I guess it kind of took a bit of courage on my part to think I could be one of those songwriters.;Helen Slater;courage
Music is subjective to everyone's unique experience.;Jared Leto;experience
Thou art my single day, God lends to leaven What were all earth else, with a feel of heaven.;Robert Browning;art
There is a great interest in comparative religion and a desire to understand faiths other than our own and even to experiment with exotic cults.;Emily Greene Balch;religion
I did stand-up comedy for 18 years. Ten of those years were spent learning, four years were spent refining, and four years were spent in wild success. I was seeking comic originality, and fame fell on me as a byproduct. The course was more plodding than heroic.;Steve Martin;success
Poetry may make us from time to time a little more aware of the deeper, unnamed feelings which form the substratum of our being, to which we rarely penetrate for our lives are mostly a constant evasion of ourselves.;T. S. Eliot;poetry
I've never been a big believer in formal education.;Megan Fox;education
I really admire a woman for her intelligence, her personality. Beauty is not enough.;Roberto Cavalli;beauty
The funny thing is, the girls that I'm always up against for roles are pretty nice and cool, like Emma Watson. She's awesome.;Amanda Seyfried;cool
The state of New Jersey is really two places - terrible cities and wonderful suburbs. I live in the suburbs, the final battleground of the American dream, where people get married and have kids and try to scratch out a happy life for themselves. It's very romantic in that way, but a bit naive. I like to play with that in my work.;Harlan Coben;romantic
The circulation of confidence is better than the circulation of money.;James Madison;money
Success is simply a matter of luck. Ask any failure.;Earl Wilson;failure
It's as if I were collaborating with myself, revealing my relationship to the material. My hand would make the drawing. Then my mouth would transmit it.;Jim Hodges;relationship
All the revision in the world will not save a bad first draft: for the architecture of the thing comes, or fails to come, in the first conception, and revision only affects the detail and ornament, alas!;T. E. Lawrence;architecture
I don't know whether it's age or maturity, but I certainly find myself committed more and more to the looser forms of Western democracy at any price.;John le Carre;age
There is frequently more to be learned from the unexpected questions of a child than the discourses of men.;John Locke;men
I can make a firm pledge, under my plan, no family making less than $250,000 a year will see any form of tax increase. Not your income tax, not your payroll tax, not your capital gains taxes, not any of your taxes.;Barack Obama;family
There are no necessary evils in government. Its evils exist only in its abuses.;Andrew Jackson;government
Rest when you're weary. Refresh and renew yourself, your body, your mind, your spirit. Then get back to work.;Ralph Marston;health
My grandfather was a general in the Nationalist Chinese Air Force during World War II, and I grew up hearing the pilot stories and seeing pictures of him in uniform.;Eric Liu;war
I think that both men, Bush and Blair, will be damned in history. Both men have made their respective countries the two most hated countries in the world.;George Galloway;history
Open markets offer the only realistic hope of pulling billions of people in developing countries out of abject poverty, while sustaining prosperity in the industrialized world.;Kofi Annan;history
Either war is obsolete, or men are.;R. Buckminster Fuller;men
All men's souls are immortal, but the souls of the righteous are immortal and divine.;Socrates;men
Every religion is true one way or another. It is true when understood metaphorically. But when it gets stuck in its own metaphors, interpreting them as facts, then you are in trouble.;Joseph Campbell;religion
In a state therefore of great equality and virtue, where pure and simple manners prevailed, the increase of the human species would evidently be much greater than any increase that has been hitherto known.;Thomas Malthus;equality
A vacuum is a hell of a lot better than some of the stuff that nature replaces it with.;Tennessee Williams;nature
Jason Lee is the most famous actor from Hawaii I can think of.;Tia Carrere;famous
My senior year of high school, when I was getting recruited for college, my dad goes to me, 'You can become an Olympic champion.' And that's the first time that I'd heard someone else say that to me. I was like, 'Uh, are you talking to me?';Ryan Lochte;dad
However things may seem, no evil thing is success and no good thing is failure.;Henry Wadsworth Longfellow;failure
Freedom only for the members of the government, only for the members of the Party - though they are quite numerous - is no freedom at all.;Rosa Luxemburg;freedom
I think basically becoming famous has taken the place of going to Heaven in modern society, hasn't it? That's the place where your dreams will come true. It's an act of faith now they think that's going to sort things out.;Jarvis Cocker;famous
The truth is that men are tired of liberty.;Benito Mussolini;truth
You learn far more from negative leadership than from positive leadership. Because you learn how not to do it. And, therefore, you learn how to do it.;Norman Schwarzkopf;leadership
I think as an American society, when we're paying too many taxes or dealing with war, we don't want to see sad things at the movies.;Zoe Saldana;movies
I'm a true believer in karma. You get what you give, whether it's bad or good.;Sandra Bullock;good
Bill Gates is the pope of the personal computer industry. He decides who's going to build.;Larry Ellison;computers
Nobody climbs mountains for scientific reasons. Science is used to raise money for the expeditions, but you really climb for the hell of it.;Edmund Hillary;money
Because wherever I am today, I still owe it to God and I owe it to two men - the Honorable Elijah Muhammad and Malcolm X and of course, two very special women, my mother and my wife.;Louis Farrakhan;god
Willingness to change is a strength, even if it means plunging part of the company into total confusion for a while.;Jack Welch;strength
When art wins, everyone wins.;Jerry Saltz;art
I don't know how it is for women or for other guys, but when I was young and in my 20s, I had a fear of marriage.;Jeff Bridges;marriage
When you're a chef, you graze. You never get a chance to sit down and eat. They don't actually sit down and eat before you cook. So when I finish work, the first thing I'll do, and especially when I'm in New York, I'll go for a run. And I'll run 10 or 15k on my - and I run to gain my appetite.;Gordon Ramsay;work
The most dangerous leadership myth is that leaders are born-that there is a genetic factor to leadership. This myth asserts that people simply either have certain charismatic qualities or not. That's nonsense in fact, the opposite is true. Leaders are made rather than born.;Warren G. Bennis;leadership
My mother gets all mad at me if I stay in a hotel. I'm 31-years-old, and I don't want to sleep on a sleeping bag down in the basement. It's humiliating.;Ben Affleck;mom
The technology is really where all of the changes have taken place, but the fundamentals of a good story being the basis of every good picture, and really the only basis still remains the rule, more so today, I think, because we've unfortunately weaned an audience from birth to kind of mindless movies.;Richard D. Zanuck;technology
A career is all very well, but no one lives by work alone.;Lorna Luft;alone
I always like to start my morning with a good amount of fruit. I really like pineapple, particularly because of the enzymes that it has. Sometimes I have oatmeal. But if I'm feeling like I really want to be watching my weight more, then I definitely do a protein, like an omelet, scrambled eggs or some smoked salmon.;Cynthia Nixon;morning
If you share a common ancestor with somebody, you're related to them. It doesn't mean that you're going to invite them to the family reunion, but it means that you share DNA. I think it's fascinating.;Henry Louis Gates;family
Here I am paying big money to you writers and what for? All you do is change the words.;Samuel Goldwyn;money
One of the big changes in politics has been because families, individuals, have felt worried, insecure... worried about the economy, worried about their jobs, worried about their kids' futures... actually the disconnect between the public and media discourse and people's everyday concerns has become bigger not smaller.;Nick Clegg;politics
I think I jump around more when I'm alone.;Nicolas Cage;alone
Success seems to be connected with action. Successful people keep moving. They make mistakes, but they don't quit.;Conrad Hilton;success
I know it's not cat food, but what exactly is it that they put inside of tinned ravioli?;Doug Coupland;food
Unless you have been to boarding-school when you are very young, it is absolutely impossible to appreciate the delights of living at home.;Roald Dahl;home
The public school has become the established church of secular society.;Ivan Illich;society
We're not uncomfortable with it, and we've already been through enough of the music business where I'm not really worried that commercial success is going to in some way - we're already past saving, you know what I mean? It's too late for us.;Jerry Garcia;success
Islam expect every Muslim to do this duty, and if we realise our responsibility time will come soon when we shall justify ourselves worthy of a glorious past.;Muhammad Ali Jinnah;time
Let others lead small lives, but not you. Let others argue over small things, but not you. Let others cry over small hurts, but not you. Let others leave their future in someone else's hands, but not you.;Jim Rohn;future
I still think that movies are amazing I respect actors and directors.;Joaquin Phoenix;amazing
'Hamlet' is one of the most dangerous things ever set down on paper. All the big, unknowable questions like what it is to be a human being the difference between sanity and insanity the meaning of life and death what's real and not real. All these subjects can literally drive you mad.;Michael Sheen;death
I am a great lover of art, in many forms: paintings, objets, textiles. I don't have the talent for painting, but I have a very good sense of colour, a love of visual beauty.;Jacqueline Bisset;beauty
The secret of a happy marriage is finding the right person. You know they're right if you love to be with them all the time.;Julia Child;anniversary
I have no wisdom to share on dating.;Rachel Dratch;wisdom
And what is a stage dad, or a stage mom? It's someone who's protective. That's all.;Nigel Lythgoe;dad
Weird people follow you in the streets, you can't sit alone in a restaurant or a cafe and read a book in peace, and I think everybody values those moments of being alone.;Winona Ryder;peace
I like four-hour movies.;Kevin Costner;movies
If you live in a ghetto and really want not to just change your life and your family's life but change your ghetto's life, make your ghetto a good neighbourhood, learn science try to be like Mark Zuckerberg, Bill Gates and Steve Jobs.;will.i.am;science
Like religion, politics, and family planning, cereal is not a topic to be brought up in public. It's too controversial.;Erma Bombeck;politics
You know, American citizens, I don't think, ever thought that the right to the pursuit of happiness did not include the right to marry the person you love. But for a whole number of Americans, gay Americans, that happens to be true.;Andrew Sullivan;happiness
I decided that, if I were to write a teen series, I'd want to set it in a place that was familiar to me - Manhattan, where I'd grown up - and I'd model the characters on myself and my friends.;Cecily von Ziegesar;teen
To know nothing is the happiest life.;Desiderius Erasmus;life
All my life, Americans have been accustomed to thinking of theirs as 'the richest, freest' country in the world. By most measurements, it was long a contender for that honor, and - among the larger countries, if equal weight were given to wealth and indices of freedom - probably did deserve to be so described.;Conrad Black;freedom
When an action is once done, it is right or wrong for ever no accidental failure of its good or evil fruits can possibly alter that.;William Kingdon Clifford;failure
Travel is very subjective. What one person loves, another loathes.;Robin Leach;travel
He that would live in peace and at ease must not speak all he knows or all he sees.;Benjamin Franklin;peace
And the sad truth is that nobody wants me to write comedy. The Exorcist not only ended that career, it expunged all memory of its existence.;William Peter Blatty;sad
I grew up in L.A., and I don't think I've seen L.A. onscreen in a way that felt real to me. There are definitely movies, but they are few and far between.;Zoe Kazan;movies
Protecting the rights of even the least individual among us is basically the only excuse the government has for even existing.;Ronald Reagan;government
I've become so earthy. And I never was earthy. I'm doing all kinds of different roles which are not at all like the intellectual and the legal mind of Ben Stone.;Michael Moriarty;legal
During the Depression, my dad made radios to sell to make extra money. Nobody had any money to buy the radios, so he would trade them for dogs. He built kennels in the backyard, and he cared for the dogs.;Betty White;money
The British system had requirements, including Latin. I'm not positive you ever had to know Greek, but there are certainly kinds of curricula where you had to know Greek too. I think in Britain there was the most mindless, repetitive sort of learning.;William Scott;positive
I admit I can't shake the idea that there is virtue in suffering, that there is a sort of psychic economy, whereby if you embrace success, happiness and comfort, these things have to be paid for.;Hugh Laurie;happiness
I've learned that success comes in a very prickly package. Whether you choose to accept it or not is up to you.;Sandra Bullock;success
Keep your face to the sunshine and you cannot see a shadow.;Helen Keller;nature
The new architecture of transparency and lightness comes from Japan and Europe.;Arthur Erickson;architecture
Patience was not my strong point.;Lauren Bacall;patience
Whatever poet, orator or sage may say of it, old age is still old age.;Sinclair Lewis;age
This is actually a very important principle that science is learning about large systems like evolution and that futurists are learning about anticipating human society: just because a future scenario is plausible doesn't mean we can get there from here.;Kevin Kelly;future
My birth neither shook the German Empire nor caused much of an upheaval in the home. It pleased mother, caused father a certain amount of pride and my elder brother the usual fraternal jealousy of a hitherto only son.;Conrad Veidt;jealousy
We have domesticated God's transcendence. We often learn about God at about the same time as we are learning about Santa Claus but our ideas about Santa Claus change, mature and become more nuanced, whereas our ideas of God can remain at a rather infantile level.;Karen Armstrong;god
Being a mom's so empowering and incredible. I'm one of those people who believes that life brings things to you at a certain time for a certain reason, and if you just go with it, that's where the best moments come from.;Ashlee Simpson;mom
Christmas is the antithesis of Thanksgiving. Christmas is pretty much a man-made holiday.;John Clayton;thanksgiving
Canada and the United States are also working at the World Trade Organization and in our own hemisphere with negotiations for a Trade Area of the Americas to try to help countries create a positive climate for investment and trade.;Paul Cellucci;positive
In sport there is never any moment that is the same as the other. I have been in Formula One for 12 years, and out of that I had one year with the perfect car.;Michael Schumacher;car
A guy named Charlie Beacham was my first mentor at Ford. He taught me the importance of the dealers, and he rubbed my nose in the retail business.;Lee Iacocca;business
We all write poems it is simply that poets are the ones who write in words.;John Fowles;poetry
Black power can be clearly defined for those who do not attach the fears of white America to their questions about it.;Stokely Carmichael;power
All great art is the work of the whole living creature, body and soul, and chiefly of the soul.;John Ruskin;art
It seems essential, in relationships and all tasks, that we concentrate only on what is most significant and important.;Soren Kierkegaard;dating
