With my new venture, Club Mom, we want to empower moms to feel their value and also build their collective power to make their lives better and easier. We want to bring them together as a community to share experiences and information.;Andrew Shue;mom
When I was a child, I wanted to be an actor, but I had really bad buckteeth. I didn't want to get braces, but my mom said I couldn't be an actor if I didn't get the braces. So, I got the braces.;James Franco;mom
But I absolutely believe that architecture is a social activity that has to do with some sort of communication or places of interaction, and that to change the environment is to change behaviour.;Thom Mayne;architecture
God continues to work miracles in my life.;Willie Aames;work
Punk is not just the sound, the music. Punk is a lifestyle.;Billie Joe Armstrong;music
To acquire knowledge, one must study but to acquire wisdom, one must observe.;Marilyn vos Savant;wisdom
So sometimes the facts are good and sometimes the facts are bad, the important thing from the point of view of a principle as broad and important as freedom of speech is that the courts articulate and set forth in a very protective way what those principles are.;Floyd Abrams;freedom
Art is for anyone. It just isn't for everyone. Still, over the past decade, its audience has hugely grown, and that's irked those outside the art world, who get irritated at things like incomprehensibility or money.;Jerry Saltz;art
Cease to inquire what the future has in store, and take as a gift whatever the day brings forth.;Horace;future
The moments of happiness we enjoy take us by surprise. It is not that we seize them, but that they seize us.;Ashley Montagu;happiness
I don't cook. I don't know anything about food. I've never reviewed a restaurant.;Calvin Trillin;food
As long as there's pasta and Chinese food in the world, I'm okay.;Michael Chang;food
In complete darkness, it is only knowledge and wisdom that separates us.;Janet Jackson;wisdom
Ancient recipients of instant news probably couldn't do very much about it, for instance. Xerxes would still need three months to get his army together, and he might not get home for years.;Peter Singer;home
You must learn day by day, year by year to broaden your horizon. The more things you love, the more you are interested in, the more you enjoy, the more you are indignant about, the more you have left when anything happens.;Ethel Barrymore;wisdom
America, 5 years after this brutal attack, is testament that a Nation conceived in liberty and equality will endure. It is a triumph of millions of Americans but it is also the triumph of an idea larger than any one person, larger than any one nation.;Nick Rahall;equality
Life is doubt, and faith without doubt is nothing but death.;Miguel de Unamuno;death
Even at school I studied ethics instead of religion.;Ville Valo;religion
My father gave me the greatest gift anyone could give another person, he believed in me.;Jim Valvano;birthday
You know, sometimes I feel well and vital in the world, and sometimes I just feel so distressed I want to pull my hair out by the roots.;Sharon Stone;fear
We think the Mac will sell zillions, but we didn't build the Mac for anybody else. We built it for ourselves. We were the group of people who were going to judge whether it was great or not. We weren't going to go out and do market research. We just wanted to build the best thing we could build.;Steve Jobs;great
I don't believe we need the government's help as much as some think we do. That belief sets me apart from the Democrats, since their way of dealing with everything is to tax and spend.;Jesse Ventura;government
I hated the idea of a high school sweetheart. Growing up, oh my God, it just made me sick. I wanted to have a range of cool boyfriends. I wanted to travel around and date these interesting men. Then it just happened. You fall in love.;Charlotte Arnold;travel
A work of art is the unique result of a unique temperament.;Oscar Wilde;art
Dictionary is the only place that success comes before work. Hard work is the price we must pay for success. I think you can accomplish anything if you're willing to pay the price.;Vince Lombardi;success
Going into politics is something people have asked me about forever.;Caroline Kennedy;politics
My mom started smoking when she was 11. She went to the hill next door to try her first cigarette. She set the entire hill on fire, but it didn't deter her.;Loni Anderson;mom
Men of ill judgment ignore the good that lies within their hands, till they have lost it.;Sophocles;men
I'm world famous, everywhere I go there are people who love me because of I've been able to bring them some joy from the movies I've made.;Tony Curtis;famous
You never stop learning. If you have a teacher, you never stop being a student.;Elisabeth Rohm;teacher
There is something curiously boring about somebody else's happiness.;Aldous Huxley;happiness
I really like children to watch my movies.;Jackie Chan;movies
Stories in which the destruction of society occurs are explorations of social fears and issues that filmmakers, novelists, playwrights, painters have been examining for a long time.;J. J. Abrams;society
I was born with music inside me. Music was one of my parts. Like my ribs, my kidneys, my liver, my heart. Like my blood. It was a force already within me when I arrived on the scene. It was a necessity for me-like food or water.;Ray Charles;music
The work of art shows people new directions and thinks of the future. The house thinks of the present.;Adolf Loos;architecture
We busted a lot of family secrets with this. But to make a long story short, my parents relationship was built heavily on security issues for my Mom, and when my Dad couldn't provide security, the relationship unraveled.;Kenny Loggins;mom
Americans are so enamored of equality that they would rather be equal in slavery than unequal in freedom.;Alexis de Tocqueville;freedom
My hopes are not always realized, but I always hope.;Ovid;hope
My house is my refuge, an emotional piece of architecture, not a cold piece of convenience.;Luis Barragan;architecture
My hope for my children must be that they respond to the still, small voice of God in their own hearts.;Andrew Young;hope
No person will make a great business who wants to do it all himself or get all the credit.;Andrew Carnegie;leadership
Believe in and follow your dreams.;Kristanna Loken;dreams
Is there any purpose to translating poetry? A poem does not contain information of importance, like a signpost or a warning notice.;James Buchan;poetry
Money is always there but the pockets change it is not in the same pockets after a change, and that is all there is to say about money.;Gertrude Stein;money
Mental attitude and concentration are the keys to pitching.;Ferguson Jenkins;attitude
I've always known I would be a success, but I was surprised at the way it came.;Eva Gabor;success
Being on 'Glee' was amazing. I remember my first day on set, my first day I arrived to the set I was in my trailer and all of the actors came and banged on my door - Lea Michele, Chris Colfer, Amber Riley, Naya Rivera. They all welcomed me with open arms, so it was a great experience. It felt like family, and I miss them a lot over there.;NeNe Leakes;amazing
We went online to surrogacy agencies. We interviewed lots of people - and I have to say, with all due respect, some of them were freaks. I was very leery of the process the whole way through.;Christopher Meloni;respect
The great and important duty which is incumbent on Christians, is to guard against all appearance of evil to watch against the first risings in the heart to evil and to have a guard upon our actions, that they may not be sinful, or so much as seem to be so.;George Whitefield;great
My parents had an old-fashioned ideal of college, that four years at a liberal arts college should be a liberal arts education.;Julie Bowen;education
When I see a good singer, I get teary-eyed. Part of it is jealousy because all comedians are frustrated rock stars. That's a fact.;Jeff Ross;jealousy
All school districts receive funds from the federal government, through the Department of Education, to support anti-drug education efforts.;John Walters;education
I was always making up rhymes. But I never thought that poetry would become my life.;Saul Williams;poetry
Follow that will and that way which experience confirms to be your own.;Carl Jung;experience
I think it is quite dangerous for an organisation to think they can predict where they are going to need leadership. It needs to be something that people are willing to assume if it feels relevant, given the context of any situation.;Margaret J. Wheatley;leadership
Most of the change we think we see in life is due to truths being in and out of favor.;Robert Frost;society
We should be the pro-legal immigration party. A party that has a positive platform and agenda on how we can create a legal immigration system that works for immigrants and works for America.;Marco Rubio;legal
If God only used perfect people, nothing would get done. God will use anybody if you're available.;Rick Warren;god
Dying is easy, it's living that scares me to death.;Annie Lennox;death
It is the belief that extremes and excesses of inequality must be reduced so that each person is free to fully develop his or her full potential. This is why we take precious time out of our lives and give it to politics.;Paul Wellstone;politics
Indeed science alone may perhaps be sterile when pursued without an understanding of the world in which scientific knowledge is created and in which the fruits of science are used.;Polykarp Kusch;knowledge
The highest revelation is that God is in every man.;Ralph Waldo Emerson;god
Well, I have a sister that I'm very close with, and that relationship is probably the most intense relationship of my life to date, probably of my life, period.;Zoe Kazan;relationship
My relationship with the journalists who covered the campaign was complicated. I often hid from the critical eye of their cameras and their omnipresent digital recorders, wary of the critique implicit in every captured moment. But I also grew to respect and understand their passion for their work, their love for the journey we were sharing.;Alexandra Kerry;relationship
Stand-up is like a movie every night. You write it, direct it, produce it, the audience votes, and you go home. There's nothing more satisfying.;Elayne Boosler;home
Democracy does not guarantee equality of conditions - it only guarantees equality of opportunity.;Irving Kristol;equality
How do you rebel in a family of rebels?;Nicolas Cage;family
Sometimes I miss out the morning's painting session and instead study my Japanese books in the open.;Gustav Klimt;morning
We hear all around us to love ourselves, and one of the ways we can do that is to eat food that serves our body, but also for us to love the food we're eating.;Gabrielle Reece;food
I did an album a long time ago called 'Replicas,' which was entirely science-fiction driven, or science-fantasy. Since then it's been a song here, a song there. It's not really a constant theme. I've written far more about my problems with religion, with God and all that.;Gary Numan;religion
I think my love of journalizing my life comes from my mom.;Jeff Bridges;mom
I was delighted to not go to university. I couldn't wait to be out of education.;Tom Stoppard;education
Change does not roll in on the wheels of inevitability, but comes through continuous struggle. And so we must straighten our backs and work for our freedom. A man can't ride you unless your back is bent.;Martin Luther King, Jr.;freedom
The very exercise of leadership fosters capacity for it.;Cyril Falls;leadership
Working with Chaplin was very amusing and strange. His films are so funny, but working with him, I found him to be a very serious man. Whereas the films of Hitchcock are macabre, he could be a very funny man to work with, always telling jokes and holding court. Of course, when I worked with Charlie he was getting older.;Tippi Hedren;funny
The whole course of human history may depend on a change of heart in one solitary and even humble individual - for it is in the solitary mind and soul of the individual that the battle between good and evil is waged and ultimately won or lost.;M. Scott Peck;history
I want anyone who believes in life, liberty, pursuit of happiness to succeed. And I want any force, any person, any element of an overarching Big Government that would stop your success, I want that organization, that element or that person to fail. I want you to succeed.;Rush Limbaugh;happiness
The heart of the jealous knows the best and most satisfying love, that of the other's bed, where the rival perfects the lover's imperfections.;Djuna Barnes;best
Obviously the facts are never just coming at you but are incorporated by an imagination that is formed by your previous experience. Memories of the past are not memories of facts but memories of your imaginings of the facts.;Philip Roth;imagination
When times are tough and people are frustrated and angry and hurting and uncertain, the politics of constant conflict may be good, but what is good politics does not necessarily work in the real world. What works in the real world is cooperation.;William J. Clinton;work
When his life was ruined, his family killed, his farm destroyed, Job knelt down on the ground and yelled up to the heavens, 'Why god? Why me?' and the thundering voice of God answered, 'There's just something about you that pisses me off.';Stephen King;family
Abraham Lincoln comes from nothing, has no education, no money, lives in the middle of nowhere on the frontier. And despite the fact that he suffers one tragedy and one setback after another, through sheer force of will, he becomes something extraordinary: not only the president but the person who almost single-handedly united the country.;Seth Graham-Smith;education
Put not your trust in money, but put your money in trust.;Oliver Wendell Holmes;money
We live in a state with a wonderful climate and plenty of natural beauty, from the shores of Cumberland Island to the Chattahoochee River to the Blue Ridge Mountains.;Roy Barnes;beauty
Since taking office, President Obama has signed into law spending increases of nearly 25 percent for domestic government agencies - an 84 percent increase when you include the failed stimulus. All of this new government spending was sold as 'investment.';Paul Ryan;government
Oh, I adored Mickey Mouse when I was a child. He was the emblem of happiness and funniness. You went to the movies then, you saw two movies and a short. When Mickey Mouse came on the screen and there was his big head, my sister said she had to hold onto me. I went berserk.;Maurice Sendak;movies
In justice to human society it may perhaps be said of almost all the polities and civil institutions in the world, however imperfect, that they have been founded in and carried on with very considerable wisdom.;Ezra Stiles;wisdom
I loved to read, and I think any child who loves to read will read anything, including the back of the cereal box, which I did every morning.;Judy Blume;morning
If the history of the Day of Atonement has anything to say to us now it is: never relieve individuals of moral responsibility. The more we have, the more we grow.;Jonathan Sacks;history
Chicago is known for good steaks, expensive stores and beautiful architecture. Unfortunately, the Windy City also enjoys a reputation for corrupt politics, violent crime, and some of the strictest gun control laws anywhere in the country.;Bob Barr;architecture
Life's greatest happiness is to be convinced we are loved.;Victor Hugo;happiness
I don't want to be interesting. I want to be good.;Ludwig Mies van der Rohe;art
Only government can take perfectly good paper, cover it with perfectly good ink and make the combination worthless.;Milton Friedman;good
I've learned that life is very tricky business: Each person needs to find what they want to do in life and not be dissuaded when people question them.;Eli Wallach;business
I love romantic poetry.;Richard Dawkins;poetry
When I was a little kid - and even still - I loved magic tricks. When I saw how movies got made - at least had a glimpse when I went on the Universal Studios tour with my grandfather, I remember feeling like this was another means by which I could do magic.;J. J. Abrams;movies
The only true happiness comes from squandering ourselves for a purpose.;John Mason Brown;happiness
If some persons died, and others did not die, death would be a terrible affliction.;Jean de la Bruyere;death
There's a tradition in British intellectual life of mocking any non-political force that gets involved in politics, especially within the sphere of the arts and the theatre.;Harold Pinter;politics
Where there is shouting, there is no true knowledge.;Leonardo da Vinci;knowledge
Affliction is the wholesome soil of virtue, where patience, honor, sweet humility, and calm fortitude, take root and strongly flourish.;David Mallet;patience
The first resistance to social change is to say it's not necessary.;Gloria Steinem;politics
There will be no lasting peace either in the heart of individuals or in social customs until death is outlawed.;Albert Camus;death
I hope I left behind a legacy that people will enjoy. But whatever they want to say, I can't predict.;Robert Duvall;hope
I'm blonde and tanned and normal-sized! I'm sweet, shy, funny, have a big heart and I'm nice - and I like to eat.;Paris Hilton;funny
No, it's interesting to remake a film for the contemporary audience today. I think it's a good idea it needs to respect the original idea. Don't just take the title and change everything else.;Dario Argento;respect
Everybody in America is going to have to sacrifice to help us rebuild the Gulf Coast. Every government program, every individual, we are all going to have to sacrifice.;Tom Coburn;government
For a successful technology, reality must take precedence over public relations, for Nature cannot be fooled.;Richard P. Feynman;technology
Every time the government grows we lose more of who we are.;Glenn Beck;government
In my second year in graduate school, I took a computer course and that was like lightening striking.;Ted Nelson;graduation
My father was very big on marriage.;Sidney Poitier;marriage
Well, you know my number one cause has always been that women's reproductive health needs to be protected.;Ann Richards;health
I'm never afraid to try something if I think it's funny. And I know I'll regret it if I don't.;Seann William Scott;funny
Take advantage of every opportunity to practice your communication skills so that when important occasions arise, you will have the gift, the style, the sharpness, the clarity, and the emotions to affect other people.;Jim Rohn;communication
What differentiates us from animals is the fact that we can listen to other people's dreams, fears, joys, sorrows, desires and defeats - and they in turn can listen to ours.;Henning Mankell;dreams
I was like a boy playing on the sea-shore, and diverting myself now and then finding a smoother pebble or a prettier shell than ordinary, whilst the great ocean of truth lay all undiscovered before me.;Isaac Newton;truth
Observe constantly that all things take place by change, and accustom thyself to consider that the nature of the Universe loves nothing so much as to change the things which are, and to make new things like them.;Marcus Aurelius;change
To know even one life has breathed easier because you have lived. This is to have succeeded.;Ralph Waldo Emerson;success
You're not famous until my mother has heard of you.;Jay Leno;famous
I do engineering, not religion.;Daniel J. Bernstein;religion
For many people, managing pain involves using prescription medicine in combination with complementary techniques like physical therapy, acupuncture, yoga and massage. I appreciate this because I truly believe medical care should address the person as a whole - their mind, body, and spirit.;Naomi Judd;medical
Politics is an act of faith you have to show some kind of confidence in the intellectual and moral capacity of the public.;George McGovern;faith
We consume our tomorrows fretting about our yesterdays.;Aulus Persius Flaccus;fear
I'm thankful for all the things that this job has given me and my family. But probably the thing that I am most proud of throughout my career is that, not only myself, but my family and the people around me have just been regular people, which we are.;Brett Favre;family
Action and reaction, ebb and flow, trial and error, change - this is the rhythm of living. Out of our over-confidence, fear out of our fear, clearer vision, fresh hope. And out of hope, progress.;Bruce Barton;hope
I once had a rose named after me and I was very flattered. But I was not pleased to read the description in the catalogue: no good in a bed, but fine up against a wall.;Eleanor Roosevelt;good
Men may change their climate, but they cannot change their nature. A man that goes out a fool cannot ride or sail himself into common sense.;Joseph Addison;nature
Solitude has its own very strange beauty to it.;Liv Tyler;beauty
Life began with waking up and loving my mother's face.;George Eliot;mothersday
We can revolutionize the attitude of inner city brown and black kids to learning. We need a civil rights movement within the African-American community.;Henry Louis Gates;attitude
I'm into designing houses and interior design. I like change. I like creating things out of nothing.;Chris Kirkpatrick;design
For science must breathe the oxygen of freedom.;John Charles Polanyi;science
I am thankful, of course, for the prize and thankful to God for each story, each idea, each word, each day.;Isaac Bashevis Singer;god
Crime and bad lives are the measure of a State's failure, all crime in the end is the crime of the community.;H. G. Wells;failure
It's only fair that stable gay relationships of long standing should have the same rights and responsibilities as married couples. I know the image of gay marriage is to some people horrific and ludicrous.;Ian Mckellen;marriage
The 1990s, after the reign of terror of academic vandalism, will be a decade of restoration: restoration of meaning, value, beauty, pleasure, and emotion to art and restoration of art to its audience.;Camille Paglia;art
Men always want to be a woman's first love - women like to be a man's last romance.;Oscar Wilde;men
Couldn't start the morning without caffeine.;Ginnifer Goodwin;morning
I like politics. I like traveling in the United States.;Laura Bush;politics
Of course I regret not having been able to spend time with my family.;Aung San Suu Kyi;family
Men who have a pierced ear are better prepared for marriage - they've experienced pain and bought jewelry.;Rita Rudner;men
It's really amazing that in the age of unbelief, as a smart man called it, there isn't even more fraud. After all, with no God, there's no one to ever call you to account, and no accounting at all if you can get away with it.;Ben Stein;amazing
It wasn't not being famous any more, or even not being a recording artist. It was having nobody who needed me, no phones ringing, nothing to do. Because I'm still too young to do nothing. I was only 24 when all that happened. Now, at 40, I feel I've got more to give than I ever have.;Gary Barlow;famous
Genius is talent set on fire by courage.;Henry Van Dyke;courage
When you learn that a truth is a lie, anger follows.;Grace Slick;anger
Today, I will vote in support of the Marriage Protection Amendment. I shall do so because like President Bush, I strongly believe that marriage should be between a man and a woman.;Nick Lampson;marriage
The best thing commercially, which is the worst artistically, by and large, is the most successful.;Orson Welles;best
You're talking to someone who has been married to various people for the last 40 years of her life. Dating is not really something familiar. I've never really been a dater.;Stockard Channing;dating
I love my beauty. It's not my fault.;Valentino Garavani;beauty
I guess I'm a very keen observer, and I'd like to think I have a good imagination.;Eric Bana;imagination
I try to decorate my imagination as much as I can.;Franz Schubert;imagination
Certainly there are things in life that money can't buy, but it's very funny - Did you ever try buying then without money?;Ogden Nash;money
I had my boy in Boston on Easter Sunday. That kills me, from a sports perspective. He's a Boston baby and I'm a New York guy.;Kevin James;sports
Telephone, n. An invention of the devil which abrogates some of the advantages of making a disagreeable person keep his distance.;Ambrose Bierce;technology
In spite of everything I still believe that people are really good at heart. I simply can't build up my hopes on a foundation consisting of confusion, misery and death.;Anne Frank;good
In reading the lives of great men, I found that the first victory they won was over themselves... self-discipline with all of them came first.;Harry S. Truman;great
I balanced all, brought all to mind, the years to come seemed waste of breath, a waste of breath the years behind, in balance with this life, this death.;William Butler Yeats;death
The history of the relationship between comedy and swimming is short indeed. Of course it is always funny when someone falls into water, but that's about it.;Arthur Smith;relationship
Everything you listen to when you are 17 should be embarrassing, otherwise you are way too cool.;Jessica Brown Findlay;cool
The public history of modern art is the story of conventional people not knowing what they are dealing with.;Golda Meir;art
In today's world, it is shortsighted to think that infectious diseases cannot cross borders. By allowing developing countries access to generic drugs, we not only help improve health in those nations, we also help ourselves control these debilitating and often deadly diseases.;Ron Wyden;health
