I'm lucky to have a great support system in my friends and some of my family. If you have those people that you trust, go ahead and fall back into them and let them be your hammock and cocoon and let them embrace you.;JoJo;trust
I look at my father. He is one of my heroes. He is such an incredible, classy man. He was such a great father and such a great husband in so many ways, and we lived through some pretty tough times losing my mom. When I see all that he did, I think, 'Wow, that's a really wonderful man.';Emmanuelle Chriqui;mom
I am so used to seeing the sort of play which deals with one man and two women. They do not leave me with the feeling I have made a full theatrical meal they do not give me the experience of the multiplicity of life.;E. M. Forster;women
The earth has grown old with its burden of care, but at Christmas it always is young, the heart of the jewel burns lustrous and fair, and its soul full of music breaks the air, when the song of angels is sung.;Phillips Brooks;music
United Artists wanted to do records with me. I had no idea, what a rare thing that was... to make an album. And they put a guy with me working on songs, and I got busy with films. I just kind of let it slide. Isn't that amazing?;John Astin;amazing
I'm leaving because the weather is too good. I hate London when it's not raining.;Groucho Marx;good
The future is like heaven, everyone exalts it, but no one wants to go there now.;James A. Baldwin;future
Love means to love that which is unlovable or it is no virtue at all.;Gilbert K. Chesterton;love
The art of the parenthesis is one of the greatest secrets of eloquence in Society.;Nicolas Chamfort;art
The days you work are the best days.;Georgia O'Keeffe;best
Well, success does not mean doing well.;Shirley MacLaine;success
I'd rather be able to face myself in the bathroom mirror than be rich and famous.;Ani DiFranco;famous
Freedom is never dear at any price. It is the breath of life. What would a man not pay for living?;Mahatma Gandhi;freedom
I'm most proud of the blessings that God has bestowed upon me, in my life. He's given me the vision to truly see that you can fall down, but you can still get back up. Hopefully I'll learn from my mistakes and have the opportunity to strengthen and improve the next thing I do.;Martin Lawrence;life
I'm going to let people know that it's cool to have a child and be young and still be a good mom. It's really tough, but I'm doing it.;Brandy Norwood;mom
It worries me about our unwillingness to really address reforms and modernization in Medicare. This thing was designed 37 years ago. It has not evolved to keep pace with current medical technology.;John Sununu;medical
Greed is a basic part of animal nature. Being against it is like being against breathing or eating. It means nothing.;Ben Stein;nature
You wouldn't want to be called a sell-out by selling a product. Selling out was frowned on, whereas now you can major in it at business school.;Alan Alda;business
I wanted to have a political career. I thought studying political science would be the best way to achieve it.;Bianca Jagger;science
I don't care whether you're driving a hybrid or an SUV. If you're headed for a cliff, you have to change direction. That's what the American people called for in November, and that's what we intend to deliver.;Barack Obama;change
We still live with this unbelievable threat over our heads of nuclear war. I mean, are we stupid? Do we think that the nuclear threat has gone, that the nuclear destruction of the planet is not imminent? It's a delusion to think it's gone away.;Kevin Costner;war
The upside to anger? Getting it out of your system. You got to express your anger. Then you have room for more positive things. If I hold something in a long time, and then I speak it, it's amazing how the light shines so much brighter.;Reba McEntire;amazing
Although a man may wear fine clothing, if he lives peacefully and is good, self-possessed, has faith and is pure and if he does not hurt any living being, he is a holy man.;Denis Diderot;faith
Love is an irresistible desire to be irresistibly desired.;Robert Frost;love
I went to school for special education. I always assumed when I had the opportunity I would love to try and help kids with disabilities.;Clay Aiken;education
Focused, hard work is the real key to success. Keep your eyes on the goal, and just keep taking the next step towards completing it. If you aren't sure which way to do something, do it both ways and see which works better.;John Carmack;work
We have art in order not to die of the truth.;Friedrich Nietzsche;truth
You come home, and you party. But after that, you get a hangover. Everything about that is negative.;Mike Tyson;home
The thing I love most about going on vacation is that I get to leave behind any kind of schedule. My entire life is scheduled from morning to night, and when I'm on vacation, there is no schedule.;Kelly Clarkson;morning
Life becomes harder for us when we live for others, but it also becomes richer and happier.;Albert Schweitzer;life
Women are like cars: we all want a Ferrari, sometimes want a pickup truck, and end up with a station wagon.;Tim Allen;women
I look up to Mick Jagger because he's an amazing performer and he's such an individual. I respect him and admire him eternally.;Victoria Justice;amazing
I don't want to transform America. I want to restore to America the economic values of freedom and opportunity and limited government that has made us the powerhouse of the world.;Mitt Romney;freedom
Life is better than death, I believe, if only because it is less boring, and because it has fresh peaches in it.;Alice Walker;death
Winning is not a sometime thing it's an all time thing. You don't win once in a while, you don't do things right once in a while, you do them right all the time. Winning is habit. Unfortunately, so is losing.;Vince Lombardi;time
Develop an interest in life as you see it the people, things, literature, music - the world is so rich, simply throbbing with rich treasures, beautiful souls and interesting people. Forget yourself.;Henry Miller;life
Fancy the happiness of Pinocchio on finding himself free! Without saying yes or no, he fled from the city and set out on the road that was to take him back to the house of the lovely Fairy.;Carlo Collodi;happiness
My faith is an important part of my life and over the years I've learnt that it takes a proud man to say he doesn't need anything. It has been a quiet strength and a backbone through a lot of difficult times.;Bear Grylls;faith
I remember that. I was talking to him and I said how great it would be if actors had a tail because I have animals and a tail is so expressive. On a cat you can tell everything. You can tell if they're annoyed. You can tell whether they're scared.;Christopher Walken;great
The golden opportunity you are seeking is in yourself. It is not in your environment it is not in luck or chance, or the help of others it is in yourself alone.;Orison Swett Marden;alone
I don't want or need to gain respect with what I do off the court. I want respect for what I do on the court.;Vince Carter;respect
My fastest time in high school was a 4:29 mile. I think cross-country has something to do with my longevity in my business. When you're in an eight-mile race, you never give up.;Alice Cooper;business
Weapons of mass destruction aren't pulled out of a black hat like a white rabbit at a magic show. They're produced in factories. There's science and technology involved. They're not produced in a hole in the ground or in a basement.;Scott Ritter;science
I sort of try to write everything for me. I'm a huge sports fan but have no interest in minutiae. I don't remember who won Super Bowls five years ago or listen to sports talk radio. I'm trying to make sure the jokes are self-contained so they're accessible to everyone.;Norm MacDonald;sports
Good acting is good acting, however you learn it. Some people who haven't studied are amazing. Some people like Leonardo DiCaprio are naturally gifted - he's learned technique by working with people early on.;Sam Rockwell;amazing
Art allows people a way to dream their way out of their struggle.;Russell Simmons;art
I don't know about the romantic comedy route, although never say never.;Kristen Wiig;romantic
What some call health, if purchased by perpetual anxiety about diet, isn't much better than tedious disease.;Alexander Pope;health
The word career is a divisive word. It's a word that divides the normal life from business or professional life.;Grace Paley;business
Art is the objectification of feeling.;Herman Melville;art
The truth is in California you can't build a new manufacturing facility, and businesses are leaving in droves because of bad government policy.;Carly Fiorina;government
The travel, the amazing work I have had the chance to do, the meetings with different people are all very inspiring and give me lots of positive energy.;Saskia de Brauw;positive
Most Americans want health insurance.;Jacob Lew;health
If you dream of something worth doing and then simply go to work on it and don't think anything of personalities, or emotional conflicts, or of money, or of family distractions it is amazing how quickly you get through those 5,000 steps.;Edwin Land;family
I love glamour and artificial beauty. I love the idea of artifice and dressing up and makeup and hair.;Dita Von Teese;beauty
My bottom is so big it's got its own gravitational field.;Carol Vorderman;fitness
I remember my dad, who coached football, would buy some of his players football shoes when they couldn't afford it.;Chaske Spencer;dad
Look at our Lords disciples. One denied Him one doubted Him one betrayed Him. If our Lord couldn't have perfection, how are you going to have it in city government?;Richard J. Daley;government
A man has a tendency to accept you the way you are, while most women immediately start to pick flaws and want to change you.;Marilyn Monroe;change
President Obama is a principled man who has worked hard to put healthcare and a good education in the reach of millions of Americans and believes that everyone who works hard and plays by the rules, should have a fair shot at the American dream.;Cristina Saralegui;education
Instead, I think over the years we have cut the strength of marriage and relationships by the law and weakened the institution. We have tried to deal with relationships with no-fault divorce, with child custody, with so many other avenues and it has not helped.;Timothy Murphy;strength
My fear is that I go up to the girl of my dreams and say 'I'm sorry, but I've got to say hello to you,' and she slides the stool back and gets up and walks away, saying, 'Not for me, Bub. I don't want anything to do with you.';John Mayer;fear
You can't fake it when you're alone with God, you know.;Jim Bakker;alone
I certainly derived my skills as a prose writer from my scrutiny of poetry and of the individual word. But schools don't do things like that anymore - tracking words down to their roots.;Camille Paglia;poetry
I believe that sex is one of the most beautiful, natural, wholesome things that money can buy.;Steve Martin;money
My only problem is the fear that opposition bowlers might go for my fingers and that's why I was scared of the short ball. Now I am struggling with the ball pitching up and swinging away. I just keep nicking that one.;Shane Warne;fear
I tell my environmental friends that they have won. Every issue we look at from an energy perspective is now also looked at from an environmental perspective.;Joe Barton;environmental
One tell-tale sign of a Wingnut: they always confuse partisanship with patriotism.;John Avlon;patriotism
Most women are one man away from welfare.;Gloria Steinem;women
Like me, the great majority of Americans wish both to preserve the traditional definition of marriage and to oppose bias and intolerance directed towards gays and lesbians.;Mitt Romney;marriage
The Constitution guarantees us our rights to life, liberty, and the pursuit of happiness. That's all. It doesn't guarantee our rights to charity.;Jesse Ventura;happiness
My formula for living is quite simple. I get up in the morning and I go to bed at night. In between, I occupy myself as best I can.;Cary Grant;morning
All government, of course, is against liberty.;H. L. Mencken;government
As many of you know I travel a good bit and do not get to see my friends and family as much as I would like.;Natalie Gulbis;travel
We can easily forgive a child who is afraid of the dark the real tragedy of life is when men are afraid of the light.;Plato;life
Muslims have a very bad attitude to homosexuality, they're very intolerant.;Pim Fortuyn;attitude
I would like a food/lifestyle show. We're not sure what that is yet. I want to be able to share what I do and how I raise my family. I feel like I have a story to tell. I enjoy talking and listening, sharing ideas and sharing advice.;Cat Cora;family
The part which American friendship played in helping us to win the freedom we enjoy in this part of Ireland has been gratefully recognized and acknowledged by our people.;Eamon de Valera;friendship
Motherhood is a great honor and privilege, yet it is also synonymous with servanthood. Every day women are called upon to selflessly meet the needs of their families. Whether they are awake at night nursing a baby, spending their time and money on less-than-grateful teenagers, or preparing meals, moms continuously put others before themselves.;Charles Stanley;great
If there are no stupid questions, then what kind of questions do stupid people ask? Do they get smart just in time to ask questions?;Scott Adams;time
There are almost no sports within which mortal accidents are not a reality.;Dietrich Mateschitz;sports
My father was against the death penalty, and that was hard in the Son of Sam summer when fear was driving the desire for the death penalty.;Andrew Cuomo;fear
Books are good enough in their own way, but they are a poor substitute for life.;Robert Louis Stevenson;good
No humorist is under any obligation to provide answers and probably if you were to delve into the literary history of humour it's probably all about not providing answers because the humorist essentially says: this is the way things are.;P. J. O'Rourke;history
Ladies and gentlemen, it is with great sadness that I announce that I will resign as Australia's Minister for Foreign Affairs. I am sad because I love this job. I'm totally dedicated to the work that we are doing in Australia's name around the world, and I believe that we have achieved many good results for Australia, and I'm proud of them.;Kevin Rudd;sad
I've used the prestige and influence of having been a president of the United States as effectively as possible. And secondly, I've still been able to carry out my commitments to peace and human rights and environmental quality and freedom and democracy and so forth.;Jimmy Carter;freedom
Marriage is give and take. You'd better give it to her or she'll take it anyway.;Joey Adams;marriage
I love physical kinds of comedy and getting down and dirty and doing stunts. When I was growing up, I was always getting into fights with guys and usually punching out boys my age because I was a lot bigger and tougher. So I'm naturally accustomed to putting myself into the headspace of a girl who can take care of herself.;Cameron Diaz;age
My mother is a professor of early childhood education. When I was two she would say she knew I was going to be an actor.;Matt Damon;education
Poetry is something to make us wiser and better, by continually revealing those types of beauty and truth, which God has set in all men's souls.;James Russell Lowell;truth
When I was pregnant. I exercised and was healthy, but it was also the first time since I was 14 that I wasn't on a diet.;Liv Tyler;diet
Latinos have fought in all of America's wars, beginning with the Revolutionary War. Many Latinos are fighting and dying for our country today in Iraq, just as several of their ancestors fought for freedom in Mexico over a century ago.;Joe Baca;freedom
I've found that if you wear a beret, people think you're either a cabdriver or a producer of dirty movies.;Ernie Harwell;movies
China, in the future, is going to have even more nuclear capability than it has had in the past. I don't believe that they have anything to fear from the United States, and I frankly don't believe they do fear the United States.;Paul Wolfowitz;fear
We turn toward God only to obtain the impossible.;Albert Camus;god
I think that everybody in the world, whatever colour or creed, has a jerk like JR in his or her family somewhere. Whether it is a father, uncle, cousin or brother, everybody can identify with JR and that certainly had something to do with the success of 'Dallas.';Larry Hagman;success
Freedom means the opportunity to be what we never thought we would be.;Daniel J. Boorstin;politics
Music - that's been my education. There's not a day that goes by that I take it for granted.;Billie Joe Armstrong;music
I really believe that all of us have a lot of darkness in our souls. Anger, rage, fear, sadness. I don't think that's only reserved for people who have horrible upbringings. I think it really exists and is part of the human condition. I think in the course of your life you figure out ways to deal with that.;Kevin Bacon;sad
Now, personally, I like a car with some sort of character.;Richard Hammond;car
You know, this is a war of ideology, a war of thoughts and of faith. And we need people to really stand for faith and trust, not hope and change.;Sharron Angle;faith
Those that have had great passions esteem themselves for the rest of their lives fortunate and unfortunate in being cured of them.;Francois de La Rochefoucauld;great
A lie told often enough becomes the truth.;Vladimir Lenin;truth
Black beauty - he's a dark horse.;Tim Vine;beauty
Old age, calm, expanded, broad with the haughty breadth of the universe, old age flowing free with the delicious near-by freedom of death.;Edith Wharton;death
The idea is, if I can't heal from my art, then how can you heal?;Maynard James Keenan;art
Never underestimate people. They do desire the cut of truth.;Natalie Goldberg;truth
Women's fashion is a subtle form of bondage. It's men's way of binding them. We put them in these tight, high-heeled shoes, we make them wear these tight clothes and we say they look sexy. But they're actually tied up.;David Duchovny;women
I used to wish there was a useful term for those of us who thought American power should be used to remove psychopathic dictators.;Christopher Hitchens;power
I'm one of those people who thinks that changing one's hair is the only part of the body that you can change at will.;Hillary Clinton;change
Racism is still with us. But it is up to us to prepare our children for what they have to meet, and, hopefully, we shall overcome.;Rosa Parks;equality
If you want to be successful, it's just this simple. Know what you are doing. Love what you are doing. And believe in what you are doing.;Will Rogers;love
The only way to make sense out of change is to plunge into it, move with it, and join the dance.;Alan Watts;change
We trifle when we assign limits to our desires, since nature hath set none.;Christian Nestell Bovee;nature
I don't find it a struggle to maintain a healthy diet now as my palate has changed. I don't crave rich food.;Jennifer Ellison;food
Everything is blooming most recklessly if it were voices instead of colors, there would be an unbelievable shrieking into the heart of the night.;Rainer Maria Rilke;nature
A man is not rightly conditioned until he is a happy, healthy, and prosperous being and happiness, health, and prosperity are the result of a harmonious adjustment of the inner with the outer of the man with his surroundings.;James Allen;health
Do parents sit down and tell their kids everything? I don't know. I don't know. I've convinced myself - I hope I'm right - that children despair of you if you don't tell them the truth.;Maurice Sendak;hope
It's not necessary to fear the prospect of failure but to be determined not to fail.;Jimmy Carter;fear
Experienced happiness refers to your feelings, to how happy you are as you live your life. In contrast, the satisfaction of the remembering self refers to your feelings when you think about your life.;Daniel Kahneman;happiness
What is not conservative about saying, 'Don't go to war unless we go to war properly with a full declaration of war and no other way?';Ron Paul;war
Good nature is worth more than knowledge, more than money, more than honor, to the persons who possess it.;Henry Ward Beecher;money
Women are the largest untapped reservoir of talent in the world.;Hillary Clinton;women
False riches, consisting of money, houses and lands, acquired by selfish means at cost to others and thereafter used selfishly, are almost always used for the oppression of other persons.;Joseph Franklin Rutherford;money
Despise not death, but welcome it, for nature wills it like all else.;Marcus Aurelius;nature
Some people just use beautiful things to just shop or to have a tribal feeling - 'Oh, blah, blah, blah, I'm wearing Hermes blah, blah, blah, I'm wearing Saint Laurent blah-blah blah' - because it's like a need, a tribe, recognition: 'Ahh, my Rolex.' But I run away from anything which is too recognizable - it's my nature.;Manolo Blahnik;nature
The cardinal sin in sports, what could really wreck it, is not cheating to win, which has gone on forever, but cheating to lose. That threatens a fundamental aspect of sports' appeal, which is their spontaneity. If games are fixed, they're no different from movies they're scripted.;Michael Mandelbaum;sports
With my daughter, we do arts and crafts, we read a lot, we listen to music, and we cut the strings off balloons and bounce them around after birthday parties.;Lisa Loeb;birthday
I have to be in a relationship where I can say what I feel even if it's wrong - so we can work through it.;Bethenny Frankel;relationship
My father was a farmer and my mother was a farmer, but, my childhood was very good. I am very grateful for my childhood, because it was full of gladness and good humanity.;Roberto Benigni;parenting
I love scary movies. I like blood and gore, and I love Halloween movies.;Carrie Underwood;movies
Time is like money, the less we have of it to spare the further we make it go.;Josh Billings;money
The best advice my dad ever gave me is that acting is believing. Acting is not acting. It isn't putting on a face and dancing around in a mask. It's believing that you are that character and playing him as if it were a normal day in the life of that character.;Haley Joel Osment;dad
The next major explosion is going to be when genetics and computers come together. I'm talking about an organic computer - about biological substances that can function like a semiconductor.;Alvin Toffler;computers
Besides the two Christmas things, we've got a about a dozen new tracks we're working on.;Chris Frantz;christmas
It's hard for me to imagine that some people in the CIA who had firsthand knowledge would be unable to recognize that this would be helpful information for a soldier's death.;Christopher Shays;knowledge
Taste is developed by the diversity of the products one can sample. I think our children today may be missing an education about food. We must teach them to know their cuisine and to know the equilibrium of nourishment. That is very important for health.;Joel Robuchon;health
The science of the mind can only have for its proper goal the understanding of human nature by every human being, and through its use, brings peace to every human soul.;Alfred Adler;nature
I'm definitely a Polaroid camera girl. For me, what I'm really excited about is bringing back the artistry and the nature of Polaroid.;Lady Gaga;nature
When I get in the car I love my wife and kids more than anything, but I'm not thinking about that side of things. I'm thinking about the car, I'm thinking about the race and I'm thinking about how to make the car faster.;Scott Dixon;car
As far as hypnosis is concerned, I had a very serious problem when I was in my twenties. I encountered a man who later became the president of the American Society of Medical Hypnosis. He couldn't hypnotize me.;Theodore Sturgeon;medical
I have a message from the Tea Party, a message that is loud and clear and does not mince words. We've come to take our government back.;Rand Paul;government
A lot of times people look at the negative side of what they feel they can't do. I always look on the positive side of what I can do.;Chuck Norris;positive
Every creature is a word of God.;Meister Eckhart;god
Bill Hanna and I owe an awful lot to television, but we both got our start and built the first phase of our partnership in the movies.;Joseph Barbera;movies
Hitchcock had a charm about him. He was very funny at times. He was incredibly brilliant in his field of suspense.;Tippi Hedren;funny
Always continue the climb. It is possible for you to do whatever you choose, if you first get to know who you are and are willing to work with a power that is greater than ourselves to do it.;Ella Wheeler Wilcox;motivational
If truth is beauty, how come no one has their hair done in the library?;Lily Tomlin;beauty
Some kids don't know where they'll spend the night. How can we expect them to focus on learning?;Dennis Moore;learning
At the end of the day, all you can hope for is to go on. The older I get, the more I realize that just keeping on keeping on is what life's all about.;Janis Ian;hope
Peace and justice are two sides of the same coin.;Dwight D. Eisenhower;peace
Have we failed to slow global warming pollution in part because climate and environmental activists have been too polite and well behaved?;Jeff Goodell;environmental
Poetry is indispensable - if I only knew what for.;Jean Cocteau;poetry
