I see a resurgence of interest in poetry. I am less optimistic about the prospects for the arts when it comes to federal funding.;Rita Dove;poetry
More books, more racing and more foolishness with cars and motorcycles are in the works.;Brock Yates;car
In some parts of life, like mathematics and science, yeah, I was a genius. I would top all the top scores you could ever measure it by.;Steve Wozniak;science
The basis of computer work is predicated on the idea that only the brain makes decisions and only the index finger does the work.;Brian Eno;computers
If you age with somebody, you go through so many roles - you're lovers, friends, enemies, colleagues, strangers you're brother and sister. That's what intimacy is, if you're with your soulmate.;Cate Blanchett;age
Few enterprises of great labor or hazard would be undertaken if we had not the power of magnifying the advantages we expect from them.;Samuel Johnson;power
Act as if what you do makes a difference. It does.;William James;motivational
I know some people will be surprised to hear it, but I've found that my music, whether its blues or rock, or whatever you want to call it, can be channeled into a positive direction that actually helps people.;Rick Derringer;positive
No man is worth his salt who is not ready at all times to risk his well-being, to risk his body, to risk his life, in a great cause.;Theodore Roosevelt;great
I don't have a dime left. I am dependent on my friends for food and a small old-age pension.;Bela Lugosi;food
As dry leaves that before the wild hurricane fly, when they meet with an obstacle, mount to the sky. So up to the house-top the coursers they flew, with the sleigh full of toys, and St. Nicholas too.;Clement Clarke Moore;christmas
You know the funny thing, I don't get along with rich people. I get along with the middle class and the poor people better than I get along with the rich people.;Donald Trump;funny
I don't believe you can find any evidence of the fact that I have changed government policy solely because of a contribution.;William J. Clinton;government
The thing that lies at the foundation of positive change, the way I see it, is service to a fellow human being.;Lech Walesa;positive
I hope America can also be the cultural leader of the world, and use this frontier spirit to lead and show others that we need courage to go places where we have not gone before.;Tadao Ando;hope
I think I turned to writing really just to wake up in the morning and be a musician and to have something to do, and feel like a musician every day even if I wasn't working.;Lesley Gore;morning
All I can ask from society is that it please stop telling me why I should like sports.;John Hodgman;sports
I can make more generals, but horses cost money.;Abraham Lincoln;money
The Paris peace talks kept a roof over my head and food on the table and clothes on my back because if something was said going in or coming out, I had the rent for the month.;Ed Bradley;food
Age merely shows what children we remain.;Johann Wolfgang von Goethe;age
I don't want to scrounge around and be homeless, and I want to finish my education.;Callan McAuliffe;education
Bride: A woman with a fine prospect of happiness behind her.;Ambrose Bierce;wedding
I had a career and I came to motherhood late and am not married and have never had such a trusting relationship with a man - and trust is where the real power of love comes from.;Diane Keaton;relationship
This is an important book, the critic assumes, because it deals with war. This is an insignificant book because it deals with the feelings of women in a drawing-room.;Virginia Woolf;women
It's a funny show. The characters are surprisingly likable, given how ugly they are. We've got this huge cast of characters that we can move around. And over the last few seasons, we've explored some of the secondary characters' personal lives a bit more.;Matt Groening;funny
I say let's go back to a truer use of the word 'freedom.' Let's start with President Franklin Roosevelt's Four Freedoms: freedom of speech and expression, freedom of worship, freedom from want and freedom from fear. I would add the freedom to bargain collectively. Those freedoms are under attack today.;Richard Trumka;freedom
I acted in theater and I took film classes when I was 12 and just obsessed over it. I loved it and spent hours and hours in the film studio learning and watching.;Mary Elizabeth Winstead;learning
Yeah, well, food is always a part of everything.;Lisa Loeb;food
If you're working on a movie, you want it to be projected on the largest tapestry possible, and the sound to be perfect, and for that kind of communal experience of the movies to take place for it.;Greg Kinnear;movies
There are only two lasting bequests we can hope to give our children. One of these is roots, the other, wings.;Hodding Carter;parenting
Androgyny is not trying to manage the relationship between the opposites it is simply flowing between them.;June Singer;relationship
Only God Himself fully appreciates the influence of a Christian mother in the molding of character in her children.;Billy Graham;god
I realize that the majority of people in the entertainment business happen to be Democrats. I have no problem with that. And they should have no problem with the fact that I'm a Republican.;Shannen Doherty;business
Sincerity: willingness to spend one's own money.;Mason Cooley;money
I did find some time to go to a record store and check out 'Headstrong' actually in the racks. It was pretty cool I never thought I'd see my own CD sitting there with everyone else's. I made my Mom take lots of pics!;Ashley Tisdale;cool
You can never really live anyone else's life, not even your child's. The influence you exert is through your own life, and what you've become yourself.;Eleanor Roosevelt;life
Lawyers are men who hire out their words and anger.;Horace;anger
I heard on public radio recently, there's a thing called Weed Dating. Singles get together in a garden and weed and then they take turns, they keep matching up with other people. Two people will weed down one row and switch over with two other people. It's in Vermont. I don't think I'd be very good at Weed Dating.;Roy Blount, Jr.;dating
The gays like 'Project Runway' because it's a fashion, and the gays are into fashion and into design. It's a creative industry, and most of the gays are pretty creative, in general. That's just like the culture. We're not all into politics necessarily. We're more into the creative environment. I also think Heidi is a big draw. The boys love Heidi and think she's so fabulous. I just think it's a glitzy, fun show, and there are also always lots of gay boys on it, and, you know, that's fun.;Christian Siriano;politics
First of all, the music that people call Latin or Spanish is really African. So Black people need to get the credit for that.;Carlos Santana;music
You are a child of God. Your playing small does not serve the world. There is nothing enlightened about shrinking so that other people won't feel insecure about you. We were born to manifest the glory of God that is within us.;Marianne Williamson;god
I have crushes on women all the time. I don't have intimate relationships with them, but I find women beautiful.;Adam Lambert;women
When we were scared about 9/11, we federalized the airport security, we spent millions for body armor for dogs in Ohio. All that over-reaction comes from fear and government - bad combination.;John Stossel;fear
The longer one is alone, the easier it is to hear the song of the earth.;Robert Anton Wilson;alone
No matter how mistaken Communist ideas may be, the experience and knowledge gained by trying them out have given a tremendous impetus to thought and imagination.;Anne Sullivan Macy;knowledge
Most children - I know I did when I was a kid - fantasize another set of parents. Or fantasize no parents. They don't tell their real parents about that - you don't want to tell Mom and Dad. Kids lead a very private life. And I was a typical child, I think. I was a liar.;Maurice Sendak;mom
You don't have to be singing about love all the time in order to give love to the people. You don't have to keep flashing those words all the time.;Jimi Hendrix;time
Hats have been my thing pretty much my whole life but finance has not. I would go to the corner store and buy really cheap baseball style caps and wear those to school.;Ne-Yo;finance
Great is our admiration of the orator who speaks with fluency and discretion.;Marcus Tullius Cicero;great
This is the America that I love. This is a great people. We can do anything. We can achieve anything. We've got a government that has gotten in the way of the American people. We're going to change that in November.;Mitt Romney;change
To drive an F1 car you have to be a little mad. On the morning of a race there's a mix of excitement and fear. If it's a wet track, then it's worse as you're not in control most of the time, which is the thing all drivers fear the most.;Jenson Button;fear
The integrity of the game is everything.;Peter Ueberroth;sports
Happiness is not a matter of events it depends upon the tides of the mind.;Alice Meynell;happiness
Books were my pass to personal freedom. I learned to read at age three, and soon discovered there was a whole world to conquer that went beyond our farm in Mississippi.;Oprah Winfrey;freedom
With the past, I have nothing to do nor with the future. I live now.;Ralph Waldo Emerson;life
Illogical thinkers throw names and slurs around because they have no arguments with which to rebut their opponents. Rational people have to keep hammering their points home.;Benjamin Carson;home
Courage is sometimes frail as hope is frail: a fragile shoot between two stones that grows brave toward the sun though warmth and brightness fail, striving and faith the only strength it knows.;Frances Rodman;hope
It's nice to be with someone, but I don't think you need to be in a relationship to feel complete. That would be really sad.;Kristin Davis;relationship
However many holy words you read, however many you speak, what good will they do you if you do not act on upon them?;Buddha;good
Pretty much at all times music motivates me. How can I say this without sounding in any way proud of myself? Obviously I've always written songs that are critical of our government, and talk about our times. Hopefully you attempt to be timeless while doing it.;Eddie Vedder;government
Once I planned to write a book of poems entirely about the things in my pocket. But I found it would be too long and the age of the great epics is past.;Gilbert K. Chesterton;age
The meaning I picked, the one that changed my life: Overcome fear, behold wonder.;Richard Bach;inspirational
I understood the importance in principle of public key cryptography but it's all moved much faster than I expected. I did not expect it to be a mainstay of advanced communications technology.;Whitfield Diffie;technology
We don't come to Canada for our health. We can think of other ways of enjoying ourselves.;Prince Philip;health
Very few recognize science as the high adventure it really is, the wildest of all explorations ever taken by human beings, the chance to glimpse things never seen before, the shrewdest maneuver for discovering how the world works.;Lewis Thomas;science
There are a lot of female artists my age around at the moment, but they're all American and blonde and blue-eyed and smiley. I'm totally the opposite of that. I want to show a bit more attitude and I have an opinion.;Samantha Mumba;attitude
When you are content to be simply yourself and don't compare or compete, everybody will respect you.;Lao Tzu;respect
Freedom comes from strength and self-reliance.;Lisa Murkowski;strength
As long as man continues to be the ruthless destroyer of lower living beings he will never know health or peace. For as long as men massacre animals, they will kill each other.;Pythagoras;health
I agree with just about everyone in the reform debate when they say 'If you like what you have, you should be able to keep it.' But the truth is that none of the health reform bills making their way through Congress actually delivers on that promise.;Ron Wyden;health
Pushing production out of America to nations without our environmental standards increases global environmental risks.;Frank Murkowski;environmental
War is just when it is necessary arms are permissible when there is no hope except in arms.;Niccolo Machiavelli;hope
Childhood obesity is best tackled at home through improved parental involvement, increased physical exercise, better diet and restraint from eating.;Bob Filner;parenting
When I walk up on that shore in Florida, I want millions of those AARP sisters and brothers to look at me and say, 'I'm going to go write that novel I thought it was too late to do. I'm going to go work in Africa on that farm that those people need help at. I'm going to adopt a child. It's not too late, I can still live my dreams.';Diana Nyad;dreams
I learn something from criticism because when it comes from sources you respect you always examine it and learn.;Maurice Strong;respect
For example, I spent a lot of time with Reagan, both before he ran for governor and when he was running for president. As a print reporter without the cameras, I was able to really test the quality of their minds and their knowledge base.;Robert Scheer;knowledge
Artists don't make objects. Artists make mythologies.;Anish Kapoor;art
When a finished work of 20th century sculpture is placed in an 18th century garden, it is absorbed by the ideal representation of the past, thus reinforcing political and social values that are no longer with us.;Robert Smithson;gardening
My mother carried on and supported us her ambition had been to write poetry and songs.;Philip Levine;poetry
Personally, I can't see why it would be any less romantic to find a husband in a nice four-color catalogue than in the average downtown bar at happy hour.;Barbara Ehrenreich;romantic
It's painful for me to watch someone who isn't funny. It's horrifying to sit in the back and watch some guy who just totally sucks.;Joe Rogan;funny
My father probably thought the capital of the world was wherever he was at the time. It couldn't possibly be anyplace else. Where he and his wife were in their own home, that, for them, was the capital of the world.;Bob Dylan;home
I was the type of guy that used to get up in the morning and go out and just out run everybody on the field without stretching or warming up or anything.;Bo Jackson;morning
If it's true that men are such beasts, this must account for the fact that most women are animal lovers.;Doris Day;men
But I feel truly wowed by the architecture and the meaning of the architecture if you get lost in it and think about the man hours in the smallest little chapel, and the love involved. God it's fantastic.;Paul Bettany;architecture
I hope to attend it as Japan needs to tell the world the lessons, knowledge and reflections learned from the nuclear crisis at the Fukushima No. 1 power plant.;Yoshihiko Noda;knowledge
On balance, my life has been a constant stream of blessings rather than disappointments and failures and tragedies. I wish I had been re-elected. I think I could have kept our country at peace. I think I could have consolidated what we achieved at Camp David with a treaty between Israel and the Palestinians.;Jimmy Carter;peace
When I was in the first grade I was afraid of the teacher and had a miserable time in the reading circle, a difficulty that was overcome by the loving patience of my second grade teacher. Even though I could read, I refused to do so.;Beverly Cleary;patience
I have always been very obsessed with time. Time's passage makes us all very vulnerable and because we all experience it in our own way, it can make us feel very alone.;John Barton;alone
I'm probably the only person who goes to work and says 'Wow, it's really nice here and sweet,' even in the competitive movie business.;Harvey Weinstein;business
There is not enough love and goodness in the world to permit giving any of it away to imaginary beings.;Friedrich Nietzsche;love
Scientific views end in awe and mystery, lost at the edge in uncertainty, but they appear to be so deep and so impressive that the theory that it is all arranged as a stage for God to watch man's struggle for good and evil seems inadequate.;Richard P. Feynman;god
To keep your secret is wisdom to expect others to keep it is folly.;William Samuel Johnson;wisdom
A plant-based diet has actually simplified my life in so many ways. For breakfast, I try to get my first serving of fruits and nuts for fuel. I'm completely addicted to coconut water for the electrolytes and hydration.;Michelle Forbes;diet
Every dollar I can't commit to my company that's paid in taxes is paying a government that I believe is too big and doing way too much that I don't want done.;Curt Schilling;government
President Bush once said that marriage is a sacred institution and should be reserved for the union of one man and one woman. If this is the case - and most Americans would agree with him on this - then I have to ask: Why is the government at all involved in marrying people?;Tony Campolo;government
The first sentence of every novel should be: Trust me, this will take time but there is order here, very faint, very human. Meander if you want to get to town.;Michael Ondaatje;trust
Being funny, it turns out, is like being a bank. It's a confidence trick. As long as everyone believes in you, you are fine.;Evan Davis;funny
I travel around the world, experiencing every language, every religion... some places where there's just no reason to smile, because their lives are so difficult.;Lionel Richie;smile
I feel fortunate that I'm not a beauty. I'm not a classic beauty. I feel it is harder for girls who are like that. There are fewer parts.;Olivia Colman;beauty
A failure is a man who has blundered, but is not able to cash in the experience.;Elbert Hubbard;experience
Culture, what you believe, what you value, how you live matters. Now, as fundamental as these principles are, they may become topics of democratic debates from time to time, so it is today with the enduring institution of marriage. Marriage is a relationship between a man and a woman.;Mitt Romney;marriage
It is not sufficient to see and to know the beauty of a work. We must feel and be affected by it.;Voltaire;beauty
My father used to play with my brother and me in the yard. Mother would come out and say, 'You're tearing up the grass' 'We're not raising grass,' Dad would reply. 'We're raising boys.';Harmon Killebrew;dad
Great men, unknown to their generation, have their fame among the great who have preceded them, and all true worldly fame subsides from their high estimate beyond the stars.;Henry David Thoreau;great
We have need of history in its entirety, not to fall back into it, but to see if we can escape from it.;Jose Ortega y Gasset;history
Art is a harmony parallel with nature.;Paul Cezanne;nature
You have to travel globally today to know what's going on and maintain an edge.;Yuri Milner;travel
I was a quiet teenager, introverted, full of angst.;Nigella Lawson;teen
I had a 2-week courtship with a fellow student in the fiction workshop in Iowa and a 5-minute wedding in a lawyer's office above the coffee shop where we'd been having lunch that day. And so I sent a cable to my father saying, 'By the time you get this, Daddy, I'll already be Mrs. Blaise!';Bharati Mukherjee;wedding
I'm thankful for the work that feminists like Gloria Steinem have done. I am a feminist, but the geography for women today is vastly different than it was in the '60s.;Amber Heard;thankful
I challenge you to show me where the saloon has ever helped business, education, church, morals or anything we hold dear.;Billy Sunday;education
Early morning cheerfulness can be extremely obnoxious.;William Feather;morning
You can't just let nature run wild.;Walt Disney;nature
Don't follow any advice, no matter how good, until you feel as deeply in your spirit as you think in your mind that the counsel is wise.;Joan Rivers;good
Mass transportation is doomed to failure in North America because a person's car is the only place where he can be alone and think.;Marshall McLuhan;failure
Woman must have her freedom, the fundamental freedom of choosing whether or not she will be a mother and how many children she will have. Regardless of what man's attitude may be, that problem is hers - and before it can be his, it is hers alone.;Margaret Sanger;alone
The belief in a supernatural source of evil is not necessary men alone are quite capable of every wickedness.;Joseph Conrad;men
So I try not to have any actual expectations for myself for any level of success or failure.;Gavin DeGraw;failure
I love romantic comedies. They're for me the easiest thing to do and the most natural to do. There's nothing natural about holding an uzi hanging out of a moving van shooting at people. That's not second nature to me, thank God.;Gabrielle Union;romantic
The spoken word was the first technology by which man was able to let go of his environment in order to grasp it in a new way.;Marshall McLuhan;technology
The greatest fear that haunts this city is a suitcase bomb, nuclear or germ. Many people carry small gas masks. The masses here seem to be resigned to the inevitable, believing an attack of major proportions will happen.;David Wilkerson;fear
My parents were kind of over protective people. Me and my sister had to play in the backyard all the time. They bought us bikes for Christmas but wouldn't let us ride in the street, we had to ride in the backyard. Another Christmas, my dad got me a basketball hoop and put it in the middle of the lawn! You can't dribble on grass.;Jimmy Fallon;dad
Prosperity or egalitarianism - you have to choose. I favor freedom - you never achieve real equality anyway: you simply sacrifice prosperity for an illusion.;Mario Vargas Llosa;equality
Politics is a lot of serendipity. You're in the right place and the right time and you've got the right message, and it either connects for you or, or it doesn't.;Jon Huntsman, Jr.;politics
If I weren't doing the politics, I wouldn't be doing my job.;Andrew Cuomo;politics
I certainly don't want a child of mine to be famous, or anyone I was very close to who isn't yet... It's the worst thing to be trapped in your house not be able to leave.;Elizabeth Hurley;famous
I think it's easy for people to assume that fame is equal to glory, but it can be a very isolating experience.;Sophia Bush;experience
We do not have a functioning market in the true sense of the word in health care. That's a layer of transparency that's sorely needed in America.;Paul Ryan;health
To me, the Seventies were very inspirational and very influential... With my whole persona as Snoop Dogg, as a person, as a rapper. I just love the Seventies style, the way all the players dressed nice, you know, kept their hair looking good, drove sharp cars and they talked real slick.;Snoop Dogg;inspirational
The true poet for me is a priest. As soon as he dons the cassock, he must leave his family.;Gustave Flaubert;family
I'm a mirror. If you're cool with me, I'm cool with you, and the exchange starts. What you see is what you reflect. If you don't like what you see, then you've done something. If I'm standoffish, that's because you are.;Jay-Z;cool
I believe in using words, not fists. I believe in my outrage knowing people are living in boxes on the street. I believe in honesty. I believe in a good time. I believe in good food. I believe in sex.;Bertrand Russell;good
I like being a woman, even in a man's world. After all, men can't wear dresses, but we can wear the pants.;Whitney Houston;men
I tend to show everything I do to my family, to check they won't be offended.;David Sedaris;family
To bare our souls is all we ask, to give all we have to life and the beings surrounding us. Here the nature spirits are intense and we appreciate them, make offerings to them - these nature spirits who call us here - sealing our fate with each other, celebrating our love.;Alex Grey;nature
Putting a little time aside for clean fun and good humor is very necessary to relieve the tensions of our time.;Hattie McDaniel;humor
I was looking very much for a career. My second marriage to Stan Herman had ended, and I wanted very much to be independent, not take alimony from him, be on my own, do the right thing.;Linda Evans;marriage
In everything truth surpasses the imitation and copy.;Marcus Tullius Cicero;truth
Mormons... are so strong, they can handle wealth, they are confident. I think it is because they are not bogged down by rules for equality, but have a firmly defined system of relative status and responsible command.;Mary Douglas;equality
I am able to follow my own death step by step. Now I move softly towards the end.;Pope John XXIII;death
I will end up with someone in the arts. I am positive. I eat, breathe and sleep acting. And I'll end up with someone who is happy staying at home and having me cook supper. But I also really need to be intellectually challenged and stimulated. I want someone bookish, and someone who is passionate.;Ginnifer Goodwin;home
Religion. A daughter of Hope and Fear, explaining to Ignorance the nature of the Unknowable.;Ambrose Bierce;hope
But you know, there's something about the kids finishing their homework in a given day, working one-on-one, getting all this attention - they go home, they're finished. They don't stall, they don't do their homework in front of the TV.;Dave Eggers;home
But it wasn't until I graduated from Texas A &amp M University and joined the United States Air Force, flying C-130's all around the globe, that I truly appreciated the blessings of freedom.;Rick Perry;freedom
I decided to take God and organized religion seriously, and to reject the secular life which in my teens had looked attractive because it allowed me to act in any way that I wanted.;Luke Ford;religion
