There is some self-interest behind every friendship. There is no friendship without self-interests. This is a bitter truth.;Chanakya;truth
I can't even find someone for a platonic relationship, much less the kind where someone wants to see me naked.;Gilbert Gottfried;dating
My nutritionist has done a great job in changing my diet after we established I am allergic to things like gluten - I can't eat pizza, pasta and bread. I have lost some weight, but my movement is sharper and I feel great.;Novak Djokovic;diet
In December 1998, I considered myself an expert on love. I was almost a year into a relationship, one that had grown more slowly than I had wished, but once it flowered it was much more stimulating than any marriage or relationship I had known.;Jane Smiley;marriage
God will not look you over for medals degrees or diplomas, but for scars.;Elbert Hubbard;graduation
One interviewer asked me: 'How do you feel that you've betrayed your father?' That wasn't really very cool.;Dhani Harrison;cool
Do dirt, get dirt. So I treat people with the same respect that I want.;DMX;respect
As told in Friendship with God, if we simply decided to believe and act as if first, we're all one, and second, life is eternal, it would render virtually everything we've done all our lives pointless.;Neale Donald Walsch;friendship
I love to shop after a bad relationship. I don't know. I buy a new outfit and it makes me feel better. It just does. Sometimes I see a really great outfit, I'll break up with someone on purpose.;Rita Rudner;movingon
I've been in California for about 15 years now. You're always in your car and insulated. I miss New York so much.;Jimmy Smits;car
Once you see your nature, sex is basically immaterial.;Bodhidharma;nature
Without my dad, I wouldn't be here.;Maria Sharapova;dad
I have always had this mentality because I hated to break anything on the car.;Alain Prost;car
The hardest part was when I was in high school not having a job and always being broke. I had to get to auditions without a car. I either took the bus or walked.;Cuba Gooding, Jr.;car
I've been sober for two-and-a-half years, My children are happy. In August, my wife and I will celebrate our fifteenth wedding anniversary. My band is back together with a sold-out tour.;Trey Anastasio;anniversary
If I weren't earning $3 million a year to dunk a basketball, most people on the street would run in the other direction if they saw me coming.;Charles Barkley;sports
Music has charms to sooth a savage breast, to soften rocks, or bend a knotted oak.;William Congreve;music
Hearing my songs in public freaks me out a bit. There was one restaurant I really liked in L.A., but I had to stop going there when they started playing my music. It felt kinda awkward.;Fiona Apple;music
Man is jealous because of his amour propre woman is jealous because of her lack of it.;Germaine Greer;jealousy
By reading the scriptures I am so renewed that all nature seems renewed around me and with me. The sky seems to be a pure, a cooler blue, the trees a deeper green. The whole world is charged with the glory of God and I feel fire and music under my feet.;Thomas Merton;music
I have always wanted what I have now come to call the voice of personal narrative. That has always been the appealing voice in poetry. It started for me lyrically in Shakespeare's sonnets.;Diane Wakoski;poetry
Comrades, this man has a nice smile, but he's got iron teeth.;Andrei A. Gromyko;smile
My gut feeling about sequels is that they should be premeditated: You should try to write a trilogy first or at least sketch out a trilogy if you have any faith in your film.;Vin Diesel;faith
People in my family and camp who grew up listening to rap music love 'We Are Young.' I've heard it play at weddings. I've heard it in graduation parties. It's a big idea and big song.;Janelle Monae;graduation
I don't act, I don't direct, I don't design.;Tom Stoppard;design
Rarely in modern times has there been such a revolution in commercial sentiment as occurred in 2008, or such a display in government and business of panic and helplessness.;James Buchan;business
For me it's always about first impressions. I trust my instincts. I love to prepare if it's something that requires training. But I don't like to prepare the psychology too much. I enjoy the psychology of the character but I work better from a first impression.;Billy Zane;trust
Yes, I believe blue material is funny, but if that's all you've got, you're dead in the water. It's not good.;Howard Stern;funny
Man needs, for his happiness, not only the enjoyment of this or that, but hope and enterprise and change.;Bertrand Russell;hope
Whether it was his ability to turn around the Massachusetts economy or turn around businesses in the private sector, Mitt Romney has demonstrated the leadership that we need in the White House to get the country on the right track.;Lisa Murkowski;leadership
Two things control men's nature, instinct and experience.;Blaise Pascal;nature
Anyone that has a job that takes them away from home, I think, can understand the difficulties in maintaining consistency, not only with your family and those you love but with your friends.;Heath Ledger;family
I have a fine sense of the ridiculous, but no sense of humor.;Edward Albee;humor
Every single art form is involved in film, in a way.;Sydney Pollack;movies
Absence and death are the same - only that in death there is no suffering.;Theodore Roosevelt;death
Television has brought back murder into the home - where it belongs.;Alfred Hitchcock;home
The passion for money is never fickle.;Mason Cooley;money
What can you do if a part of it is uphill? You can't work out another route. You've just got to run the one they give you. But they tell me London is a nice course. Even the cobbles, I hope, are not very much of a problem for me.;Haile Gebrselassie;hope
Life is the flower for which love is the honey.;Victor Hugo;love
I have long believed that sacrifice is the pinnacle of patriotism.;Bob Riley;patriotism
Saturdays and Sundays, America in the year 2009 does not in some ways differ significantly from the country that existed almost 50 years ago. This is truly sad.;Eric Holder;sad
The end of life is to be like God, and the soul following God will be like Him.;Socrates;life
Well, it's a - I don't want to disappoint you, but it's a time worn tradition of Australian Governments over many years not to get into any discussion about that aspect of intelligence matters.;Alexander Downer;intelligence
Through hard work, perseverance and a faith in God, you can live your dreams.;Benjamin Carson;faith
Well may the boldest fear and the wisest tremble when incurring responsibilities on which may depend our country's peace and prosperity, and in some degree the hopes and happiness of the whole human family.;James K. Polk;happiness
Everything has been homogenized. Over time, with television and jet travel, everybody has blended together. Some of our wonderful charm has been lost.;Bruce Paltrow;travel
I've just got crap hair. Although I inherited a lot of stuff from my dad, including giant knees, I didn't get his good, thick hair. I got my mother's thin, wispy, non-event hair instead.;Jenny Eclair;dad
The senses deceive from time to time, and it is prudent never to trust wholly those who have deceived us even once.;Rene Descartes;trust
There's much more we can be doing in Parliament, we could be giving more power back to people at local government level, through local referendums.;Theresa May;government
The best director is the one you don't see.;Billy Wilder;best
As a kid, all I thought about was death.;Maurice Sendak;death
I'm excited about there being more of a sisterhood these days. Back in the '90s there was a lot of hate - the women I looked up to as artists were dissing me! It's not so patriarchal these days - there's more love and a lot less hate!;Alanis Morissette;women
Communication is a skill that you can learn. It's like riding a bicycle or typing. If you're willing to work at it, you can rapidly improve the quality of evry part of your life.;Brian Tracy;communication
In America, we no longer have an institutionalized, organized way of calling business to task - of taking them to account for what they've done - and this is especially true in the cultural realm.;Thomas Frank;business
Publishing the lyric books, poetry or comics of other musicians I know. That's the thing I really want to break into!;Frank Iero;poetry
So, I think that Marilyn, what she gave the world, and in many ways Kennedy too, was that they had dreams and they didn't allow anybody to take away their dreams.;Sally Kirkland;dreams
There is no knowledge, no light, no wisdom that you are in possession of, but what you have received it from some source.;Brigham Young;knowledge
Newspaper people, once celebrated as founts of ribald humor and uncouth fun, have of late lost all their gaiety, and small wonder.;Russell Baker;humor
I am in very good health. I've never felt better.;Hugh Hefner;health
I'm sure that had I not been a coach, I would have been some form of a teacher.;John Madden;teacher
Even back then, I exuded self-confidence, and that drives women crazy.;Larry David;women
I imagined being a famous writer would be like being like Jane Austen.;J. K. Rowling;famous
I was a little shocked at how adult some of the humor was, because I was never that into animation before and when I watched 'Shrek' I really laughed out loud.;Cheryl Hines;humor
Having two daughters changed my perspective on a lot of things, and I definitely have a newfound respect for women. And I think I finally became a good and real man when I had a daughter.;Mark Wahlberg;respect
The difference between Socrates and Jesus? The great conscious and the immeasurably great unconscious.;Thomas Carlyle;great
I wanted to be a teacher. I love children, so I wanted to deal with children. Then I wanted to be a veterinarian. But by the age of ten or eleven, when I opened my mouth and said, 'Oh, God, what's this?' I kind of knew teaching and being a veterinarian were gonna have to wait.;Whitney Houston;age
Year after year, President Bush has broken his campaign promises on college aid. And year after year, the Republican leadership in Congress has let him do it.;Sherrod Brown;leadership
Just as the science and art of agriculture depend upon chemistry and botany, so the art of education depends upon physiology and psychology.;Edward Thorndike;education
Nothing ever becomes real till it is experienced.;John Keats;experience
My impression is that most women public service workers have a long fuse. Precisely because they care so deeply about services, more than anyone, they still want to find a sensible and fair negotiated agreement. But their patience has run out.;Frances O'Grady;patience
Now I think poetry will save nothing from oblivion, but I keep writing about the ordinary because for me it's the home of the extraordinary, the only home.;Philip Levine;poetry
I'm not going to be in a relationship that I don't fully trust.;Jake Pavelka;trust
They call them terrorists, I call them freedom fighters.;Louis Farrakhan;freedom
A master can tell you what he expects of you. A teacher, though, awakens your own expectations.;Patricia Neal;teacher
Crabbed and obscure definitions are of no use beyond a narrow circle of students, of whom probably every one has a pet one of his own.;Frederick Pollock;pet
I am fiscally prudent and socially progressive. I believe in protecting a woman's right to choose. I believe in marriage equality.;Andrew Cuomo;equality
Hip-hop is supposed to uplift and create, to educate people on a larger level and to make a change.;Doug E. Fresh;change
More gold has been mined from the thoughts of men than has been taken from the earth.;Napoleon Hill;men
The really courageous and bold thing is to make movies about human behaviour.;Laura Dern;movies
We spend the first twelve months of our children's lives teaching them to walk and talk and the next twelve telling them to sit down and shut up.;Phyllis Diller;teacher
Knowledge of God's Word is a bulwark against deception, temptation, accusation, even persecution.;Edwin Louis Cole;knowledge
The mediocre teacher tells. The good teacher explains. The superior teacher demonstrates. The great teacher inspires.;William Arthur Ward;good
I would point out that Japan's proposal at the Versailles Peace Conference on the principle of racial equality was rejected by delegates such as those from Britain and the United States.;Hideki Tojo;equality
'Keep your head down at school.' Those are sage words from my dad. They kept me in check for years.;Dhani Harrison;dad
Then I was lucky I met with my future husband, and I started new life with my husband, and I was happy again. He was a musician. I start to travel with him through Europe also and around the former Soviet Union.;Olga Korbut;travel
Amidst the confusion of the times, the conflicts of conscience, and the turmoil of daily living, an abiding faith becomes an anchor to our lives.;Thomas S. Monson;faith
Life is about not knowing, having to change, taking the moment and making the best of it, without knowing what's going to happen next.;Gilda Radner;life
Prosperity is a great teacher adversity a greater.;William Hazlitt;teacher
I know from personal experience how damaging it can be to live with bitterness and unforgiveness. I like to say it's like taking poison and hoping your enemy will die. And it really is that harmful to us to live this way.;Joyce Meyer;experience
Passion is energy. Feel the power that comes from focusing on what excites you.;Oprah Winfrey;power
After the tragedy, New Yorkers are more united than ever in their vision, as well as in appreciation what living in freedom means - and that if we stand together, we can accomplish anything.;George Pataki;freedom
Fear follows crime and is its punishment.;Voltaire;fear
I'd like to be a wounded leading man. Instead of a pillar of strength, I'd be the scared one.;Jamie Kennedy;strength
Trouble is, kids feel they have to shock their elders and each generation grows up into something harder to shock.;Ben Lindsey;teen
I don't care what people say. My music's, my music.;Enrique Iglesias;music
Death is inevitable, but Life - that's the tricky bit where things happen.;Simon Travaglia;death
The flower is the poetry of reproduction. It is an example of the eternal seductiveness of life.;Jean Giraudoux;poetry
In the revolt against idealism, the ambiguities of the word experience have been perceived, with the result that realists have more and more avoided the word.;Bertrand Russell;experience
The left dismisses talk about the collapse of family life and talks instead about the emergence of the growing new diversity of family types.;Christopher Lasch;family
A generous basic state pension is the least a civilized society should offer those who have worked hard and saved through their whole lives.;George Osborne;society
Field of Dreams is probably our generation's It's A Wonderful Life.;Kevin Costner;dreams
Philosophy is an attempt by man to find cause and effect. Religion has the same goal.;Al Goldstein;religion
We decided to try in vitro, because both Peter and I felt we couldn't handle another failure. When I miscarried after that, we had to come to terms with the possibility that this wasn't meant to be.;Christie Brinkley;failure
Anger is seldom without argument but seldom with a good one.;Lord Halifax;anger
Democratic principles are the result of equality of condition.;Mercy Otis Warren;equality
The best doctors in the world are Doctor Diet, Doctor Quiet, and Doctor Merryman.;Jonathan Swift;best
All religion, my friend, is simply evolved out of fraud, fear, greed, imagination, and poetry.;Edgar Allan Poe;fear
Wisdom is the abstract of the past, but beauty is the promise of the future.;Oliver Wendell Holmes;beauty
User-centered design means working with your users all throughout the project.;Donald Norman;design
There has to be this pioneer, the individual who has the courage, the ambition to overcome the obstacles that always develop when one tries to do something worthwhile, especially when it is new and different.;Alfred P. Sloan;courage
In Britain, you do your job. When you do an American TV show, there is a sense of being one with the crew, and there is a leadership element, which was a learning curve for me because it is very different culturally. In Britain, you just do it, leave and say, 'Thanks.';Theo James;leadership
A diplomatic peace is not yet the real peace. It is an essential step in the peace process leading towards a real peace.;Yitzhak Rabin;peace
A final word: I am not knowledgeable about the internet. I do not have a computer. I guess that at 74 years of age, I don't have the patience to learn.;David Wilkerson;age
Obviously, I've been on sets before but nothing as big as 'Twilight.' You forget sometimes that you're on set of one of the biggest movies ever- so when you just sit back and think about it its just so incredible. It's such a great learning experience.;Booboo Stewart;learning
I'd wake up in the morning and I would think, 'Where am I?' I'd have to gather myself.;Pat Summitt;morning
I don't even drink! I can't stand the taste of alcohol. Every New Year's Eve I try one drink and every time it makes me feel sick. So I don't touch booze - I'm always the designated driver.;Kim Kardashian;newyears
I have no right to beauty. I had been condemned to masculine ugliness.;Renee Vivien;beauty
Any idiot can get laid when they're famous. That's easy. It's getting laid when you're not famous that takes some talent.;Kevin Bacon;famous
Most people I know are not hard-core religious people. They are what I would call 'lightly religious.' So I don't buy the notion that we can't laugh about religion in America.;Trey Parker;religion
To be obliged to beg our daily happiness from others bespeaks a more lamentable poverty than that of him who begs his daily bread.;Charles Caleb Colton;happiness
Corn is an efficient way to get energy calories off the land and soybeans are an efficient way of getting protein off the land, so we've designed a food system that produces a lot of cheap corn and soybeans resulting in a lot of cheap fast food.;Michael Pollan;food
Of all the hard jobs around, one of the hardest is being a good teacher.;Maggie Gallagher;teacher
Well, my personal mission statement is that we want marriage equality in all 50 states. We want it not to be a state-by-state issue. We don't want it to be something the majority is voting on. I don't think the civil rights of any minority should be in the hands of any majority.;Jesse Tyler Ferguson;marriage
I guess I have always been deeply terrified to really be someone's wife since I know from life one cannot love another, ever, really.;Marilyn Monroe;love
And I think that if I were a for real celebrity that was recognizable everywhere, I'd just crawl under a rock and you know, have someone run over the rock with a car, or something.;Steve Burns;car
Real firmness is good for anything strut is good for nothing.;Alexander Hamilton;good
The crucial question one comes back to is the examination without that experience is meaningless. And I think it's true that society is becoming more and more passive, less and less fired up with enthusiasm, in many spheres.;Peter Hammill;experience
You that would judge me, do not judge alone this book or that, come to this hallowed place where my friends' portraits hang and look thereon Ireland's history in their lineaments trace think where man's glory most begins and ends and say my glory was I had such friends.;William Butler Yeats;history
The people are the government, administering it by their agents they are the government, the sovereign power.;Andrew Jackson;government
A friendship founded on business is better than a business founded on friendship.;John D. Rockefeller;friendship
What gives me the most hope every day is God's grace knowing that his grace is going to give me the strength for whatever I face, knowing that nothing is a surprise to God.;Rick Warren;god
My theory is that all of Scottish cuisine is based on a dare.;Mike Myers;funny
I mean you might say he had a travelling post office, but also Barney was very, very active. He was a legal officer for the NAACP and they had a lot of problems after Pease.;Betty Hill;legal
But nobody is listening to those points. They are just listening to the gossip which is saying that I knew I was positive for all these years because I had a faked test a few years ago.;Marc Wallice;positive
Despair gives courage to a coward.;Thomas Fuller;courage
I love Benny Hill. He one of my favourites of aaall time. Like, the way Benny did it, he was just amazing. Just seeing how he put songs together and comedy and the timing and the sketches. He was way ahead of his time.;Snoop Dogg;amazing
Imagination is always the fabric of social life and the dynamic of history. The influence of real needs and compulsions, of real interests and materials, is indirect because the crowd is never conscious of it.;Simone Weil;imagination
Clear thinking requires courage rather than intelligence.;Thomas Szasz;courage
In my experience, there is only one motivation, and that is desire. No reasons or principle contain it or stand against it.;Jane Smiley;experience
It's a paradox to be an actress, living in the city, taking planes all the time, trying to find the right balance in this life, which is not so eco-friendly, and still try to respect the environment.;Marion Cotillard;respect
Well, I needed the work - that's the honest answer. I haven't worked for a while, a couple of years. So I thought it would be nice to get back to work and earn some money.;Gary Oldman;money
I have married thriteen couples. I'm about to do a marriage next month.;Sally Kirkland;marriage
It is only partly true that religion does more harm than good in society. The community makes God into the image it wants, vengeful, or milky sweet, or scrupulously just, and so on.;Mary Douglas;religion
My success was not based so much on any great intelligence but on great common sense.;Helen Gurley Brown;great
I always say that the real success of Wine Library wasn't due to the videos I posted, but to the hours I spent talking to people online afterward, making connections and building relationships.;Gary Vaynerchuk;success
Obviously, marriage is not a synonym for morality. But stable marriages and families do encourage moral behavior.;Gary Bauer;marriage
Here in Silicon Valley, I have taken part in hundreds of conversations trying to convince people to dive in and become entrepreneurs. All too often, innovators with good, safe, jobs are unwilling to put their family's access to health care at risk by walking away from company-backed medical insurance.;Eric Ries;health
My mum and my dad are the sweetest couple.;Rita Ora;dad
My mom and dad worked very hard to give me the best chance in - not just in golf but in life. You know, I was an only child, you know, my dad worked three jobs at one stage. My mom worked night shifts in a factory.;Rory McIlroy;mom
There's something about death that is comforting. The thought that you could die tomorrow frees you to appreciate your life now.;Angelina Jolie;death
All God does is watch us and kill us when we get boring. We must never, ever be boring.;Chuck Palahniuk;god
The two major things that changed the makeup of all professional sports are money generated by television and courts that players went to in order to win their freedom as free agents.;Will McDonough;sports
I absolutely adore Thanksgiving. It's the only holiday I insist on making myself.;Ina Garten;thanksgiving
A world technology means either a world government or world suicide.;Max Lerner;technology
Your experiences will be yours alone. But truth and best friendship will rarely if ever disappoint you.;Anne Lamott;experience
You have to take away some of tax breaks for the wealthy, and you have to cut back on some entitlements. Because, unless we do all of these things, it just doesn't work. And what's good theater and what's good politics isn't necessarily good economic policy.;Michael Bloomberg;politics
Power is the most persuasive rhetoric.;Friedrich Schiller;power
When governments become large, voters cannot exercise close oversight, otherwise known as political power.;Maggie Gallagher;power
Work ethic has always been stressed in my family. My dad is going to be 80 years old and he still works part time. My mom just retired a couple years ago and she's in her mid- to late 70s.;Jamie Moyer;dad
For after my marriage I had made various attempts to write fiction. They were clearly failures.;Mary Augusta Ward;marriage
I think the thing that the American people want is for the divisive debate on health care to stop.;Jacob Lew;health
The magazine, the daytime show, we've always tried to write affordable, accessible. Those are key words for us, and I do mean us, a huge staff of people at the magazine who love to cook affordable, friendly food that helps families eat better for less.;Rachael Ray;food
The strength and power and goodness of America has always been based on the strength and power and goodness of our communities, our families, our faiths. That is the bedrock of what makes America, America. In our best days, we can feel the vibrancy of America's communities, large and small.;Mitt Romney;strength
You campaign in poetry. You govern in prose.;Mario Cuomo;poetry
I grew up in a family where the internalized understanding was that the kids were going to grow up into a better world. I worry, because I don't think my kids are going to have that. The world is very scary. The world would be scary without the choices the current administration made, but they just exacerbated it. And it ticks me off. I want my kids to have a good life.;Bradley Whitford;family
