And that is why marriage and family law has emphasized the importance of marriage as the foundation of family, addressing the needs of children in the most positive way.;John Boehner;positive
My faith helps me understand that circumstances don't dictate my happiness, my inner peace.;Denzel Washington;peace
Later, my father died up in Marysville. So, my mother and I got in the car and came down to Hollywood.;Marc Davis;car
I have a kind of boring personal life, to the paparazzi anyway, and I don't hang with the cool crowd.;Diane Kruger;cool
It is an unfortunate fact that we can secure peace only by preparing for war.;John F. Kennedy;war
I had never had a positive leading character - somebody that wasn't an antihero, or who wasn't more of a guy that you're supposed to be on the side of.;Gus Van Sant;positive
Do not waste your time on Social Questions. What is the matter with the poor is Poverty what is the matter with the rich is Uselessness.;George Bernard Shaw;time
Few people know so clearly what they want. Most people can't even think what to hope for when they throw a penny in a fountain.;Barbara Kingsolver;hope
Therefore I am sure that this, my Coronation, is not the symbol of a power and a splendor that are gone but a declaration of our hopes for the future, and for the years I may, by God's Grace and Mercy, be given to reign and serve you as your Queen.;Queen Elizabeth II;future
And finally I twist my heart round again, so that the bad is on the outside and the good is on the inside, and keep on trying to find a way of becoming what I would so like to be, and could be, if there weren't any other people living in the world.;Anne Frank;good
I give away something up to $500 million a year throughout the world promoting Open Society. My foundations support people in the country who care about an open society. It's their work that I'm supporting. So it's not me doing it.;George Soros;society
Since fame is an illusion and death is in our future all we have is the next moment before we are swallowed into oblivion.;Al Goldstein;future
Unrest of spirit is a mark of life.;Karl A. Menninger;life
Well, I think that there's a very thin dividing line between success and failure. And I think if you start a business without financial backing, you're likely to go the wrong side of that dividing line.;Richard Branson;success
The supreme accomplishment is to blur the line between work and play.;Arnold J. Toynbee;work
I don't claim to be knowledgeable about theology. Most of my knowledge comes out of my experience and the lessons in the Bible. Every Sunday I'm home I teach 45 minutes and we boiled them down to one page for the new book, 'Through the Year with Jimmy Carter.';Jimmy Carter;home
A girl came up to me in a bar and said she wanted to be my apple pie. I wish I'd said something cool, but I was stunned.;Jason Biggs;cool
Worry is a cycle of inefficient thoughts whirling around a center of fear.;Corrie Ten Boom;fear
But if we learn to think of it as anticipation, as learning, as growing, if we think of the time we spend waiting for the big things of life as an opportunity instead of a passing of time, what wonderful horizons open out!;Anna Neagle;learning
When I was little, we lived on 8 acres and my mom had a horse. But when I was 7, my mom kicked my dad out, and then in order to feed us five kids, she got critters cheap or for free and raised them for food. We milked a cow, raised chickens, pigs and beef cattle. We heated our one-story house with wood and stayed cold all winter.;Bonnie Jo Campbell;mom
I'm also interested in the modern suggestion that you can have a combination of love and sex in a marriage - which no previous society has ever believed.;Alain de Botton;marriage
Peace demands the most heroic labor and the most difficult sacrifice. It demands greater heroism than war. It demands greater fidelity to the truth and a much more perfect purity of conscience.;Thomas Merton;war
The plane took off at 8:10 in the morning - or that's when it was scheduled to take off. And that's when I believe it took off. I had been in my office at the Department of Justice. Someone told me that there had been the two strikes that occurred at the World Trade Center.;Ted Olson;morning
I love watching people's dreams come true.;Jessica Simpson;dreams
If I had been elected president in 1948, history would be vastly different. I believe we would have stemmed the growth of Big Government, which had begun with the New Deal and culminated with the Great Society.;Strom Thurmond;society
To dare to live alone is the rarest courage since there are many who had rather meet their bitterest enemy in the field, than their own hearts in their closet.;Charles Caleb Colton;alone
My faith is very private to me. It plays an important part in my life, but I do not try and throw my beliefs at others. I have tremendous respect for all faiths and beliefs, but have a deep concern that religion and faith are currently a long way apart from each other.;Rick Wakeman;faith
And what's more I've got no need for anyone to tell me how to do it. I am not interested. You act how you want to and leave me alone to do my own thing.;Olivier Martinez;alone
He that is jealous is not in love.;Saint Augustine;jealousy
Power is of two kinds. One is obtained by the fear of punishment and the other by acts of love. Power based on love is a thousand times more effective and permanent then the one derived from fear of punishment.;Mahatma Gandhi;fear
He is so old that his blood type was discontinued.;Bill Dana;science
We are the children of a technological age. We have found streamlined ways of doing much of our routine work. Printing is no longer the only way of reproducing books. Reading them, however, has not changed.;Lawrence Clark Powell;technology
I doubt I'll be singing forever, because at some point people aren't going to want to hear my music, and I hope that I'll still get the opportunity to write songs.;Adele;music
No one can arrive from being talented alone, work transforms talent into genius.;Anna Pavlova;alone
Follow the wisdom of the great actor, James Cagney, you hit your mark, you look the other guy in the eye, and you tell the truth.;Larry Merchant;wisdom
Enthusiasm is the best protection in any situation. Wholeheartedness is contagious. Give yourself, if you wish to get others.;David Seabury;best
I'm following my dreams and doing what I love as a designer. I did not want to be one of those kids with a famous last name that doesn't do anything. That is very unfulfilling to me and I'm very happy.;Nicky Hilton;dreams
I have had fans make me the big picture collages of the photo books I have had fans send me birthday cakes... sing to me on my voicemail. I have had fans flash me. I have had older fans give me their bras and underwear onstage.;Puff Daddy;birthday
I've exchanged messages and photos of an explicit nature with about six women over the last three years. For the most part, these communications took place before my marriage, though some have sadly took place after. To be clear, I have never met any of these women or had physical relationships at any time.;Anthony Weiner;marriage
But I do know focusing on the exterior doesn't make me happy. If I want peace and serenity, it won't be reached by getting thinner or fatter.;Elle Macpherson;peace
I think architecture has to be a gift.;Jean Nouvel;architecture
When I started to watch some of the films I'd done, I realized I was doing movies that I might not actually want to see.;Heath Ledger;movies
I've set the model of showing fighters how they should conduct their business.;Floyd Mayweather, Jr.;business
I've never worried about age.;Jeanne Moreau;age
To those of you who are wearing ties, I think my dad would appreciate it if you took them off.;Robert Moog;dad
There isn't a flaw in his golf or his makeup. He will win more majors than Arnold Palmer and me combined. Somebody is going to dust my records. It might as well be Tiger, because he's such a great kid.;Jack Nicklaus;sports
I did not want to put myself on the line, as an Australian playing Britain's greatest comic actor. The fans of Sellers are obsessive, possessive - and aggressive. I did not want to risk their anger - or my own reputation.;Geoffrey Rush;anger
In my view, relationship movies never get old because humanity will never not be confounded by their relationships.;Zoe Lister-Jones;relationship
Healthy children will not fear life if their elders have integrity enough not to fear death.;Erik H. Erikson;death
What we are trying to do is to create a social business in Bangladesh, a joint venture to create restaurants for common people. Good, healthy food at affordable prices so that people don't have to opt for food that is unhealthy and unhygienic.;Muhammad Yunus;food
In a sense it might even be said that our failure is to form habits: for, after all, habit is relative to a stereotyped world, and meantime it is only the roughness of the eye that makes two persons, things, situations, seem alike.;Walter Pater;failure
What makes Superman a hero is not that he has power, but that he has the wisdom and the maturity to use the power wisely. From an acting point of view, that's how I approached the part.;Christopher Reeve;power
Bear and endure: This sorrow will one day prove to be for your good.;Ovid;sympathy
You must capture and keep the heart of the original and supremely able man before his brain can do its best.;Andrew Carnegie;best
Marriage is obsolete and a trap.;Catherine Deneuve;marriage
We have always said that in our war with the Arabs we had a secret weapon - no alternative.;Golda Meir;war
I have never been jealous. Not even when my dad finished fifth grade a year before I did.;Jeff Foxworthy;dad
I often say of George Washington that he was one of the few in the whole history of the world who was not carried away by power.;Robert Frost;history
A lot of times you get credit for stuff in your movies you didn't intend to be there.;Spike Lee;movies
It is a sad commentary that today we face a choice between having schools that are a monument to our past - or schools that will be the lifeblood of our future. But since that is our choice, let us resolve to choose wisely.;Ted Kulongoski;sad
The best things and best people rise out of their separateness I'm against a homogenized society because I want the cream to rise.;Robert Frost;society
My death, taking the light from my eyes, gives back to the day the purity which they soiled.;Jean Racine;death
'Do What You Gotta Do' is a positive, inspirational song that says no matter what it is whether you're up against challenges or trying to get your dreams and aspirations met, you should do what whatever you have to do shy of killing yourself or someone else.;Angie Stone;dreams
The next morning we saw nothing of the enemy, though we were still lying to.;John Byng;morning
I think I wanted to write a book about the relationship between the victim and perpetrator in which the victim agrees to remain silent.;Darrell Hammond;relationship
The war in Iraq, clearly has not turned out in the way that was hoped.;William Hague;war
You are not here merely to make a living. You are here in order to enable the world to live more amply, with greater vision, with a finer spirit of hope and achievement. You are here to enrich the world, and you impoverish yourself if you forget the errand.;Woodrow Wilson;motivational
Learning is its own exceeding great reward.;William Hazlitt;learning
Yet what you need is not marches, demonstrations, rallies or wide associations, all of them are important. What you need is direct action. The sooner people understand that, the sooner we'll begin to change things.;Arthur Scargill;change
Romance is tempestuous. Love is calm.;Mason Cooley;romantic
George has only got to ring me. His imagination is so wonderful, I'd do any character he might create.;Peter Mayhew;imagination
Children love and want to be loved and they very much prefer the joy of accomplishment to the triumph of hateful failure. Do not mistake a child for his symptom.;Erik Erikson;failure
The only real happiness a ballplayer has is when he is playing a ball game and accomplishes something he didn't think he could do.;Ring Lardner;happiness
I need my food to keep my energy up, so I can't really diet.;Sienna Miller;food
Anyone's life truly lived consists of work, sunshine, exercise, soap, plenty of fresh air, and a happy contented spirit.;Lillie Langtry;work
I think my best skill in this whole deal is as a conduit to try to bring people together, because I think it's in our unity that we'll have the greatest strength.;Woody Harrelson;strength
Love and desire are the spirit's wings to great deeds.;Johann Wolfgang von Goethe;great
To rely upon conviction, devotion, and other excellent spiritual qualities that is not to be taken seriously in politics.;Vladimir Lenin;politics
I've always felt, in all my books, that there's a deep decency in the American people and a native intelligence - providing they have the facts, providing they have the information.;Studs Terkel;intelligence
Every age has its own poetry in every age the circumstances of history choose a nation, a race, a class to take up the torch by creating situations that can be expressed or transcended only through poetry.;Jean-Paul Sartre;history
Adam knew Eve his wife and she conceived. It is a pity that this is still the only knowledge of their wives at which some men seem to arrive.;F. H. Bradley;knowledge
When I woke up Sunday morning at the Open and stepped outside and felt the wind and rain in my face, I knew I had an excellent chance to win if I just took my time and trusted myself.;Tom Kite;morning
Humor can inform and break down stigma, which is a huge issue in the military.;Garry Trudeau;humor
Basketball is like war in that offensive weapons are developed first, and it always takes a while for the defense to catch up.;Red Auerbach;war
So near is falsehood to truth that a wise man would do well not to trust himself on the narrow edge.;Marcus Tullius Cicero;trust
People spend time worrying about things they think they have to have and lose perception of what they do have. You can have all the money and material things you want. If you aren't here to enjoy them, what good do they do?;Eric Davis;money
If the abstract rights of man will bear discussion and explanation, those of women, by a parity of reasoning, will not shrink from the same test.;Mary Wollstonecraft;women
To have great poets, there must be great audiences.;Walt Whitman;great
I drank a lot when I was a teenager and I don't drink any more, because that's when I thought, you know, I'm gonna end up a car wreck.;Kristin Davis;car
I suppose leadership at one time meant muscles but today it means getting along with people.;Mahatma Gandhi;time
Love is the poetry of the senses.;Honore de Balzac;love
When the sword is once drawn, the passions of men observe no bounds of moderation.;Alexander Hamilton;men
You can't test courage cautiously.;Annie Dillard;courage
Religion points to that area of human experience where in one way or another man comes upon mystery as a summons to pilgrimage.;Frederick Buechner;religion
The word philosophy sounds high-minded, but it simply means the love of wisdom. If you love something, you don't just read about it you hug it, you mess with it, you play with it, you argue with it.;Hugh Jackman;wisdom
Television is an invention that permits you to be entertained in your living room by people you wouldn't have in your home.;David Frost;home
A gentle word, a kind look, a good-natured smile can work wonders and accomplish miracles.;William Hazlitt;smile
I think there ought to be a club in which preachers and journalists could come together and have the sentimentalism of the one matched with the cynicism of the other. That ought to bring them pretty close to the truth.;Reinhold Niebuhr;truth
Terrorists have failed to trigger mass conflict between Muslims and non-Muslims in Europe. We should draw strength from that fact.;Gijs de Vries;strength
I don't like politics.;will.i.am;politics
My dad is this very sensible guy who never let me feel that anything was beyond my station.;Mireille Enos;dad
Wisdom finds its literary expression in wisdom literature.;Paul Ricoeur;wisdom
Surely, God on high has not refused to give us enough wisdom to find ways to bring us an improvement in relations between the two great nations on earth.;Mikhail Gorbachev;wisdom
Although my family - parents and sister - all work in the personnel management business, their real passion is performing, amateur operatic societies and so on.;Michael Sheen;business
It takes most men five years to recover from a college education, and to learn that poetry is as vital to thinking as knowledge.;Brooks Atkinson;poetry
The conscious purpose of science is control of Nature its unconscious effect is disruption and chaos.;William Irwin Thompson;science
All women who kill or have sexual obsessions or who are prostitutes have trouble with their fathers.;Catherine Deneuve;women
Unless you choose to do great things with it, it makes no difference how much you are rewarded, or how much power you have.;Oprah Winfrey;great
A graduation ceremony is an event where the commencement speaker tells thousands of students dressed in identical caps and gowns that 'individuality' is the key to success.;Robert Orben;graduation
New Year's Resolution: To tolerate fools more gladly, provided this does not encourage them to take up more of my time.;James Agate;newyears
I can support going in after Saddam Hussein, but I want to make sure I don't go alone.;John Dingell;alone
The essence of all beautiful art, all great art, is gratitude.;Friedrich Nietzsche;great
My dad's Irish music was such a huge influence.;Dido Armstrong;dad
The greatest happiness of life is the conviction that we are loved loved for ourselves, or rather, loved in spite of ourselves.;Victor Hugo;life
I grew up in a dysfunctional family.;Melissa Gilbert;family
For me, growing up, the downside of it was that as a kid you don't want to stand out. You don't want to have a famous father let alone get a job because of your famous father, you know? But I'm a product of nepotism. That's how I got my foot in the door, through my dad.;Jeff Bridges;famous
Age carries all things away, even the mind.;Virgil;age
Walk a mile in my shoes is good advice. Our children will learn to respect others if they are used to imagining themselves in another's place.;Neil Kurshan;respect
There is nothing worse that a thirteen-year-old boy. You're embarrassed by your parents, and you're trying to find your independance because, deep inside, you are so dependent on your mom.;Ben Affleck;mom
When I was a kid, my father didn't really have much hope for me. He thought I was a dreamer he didn't think I would amount to anything. My mother also.;Frank Gehry;hope
Do not meddle in the affairs of wizards, for they are subtle and quick to anger.;J. R. R. Tolkien;anger
He who is fixed to a star does not change his mind.;Leonardo da Vinci;change
A lot of the music that you listen to now is because of the things that the Meters did, the Neville Brothers did, and they're there, the guys who invented those beats that the guys sample today. Such an enormous opportunity.;Harry Connick, Jr.;music
We need real campaign finance reform to loosen the grip of special interests on politics.;Tom Daschle;finance
Creativity comes from trust. Trust your instincts. And never hope more than you work.;Rita Mae Brown;hope
I have always believed in God.;Joel Osteen;god
I feel sorry for people who don't drink. When they wake up in the morning, that's as good as they're going to feel all day.;Frank Sinatra;funny
I'm carded for R-rated movies. And I get talked down to a lot. When I try to go rent a car or buy an airplane ticket or other stuff adults do, I get 'Okaaaaaay, honey.' I remember when I was 18, getting crayons in a restaurant.;Kristen Bell;car
But Socialism, alone, can bring self-determination of their peoples.;Karl Liebknecht;alone
Knowing that we can be loved exactly as we are gives us all the best opportunity for growing into the healthiest of people.;Fred Rogers;best
It depends on the situation. I mean, on one hand there's the argument that people should be left alone on the other hand, there's the argument to wade in a stop slaughters in places like Bosnia and Kosovo and what we probably should have done in Rwanda.;Jello Biafra;alone
I think the church and the religion right now have a lot more to be worried about than SLAYER.;Kerry King;religion
A peace that depends on fear is nothing but a suppressed war.;Henry Van Dyke;peace
Rather like Batman, I embody the themes of the movie which are the values of family, courage and compassion and a sense of right and wrong, good and bad and justice.;Gary Oldman;family
One of the things being in politics has taught me is that men are not a reasoned or reasonable sex.;Margaret Thatcher;politics
If there were no God, it would be necessary to invent him.;Voltaire;god
The Google algorithm was a significant development. I've had thank-you emails from people whose lives have been saved by information on a medical website or who have found the love of their life on a dating website.;Tim Berners-Lee;dating
I think our relationship with Epic had run its natural course, and it happened to coincide with the fulfillment of our contract. We decided not to resign with them.;Mike McCready;relationship
With reality TV, sometimes it's amazing chemistry and you get these gems that turn out to be everything you hoped, and the camera loves them and they just blossom on the show. And then sometimes it's not all you envision.;Alison Sweeney;amazing
Science is a wonderful thing if one does not have to earn one's living at it.;Albert Einstein;science
Stevie Wonder is just one of those guys that completely delivers everything that you want to be true about Stevie Wonder. He's an amazing human being, and the fairytale exists with that man.;Adam Levine;amazing
Texas was such a welcoming place, and with its unbelievable history and tradition, it's extra special to be a part of that.;Ricky Williams;history
By reading the scriptures I am so renewed that all nature seems renewed around me and with me. The sky seems to be a pure, a cooler blue, the trees a deeper green. The whole world is charged with the glory of God and I feel fire and music under my feet.;Thomas Merton;nature
We had incense and rock'n'roll posters, and we sold records and rolling papers. People could just, like, hang out. We had a cool vibe going.;Tommy Hilfiger;cool
Science knows only one commandment - contribute to science.;Bertolt Brecht;science
While all other sciences have advanced, that of government is at a standstill - little better understood, little better practiced now than three or four thousand years ago.;John Adams;government
Well, again, a gun sale database is just trying to get the Department of Justice to keep track of the guns that they're purchasing and supplying to drug dealers and murderers. I mean, wow. Come on, let's get the government under control before we start restricting the rights of - innocent citizens.;John Mica;government
I'm a person who likes these sort of movies... sad but moving 'art movies' that normally are at a festival and then they go to a small art house theater and disappear.;Zach Braff;movies
Some people swear by writing courses, but whether it really helps American poetry, I have doubts.;Robert Morgan;poetry
Those who have succeeded at anything and don't mention luck are kidding themselves.;Larry King;success
One must be a god to be able to tell successes from failures without making a mistake.;Anton Chekhov;god
There's always going to be dreams and goals I have, but I never really tell people what they are.;Tyra Banks;dreams
Priorities like winning the War on Terror and providing tax relief that will keep our economy growing strong.;Dennis Hastert;war
I'm quitting the business today. I'm going to open up an appliance store, I've always really been into toasters. I'm giving it all up.;Dane Cook;business
All men make mistakes, but married men find out about them sooner.;Red Skelton;men
If you find someone you love in your life, then hang on to that love.;Princess Diana;love
We all know we have a problem, a broad problem. Ninety-eight percent of the fuel that is used by our vehicles, our autos and trucks for personal and commercial purposes, for highway and air travel operates on oil. The world has the same problem.;John Olver;travel
Bluegrass has brought more people together and made more friends than any music in the world. You meet people at festivals and renew acquaintances year after year.;Bill Monroe;music
The more equality women have, the fairer, more civilized and tolerant society will be. Sexual equality is a lot more effective against terrorism than military strength.;Jose Luis Rodriguez Zapatero;society
A poet never takes notes. You never take notes in a love affair.;Robert Frost;love
I will not be concerned at other men's not knowing meI will be concerned at my own want of ability.;Confucius;men
I think the best place to work in football is England.;Jose Mourinho;work
Little children are still the symbol of the eternal marriage between love and duty.;George Eliot;marriage
The mother's battle for her child with sickness, with poverty, with war, with all the forces of exploitation and callousness that cheapen human life needs to become a common human battle, waged in love and in the passion for survival.;Adrienne Rich;war
Without health life is not life it is only a state of langour and suffering - an image of death.;Buddha;life
And what is a stage dad, or a stage mom? It's someone who's protective. That's all.;Nigel Lythgoe;mom
Love is trembling happiness.;Khalil Gibran;happiness
