Time is the coin of your life. It is the only coin you have, and only you can determine how it will be spent. Be careful lest you let other people spend it for you.;Carl Sandburg;life
In the U.S. alone, weather disasters caused $50 billion in economic damages in 2010.;Jeff Goodell;alone
In order to experience everyday spirituality, we need to remember that we are spiritual beings spending some time in a human body.;Barbara de Angelis;time
Money is like manure. You have to spread it around or it smells.;J. Paul Getty;money
I'm experimental by nature... always exploring my creativity.;Christina Aguilera;nature
To me, acting is the most logical way for people's neuroses to manifest themselves, in this great need we all have to express ourselves.;James Dean;great
I crave working on those small independent movies because I love going to see those myself.;Orlando Bloom;movies
Civilization grew in the beginning from the minute that we had communication - particularly communication by sea that enabled people to get inspiration and ideas from each other and to exchange basic raw materials.;Thor Heyerdahl;communication
The salesman knows nothing of what he is selling save that he is charging a great deal too much for it.;Oscar Wilde;great
The art of dancing stands at the source of all the arts that express themselves first in the human person. The art of building, or architecture, is the beginning of all the arts that lie outside the person and in the end they unite.;Havelock Ellis;architecture
Most men are very attached to the idea of being male, and usually experience a lot of fear and insecurity around the idea of being a man. Most women are very identified with their gender, and also experience a tremendous amount of fear and insecurity.;Andrew Cohen;experience
I think my mother... made it clear that you have to live life by your own terms and you have to not worry about what other people think and you have to have the courage to do the unexpected.;Caroline Kennedy;courage
Chains do not hold a marriage together. It is threads, hundreds of tiny threads, which sew people together through the years.;Simone Signoret;anniversary
The best revenge is to be unlike him who performed the injury.;Marcus Aurelius;best
Surround yourself with positive people.;Melanie Fiona;positive
It's interesting that whenever I meet some of the other Bond girls, I always have something in common, and it is an interesting sorority. We all share about our Bonds. 'Did your Bond do that?' 'Yes mine did!' So it is quite funny conversations. We may as well be in high school.;Jane Seymour;funny
I think a lot of food shows, especially when we started 'Good Eats' back in the late '90s, they were still really about food. 'Good Eats' isn't about food, it's about entertainment. If, however, we can virally infect you with knowledge or interest, then all the better.;Alton Brown;knowledge
They should hold themselves absolutely upon the immovable foundation of truth and nature, whereby alone they can save themselves from misapprehensions and from the danger of being entirely carried away from reality into mere dreams and fictions.;Ethan A. Hitchcock;dreams
I have a mantra in my head that there will always be another meal. I can put my fork down, knowing there will be good things in my future!;Gail Simmons;future
A serious problem in America is the gap between academe and the mass media, which is our culture. Professors of humanities, with all their leftist fantasies, have little direct knowledge of American life and no impact whatever on public policy.;Camille Paglia;knowledge
I'm not a defender of old or new football managers. I believe in good ones and bad ones, those that achieve success and those that don't.;Jose Mourinho;success
We tried war, we tried aggression, we tried intervention. None of it works. Why don't we try peace, as a science of human relations, not as some vague notion - as everyday work.;Dennis Kucinich;science
I think that in a year I may retire. I cannot take my money with me when I die and I wish to enjoy it, with my family, while I live. I should prefer living in Germany to any other country, though I am an American, and am loyal to my country.;Harry Houdini;money
But such is the irresistable nature of truth, that all it asks, and all it wants is the liberty of appearing.;Thomas Paine;truth
George wrote Taxman, and I played guitar on it. He wrote it in anger at finding out what the taxman did. He had never known before then what could happen to your money.;Paul McCartney;anger
I cannot say that the attitude of the United Nations always is for the Israeli attitude. Israel, I think, has been under severe attacks by members of the United Nations many times.;Ariel Sharon;attitude
An unexciting truth may be eclipsed by a thrilling lie.;Aldous Huxley;truth
The Artist is he who detects and applies the law from observation of the works of Genius, whether of man or Nature. The Artisan is he who merely applies the rules which others have detected.;Henry David Thoreau;nature
I was so lucky to have parents who supported me, 100%, with whatever I was doing, both financially and emotionally. Having that they made my life so much easier. Instead of becoming a bartender and trying to survive while trying to pursue your dreams, I didn't have to worry about that aspect. I could just pursue my dreams.;Cam Gigandet;dreams
I cannot persuade myself that a beneficent and omnipotent God would have designedly created parasitic wasps with the express intention of their feeding within the living bodies of Caterpillars.;Charles Darwin;god
Security is mostly a superstition. It does not exist in nature, nor do the children of men as a whole experience it. Avoiding danger is no safer in the long run than outright exposure. Life is either a daring adventure, or nothing.;Helen Keller;life
In general, the art of government consists of taking as much money as possible from one class of citizens to give to another.;Voltaire;government
When the people become involved in their government, government becomes more accountable, and our society is stronger, more compassionate, and better prepared for the challenges of the future.;Arnold Schwarzenegger;government
Don't waste time on jealousy. Sometimes you're ahead, sometimes you're behind.;Mary Schmich;time
The news is what it is. It's going to be good, it's going to be positive, it's going to be negative. It's going to have all sorts of effects on candidates always.;Mark E. Hyman;positive
In life, single women are the most vulnerable adults. In movies, they are given imaginary power.;Elizabeth Wurtzel;movies
Right now I'd love to be sitting on a Greek island somewhere because of being Greek American, eating great octopus salad and some fantastic lamb. Or sipping a little ouzo. I think the Mediterranean diet is one of the healthiest... Lots of nuts, vegetables, fruits, fresh fish, lean meats, yogurt.;Cat Cora;diet
I enjoy looking at words on paper and visualizing how to make them come to life. As a director, the creative process is really amazing.;Alfonso Ribeiro;amazing
My dad had emphysema and both of my parents had chronic bronchitis and ended up with cancers - all smoking related.;Loni Anderson;dad
Middle Age is that perplexing time of life when we hear two voices calling us, one saying, 'Why not?' and the other, 'Why bother?';Sydney J. Harris;age
For many in baseball September is a month of stark contrast with April, when everyone had dared to hope. If baseball is a lot like life, as pundits declare, it is because life is more about losing than winning.;John Thorn;hope
I love my dad and we have a very good relationship now.;Norah Jones;relationship
I remember a moment when the Prince went back to his old school, Grammar School in Melbourne, and slightly to his horror his old music teacher produced a cello.;Anthony Holden;teacher
Perseverance is the hard work you do after you get tired of doing the hard work you already did.;Newt Gingrich;work
Liberty has never come from Government. Liberty has always come from the subjects of it. The history of liberty is a history of limitations of governmental power, not the increase of it.;Woodrow Wilson;government
The chief duty of government is to keep the peace and stand out of the sunshine of the people.;James A. Garfield;peace
I look up to my mom. She's a beautiful woman.;Leighton Meester;mom
I put on fifteen pounds of muscle, so that was a lot of eating chicken and a high protein, low-carb diet. Also a lot of heavy lifting and a very different kind of training with an ex-navy SEAL guy who wanted to kill me every time I got with him. In a good way.;Josh Hutcherson;diet
A man doesn't know what he knows until he knows what he doesn't know.;Laurence J. Peter;funny
My mom's a social worker, and my dad works in non-profit organisations.;Seth Rogen;dad
To have some idea what it's like, stand in the outside lane of a motorway, get your mate to drive his car at you at 95 mph and wait until he's 12 yards away, before you decide which way to jump.;Geoffrey Boycott;car
The boy who expects every morning to open into a new world finds that today is like yesterday, but he believes tomorrow will be different.;Charles Dudley Warner;morning
I do wish I could tell you my age but it's impossible. It keeps changing all the time.;Greer Garson;age
The only thing I fear more than change is no change. The business of being static makes me nuts.;Twyla Tharp;change
Courage is always the surest wisdom.;Wilfred Grenfell;courage
The time not to become a father is eighteen years before a war.;E. B. White;war
Imagination is the voice of daring. If there is anything Godlike about God it is that. He dared to imagine everything.;Henry Miller;imagination
I believe the home and marriage is the foundation of our society and must be protected.;Billy Graham;society
Either marriage is a destiny, I believe, or there is no sense in it at all, it's a piece of humbug.;Max Frisch;marriage
It seems like once people grow up, they have no idea what's cool.;Bill Watterson;cool
At the end of the day, the most overwhelming key to a child's success is the positive involvement of parents.;Jane D. Hull;positive
I love what I do, and when I don't love what I do, I'll make a change.;Katy Perry;change
Also, they don't understand - writing is language. The use of language. The language to create image, the language to create drama. It requires a skill of learning how to use language.;John Milius;learning
If God had wanted man to play soccer, he wouldn't have given us arms.;Mike Ditka;god
I am not systematic at all when it comes to religion. I just love life. And I'm not judgmental. And I'm a vegetarian.;Erykah Badu;religion
Jealousy - that jumble of secret worship and ostensible aversion.;Emile M. Cioran;jealousy
It was so quiet that morning in Paris that the heels of my two companions and myself were loud on the deserted pavements. It was a city of shuttered shops, and barred windows, and deserted avenues.;Philip Gibbs;morning
Every animal has his or her story, his or her thoughts, daydreams, and interests. All feel joy and love, pain and fear, as we now know beyond any shadow of a doubt. All deserve that the human animal afford them the respect of being cared for with great consideration for those interests or left in peace.;Ingrid Newkirk;respect
I had faith in Israel before it was established, I have in it now. I believe it has a glorious future before it - not just another sovereign nation, but as an embodiment of the great ideals of our civilization.;Harry S. Truman;great
In friendship as well as love, ignorance very often contributes more to our happiness than knowledge.;Francois de La Rochefoucauld;friendship
Music is my shining light, my favorite thing in the world. T get me to stop doing it for one second would be difficult!;Taylor Swift;music
It is a sad thing when men have neither the wit to speak well nor the judgment to hold their tongues.;Jean de la Bruyere;sad
The development of beauty in chess never depends on you alone. No matter how much imagination and creativity you invest, you still do not create beauty. Your opponent must react at the same highest level.;Vladimir Kramnik;alone
The greatest gift is a passion for reading. It is cheap, it consoles, it distracts, it excites, it gives you knowledge of the world and experience of a wide kind. It is a moral illumination.;Elizabeth Hardwick;experience
The best remedy for those who are afraid, lonely or unhappy is to go outside, somewhere where they can be quiet, alone with the heavens, nature and God. Because only then does one feel that all is as it should be.;Anne Frank;god
Courage is the ladder on which all the other virtues mount.;Clare Boothe Luce;courage
You know, be able to do something great in your life, you're gonna have to realize your failures. You're gonna have to embrace them and figure out how to overcome it.;Dave Chappelle;great
Testimony should be a philosophical problem and not limited to legal or historical contexts where it refers to the account of a witness who reports what he has seen.;Paul Ricoeur;legal
If you ask me to summarise our mission, I would put it this way: We were a military regime that sought to lay the foundations for freedom and liberty in a complex society.;Ibrahim Babangida;freedom
To give money to a woman - and here I must speak as a man - is to deny her special quality, her irreplaceability, and reduce her unique amiability to a commodity. Money takes away her name, while transforming her lover into a nameless customer of a market of appetites.;James Buchan;money
Humility and knowledge in poor clothes excel pride and ignorance in costly attire.;William Penn;knowledge
Paris is one of the most beautiful places in all the world. Unfortunately, I was so homesick I couldn't appreciate its beauty.;Tyra Banks;beauty
If you want others to be happy, practice compassion. If you want to be happy, practice compassion.;Dalai Lama;happiness
Poetry is thoughts that breathe, and words that burn.;Thomas Gray;poetry
Travel is glamorous only in retrospect.;Paul Theroux;travel
I want to tell my jokes. I want to have time with my children. I want to entertain people. And at one point, I'll walk away from show business. But I don't want to walk away empty-handed.;Dave Chappelle;business
Trying to force creativity is never good.;Sarah McLachlan;art
The greatest part of a writer's time is spent in reading in order to write. A man will turn over half a library to make a book.;Samuel Johnson;time
It is a sign of creeping inner death when we can no longer praise the living.;Eric Hoffer;death
Ah, reality TV: where opportunists delight in exposing opportunism! It's kind of like the indie music scene.;Diablo Cody;music
It's not the tools that you have faith in - tools are just tools. They work, or they don't work. It's people you have faith in or not. Yeah, sure, I'm still optimistic I mean, I get pessimistic sometimes but not for long.;Steve Jobs;work
Basketball is my passion, I love it. But my family and friends mean everything to me. That's what's important. I need my phone so I can keep in contact with them at all times.;LeBron James;love
My grandfather, along with Carnegie, was a pioneer in philanthropy, which my father then practiced on a very large scale.;David Rockefeller;dad
Our party is a diverse one, as is my home state of Illinois.;Dick Durbin;politics
It's a unique situation as well because England is a small country, so it makes it easy for the fans to travel. If we play down in London, they get buses and we'll get three or four thousand fans come down. They'll all sit in the same area and show their support for the team.;Claudio Reyna;travel
I never was good at learning things. I did just enough work to pass. In my opinion it would have been wrong to do more than was just sufficient, so I worked as little as possible.;Manfred von Richthofen;learning
We come altogether fresh and raw into the several stages of life, and often find ourselves without experience, despite our years.;Francois de La Rochefoucauld;experience
I arise full of eagerness and energy, knowing well what achievement lies ahead of me.;Zane Grey;inspirational
Italy advocates the adoption of a legal instrument on cultural diversity, guaranteeing every country the protection of its own historical identity and the uniqueness of its physical and intangible cultural heritage.;Carlo Azeglio Ciampi;legal
There's only two people in your life you should lie to... the police and your girlfriend.;Jack Nicholson;dating
Reverse every natural instinct and do the opposite of what you are inclined to do, and you will probably come very close to having a perfect golf swing.;Ben Hogan;sports
When I shoot I'll take my family with me - one movie a year and then the rest of the time at home.;Eric Bana;home
Thanks to the Interstate Highway System, it is now possible to travel across the country from coast to coast without seeing anything.;Charles Kuralt;travel
People are getting smarter nowadays they are letting lawyers, instead of their conscience, be their guide.;Will Rogers;legal
My sisters have been baptized and my dad is a deacon at his church now. Sadly my mother passed away but what I can say is that the Jehovah Witnesses took very good care of her up until she died.;Sherri Shepherd;dad
Mental illness can happen to anybody. You can be a dustman, a politician, a Tesco worker... anyone. It could be your dad, your brother or your aunt.;Frank Bruno;dad
My only fear is that I may live too long. This would be a subject of dread to me.;Thomas Jefferson;fear
I don't know much about only children. I was the middle one of three, and if ever I was alone with mum and dad, it was a rare moment.;Elizabeth Hurley;alone
It's mainly about working hard and proving to people you're serious about it, and stretching yourself and learning. The mistake a lot of actors make, particularly young ones, is allowing themselves to feel that they're the finished articles, the bee's knees, and it's not true.;Daniel Radcliffe;learning
Being yourself is one of the hardest things because it's scary. You always wonder whether you'll be accepted for who you really are. I decided to call my record 'Inside Out' because that's my motto about life. I don't think you ever succeed at trying to be anyone else but who you truly are.;Emmy Rossum;life
Often the difference between a successful man and a failure is not one's better abilities or ideas, but the courage that one has to bet on his ideas, to take a calculated risk, and to act.;Maxwell Maltz;courage
Four legs good, two legs bad.;George Orwell;good
The reproduction of mankind is a great marvel and mystery. Had God consulted me in the matter, I should have advised him to continue the generation of the species by fashioning them out of clay.;Martin Luther;god
Every human has four endowments- self awareness, conscience, independent will and creative imagination. These give us the ultimate human freedom... The power to choose, to respond, to change.;Stephen Covey;imagination
My philosophy of life is that if we make up our mind what we are going to make of our lives, then work hard toward that goal, we never lose - somehow we win out.;Ronald Reagan;work
Failure comes only when we forget our ideals and objectives and principles.;Jawaharlal Nehru;failure
The truth is I love being alive. And I love feeling free. So if I can't have those things then I feel like a caged animal and I'd rather not be in a cage. I'd rather be dead. And it's real simple. And I think it's not that uncommon.;Angelina Jolie;love
I also take pleasure in the so-called negative power in Grotjahn's work. That is, I love his paintings for what they are not. Unlike much art of the past decade, Grotjahn isn't simply working from a prescribed checklist of academically acceptable, curator-approved 'isms' and twists.;Jerry Saltz;art
Invented languages have often been created in tandem with entire invented universes, and most conlangers come to their craft by way of fantasy and science fiction.;Joshua Foer;science
Religion is doing a man does not merely think his religion or feel it, he lives his religion as much as he is able, otherwise it is not religion but fantasy or philosophy.;George Gurdjieff;religion
We are celebrating the feast of the Eternal Birth which God the Father has borne and never ceases to bear in all eternity... But if it takes not place in me, what avails it? Everything lies in this, that it should take place in me.;Meister Eckhart;god
The writer is the person who stands outside society, independent of affiliation and independent of influence.;Don DeLillo;society
When you're a mom and you have three children, nothing bothers you. Trust me. Who cares what people say? I've got other things to deal with.;Faith Hill;mom
Unfortunately, the Republican leadership in the House right now seems to have been strangled by the tea party.;Debbie Wasserman Schultz;leadership
I have a Lab, it's fun to hang out and hike with the dog, people come up to him, and pet him, it's fun.;George Eads;pet
Success is the necessary misfortune of life, but it is only to the very unfortunate that it comes early.;Anthony Trollope;success
Rather like Batman, I embody the themes of the movie which are the values of family, courage and compassion and a sense of right and wrong, good and bad and justice.;Gary Oldman;courage
Against the beautiful and the clever and the successful, one can wage a pitiless war, but not against the unattractive: then the millstone weighs on the breast.;Graham Greene;war
In the long-run every Government is the exact symbol of its People, with their wisdom and unwisdom we have to say, Like People like Government.;Thomas Carlyle;wisdom
Dishonesty is so grasping it would deceive God himself, were it possible.;George Bancroft;god
If you have a line of business - I know this as a CEO - or if you have a teenager - I know this as a parent - who have a spending problem, what do you do? You quit giving them money.;Carly Fiorina;business
My dad came from Cuba when he was a teenager not speaking English. And I grew up here speaking Spanglish. That's the world in which I grew up, and that's a world in which a lot of second generation immigrants find themselves.;Ted Cruz;dad
It can be liberating to get fired because you realize the world doesn't end. There's other ways to make money, better jobs.;Ron Livingston;money
Everyone thinks of changing the world, but no one thinks of changing himself.;Leo Tolstoy;change
I was born to a single mom and raised by her and my grandparents.;Anthony Foxx;mom
The Peace Corps is an outstanding organization that promotes peace through helping countless individuals who want to help build a better life for the community in which they serve.;Solomon Ortiz;peace
I am healthy, my family is healthy. That is the important thing. After that we go racing.;Mark Webber;family
Ever since Israel has been a nation the United States has provided the leadership. Every president down to the ages has done this in a fairly balanced way, including George Bush senior, Gerald Ford, and others including myself and Bill Clinton.;Jimmy Carter;leadership
I consider myself a product of Alaska. The love and the debt that I feel to my home state, you always want your hometown to be the proudest of you.;Jewel;home
My parents divorced when I was born, and my mother is a political science professor, like a feminist Mormon, which is sort of an oxymoron.;Eliza Dushku;science
A movie like House of the Dead with around $7 million budget or Alone in the Dark with around $16 million budget are much easier to make profit than the typical $50 million major motion picture.;Uwe Boll;alone
If dreams are like movies, then memories are films about ghosts.;Adam Duritz;movies
Such is the state of life, that none are happy but by the anticipation of change: the change itself is nothing when we have made it, the next wish is to change again.;Samuel Johnson;change
I think it pisses God off if you walk by the color purple in a field somewhere and don't notice it.;Alice Walker;nature
Peace in the head, peace in the stomach.;Jean-Bertrand Aristide;peace
But the age of chivalry is gone. That of sophisters, economists, and calculators has succeeded and the glory of Europe is extinguished forever.;Edmund Burke;age
Benevolence alone will not make a teacher, nor will learning alone do it. The gift of teaching is a peculiar talent, and implies a need and a craving in the teacher himself.;John Jay Chapman;teacher
We are so reliant on power and technology for everything.;Billy Burke;technology
As Members of Congress we can now engage with our constituents via online innovations like the Huffington Post, while a small business in rural Oregon can use the Internet to find customers around the world.;Ron Wyden;business
A healthful hunger for a great idea is the beauty and blessedness of life.;Jean Ingelow;great
Human nature is so well disposed towards those who are in interesting situations, that a young person, who either marries or dies, is sure of being kindly spoken of.;Jane Austen;nature
Human societies, like human beings, live by faith and die when faith dies.;Whittaker Chambers;faith
The bravest sight in the world is to see a great man struggling against adversity.;Lucius Annaeus Seneca;great
Perhaps I'd like to design cars, but I don't think I'd be much good at it.;Jonathan Ive;design
For even in dreams a good deed is not lost.;Pedro Calderon de la Barca;dreams
The good times of today, are the sad thoughts of tomorrow.;Bob Marley;sad
My humanitarian work evolved from being with my family. My mom, my dad, they really set a great example for giving back. My mom was a nurse, my dad was a school teacher. But my mom did a lot of things for geriatrics and elderly people. She would do home visits for free.;Cat Cora;home
