The grandeur and strength or our people and democracy are as big as a forest.;Chen Shui-bian;strength
We need to tap the resource of current and retiring science and math professionals that have both content mastery and the practical experience to serve as effective teachers.;Cathy McMorris;science
So far, 44 States, or 88 percent of the States, have enacted laws providing that marriage shall consist of a union between a man and a woman. Only 75 percent of the States are required to approve a constitutional amendment.;Jack Kingston;marriage
As a chef, I had started working with groups like Share Our Strength and various local food banks in New York, raising money for hunger-related issues. And not only me, but the entire restaurant industry has been very focused on this issue.;Tom Colicchio;food
Jealousy is the jaundice of the soul.;John Dryden;jealousy
My mom is painfully sweet she's from Nebraska.;Gabrielle Union;mom
In my family, there was one cardinal priority - education. College was not an option it was mandatory. So even though we didn't have a lot of money, we made it work. I signed up for financial aid, Pell Grants, work study, anything I could.;Eva Longoria;education
My friends that are snobs think its cool I did a movie with Albert Brooks.;Robin Tunney;cool
I have lived in Mumbai for more than 20 years, have my domicile here, my home and family here.;Shahrukh Khan;family
Just hit my 75th birthday, I'm feeling great!;Colin Powell;great
Germany must be a country which generates political ideas and leadership, which is capable of compromise, which is sovereign and yet knows that it needs its partners on both sides of the Atlantic.;Horst Koehler;leadership
God gave us faculties for our use each of them will receive its proper reward. Then do not let us try to charm them to sleep, but permit them to do their work until divinely called to something higher.;Saint Teresa of Avila;god
I don't know concretely if it's due to superstition, but any time a new rule is implemented into the NBA or a new piece of equipment or a new technology, there is always a transition and adjustment period by players and coaches and anyone involved with the game.;Stu Jackson;technology
There are so many things I want to do. Like, I want to get an artist, a musician, a photographer, and a bunch of dancers that I know and just travel across Africa and just film it and just see what happens. Do and learn as much as I possibly can. Luckily, I have a lot more time.;Channing Tatum;travel
In every election in American history both parties have their cliches. The party that has the cliches that ring true wins.;Newt Gingrich;history
I think that the entertainment industry itself has a history of chasing success. Any time a hit product comes out, all the other companies start chasing after that success and trying to recreate it by putting out similar products.;Shigeru Miyamoto;history
The primary requisite for writing well about food is a good appetite. Without this, it is impossible to accumulate, within the allotted span, enough experience of eating to have anything worth setting down.;A. J. Liebling;food
I know of no safe depository of the ultimate powers of the society but the people themselves and if we think them not enlightened enough to exercise their control with a wholesome discretion, the remedy is not to take it from them but to inform their discretion.;Thomas Jefferson;society
You can't legislate good will - that comes through education.;Malcolm X;education
Men create real miracles when they use their God-given courage and intelligence.;Jean Anouilh;intelligence
Work hard, stay positive, and get up early. It's the best part of the day.;George Allen, Sr.;best
But after this natural burst of indignation, no man of sense, courage, or prudence will waste his time or his strength in retrospective reproaches or repinings.;Robert Peel;courage
My dad was a ham, too. He could sell those women anything. Of all his sons, I was the only one he could trust to sell as well as he could. I was proud of that.;Paul Lynde;dad
He is not a lover who does not love forever.;Euripides;love
I'm still shy - I'm no good at my children's parent-teacher conferences, and I'm slowly learning how to ask for what I want. But I now know that I have a reserve of courage to draw upon when I really need it. There's nothing that I'm too scared to have a go at.;Emily Mortimer;learning
Where are the jobs going to come from?Small business, manufacturing and clean energy. Where's the money to finance them? The banks and the corporations in America today have lots of money that they can invest right now.;William J. Clinton;finance
I respect only those who resist me, but I cannot tolerate them.;Charles de Gaulle;respect
It's just like any relationship, the more contained the environment, the more the good stuff appears and the more the bad stuff will reveal itself.;Bruce Greenwood;relationship
My father was the quintessential husband and dad.;Sidney Poitier;dad
I always wanted to be a teacher.;Nicky Hilton;teacher
Great nations are simply the operating fronts of behind-the-scenes, vastly ambitious individuals who had become so effectively powerful because of their ability to remain invisible while operating behind the national scenery.;R. Buckminster Fuller;great
I have the same attitude with work - I like to go to work, I like to work really hard I, like to give everything my all, I like to try things that are new, you know.;Rosie Huntington-Whiteley;attitude
I do enjoy reading some science fiction.;Colin Farrell;science
The megalomaniac differs from the narcissist by the fact that he wishes to be powerful rather than charming, and seeks to be feared rather than loved. To this type belong many lunatics and most of the great men of history.;Bertrand Russell;men
There's no such thing as soy milk. It's soy juice.;Lewis Black;funny
I did work at a mall in college - I think retail/customer service is just one of the most hideous jobs in the world. So I always try to be extra nice when I go into a store. But malls are part of our culture, if you watched any teen comedy in the '80s. it's clear that malls are where we live!;Jayma Mays;teen
I'm actually living my life with the material I choose to work with.;Ang Lee;work
Liberalism is an attitude rather than a set of dogmas - an attitude that insists upon questioning all plausible and self-evident propositions, seeking not to reject them but to find out what evidence there is to support them rather than their possible alternatives.;Morris Raphael Cohen;attitude
Some people think having large breasts makes a woman stupid. Actually, it's quite the opposite: a woman having large breasts makes men stupid.;Rita Rudner;men
There are 10-20 times more male comics than female comics it's something to do with the social structure of society.;Jo Brand;society
Be strong, believe in freedom and in God, love yourself, understand your sexuality, have a sense of humor, masturbate, don't judge people by their religion, color or sexual habits, love life and your family.;Madonna Ciccone;family
Many men owe the grandeur of their lives to their tremendous difficulties.;Charles Spurgeon;men
I don't want to tell President Obama how to make a speech. He's a much better speech maker than I am. But I think always to tell the truth in a sometimes blatant way, even though it might be temporarily unpopular, is the best approach.;Jimmy Carter;best
What lingers from the parent's individual past, unresolved or incomplete, often becomes part of her or his irrational parenting.;Virginia Satir;parenting
I auditioned for a solo in church and got it. I was about seven and I sang a song called, 'Jesus, I Heard You Had a Big House' and I remember people standing up at the end and me thinking, 'Oh, I think I'm going to like this.' That's how it all began. Sounds funny to say you got your start in church, but I did.;Kristin Chenoweth;funny
A sad soul can kill quicker than a germ.;John Steinbeck;sad
I come from pioneer stock, developers of the West, people who went out into the wilderness and set up home with nothing but a pair of oxen.;Joni Mitchell;home
Cooking is always very romantic!;Matthew Morrison;romantic
The time you spend alone with God will transform your character and increase your devotion. Then your integrity and godly behavior in an unbelieving world will make others long to know the Lord.;Charles Stanley;alone
I'd like to think that the actions we take today will allow others in the future to discover the wonders of landscapes we helped protect but never had the chance to enjoy ourselves.;Annie Leibovitz;future
For the things of this world cannot be made known without a knowledge of mathematics.;Roger Bacon;knowledge
Home is where you feel at home and are treated well.;Dalai Lama;home
As soon as men know that they can kill without fear of punishment or blame, they kill or at least they encourage killers with approving smiles.;Simone Weil;fear
There's a tremendous difference between alone and lonely. You could be lonely in a group of people. I like being alone. I like eating by myself. I go home at night and just watch a movie or hang out with my dog. I have to exert myself and really say, oh God, I've got to see my friends 'cause I'm too content being by myself.;Drew Barrymore;god
The test of the morality of a society is what it does for its children.;Dietrich Bonhoeffer;society
The point of departure of the process to which we wish to contribute is the fact that war is the natural reaction of human nature in the savage state, while peace is the result of acquired characteristics.;Elihu Root;peace
I assume we will have figured out a way to efficiently utilize solar energy and tied that to an efficient way to use nuclear energy in such a way that it doesn't pose a serious environmental issue.;John Hickenlooper;environmental
You can be in Tokyo or Alberta at four in the morning in your hotel and you can still practice if you feel like it. A trombone cannot do that at four in the morning.;Toots Thielemans;morning
Anger is implanted in us as sort of sting, to make us gnash with our teeth against the devil, to make us vehement against him, not to set us in array against each other.;Richard Savage;anger
Wherever there is a design that is highly successful in a broad range of similar environments, it is apt to emerge again and again, independently - the phenomenon known in biology as convergent evolution. I call these designs 'good tricks.';Daniel Dennett;design
I like fantasy. I like horror, science fiction because I can get avant-garde with those performances in those movies.;Nicolas Cage;movies
Money speaks, but it speaks with a male voice.;Andrea Dworkin;money
All the legal action I've taken against newspapers has had a massively positive effect on my life and achieved exactly what I wanted, which is privacy and non-harassment.;Sienna Miller;positive
When I was growing up in Mississippi - it was good Southern food... but I also grew up with a Greek family when other kids were eating fried okra, we were eating steamed artichokes. So I think it played a big part in my healthy cooking.;Cat Cora;food
Lessons of wisdom have the most power over us when they capture the heart through the groundwork of a story, which engages the passions.;Laurence Sterne;power
I have to admit that when I watch a movie in which there is no moral context for the violence - I find that offensive. I think that's potentially damaging to society.;Dean Koontz;society
Lately I did a film called All I Want for Christmas and it was well received. This gave me a new point of view and a new respect for my work as an actress.;Sarah Polley;christmas
Well, if Fortune be a woman, she's a good wench for this gear.;William Shakespeare;good
Our family was too strange and weird for even Santa Claus to come visit... Santa, who was jolly - but, let's face it, he was also very judgmental.;Julia Sweeney;family
I've always been homeschooled, so doing it on set is kind of the same thing. My mom makes it very interactive - we'll get a book on chocolate and learn how to make it, or she will buy antique items. I love military history, the mechanics and strategy of it.;Atticus Shaffer;mom
Once I accomplish one thing and I'm satisfied, I try something else. I may be 50 and doing something totally outside of music and acting. Maybe I'll become a kindergarten teacher.;Kid Cudi;teacher
The people of Liberia know what it means to be deprived of clean water, but we also know what it means to see our children to begin to smile again with a restoration of hope and faith in the future.;Ellen Johnson Sirleaf;smile
In West Virginia, the most vulnerable people we have are people who get up every morning and go to work.;Joe Manchin;morning
You do the right thing even if it makes you feel bad. The purpose of life is not to be happy but to be worthy of happiness.;Tracy Kidder;happiness
Those who visit foreign nations, but associate only with their own country-men, change their climate, but not their customs. They see new meridians, but the same men and with heads as empty as their pockets, return home with traveled bodies, but untravelled minds.;Charles Caleb Colton;change
I love costumes. I love getting dressed up because it really helps my imagination make the leap to believe that I am who I say I am.;Alessandro Nivola;imagination
Happiness is having a large, loving, caring, close-knit family in another city.;George Burns;family
My mom and dad met at UCLA when he as a captain in the Air Force and she was in her junior year.;Tracy Austin;mom
When I was doing ensemble theater and comedy work, I felt I had some talents. But when I started doing my shows in Berkeley and found that I could be funny on my own, I was shocked.;Whoopi Goldberg;funny
How many a man has thrown up his hands at a time when a little more effort, a little more patience would have achieved success.;Elbert Hubbard;success
He taught me housekeeping when I divorce I keep the house.;Zsa Zsa Gabor;funny
I like starting. It's pretty cool.;Al Leiter;cool
Few women, I fear, have had such reason as I have to think the long sad years of youth were worth living for the sake of middle age.;Dwight D. Eisenhower;fear
Love. Fall in love and stay in love. Write only what you love, and love what you write. The key word is love. You have to get up in the morning and write something you love, something to live for.;Ray Bradbury;morning
It is easy for Christians to have the false impression that once we have established a relationship with Christ, which we believe sets us right with God, the problems of life will somehow scoot away or they will slowly be removed from our lives.;Charles R. Swindoll;relationship
I loved climbing because of the freedom, and having time and space. I remember coming off Everest for the last time, thinking of Dad and wishing that he could have seen what I saw. He would have loved it.;Bear Grylls;dad
I always found the extraordinary loss of life in the First World War very moving. I remember learning about it as a very young child, as an eight- or nine-year-old, asking my teachers what poppies were for. Every year the teachers would suddenly wear these red paper flowers in their lapels, and I would say 'What does that mean?';Tom Hiddleston;learning
Do what you love and the money will follow.;Marsha Sinetar;money
The main reason for the failure of the modern medical science is that it is dealing with results and not causes. Nothing more than the patching up of those attacked and the burying of those who are slain, without a thought being given to the real strong hold.;Edward Bach;medical
The length of a film should be directly related to the endurance of the human bladder.;Alfred Hitchcock;movies
I do not consider divorce an evil by any means. It is just as much a refuge for women married to brutal men as Canada was to the slaves of brutal masters.;Susan B. Anthony;men
You must not fear death, my lads defy him, and you drive him into the enemy's ranks.;Napoleon Bonaparte;fear
I hate to play the I-live-in-the-country card, but it really takes all of the 'pack the kids into the car and run from here to there' out of the equation.;Ree Drummond;car
Affirmative action has a negative effect on our society when it means counting us like so many beans and dividing us into separate piles.;John Kasich;society
America's fighting men and women sacrifice much to ensure that our great nation stays free. We owe a debt of gratitude to the soldiers that have paid the ultimate price for this cause, as well as for those who are blessed enough to return from the battlefield unscathed.;Allen Boyd;great
Studies have shown that inmate participation in education, vocational and job training, prison work skills development, drug abuse, mental health and other treatment programs, all reduce recidivism, significantly.;Bobby Scott;education
I would wish for any one of my colleagues to have the experience of working with Martin Scorsese once in their lifetime.;Daniel Day-Lewis;experience
To have the chance to see your music be elevated and to have almost universally positive response to that music, makes me feel better every day. I feel more confident and inspired, and that's fun.;John Legend;positive
Comedy was why I got into acting the first place. Peter Sellers was a huge influence on my wanting to act. I grew up with him and found him hysterical. The Pink Panther films were an inspiration, from my earliest childhood days, when I was watching them with my brother and my dad.;Sally Hawkins;dad
By the Obama administration's reasoning, it would be constitutionally permissible to make Americans purchase nearly any product (broccoli, gym membership) that improved their health and thereby contributed to lower health-care costs.;John Cornyn;health
The secret of learning to be sick is this: Illness doesn't make you less of what you were. You are still you.;Tony Snow;learning
My relationship with my mom is really the single most profound relationship that I've ever had in my life.;Mindy Kaling;mom
If somebody has a chance to put my food in their mouth, that tells the story.;Emeril Lagasse;food
I look forward to the future - and going into the studio to make new music.;Diana Ross;future
When a man assumes a public trust he should consider himself a public property.;Thomas Jefferson;trust
I love cats because I enjoy my home and little by little, they become its visible soul.;Jean Cocteau;love
Acting allows me the freedom to let go, to be in the moment, to be spontaneous. I no longer have the fear of losing, of failure.;Cathy Rigby;failure
It is in the character of very few men to honor without envy a friend who has prospered.;Aeschylus;men
One of the essential elements of government responsibility is to communicate effectively to the American people, especially in time of a potential terrorist attack or a natural disaster.;Vito Fossella;government
I have long enjoyed the friendship and companionship of Republicans because I am by instinct a teacher, and I would like to teach them something.;Woodrow Wilson;teacher
Art is vice. You don't marry it legitimately, you rape it.;Edgar Degas;art
Prayer is mans greatest power!;W. Clement Stone;power
I'm essentially a momma's boy with a good education.;Tom Sizemore;education
What's weird is that I work with these directors and then I start channeling them. I kind of turn into them a bit - which is cool when you're working with Clint Eastwood.;Jamie Bell;cool
I grew up in this town, my poetry was born between the hill and the river, it took its voice from the rain, and like the timber, it steeped itself in the forests.;Pablo Neruda;poetry
I would argue that we have a generation of young people, particularly minorities, who are no longer putting up with the kinds of things their parents put up with. They're much more self-confident. It's no longer acceptable to make fun of people because of race or sex. But it has always been present in American society.;Donna Shalala;society
Peace has to be created, in order to be maintained. It will never be achieved by passivity and quietism.;Dorothy Thompson;peace
It is the nature of every person to error, but only the fool perseveres in error.;Marcus Tullius Cicero;nature
I am drawn to women who are independent and creative, which is problematic because it's a struggle, a competition of careers. There's jealousy.;Marilyn Manson;women
If you're going through friendship issues, I would say, first of all take a step back. How important is the friendship to you? Sometimes, if someone's not being a good friend to you and isn't treating you the way you should be treated, then you kind of have to move on sometimes.;Victoria Justice;friendship
I now bid farewell to the country of my birth - of my passions - of my death a country whose misfortunes have invoked my sympathies - whose factions I sought to quell - whose intelligence I prompted to a lofty aim - whose freedom has been my fatal dream.;Thomas Francis Meagher;freedom
We all feel really blessed to have been with my dad for these 85 years.;Beau Bridges;dad
Faith is an oasis in the heart which will never be reached by the caravan of thinking.;Khalil Gibran;faith
Singing is my passion and I always wanted to travel the country.;Thia Megia;travel
Owning a home is a keystone of wealth - both financial affluence and emotional security.;Suze Orman;finance
He who seeks rest finds boredom. He who seeks work finds rest.;Dylan Thomas;work
No part of the education of a politician is more indispensable than the fighting of elections.;Winston Churchill;education
I know what Germans are. They are a funny people. They are always choosing someone to lead them in a direction which they do not want to go.;Gertrude Stein;funny
My parents divorced when I was young but I was brought up in two really loving households. I didn't have a contentious relationship with my mom or dad.;Matt Damon;mom
My philosophy is: It's none of my business what people say of me and think of me.;Anthony Hopkins;business
One science only will one genius fit so vast is art, so narrow human wit.;Alexander Pope;art
Victory is everything. You can spend the money but you can never spend the memories.;Ken Venturi;money
When leaders take back power, when they act as heroes and saviors, they end up exhausted, overwhelmed, and deeply stressed.;Margaret J. Wheatley;power
I'm a great believer that any tool that enhances communication has profound effects in terms of how people can learn from each other, and how they can achieve the kind of freedoms that they're interested in.;Bill Gates;great
Just in terms of allocation of time resources, religion is not very efficient. There's a lot more I could be doing on a Sunday morning.;Bill Gates;time
Perhaps we don't need these religious concoctions to pillow the fear of death. Just the fact that there is an unknown, and something greater, can bring a feeling of peace. That's enough for me.;Brad Pitt;peace
My country is the world, and my religion is to do good.;Thomas Paine;religion
For me, pointing and clicking my phone is absolutely fine. People say that isn't the art of photography but I don't agree.;Annie Lennox;art
One of the things that's great about New York is that it is not a one-industry town. It has education, academia, the service industry, arts, publishing, theater, politics, fashion, finance, as well as movie-making.;Sarah Jessica Parker;politics
We no longer dare to believe in beauty and we make of it a mere appearance in order the more easily to dispose of it.;Hans Urs von Balthasar;beauty
People are so busy dreaming the American Dream, fantasizing about what they could be or have a right to be, that they're all asleep at the switch. Consequently we are living in the Age of Human Error.;Florence King;dreams
There is only one kind of love, but there are a thousand imitations.;Francois de La Rochefoucauld;love
The soul is everlasting, and its learning experience is lifetime after lifetime.;Shirley MacLaine;learning
Lesson from Pataki's success is: Use the political moment.;Andrew Cuomo;success
An Army is a collection of armed men obliged to obey one man. Every change in the rules which impairs the principle weakens the army.;William Tecumseh Sherman;change
The said truth is that it is the greatest happiness of the greatest number that is the measure of right and wrong.;Jeremy Bentham;happiness
Millions of young Americans have graduated from college during the Obama presidency, ready to use their gifts and get moving in life. Half of them can't find the work they studied for, or any work at all. So here's the question: Without a change in leadership, why would the next four years be any different from the last four years?;Paul Ryan;change
I'm a scientist, not a theologian. I don't know if there is a God or not. Religion requires certainty. Revere and respect Gaia. Have trust in Gaia. But not faith.;James Lovelock;respect
I am more and more convinced that our happiness or our unhappiness depends far more on the way we meet the events of life than on the nature of those events themselves.;Wilhelm von Humboldt;happiness
Love conquers all things except poverty and toothache.;Mae West;love
One has only as much morality as one has philosophy and poetry.;Karl Wilhelm Friedrich Schlegel;poetry
I could see myself in a relationship with a girl Olivia Wilde is so sexy she makes me want to strangle a mountain ox with my bare hands. She's mesmerizing.;Megan Fox;relationship
Yet, it ought to be obvious that good music generally occupies a higher plane that mere politics. Great writers can express moods through melody and capture experiences we share most powerfully - love, lust, longing joy, rage, fear triumph, yearning and confusion.;Tony Snow;fear
