In America everybody is of the opinion that he has no social superiors, since all men are equal, but he does not admit that he has no social inferiors, for, from the time of Jefferson onward, the doctrine that all men are equal applies only upwards, not downwards.;Bertrand Russell;time
Responsibility walks hand in hand with capacity and power.;J. G. Holland;power
You have to be smart. The easy days are over.;Robert Kiyosaki;intelligence
Thinking: the talking of the soul with itself.;Plato;inspirational
We will not waver we will not tire we will not falter, and we will not fail. Peace and Freedom will prevail.;George W. Bush;freedom
I know it's a cliche but I never wanted to be famous. I don't believe anybody wants to be famous.;Jeremy Renner;famous
My wife handles all of our technology. So if something goes wrong with the computer, I throw up my arms and step aside while the IT gal figures it out.;Ty Burrell;technology
I'm so disturbed when my women students behave as though they can only read women, or black students behave as though they can only read blacks, or white students behave as though they can only identify with a white writer.;Bell Hooks;women
I was who I was in high school in accordance with the rules of conduct for a normal person, like obeying your mom and dad. Then I got out of high school and moved out of the house, and I just started, for lack of a better term, running free.;Iggy Pop;mom
I started thinking about joy. Everything in our society is so purposeful. Let's bring joy back to the experience.;Sara Blakely;society
Tell the children the truth.;Bob Marley;truth
The wave of new productive enterprises would provide opportunities to remedy the unjust distribution of environmental hazards among economic classes and racial and ethnic communities.;Barry Commoner;environmental
The historic ascent of humanity, taken as a whole, may be summarized as a succession of victories of consciousness over blind forces - in nature, in society, in man himself.;Leon Trotsky;society
Imagination was given to man to compensate him for what he isn't. A sense of humor was provided to console him for what he is.;Horace Walpole;humor
Look, I don't want to wax philosophic, but I will say that if you're alive you've got to flap your arms and legs, you've got to jump around a lot, for life is the very opposite of death, and therefore you must at very least think noisy and colorfully, or you're not alive.;Mel Brooks;death
I always supported the women I worked with having time off to go to parent-teacher conferences and doctors' appointments or bringing their infants into the office.;Hillary Clinton;women
A man who pretends to understand women is bad manners. For him to really to understand them is bad morals.;Henry James;women
Few if any teenagers can relate to getting up for school and finding famous comics like Pryor and Williams hanging out in your living room after a hard night of partying. But that's Hollywood.;Pauly Shore;famous
Beauty is indeed a good gift of God but that the good may not think it a great good, God dispenses it even to the wicked.;Saint Augustine;beauty
Love before marriage is absolutely necessary.;Samuel Richardson;marriage
Why are ecologists and environmentalists so feared and hated? This is because in part what they have to say is new to the general public, and the new is always alarming.;Garrett Hardin;environmental
Light and funny has a more compelling quality when you're younger. But I haven't abandoned the genre: I love falling down I love Lucille Ball. It's just that a lot of those stories revolve around problems that I can't convincingly portray at this age.;Julia Roberts;age
In some ways England is more liberal than France, but I also find it more intrusive. But when you go abroad you have to accept the ways of where you live. I have to respect that.;Arsene Wenger;respect
The thing is this: You got to have fun while you're fightin' for freedom, 'cause you don't always win.;Molly Ivins;freedom
We all have a responsibility to volunteer somewhere and I'm lucky that I get the education and get taken to places to see what's out there and see what's happening and to then be a part of it in hopefully an impactful way.;Jennifer Garner;education
The great gift of human beings is that we have the power of empathy.;Meryl Streep;power
Love grows by giving. The love we give away is the only love we keep. The only way to retain love is to give it away.;Elbert Hubbard;love
We have to realize only in communication, in real knowledge, in real reaching out, can there be an understanding that there's humanity everywhere, and that's what I'm trying to do.;Mira Nair;knowledge
If a June night could talk, it would probably boast it invented romance.;Bernard Williams;romantic
I thin many people's deviant behavior starts with dreams because dreams are so non-linear... as if there's an assumption that everything has to be linear or has to be plotted.;Robyn Hitchcock;dreams
I love to travel, but sometimes it's nice to stay in one place.;Gustavo Dudamel;travel
The first few games that we played against some of the teams, the young guys, you know, want a stick sign or photo sign, and I think that they respect what I have achieved throughout my career.;Mario Lemieux;respect
If we get our self-esteem from superficial places, from our popularity, appearance, business success, financial situation, health, any of these, we will be disappointed, because no one can guarantee that we'll have them tomorrow.;Kathy Ireland;business
Boldness is a mask for fear, however great.;John Dryden;great
More and more, Democrats are starting to worry they that they have a more um, colorful version of Jimmy Carter on their hands. Obama acts cool as a proverbial cucumber but that awful '70s show seems frightfully close to a rerun.;Eric Alterman;cool
I came from a family where joining a union was the expected thing to do. I've always believed that the relationship between an employer and an individual worker is fundamentally unequal.;Frances O'Grady;relationship
Take the diplomacy out of war and the thing would fall flat in a week.;Will Rogers;war
I've never thought of my characters as being sad. On the contrary, they are full of life. They didn't choose tragedy. Tragedy chose them.;Juliette Binoche;sad
Age does not matter if the matter does not age.;Jean Paul;age
I think the most wonderful thing in the world is another chef. I'm always excited about learning new things about food.;Paul Prudhomme;food
A bachelor is a man who comes to work each morning from a different direction.;Sholom Aleichem;work
Always speak the truth, think before you speak, and write it down afterwards.;Lewis Carroll;truth
Almost the only persons who may be said to comprehend even approximately the significance, principles, and purposes of Socialism are the chief leaders of the extreme wings of the Socialistic forces, and perhaps a few of the money kings themselves.;Benjamin Tucker;money
If you work at comedy too laboriously, you can kill what's funny in the joke.;Richard Russo;funny
I hadn't made a big-budget film, and in Hollywood there's a sort of man and boys situation. You're a man, you make $80 million movies! As if it's harder to make an $80 million movie. Well, I guess businesswise it is because you have more executives to argue with.;Gus Van Sant;movies
I adore this adventure, I adore working with youth. For me it's a daily challenge, working to help these youths realize their dreams.;Patrick Roy;dreams
The trouble with our times is that the future is not what it used to be.;Paul Valery;future
I just get so fed up with seeing the same things written about me. If I see the words 'ice queen' attached to me, I feel like banging my head against the wall. There's this perception that I can only be in a film if I have a glass of champagne in my hand and a stately home in the background.;Kristin Scott Thomas;home
Canadians have been very generous toward Haiti after the earthquake and, thanks to you, our most vulnerable people have received food, drinkable water, shelter, medical care and education. For that, we are extremely grateful.;Laurent Lamothe;medical
Great companies in the way they work, start with great leaders.;Steve Ballmer;leadership
Hopelessness has surprised me with patience.;Margaret J. Wheatley;patience
In third grade, I was taking tap-dance lessons, and about six weeks before the recital I wanted to quit. My mom said, 'No, you're going to stay with it.' Well, I did it, and I was bad, too! But my parents never let their kids walk away from something because it was too hard.;Rebecca Lobo;mom
I like starting off the new year fresh. I'm excited to see how 2013 turns out. Maybe because I'm an actress and I am always on a diet and fitness program, but my New Year's resolution is to let myself be nice to myself about my body.;Busy Philipps;diet
Technology is destructive only in the hands of people who do not realize that they are one and the same process as the universe.;Alan Watts;technology
I think it was my study of history that convinced me that the Democratic Party was more on the side of the average American.;George McGovern;history
I'm so touched that complete strangers will send me a script asking me to be in their film. That still amazes me - and sometimes for a lot of money too.;Liam Neeson;money
Legends die hard. They survive as truth rarely does.;Helen Hayes;truth
The more I read and watched about the meat industry, the more determined I became to keep meat out of my diet. The things I saw in slaughterhouse exposes made me feel sick and I refused to just ignore what I now knew.;Renee Olstead;diet
Enlightened leadership is spiritual if we understand spirituality not as some kind of religious dogma or ideology but as the domain of awareness where we experience values like truth, goodness, beauty, love and compassion, and also intuition, creativity, insight and focused attention.;Deepak Chopra;experience
We would load up the yellow Cutlass Supreme station wagon and pick blackberries during blackberry season or spring onions during spring onion season. For us, food was part of the fabric of our day.;Mario Batali;food
Gender equality is more than a goal in itself. It is a precondition for meeting the challenge of reducing poverty, promoting sustainable development and building good governance.;Kofi Annan;equality
It is all very well to copy what one sees, but it is far better to draw what one now only sees in one's memory. That is a transformation in which imagination collaborates with memory.;Edgar Degas;imagination
In the old days... it was a basic, cardinal fact that producers didn't have opinions. When I was producing natural history programmes, I didn't use them as vehicles for my own opinion. They were factual programmes.;David Attenborough;history
I've worked with a band, and it's nice to have someone to travel around with, but I didn't like it as well on stage.;Randy Newman;travel
The science of politics is the one science that is deposited by the streams of history, like the grains of gold in the sand of a river and the knowledge of the past, the record of truths revealed by experience, is eminently practical, as an instrument of action and a power that goes to making the future.;Lord Acton;experience
Who knows what true loneliness is - not the conventional word but the naked terror? To the lonely themselves it wears a mask. The most miserable outcast hugs some memory or some illusion.;Joseph Conrad;alone
Success is survival.;Leonard Cohen;success
I was looking for something a lot heavier, yet melodic at the same time. Something different from heavy metal, a different attitude.;Kurt Cobain;time
Nothing is more sad than the death of an illusion.;Arthur Koestler;sad
I have no fear of making changes, destroying the image, etc., because the painting has a life of its own.;Jackson Pollock;fear
Bob summed it up best when he was on his knees at the end of the night saying, 'Don't trust in Guided By Voices.' You were there was the show awful or something? I know it was sloppy, but they're not really that tight anyway, but was it embarrassing, was it sad?;Kim Deal;sad
I plan to stay in music. I plan to keep making records.;Joan Jett;music
Personally, I just think rap music is the best thing out there, period. If you look at my deck in my car radio, you're always going to find a hip-hop tape that's all I buy, that's all I live, that's all I listen to, that's all I love.;Eminem;love
A nation that is afraid to let its people judge the truth and falsehood in an open market is a nation that is afraid of its people.;John F. Kennedy;truth
Increased awareness and education could be a great help toward improving spending and saving habits and increasing participation and contribution levels to retirement plans.;Ron Lewis;education
The income tax created more criminals than any other single act of government.;Barry Goldwater;government
I think the first and principle objective is to repeal Obamacare before it does lasting, fundamental damage to our health care system, to our individual liberty, to the relationship each of us has with his or her doctor.;Ted Cruz;relationship
I think movies do play a valuable role in turning people on to the act of reading. I think that phenomenon just creates readers. At first they're going to love 'Harry Potter,' or they may love 'The Hunger Games,' but after that, they're going to love the act of reading and wonder, 'What else can I read?';Gary Ross;movies
I'm probably writing music now for the same reason as I started writing songs when I was 14 - to meet women.;Billy Joel;music
When I work, and in my art, I hold hands with God.;Robert Mapplethorpe;art
Recently, I was in Bernalda, my dad's ancestral home town in Italy. He has just refurbished a palazzo and turned it into a hotel, so we had my sister's wedding there. It was beautiful.;Roman Coppola;wedding
I paint self-portraits because I am so often alone, because I am the person I know best.;Frida Kahlo;best
A man is great by deeds, not by birth.;Chanakya;great
I've been heartbroken. I've broken hearts. That's part of life, and its part of figuring out who you are so you can find the right partner.;Heidi Klum;movingon
O! many a shaft, at random sent, Finds mark the archer little meant! And many a word, at random spoken, May soothe or wound a heart that's broken!;Walter Scott;movingon
Spring is when you feel like whistling even with a shoe full of slush.;Doug Larson;nature
If we can't have the courage to tell our constituents, hey, we've got to cut back, then if we can point to something and say, I would like to vote for more benefits for you, but this balanced budget amendment or statutory spending cap or whatever the device is, is preventing me from doing it.;Jeff Flake;courage
The marvel of the Bhagavad-Gita is its truly beautiful revelation of life's wisdom which enables philosophy to blossom into religion.;Herman Hesse;religion
When we talk about Oscars, it's almost as a symbol of excellence, and the American public and the worldwide public accept that symbol. So, a movie like 'The Artist' that costs $14 million, has to go out and compete with movies that cost $140 million. How does David deal with Goliath?;Harvey Weinstein;movies
Anger tears me up inside... My own... or anyone else's.;Betty White;anger
From politics, it was an easy step to silence.;Jane Austen;politics
I have a new found respect for women who have been through breast cancer and this surgery.;Giuliana Rancic;respect
I had my footballing heroes such as Bryan Robson and Diego Maradona but my dad was a rugby league star, and he was my real hero. But the relationship with my mum was rocky and we saw things that would affect any youngster.;Ryan Giggs;relationship
My dream of politics all my life has been that it is the common business, that it is something we owe to each other to understand and discuss with absolute frankness.;Woodrow Wilson;business
There is no force like success, and that is why the individual makes all effort to surround himself throughout life with the evidence of it as of the individual, so should it be of the nation.;Marcus Garvey;success
Essentially, I'm untrained, so I just go with my imagination and try to put myself as solidly as I can into the shoes of whatever person I'm going to be playing.;Christian Bale;imagination
Things that I felt absolutely sure of but a few years ago, I do not believe now. This thought makes me see more clearly how foolish it would be to expect all men to agree with me.;Jim Rohn;men
You can be cool and at the same time respect your woman, who will hopefully become your wife, who will hopefully become the mother of your kids. America needs to get back to family values.;Martin Lawrence;cool
I hate ready-made suits, button-down collars, and sports shirts.;Bobby Fischer;sports
The only disability in life is a bad attitude.;Scott Hamilton;life
The marriage didn't work out but the separation is great.;Liz Smith;marriage
The more man meditates upon good thoughts, the better will be his world and the world at large.;Confucius;motivational
For every quarrel a man and wife have before others, they have a hundred when alone.;E. W. Howe;alone
Inflation is as violent as a mugger, as frightening as an armed robber and as deadly as a hit man.;Ronald Reagan;politics
A good politician is quite as unthinkable as an honest burglar.;H. L. Mencken;good
I've never gone to acting school and I never will, so I'm learning about the business from the people who are in the business. It doesn't seem like I work at all. And the unknown is always exciting.;Jonathan Rhys Meyers;learning
I noticed a lot of guitar players neglected the rhythm part of rhythm guitar and decided I would try to focus in that. As my skill and knowledge of the instrument grew, I found lead started to come naturally. Sometimes I play guitar like a frustrated drummer. Ha ha!;Hal Sparks;knowledge
But for my faith in God, I should have been a raving maniac.;Mahatma Gandhi;god
By asking the question 'Am I happy?,' and via the answer setting out what I mean by happiness, there is a political route that can be taken, by asking another question - 'Can politics deliver happiness, and should it try?';Alastair Campbell;politics
I've just finished my 20th book this past year and I'm working on my 21st book about the Middle East right now that I'll finish this year. And I get up early in the morning and when I get tired of the computer and tired of doing research, I walk 20 steps out to my woodshop and I either build furniture or paint paintings. I'm an artist too.;Jimmy Carter;morning
Every parting is a form of death, as every reunion is a type of heaven.;Tryon Edwards;death
I do not read advertisements. I would spend all of my time wanting things.;Franz Kafka;time
I didn't have any success in show business until I was 30 to 31 years of age.;Adam Carolla;business
I know some people say I can be funny. But there is always a deeper meaning to what I say. I am a socialist at heart and have the interests of the poor in mind. When people see how I manage to work my way out of tough situations, it gives them hope in their own life.;Lalu Prasad Yadav;work
The only kind of seafood I trust is the fish stick, a totally featureless fish that doesn't have eyeballs or fins.;Dave Barry;trust
I started in this racket in the early '70s, and when I was president of the Science Fiction Writers of America, of which I was like the sixth president, I was the first one nobody ever heard of.;Jerry Pournelle;science
If we do not permit the earth to produce beauty and joy, it will in the end not produce food, either.;Joseph Wood Krutch;environmental
I do not believe a man can ever leave his business. He ought to think of it by day and dream of it by night.;Henry Ford;business
The best books for a man are not always those which the wise recommend, but often those which meet the peculiar wants, the natural thirst of his mind, and therefore awaken interest and rivet thought.;William Ellery Channing;best
The size of your accomplishments, the quality of your achievement, will depend very largely on how big a man you see in yourself, what sort of image you get of your possible self, yourself at your best.;Orison Swett Marden;best
My father was my main influence. He was a preacher, but he was also a history and political science teacher, and since he was my hero, I wanted to follow in his footsteps and become a teacher.;David Soul;science
When a great many people are unable to find work, unemployment results.;Calvin Coolidge;great
I photographed rocks and trees and tide pools and nudes and all that stuff for years and years. Until 20 years ago when I found that I could do it in the studio and never have to travel.;Kim Weston;travel
To me, all war is failure for humanity, though it often is a bounty for commerce.;Mark Edwards;failure
I told my father I had to try political science for a year. He thought I was throwing my life away.;Paul Wolfowitz;science
When we believe ourselves in possession of the only truth, we are likely to be indifferent to common everyday truths.;Eric Hoffer;truth
All of the biggest technological inventions created by man - the airplane, the automobile, the computer - says little about his intelligence, but speaks volumes about his laziness.;Mark Kennedy;intelligence
Family and friends and faith are the most important things in your life and you should be building friendships.;Barbara Bush;family
I wanted my marriage to work, but it didn't.;Diane Abbott;marriage
I am fussy, about my diet and straining my voice. I know, sounds a bit over the top. But I'm not as bad as I used to be. These days I don't drink alcohol for five days before a show - very dehydrating for the vocal cords, and all that acid reflux. I used to ban it for a fortnight. Nightmare.;Katherine Jenkins;diet
Resolve not to be poor: whatever you have, spend less. Poverty is a great enemy to human happiness it certainly destroys liberty, and it makes some virtues impracticable, and others extremely difficult.;Samuel Johnson;happiness
I was very sexual from a very young age.;Portia de Rossi;age
We need a new religion.;Lauren Hutton;religion
It is not in the nature of politics that the best men should be elected. The best men do not want to govern their fellowmen.;George MacDonald;men
A good day is one where I can not just read a book, but write a review of it. Maybe today I'll be able to do that. I get for some reason somewhat stronger when the sun starts to go down. Dusk is a good time for me. I'm crepuscular.;Christopher Hitchens;time
Ever since the Crusades, when Christians from western Europe were fighting holy wars against Muslims in the near east, western people have often perceived Islam as a violent and intolerant faith - even though when this prejudice took root Islam had a better record of tolerance than Christianity.;Karen Armstrong;faith
What ever our wandering our happiness will always be found within a narrow compass, and in the middle of the objects more immediately within our reach.;Edward G. Bulwer-Lytton;happiness
We don't have enough support for maternal leave and the kinds of things that some of the European countries do. So we still make it hard on women to go into the work force and feel that they can be good at work but then doing the most important job, which is raising your children in a responsible and positive way.;Hillary Clinton;positive
The sway of alcohol over mankind is unquestionably due to its power to stimulate the mystical faculties of human nature, usually crushed to earth by the cold facts and dry criticisms of the sober hour.;William James;power
Magnanimity in politics is not seldom the truest wisdom and a great empire and little minds go ill together.;Edmund Burke;wisdom
I was an only child. I've known only children. From this experience, I do believe that the children should outnumber the parents.;Jane Smiley;experience
If you start to disrespect the character you're playing, or play it too much for laughs, that can work for a sketch, it will sell some gags, but it's all technique. It's like watching a juggler - you can be impressed by it, but it's not going to touch you in any way.;Steve Coogan;work
What gives me the most hope every day is God's grace knowing that his grace is going to give me the strength for whatever I face, knowing that nothing is a surprise to God.;Rick Warren;strength
My professional dreams were coming true while I was living a personal nightmare.;Dane Cook;dreams
One of the things I've started doing lately is tracking my dreams. I feel like there's a lot of information there and you can really bring those emotions to the situations that may feel mundane or familiar. That gives them new life and gives you a new relationship with it - if that makes any sort of sense.;Jennifer Carpenter;dreams
The world will never have lasting peace so long as men reserve for war the finest human qualities. Peace, no less than war, requires idealism and self-sacrifice and a righteous and dynamic faith.;John Foster Dulles;peace
The American economy has always been driven by the entrepreneurial nature of its citizens, and blocking access to affordable health care will only suffocate growth within the small business sector of our economy.;Paul Gillmor;health
Poetry leads us to the unstructured sources of our beings, to the unknown, and returns us to our rational, structured selves refreshed.;A. R. Ammons;poetry
A lot of Thanksgiving days have been ruined by not carving the turkey in the kitchen.;Kin Hubbard;thanksgiving
Not even old age knows how to love death.;Sophocles;death
Faith activates God - Fear activates the Enemy.;Joel Osteen;faith
I want the French people to respect values that allow each individual to practice his or her faith, but in the frame of our common rules of secularism.;Francois Hollande;faith
